Bus Hound 6.01 capture on Windows Vista (x64). Complements of www.perisoft.net

U盘枚举数据包

  Device - Device ID (followed by the endpoint for USB devices)
            (31) USB Mass Storage Device
            (32) Kingston DataTraveler 3.0
  Address - FireWire async address or channel number
  Length - Total transfer length
  Phase  - Phase Type
            ATA   ATA task file command      OUT   Data out transfer
            CMD   SCSI/ATAPI command         SENSE SCSI sense data
            CTL   USB control transfer       SSTS  SCSI request block status
            IN    Data in transfer           ok    command complete
  Data   - Hex dump of the data transferred
  Descr  - Description of the phase
  Delta  - Elapsed time from the previous phase to the current phase
  Cmd... - Position in the captured data
  Date   - Date the phase occurred in year/month/day form
  Time   - Time the phase occurred in hour:minute:second.millisec form
  Driver - Driver that submitted the command
            vdiusbfilter : Vdi usb hub filter 2.3.21.1018
            usbstor      : USB Mass Storage Class Driver 10.0.18362.1 (WinBuild.160101.0800)
            classpnp     : SCSI Class System Dll 10.0.18362.628 (WinBuild.160101.0800)
            disk         : PnP Disk Driver 10.0.18362.1 (WinBuild.160101.0800)
            partmgr      : Partition driver 10.0.18362.145 (WinBuild.160101.0800)
            fvevol       : BitLocker Drive Encryption Driver 10.0.18362.267 (WinBuild.160101.0800)


Device  Address              Length    Phase  Data                                                Description       Delta  Cmd.Phase.Ofs(rep)  Date        Time          Driver      
------  -------------------  --------  -----  --------------------------------------------------  ----------------  -----  ------------------  ----------  ------------  ------------
  31.0                                 CTL    80 06 00 01  00 00 12 00                            GET DESCRIPTOR     19sc         1.1.0        2024/08/22  10:20:41.352  vdiusbfilter  
  31.0                             18  IN     12 01 10 02  00 00 00 40  51 09 66 16  01 00 01 02  .......@Q.f.....  284us         1.2.0        2024/08/22  10:20:41.352                
                                              03 01                                               ..                              1.2.16                                               
  31.0                                 CTL    80 06 00 02  00 00 09 00                            GET DESCRIPTOR     12us         2.1.0        2024/08/22  10:20:41.352  vdiusbfilter  
  31.0                              9  IN     09 02 20 00  01 01 00 80  96                        .. ......         279us         2.2.0        2024/08/22  10:20:41.352                
  31.0                                 CTL    80 06 00 02  00 00 20 00                            GET DESCRIPTOR     11us         3.1.0        2024/08/22  10:20:41.352  vdiusbfilter  
  31.0                             32  IN     09 02 20 00  01 01 00 80  96 09 04 00  00 02 08 06  .. .............  278us         3.2.0        2024/08/22  10:20:41.352                
                                              50 00 07 05  81 02 00 02  ff 07 05 02  02 00 02 ff  P...............                3.2.16                                               
  31.0                                 CTL    80 06 00 01  00 00 12 00                            GET DESCRIPTOR     16us         4.1.0        2024/08/22  10:20:41.352  vdiusbfilter  
  31.0                             18  IN     12 01 10 02  00 00 00 40  51 09 66 16  01 00 01 02  .......@Q.f.....  278us         4.2.0        2024/08/22  10:20:41.353                
                                              03 01                                               ..                              4.2.16                                               
  31.0                                 CTL    80 06 00 02  00 00 09 00                            GET DESCRIPTOR      8us         5.1.0        2024/08/22  10:20:41.353  vdiusbfilter  
  31.0                              9  IN     09 02 20 00  01 01 00 80  96                        .. ......         292us         5.2.0        2024/08/22  10:20:41.353                
  31.0                                 CTL    80 06 00 02  00 00 20 00                            GET DESCRIPTOR      6us         6.1.0        2024/08/22  10:20:41.353  vdiusbfilter  
  31.0                             32  IN     09 02 20 00  01 01 00 80  96 09 04 00  00 02 08 06  .. .............  279us         6.2.0        2024/08/22  10:20:41.353                
                                              50 00 07 05  81 02 00 02  ff 07 05 02  02 00 02 ff  P...............                6.2.16                                               
  31.0                                 CTL    80 06 00 01  00 00 12 00                            GET DESCRIPTOR     16us         7.1.0        2024/08/22  10:20:41.353  vdiusbfilter  
  31.0                             18  IN     12 01 10 02  00 00 00 40  51 09 66 16  01 00 01 02  .......@Q.f.....  277us         7.2.0        2024/08/22  10:20:41.354                
                                              03 01                                               ..                              7.2.16                                               
  31.0                                 CTL    80 06 00 02  00 00 09 00                            GET DESCRIPTOR      5us         8.1.0        2024/08/22  10:20:41.354  vdiusbfilter  
  31.0                              9  IN     09 02 20 00  01 01 00 80  96                        .. ......         275us         8.2.0        2024/08/22  10:20:41.354                
  31.0                                 CTL    80 06 00 02  00 00 20 00                            GET DESCRIPTOR      3us         9.1.0        2024/08/22  10:20:41.354  vdiusbfilter  
  31.0                             32  IN     09 02 20 00  01 01 00 80  96 09 04 00  00 02 08 06  .. .............  275us         9.2.0        2024/08/22  10:20:41.354                
                                              50 00 07 05  81 02 00 02  ff 07 05 02  02 00 02 ff  P...............                9.2.16                                               
  31.0                                 CTL    80 06 00 01  00 00 12 00                            GET DESCRIPTOR    4.8ms        10.1.0        2024/08/22  10:20:41.359  vdiusbfilter  
  31.0                             18  IN     12 01 10 02  00 00 00 40  51 09 66 16  01 00 01 02  .......@Q.f.....  303us        10.2.0        2024/08/22  10:20:41.359                
                                              03 01                                               ..                             10.2.16                                               
  31.0                                 CTL    80 06 00 01  00 00 12 00                            GET DESCRIPTOR    146us        11.1.0        2024/08/22  10:20:41.360  usbstor       
  31.0                             18  IN     12 01 10 02  00 00 00 40  51 09 66 16  01 00 01 02  .......@Q.f.....  284us        11.2.0        2024/08/22  10:20:41.360                
                                              03 01                                               ..                             11.2.16                                               
  31.0                                 CTL    80 06 00 02  00 00 09 00                            GET DESCRIPTOR      9us        12.1.0        2024/08/22  10:20:41.360  usbstor       
  31.0                              9  IN     09 02 20 00  01 01 00 80  96                        .. ......         284us        12.2.0        2024/08/22  10:20:41.360                
  31.0                                 CTL    80 06 00 02  00 00 20 00                            GET DESCRIPTOR      8us        13.1.0        2024/08/22  10:20:41.360  usbstor       
  31.0                             32  IN     09 02 20 00  01 01 00 80  96 09 04 00  00 02 08 06  .. .............  284us        13.2.0        2024/08/22  10:20:41.360                
                                              50 00 07 05  81 02 00 02  ff 07 05 02  02 00 02 ff  P...............               13.2.16                                               
  31.0                                 CTL    80 06 00 03  00 00 02 00                            GET DESCRIPTOR      6us        14.1.0        2024/08/22  10:20:41.360  usbstor       
  31.0                              2  IN     04 03                                               ..                1.9ms        14.2.0        2024/08/22  10:20:41.362                
  31.0                                 CTL    80 06 00 03  00 00 04 00                            GET DESCRIPTOR     14us        15.1.0        2024/08/22  10:20:41.362  usbstor       
  31.0                              4  IN     04 03 09 04                                         ....              1.9ms        15.2.0        2024/08/22  10:20:41.364                
  31.0                                 CTL    80 06 03 03  09 04 02 00                            GET DESCRIPTOR     15us        16.1.0        2024/08/22  10:20:41.364  usbstor       
  31.0                              2  IN     32 03                                               2.                2.0ms        16.2.0        2024/08/22  10:20:41.366                
  31.0                                 CTL    80 06 03 03  09 04 32 00                            GET DESCRIPTOR     17us        17.1.0        2024/08/22  10:20:41.366  usbstor       
  31.0                             50  IN     32 03 45 00  30 00 44 00  35 00 35 00  45 00 36 00  2.E.0.D.5.5.E.6.  1.9ms        17.2.0        2024/08/22  10:20:41.368                
                                              32 00 42 00  30 00 31 00  36 00 46 00  35 00 39 00  2.B.0.1.6.F.5.9.               17.2.16                                               
                                              31 00 42 00  38 00 38 00  33 00 30 00  45 00 45 00  1.B.8.8.3.0.E.E.               17.2.32                                               
                                              36 00                                               6.                             17.2.48                                               
  31.0                                 CTL    00 09 01 00  00 00 00 00                            SET CONFIG        759us        18.1.0        2024/08/22  10:20:41.369  usbstor       
  31.0                                 CTL    01 0b 00 00  00 00 00 00                            SET INTERFACE     2.2ms        19.1.0        2024/08/22  10:20:41.371  usbstor       
  31.0                                 CTL    a1 fe 00 00  00 00 01 00                            GET MAX LUN        11ms        20.1.0        2024/08/22  10:20:41.383  usbstor       
  31.0                              1  IN     00                                                  .                 308us        20.2.0        2024/08/22  10:20:41.383                
  31.2                             31  OUT    55 53 42 43  f0 97 81 7f  24 00 00 00  80 00 06 12  USBC....$.......  2.3ms        21.1.0        2024/08/22  10:20:41.386  usbstor       
                                              00 00 00 24  00 00 00 00  00 00 00 00  00 00 00     ...$...........                21.1.16                                               
  31.1                             36  IN     00 80 06 02  f8 00 00 00  4b 69 6e 67  73 74 6f 6e  ........Kingston  1.2ms        22.1.0        2024/08/22  10:20:41.387  usbstor       
                                              44 61 74 61  54 72 61 76  65 6c 65 72  20 33 2e 30  DataTraveler 3.0               22.1.16                                               
                                              00 00 00 00                                         ....                           22.1.32                                               
  31.1                             13  IN     55 53 42 53  f0 97 81 7f  00 00 00 00  00           USBS.........     1.7ms        23.1.0        2024/08/22  10:20:41.389  usbstor       
  31.2                             31  OUT    55 53 42 43  f0 97 81 7f  24 00 00 00  80 00 06 12  USBC....$.......  1.9ms        24.1.0        2024/08/22  10:20:41.391  usbstor       
                                              00 00 00 24  00 00 00 00  00 00 00 00  00 00 00     ...$...........                24.1.16                                               
  31.1                             36  IN     00 80 06 02  f8 00 00 00  4b 69 6e 67  73 74 6f 6e  ........Kingston  2.0ms        25.1.0        2024/08/22  10:20:41.393  usbstor       
                                              44 61 74 61  54 72 61 76  65 6c 65 72  20 33 2e 30  DataTraveler 3.0               25.1.16                                               
                                              00 00 00 00                                         ....                           25.1.32                                               
  31.1                             13  IN     55 53 42 53  f0 97 81 7f  00 00 00 00  00           USBS.........     1.9ms        26.1.0        2024/08/22  10:20:41.395  usbstor       
  31.2                             31  OUT    55 53 42 43  f0 97 81 7f  fc 00 00 00  80 00 0a 23  USBC...........#  2.0ms        27.1.0        2024/08/22  10:20:41.397  usbstor       
                                              00 00 00 00  00 00 00 fc  00 00 00 00  00 00 00     ...............                27.1.16                                               
  31.1                             12  IN     00 00 00 08  03 9a 33 f4  02 00 02 00               ......3.....      2.0ms        28.1.0        2024/08/22  10:20:41.399  usbstor       
  31.1                             13  IN     55 53 42 53  f0 97 81 7f  f0 00 00 00  00           USBS.........     1.9ms        29.1.0        2024/08/22  10:20:41.401  usbstor       
  31.2                             31  OUT    55 53 42 43  f0 97 81 7f  ff 00 00 00  80 00 06 12  USBC............  1.3ms        30.1.0        2024/08/22  10:20:41.402  usbstor       
                                              01 80 00 ff  00 00 00 00  00 00 00 00  00 00 00     ...............                30.1.16                                               
  31.1                             31  IN     00 80 04 1b  03 30 00 30  00 30 00 30  00 30 00 30  .....0.0.0.0.0.0  1.6ms        31.1.0        2024/08/22  10:20:41.404  usbstor       
                                              00 30 00 30  00 30 00 30  00 30 00 30  00 30 00     .0.0.0.0.0.0.0.                31.1.16                                               
  31.1                             13  IN     55 53 42 53  f0 97 81 7f  db 00 00 00  00           USBS.........     2.0ms        32.1.0        2024/08/22  10:20:41.406  usbstor       
  32                                   CMD    12 00 00 00  24 00                                  INQUIRY           2.0ms        33.1.0        2024/08/22  10:20:41.408  unknown       
  32                               36  IN     00 80 06 02  f8 00 00 00  4b 69 6e 67  73 74 6f 6e  ........Kingston    1us        33.2.0        2024/08/22  10:20:41.408                
                                              44 61 74 61  54 72 61 76  65 6c 65 72  20 33 2e 30  DataTraveler 3.0               33.2.16                                               
                                              00 00 00 00                                         ....                           33.2.32                                               
  32                                   CMD    25 00 00 00  00 00 00 00  00 00                     READ CAPACITY     457us        34.1.0        2024/08/22  10:20:41.408  classpnp      
  31.2                             31  OUT    55 53 42 43  10 60 79 7f  08 00 00 00  80 00 0a 25  USBC.`y........%  361us        35.1.0        2024/08/22  10:20:41.409  classpnp      
                                              00 00 00 00  00 00 00 00  00 00 00 00  00 00 00     ...............                35.1.16                                               
  31.1                              8  IN     03 9a 33 f3  00 00 02 00                            ..3.....          2.0ms        36.1.0        2024/08/22  10:20:41.411  classpnp      
  31.1                             13  IN     55 53 42 53  10 60 79 7f  00 00 00 00  00           USBS.`y......     326us        37.1.0        2024/08/22  10:20:41.411  classpnp      
  32                                8  IN     03 9a 33 f3  00 00 02 00                            ..3.....            3us        34.2.0        2024/08/22  10:20:41.411                
  32                                   ATA    00 00 00 4f  c2 a0 ec                               IDENTIFY           72us        38.1.0        2024/08/22  10:20:41.411  disk          
  32                                   SSTS   04                                                  check condition     1us        38.2.0        2024/08/22  10:20:41.411                
  32                                   CMD    1a 00 1c 00  c0 00                                  MODE SENSE 1C       7us        39.1.0        2024/08/22  10:20:41.411  partmgr       
  32                                   CMD    12 01 00 00  ff 00                                  INQUIRY            92us        40.1.0        2024/08/22  10:20:41.411  classpnp      
  32                               18  SENSE  70 00 05 00  00 00 00 0a  00 00 00 00  24 00 00 00  invalid cdb         2us        40.2.0        2024/08/22  10:20:41.411                
                                              00 00                                                                              40.2.16                                               
  32                                   CMD    1a 00 08 00  c0 00                                  MODE SENSE 08     219us        41.1.0        2024/08/22  10:20:41.411  classpnp      
  31.2                             31  OUT    55 53 42 43  b0 39 67 7f  c0 00 00 00  80 00 06 1a  USBC.9g.........  968us        42.1.0        2024/08/22  10:20:41.412  unknown       
                                              00 1c 00 c0  00 00 00 00  00 00 00 00  00 00 00     ...............                42.1.16                                               
  31.1                            192  IN     bf 00 00 00  1c 0a 00 00  00 00 00 00  00 00 00 00  ................  2.3ms        43.1.0        2024/08/22  10:20:41.415  unknown       
                                              00 00 00 00  00 00 00 00  00 00 00 00  00 00 00 00  ................               43.1.16                                               
                                              00 00 00 00  00 00 00 00  00 00 00 00  00 00 00 00  ................               43.1.32                                               
                                              00 00 00 00  00 00 00 00  00 00 00 00  00 00 00 00  ................               43.1.48                                               
                                              00 00 00 00  00 00 00 00  00 00 00 00  00 00 00 00  ................               43.1.64                                               
                                              00 00 00 00  00 00 00 00  00 00 00 00  00 00 00 00  ................               43.1.80                                               
                                              00 00 00 00  00 00 00 00  00 00 00 00  00 00 00 00  ................               43.1.96                                               
                                              00 00 00 00  00 00 00 00  00 00 00 00  00 00 00 00  ................               43.1.112                                              
                                              00 00 00 00  00 00 00 00  00 00 00 00  00 00 00 00  ................               43.1.128                                              
                                              00 00 00 00  00 00 00 00  00 00 00 00  00 00 00 00  ................               43.1.144                                              
                                              00 00 00 00  00 00 00 00  00 00 00 00  00 00 00 00  ................               43.1.160                                              
                                              00 00 00 00  00 00 00 00  00 00 00 00  00 00 00 00  ................               43.1.176                                              
  31.1                             13  IN     55 53 42 53  b0 39 67 7f  00 00 00 00  00           USBS.9g......     1.9ms        44.1.0        2024/08/22  10:20:41.417  unknown       
  32                              192  IN     bf 00 00 00  1c 0a 00 00  00 00 00 00  00 00 00 00  ................   65us        39.2.0        2024/08/22  10:20:41.417                
                                              00 00 00 00  00 00 00 00  00 00 00 00  00 00 00 00  ................               39.2.16                                               
                                              00 00 00 00  00 00 00 00  00 00 00 00  00 00 00 00  ................               39.2.32                                               
                                              00 00 00 00  00 00 00 00  00 00 00 00  00 00 00 00  ................               39.2.48                                               
                                              00 00 00 00  00 00 00 00  00 00 00 00  00 00 00 00  ................               39.2.64                                               
                                              00 00 00 00  00 00 00 00  00 00 00 00  00 00 00 00  ................               39.2.80                                               
                                              00 00 00 00  00 00 00 00  00 00 00 00  00 00 00 00  ................               39.2.96                                               
                                              00 00 00 00  00 00 00 00  00 00 00 00  00 00 00 00  ................               39.2.112                                              
                                              00 00 00 00  00 00 00 00  00 00 00 00  00 00 00 00  ................               39.2.128                                              
                                              00 00 00 00  00 00 00 00  00 00 00 00  00 00 00 00  ................               39.2.144                                              
                                              00 00 00 00  00 00 00 00  00 00 00 00  00 00 00 00  ................               39.2.160                                              
                                              00 00 00 00  00 00 00 00  00 00 00 00  00 00 00 00  ................               39.2.176                                              
  31.2                             31  OUT    55 53 42 43  10 60 79 7f  c0 00 00 00  80 00 06 1a  USBC.`y.........  1.2ms        45.1.0        2024/08/22  10:20:41.418  classpnp      
                                              00 08 00 c0  00 00 00 00  00 00 00 00  00 00 00     ...............                45.1.16                                               
  31.1                             24  IN     17 00 00 00  08 12 00 00  00 00 00 00  00 00 00 00  ................  1.4ms        46.1.0        2024/08/22  10:20:41.420  classpnp      
                                              00 00 00 00  00 00 00 00                            ........                       46.1.16                                               
  31.1                             13  IN     55 53 42 53  10 60 79 7f  a8 00 00 00  00           USBS.`y......     2.1ms        47.1.0        2024/08/22  10:20:41.422  classpnp      
  32                               24  IN     17 00 00 00  08 12 00 00  00 00 00 00  00 00 00 00  ................    5us        41.2.0        2024/08/22  10:20:41.422                
                                              00 00 00 00  00 00 00 00                            ........                       41.2.16                                               
  32                                   SSTS   12                                                  data overrun        1us        41.3.0        2024/08/22  10:20:41.422                
  32                                   CMD    25 00 00 00  00 00 00 00  00 00                     READ CAPACITY     160us        48.1.0        2024/08/22  10:20:41.422  usbstor       
  31.2                             31  OUT    55 53 42 43  00 a5 72 7d  08 00 00 00  80 00 0a 25  USBC..r........%  388us        49.1.0        2024/08/22  10:20:41.422  usbstor       
                                              00 00 00 00  00 00 00 00  00 00 00 00  00 00 00     ...............                49.1.16                                               
  31.1                              8  IN     03 9a 33 f3  00 00 02 00                            ..3.....          1.5ms        50.1.0        2024/08/22  10:20:41.424  usbstor       
  31.1                             13  IN     55 53 42 53  00 a5 72 7d  00 00 00 00  00           USBS..r......     326us        51.1.0        2024/08/22  10:20:41.424  usbstor       
  32                                8  IN     03 9a 33 f3  00 00 02 00                            ..3.....            5us        48.2.0        2024/08/22  10:20:41.424                
  32                                   CMD    12 00 00 00  24 00                                  INQUIRY            12us        52.1.0        2024/08/22  10:20:41.424  usbstor       
  31.2                             31  OUT    55 53 42 43  00 a5 72 7d  24 00 00 00  80 00 06 12  USBC..r.$.......  1.5ms        53.1.0        2024/08/22  10:20:41.426  usbstor       
                                              00 00 00 24  00 00 00 00  00 00 00 00  00 00 00     ...$...........                53.1.16                                               
  31.1                             36  IN     00 80 06 02  f8 00 00 00  4b 69 6e 67  73 74 6f 6e  ........Kingston  2.0ms        54.1.0        2024/08/22  10:20:41.428  usbstor       
                                              44 61 74 61  54 72 61 76  65 6c 65 72  20 33 2e 30  DataTraveler 3.0               54.1.16                                               
                                              00 00 00 00                                         ....                           54.1.32                                               
  31.1                             13  IN     55 53 42 53  00 a5 72 7d  00 00 00 00  00           USBS..r......     1.9ms        55.1.0        2024/08/22  10:20:41.430  usbstor       
  32                               36  IN     00 80 06 02  f8 00 00 00  4b 69 6e 67  73 74 6f 6e  ........Kingston    4us        52.2.0        2024/08/22  10:20:41.430                
                                              44 61 74 61  54 72 61 76  65 6c 65 72  20 33 2e 30  DataTraveler 3.0               52.2.16                                               
                                              00 00 00 00                                         ....                           52.2.32                                               
  32                                   CMD    9e 10 00 00  00 00 00 00  00 00 00 00  00 20 00 00  SVC ACTION IN      18us        56.1.0        2024/08/22  10:20:41.430  classpnp      
  32                               18  SENSE  70 00 05 00  00 00 00 0a  00 00 00 00  20 00 00 00  illegal request     2us        56.2.0        2024/08/22  10:20:41.430                
                                              00 00                                                                              56.2.16                                               
  32                                   CMD    25 00 00 00  00 00 00 00  00 00                     READ CAPACITY     161us        57.1.0        2024/08/22  10:20:41.430  classpnp      
  31.2                             31  OUT    55 53 42 43  10 60 79 7f  08 00 00 00  80 00 0a 25  USBC.`y........%  331us        58.1.0        2024/08/22  10:20:41.430  classpnp      
                                              00 00 00 00  00 00 00 00  00 00 00 00  00 00 00     ...............                58.1.16                                               
  31.1                              8  IN     03 9a 33 f3  00 00 02 00                            ..3.....          1.5ms        59.1.0        2024/08/22  10:20:41.432  classpnp      
  31.1                             13  IN     55 53 42 53  10 60 79 7f  00 00 00 00  00           USBS.`y......     280us        60.1.0        2024/08/22  10:20:41.432  classpnp      
  32                                8  IN     03 9a 33 f3  00 00 02 00                            ..3.....            4us        57.2.0        2024/08/22  10:20:41.432                
  32                                   CMD    25 00 00 00  00 00 00 00  00 00                     READ CAPACITY      28us        61.1.0        2024/08/22  10:20:41.432  classpnp      
  31.2                             31  OUT    55 53 42 43  10 60 79 7f  08 00 00 00  80 00 0a 25  USBC.`y........%  322us        62.1.0        2024/08/22  10:20:41.432  classpnp      
                                              00 00 00 00  00 00 00 00  00 00 00 00  00 00 00     ...............                62.1.16                                               
  31.1                              8  IN     03 9a 33 f3  00 00 02 00                            ..3.....          1.2ms        63.1.0        2024/08/22  10:20:41.434  classpnp      
  31.1                             13  IN     55 53 42 53  10 60 79 7f  00 00 00 00  00           USBS.`y......     279us        64.1.0        2024/08/22  10:20:41.434  classpnp      
  32                                8  IN     03 9a 33 f3  00 00 02 00                            ..3.....            3us        61.2.0        2024/08/22  10:20:41.434                
  32                                   CMD    25 00 00 00  00 00 00 00  00 00                     READ CAPACITY      15us        65.1.0        2024/08/22  10:20:41.434  classpnp      
  31.2                             31  OUT    55 53 42 43  f0 ca 7c 7f  08 00 00 00  80 00 0a 25  USBC...........%  292us        66.1.0        2024/08/22  10:20:41.434  classpnp      
                                              00 00 00 00  00 00 00 00  00 00 00 00  00 00 00     ...............                66.1.16                                               
  31.1                              8  IN     03 9a 33 f3  00 00 02 00                            ..3.....          1.4ms        67.1.0        2024/08/22  10:20:41.436  classpnp      
  31.1                             13  IN     55 53 42 53  f0 ca 7c 7f  00 00 00 00  00           USBS.........     278us        68.1.0        2024/08/22  10:20:41.436  classpnp      
  32                                8  IN     03 9a 33 f3  00 00 02 00                            ..3.....            4us        65.2.0        2024/08/22  10:20:41.436                
  32                                   CMD    28 00 00 00  00 00 00 00  01 00                     READ               21us        69.1.0        2024/08/22  10:20:41.436  classpnp      
  31.2                             31  OUT    55 53 42 43  f0 ca 7c 7f  00 02 00 00  80 00 0a 28  USBC...........(  344us        70.1.0        2024/08/22  10:20:41.436  classpnp      
                                              00 00 00 00  00 00 00 01  00 00 00 00  00 00 00     ...............                70.1.16                                               
  31.1                            512  IN     33 c0 8e d0  bc 00 7c 8e  c0 8e d8 be  00 7c bf 00  3...............  1.3ms        71.1.0        2024/08/22  10:20:41.438  classpnp      
                                              06 b9 00 02  fc f3 a4 50  68 1c 06 cb  fb b9 04 00  .......Ph.......               71.1.16                                               
                                              bd be 07 80  7e 00 00 7c  0b 0f 85 0e  01 83 c5 10  ................               71.1.32                                               
                                              e2 f1 cd 18  88 56 00 55  c6 46 11 05  c6 46 10 00  .....V.U.F...F..               71.1.48                                               
                                              b4 41 bb aa  55 cd 13 5d  72 0f 81 fb  55 aa 75 09  .A..U..]r...U.u.               71.1.64                                               
                                              f7 c1 01 00  74 03 fe 46  10 66 60 80  7e 10 00 74  ....t..F.f`....t               71.1.80                                               
                                              26 66 68 00  00 00 00 66  ff 76 08 68  00 00 68 00  &fh....f.v.h..h.               71.1.96                                               
                                              7c 68 01 00  68 10 00 b4  42 8a 56 00  8b f4 cd 13  .h..h...B.V.....               71.1.112                                              
                                              9f 83 c4 10  9e eb 14 b8  01 02 bb 00  7c 8a 56 00  ..............V.               71.1.128                                              
                                              8a 76 01 8a  4e 02 8a 6e  03 cd 13 66  61 73 1c fe  .v..N..n...fas..               71.1.144                                              
                                              4e 11 75 0c  80 7e 00 80  0f 84 8a 00  b2 80 eb 84  N.u.............               71.1.160                                              
                                              55 32 e4 8a  56 00 cd 13  5d eb 9e 81  3e fe 7d 55  U2..V...]...>..U               71.1.176                                              
                                              aa 75 6e ff  76 00 e8 8d  00 75 17 fa  b0 d1 e6 64  .un.v....u.....d               71.1.192                                              
                                              e8 83 00 b0  df e6 60 e8  7c 00 b0 ff  e6 64 e8 75  ......`......d.u               71.1.208                                              
                                              00 fb b8 00  bb cd 1a 66  23 c0 75 3b  66 81 fb 54  .......f#.u;f..T               71.1.224                                              
                                              43 50 41 75  32 81 f9 02  01 72 2c 66  68 07 bb 00  CPAu2....r,fh...               71.1.240                                              
                                              00 66 68 00  02 00 00 66  68 08 00 00  00 66 53 66  .fh....fh....fSf               71.1.256                                              
                                              53 66 55 66  68 00 00 00  00 66 68 00  7c 00 00 66  SfUfh....fh....f               71.1.272                                              
                                              61 68 00 00  07 cd 1a 5a  32 f6 ea 00  7c 00 00 cd  ah.....Z2.......               71.1.288                                              
                                              18 a0 b7 07  eb 08 a0 b6  07 eb 03 a0  b5 07 32 e4  ..............2.               71.1.304                                              
                                              05 00 07 8b  f0 ac 3c 00  74 09 bb 07  00 b4 0e cd  ......<.t.......               71.1.320                                              
                                              10 eb f2 f4  eb fd 2b c9  e4 64 eb 00  24 02 e0 f8  ......+..d..$...               71.1.336                                              
                                              24 02 c3 49  6e 76 61 6c  69 64 20 70  61 72 74 69  $..Invalid parti               71.1.352                                              
                                              74 69 6f 6e  20 74 61 62  6c 65 00 45  72 72 6f 72  tion table.Error               71.1.368                                              
                                              20 6c 6f 61  64 69 6e 67  20 6f 70 65  72 61 74 69   loading operati               71.1.384                                              
                                              6e 67 20 73  79 73 74 65  6d 00 4d 69  73 73 69 6e  ng system.Missin               71.1.400                                              
                                              67 20 6f 70  65 72 61 74  69 6e 67 20  73 79 73 74  g operating syst               71.1.416                                              
                                              65 6d 00 00  00 63 7b 9a  ca 58 3c 43  00 00 80 20  em...c...X<C...                71.1.432                                              
                                              21 00 07 fe  ff ff 00 08  00 00 00 28  9a 03 00 00  !..........(....               71.1.448                                              
                                              00 00 00 00  00 00 00 00  00 00 00 00  00 00 00 00  ................               71.1.464                                              
                                              00 00 00 00  00 00 00 00  00 00 00 00  00 00 00 00  ................               71.1.480                                              
                                              00 00 00 00  00 00 00 00  00 00 00 00  00 00 55 aa  ..............U.               71.1.496                                              
  31.1                             13  IN     55 53 42 53  f0 ca 7c 7f  00 00 00 00  00           USBS.........     276us        72.1.0        2024/08/22  10:20:41.438  classpnp      
  32                              512  IN     33 c0 8e d0  bc 00 7c 8e  c0 8e d8 be  00 7c bf 00  3...............    3us        69.2.0        2024/08/22  10:20:41.438                
                                              06 b9 00 02  fc f3 a4 50  68 1c 06 cb  fb b9 04 00  .......Ph.......               69.2.16                                               
                                              bd be 07 80  7e 00 00 7c  0b 0f 85 0e  01 83 c5 10  ................               69.2.32                                               
                                              e2 f1 cd 18  88 56 00 55  c6 46 11 05  c6 46 10 00  .....V.U.F...F..               69.2.48                                               
                                              b4 41 bb aa  55 cd 13 5d  72 0f 81 fb  55 aa 75 09  .A..U..]r...U.u.               69.2.64                                               
                                              f7 c1 01 00  74 03 fe 46  10 66 60 80  7e 10 00 74  ....t..F.f`....t               69.2.80                                               
                                              26 66 68 00  00 00 00 66  ff 76 08 68  00 00 68 00  &fh....f.v.h..h.               69.2.96                                               
                                              7c 68 01 00  68 10 00 b4  42 8a 56 00  8b f4 cd 13  .h..h...B.V.....               69.2.112                                              
                                              9f 83 c4 10  9e eb 14 b8  01 02 bb 00  7c 8a 56 00  ..............V.               69.2.128                                              
                                              8a 76 01 8a  4e 02 8a 6e  03 cd 13 66  61 73 1c fe  .v..N..n...fas..               69.2.144                                              
                                              4e 11 75 0c  80 7e 00 80  0f 84 8a 00  b2 80 eb 84  N.u.............               69.2.160                                              
                                              55 32 e4 8a  56 00 cd 13  5d eb 9e 81  3e fe 7d 55  U2..V...]...>..U               69.2.176                                              
                                              aa 75 6e ff  76 00 e8 8d  00 75 17 fa  b0 d1 e6 64  .un.v....u.....d               69.2.192                                              
                                              e8 83 00 b0  df e6 60 e8  7c 00 b0 ff  e6 64 e8 75  ......`......d.u               69.2.208                                              
                                              00 fb b8 00  bb cd 1a 66  23 c0 75 3b  66 81 fb 54  .......f#.u;f..T               69.2.224                                              
                                              43 50 41 75  32 81 f9 02  01 72 2c 66  68 07 bb 00  CPAu2....r,fh...               69.2.240                                              
                                              00 66 68 00  02 00 00 66  68 08 00 00  00 66 53 66  .fh....fh....fSf               69.2.256                                              
                                              53 66 55 66  68 00 00 00  00 66 68 00  7c 00 00 66  SfUfh....fh....f               69.2.272                                              
                                              61 68 00 00  07 cd 1a 5a  32 f6 ea 00  7c 00 00 cd  ah.....Z2.......               69.2.288                                              
                                              18 a0 b7 07  eb 08 a0 b6  07 eb 03 a0  b5 07 32 e4  ..............2.               69.2.304                                              
                                              05 00 07 8b  f0 ac 3c 00  74 09 bb 07  00 b4 0e cd  ......<.t.......               69.2.320                                              
                                              10 eb f2 f4  eb fd 2b c9  e4 64 eb 00  24 02 e0 f8  ......+..d..$...               69.2.336                                              
                                              24 02 c3 49  6e 76 61 6c  69 64 20 70  61 72 74 69  $..Invalid parti               69.2.352                                              
                                              74 69 6f 6e  20 74 61 62  6c 65 00 45  72 72 6f 72  tion table.Error               69.2.368                                              
                                              20 6c 6f 61  64 69 6e 67  20 6f 70 65  72 61 74 69   loading operati               69.2.384                                              
                                              6e 67 20 73  79 73 74 65  6d 00 4d 69  73 73 69 6e  ng system.Missin               69.2.400                                              
                                              67 20 6f 70  65 72 61 74  69 6e 67 20  73 79 73 74  g operating syst               69.2.416                                              
                                              65 6d 00 00  00 63 7b 9a  ca 58 3c 43  00 00 80 20  em...c...X<C...                69.2.432                                              
                                              21 00 07 fe  ff ff 00 08  00 00 00 28  9a 03 00 00  !..........(....               69.2.448                                              
                                              00 00 00 00  00 00 00 00  00 00 00 00  00 00 00 00  ................               69.2.464                                              
                                              00 00 00 00  00 00 00 00  00 00 00 00  00 00 00 00  ................               69.2.480                                              
                                              00 00 00 00  00 00 00 00  00 00 00 00  00 00 55 aa  ..............U.               69.2.496                                              
  32                                   CMD    25 00 00 00  00 00 00 00  00 00                     READ CAPACITY     329us        73.1.0        2024/08/22  10:20:41.438  classpnp      
  31.2                             31  OUT    55 53 42 43  10 60 79 7f  08 00 00 00  80 00 0a 25  USBC.`y........%  344us        74.1.0        2024/08/22  10:20:41.439  classpnp      
                                              00 00 00 00  00 00 00 00  00 00 00 00  00 00 00     ...............                74.1.16                                               
  32                                   CMD    25 00 00 00  00 00 00 00  00 00                     READ CAPACITY     607us        75.1.0        2024/08/22  10:20:41.439  classpnp      
  31.1                              8  IN     03 9a 33 f3  00 00 02 00                            ..3.....          1.4ms        76.1.0        2024/08/22  10:20:41.441  classpnp      
  31.1                             13  IN     55 53 42 53  10 60 79 7f  00 00 00 00  00           USBS.`y......     287us        77.1.0        2024/08/22  10:20:41.441  classpnp      
  32                                8  IN     03 9a 33 f3  00 00 02 00                            ..3.....           50us        73.2.0        2024/08/22  10:20:41.441                
  32                                   CMD    25 00 00 00  00 00 00 00  00 00                     READ CAPACITY      21us        78.1.0        2024/08/22  10:20:41.441  classpnp      
  31.2                             31  OUT    55 53 42 43  00 a5 72 7d  08 00 00 00  80 00 0a 25  USBC..r........%  222us        79.1.0        2024/08/22  10:20:41.441  classpnp      
                                              00 00 00 00  00 00 00 00  00 00 00 00  00 00 00     ...............                79.1.16                                               
  31.1                              8  IN     03 9a 33 f3  00 00 02 00                            ..3.....          1.5ms        80.1.0        2024/08/22  10:20:41.443  classpnp      
  31.1                             13  IN     55 53 42 53  00 a5 72 7d  00 00 00 00  00           USBS..r......     336us        81.1.0        2024/08/22  10:20:41.443  classpnp      
  32                                8  IN     03 9a 33 f3  00 00 02 00                            ..3.....           77us        75.2.0        2024/08/22  10:20:41.443                
  32                                   CMD    25 00 00 00  00 00 00 00  00 00                     READ CAPACITY      17us        82.1.0        2024/08/22  10:20:41.443  classpnp      
  31.2                             31  OUT    55 53 42 43  10 60 79 7f  08 00 00 00  80 00 0a 25  USBC.`y........%  274us        83.1.0        2024/08/22  10:20:41.444  classpnp      
                                              00 00 00 00  00 00 00 00  00 00 00 00  00 00 00     ...............                83.1.16                                               
  31.1                              8  IN     03 9a 33 f3  00 00 02 00                            ..3.....          1.2ms        84.1.0        2024/08/22  10:20:41.445  classpnp      
  31.1                             13  IN     55 53 42 53  10 60 79 7f  00 00 00 00  00           USBS.`y......     281us        85.1.0        2024/08/22  10:20:41.445  classpnp      
  32                                8  IN     03 9a 33 f3  00 00 02 00                            ..3.....           50us        78.2.0        2024/08/22  10:20:41.445                
  31.2                             31  OUT    55 53 42 43  00 a5 72 7d  08 00 00 00  80 00 0a 25  USBC..r........%  273us        86.1.0        2024/08/22  10:20:41.445  classpnp      
                                              00 00 00 00  00 00 00 00  00 00 00 00  00 00 00     ...............                86.1.16                                               
  31.1                              8  IN     03 9a 33 f3  00 00 02 00                            ..3.....          1.3ms        87.1.0        2024/08/22  10:20:41.447  classpnp      
  31.1                             13  IN     55 53 42 53  00 a5 72 7d  00 00 00 00  00           USBS..r......     278us        88.1.0        2024/08/22  10:20:41.447  classpnp      
  32                                8  IN     03 9a 33 f3  00 00 02 00                            ..3.....            3us        82.2.0        2024/08/22  10:20:41.447                
  32                                   CMD    25 00 00 00  00 00 00 00  00 00                     READ CAPACITY     250us        89.1.0        2024/08/22  10:20:41.447  classpnp      
  31.2                             31  OUT    55 53 42 43  00 a5 72 7d  08 00 00 00  80 00 0a 25  USBC..r........%  325us        90.1.0        2024/08/22  10:20:41.448  classpnp      
                                              00 00 00 00  00 00 00 00  00 00 00 00  00 00 00     ...............                90.1.16                                               
  31.1                              8  IN     03 9a 33 f3  00 00 02 00                            ..3.....          823us        91.1.0        2024/08/22  10:20:41.448  classpnp      
  31.1                             13  IN     55 53 42 53  00 a5 72 7d  00 00 00 00  00           USBS..r......     334us        92.1.0        2024/08/22  10:20:41.449  classpnp      
  32                                8  IN     03 9a 33 f3  00 00 02 00                            ..3.....            2us        89.2.0        2024/08/22  10:20:41.449                
  32                                   CMD    28 00 00 00  00 02 00 00  01 00                     READ               21us        93.1.0        2024/08/22  10:20:41.449  classpnp      
  31.2                             31  OUT    55 53 42 43  00 a5 72 7d  00 02 00 00  80 00 0a 28  USBC..r........(  296us        94.1.0        2024/08/22  10:20:41.449  classpnp      
                                              00 00 00 00  02 00 00 01  00 00 00 00  00 00 00     ...............                94.1.16                                               
  31.1                            512  IN     00 00 00 00  00 00 00 00  00 00 00 00  00 00 00 00  ................  1.7ms        95.1.0        2024/08/22  10:20:41.451  classpnp      
                                              00 00 00 00  00 00 00 00  00 00 00 00  00 00 00 00  ................               95.1.16                                               
                                              00 00 00 00  00 00 00 00  00 00 00 00  00 00 00 00  ................               95.1.32                                               
                                              00 00 00 00  00 00 00 00  00 00 00 00  00 00 00 00  ................               95.1.48                                               
                                              00 00 00 00  00 00 00 00  00 00 00 00  00 00 00 00  ................               95.1.64                                               
                                              00 00 00 00  00 00 00 00  00 00 00 00  00 00 00 00  ................               95.1.80                                               
                                              00 00 00 00  00 00 00 00  00 00 00 00  00 00 00 00  ................               95.1.96                                               
                                              00 00 00 00  00 00 00 00  00 00 00 00  00 00 00 00  ................               95.1.112                                              
                                              00 00 00 00  00 00 00 00  00 00 00 00  00 00 00 00  ................               95.1.128                                              
                                              00 00 00 00  00 00 00 00  00 00 00 00  00 00 00 00  ................               95.1.144                                              
                                              00 00 00 00  00 00 00 00  00 00 00 00  00 00 00 00  ................               95.1.160                                              
                                              00 00 00 00  00 00 00 00  00 00 00 00  00 00 00 00  ................               95.1.176                                              
                                              00 00 00 00  00 00 00 00  00 00 00 00  00 00 00 00  ................               95.1.192                                              
                                              00 00 00 00  00 00 00 00  00 00 00 00  00 00 00 00  ................               95.1.208                                              
                                              00 00 00 00  00 00 00 00  00 00 00 00  00 00 00 00  ................               95.1.224                                              
                                              00 00 00 00  00 00 00 00  00 00 00 00  00 00 00 00  ................               95.1.240                                              
                                              00 00 00 00  00 00 00 00  00 00 00 00  00 00 00 00  ................               95.1.256                                              
                                              00 00 00 00  00 00 00 00  00 00 00 00  00 00 00 00  ................               95.1.272                                              
                                              00 00 00 00  00 00 00 00  00 00 00 00  00 00 00 00  ................               95.1.288                                              
                                              00 00 00 00  00 00 00 00  00 00 00 00  00 00 00 00  ................               95.1.304                                              
                                              00 00 00 00  00 00 00 00  00 00 00 00  00 00 00 00  ................               95.1.320                                              
                                              00 00 00 00  00 00 00 00  00 00 00 00  00 00 00 00  ................               95.1.336                                              
                                              00 00 00 00  00 00 00 00  00 00 00 00  00 00 00 00  ................               95.1.352                                              
                                              00 00 00 00  00 00 00 00  00 00 00 00  00 00 00 00  ................               95.1.368                                              
                                              00 00 00 00  00 00 00 00  00 00 00 00  00 00 00 00  ................               95.1.384                                              
                                              00 00 00 00  00 00 00 00  00 00 00 00  00 00 00 00  ................               95.1.400                                              
                                              00 00 00 00  00 00 00 00  00 00 00 00  00 00 00 00  ................               95.1.416                                              
                                              00 00 00 00  00 00 00 00  00 00 00 00  00 00 00 00  ................               95.1.432                                              
                                              00 00 00 00  00 00 00 00  00 00 00 00  00 00 00 00  ................               95.1.448                                              
                                              00 00 00 00  00 00 00 00  00 00 00 00  00 00 00 00  ................               95.1.464                                              
                                              00 00 00 00  00 00 00 00  00 00 00 00  00 00 00 00  ................               95.1.480                                              
                                              00 00 00 00  00 00 00 00  00 00 00 00  00 00 00 00  ................               95.1.496                                              
  31.1                             13  IN     55 53 42 53  00 a5 72 7d  00 00 00 00  00           USBS..r......     282us        96.1.0        2024/08/22  10:20:41.451  classpnp      
  32                              512  IN     00 00 00 00  00 00 00 00  00 00 00 00  00 00 00 00  ................    3us        93.2.0        2024/08/22  10:20:41.451                
                                              00 00 00 00  00 00 00 00  00 00 00 00  00 00 00 00  ................               93.2.16                                               
                                              00 00 00 00  00 00 00 00  00 00 00 00  00 00 00 00  ................               93.2.32                                               
                                              00 00 00 00  00 00 00 00  00 00 00 00  00 00 00 00  ................               93.2.48                                               
                                              00 00 00 00  00 00 00 00  00 00 00 00  00 00 00 00  ................               93.2.64                                               
                                              00 00 00 00  00 00 00 00  00 00 00 00  00 00 00 00  ................               93.2.80                                               
                                              00 00 00 00  00 00 00 00  00 00 00 00  00 00 00 00  ................               93.2.96                                               
                                              00 00 00 00  00 00 00 00  00 00 00 00  00 00 00 00  ................               93.2.112                                              
                                              00 00 00 00  00 00 00 00  00 00 00 00  00 00 00 00  ................               93.2.128                                              
                                              00 00 00 00  00 00 00 00  00 00 00 00  00 00 00 00  ................               93.2.144                                              
                                              00 00 00 00  00 00 00 00  00 00 00 00  00 00 00 00  ................               93.2.160                                              
                                              00 00 00 00  00 00 00 00  00 00 00 00  00 00 00 00  ................               93.2.176                                              
                                              00 00 00 00  00 00 00 00  00 00 00 00  00 00 00 00  ................               93.2.192                                              
                                              00 00 00 00  00 00 00 00  00 00 00 00  00 00 00 00  ................               93.2.208                                              
                                              00 00 00 00  00 00 00 00  00 00 00 00  00 00 00 00  ................               93.2.224                                              
                                              00 00 00 00  00 00 00 00  00 00 00 00  00 00 00 00  ................               93.2.240                                              
                                              00 00 00 00  00 00 00 00  00 00 00 00  00 00 00 00  ................               93.2.256                                              
                                              00 00 00 00  00 00 00 00  00 00 00 00  00 00 00 00  ................               93.2.272                                              
                                              00 00 00 00  00 00 00 00  00 00 00 00  00 00 00 00  ................               93.2.288                                              
                                              00 00 00 00  00 00 00 00  00 00 00 00  00 00 00 00  ................               93.2.304                                              
                                              00 00 00 00  00 00 00 00  00 00 00 00  00 00 00 00  ................               93.2.320                                              
                                              00 00 00 00  00 00 00 00  00 00 00 00  00 00 00 00  ................               93.2.336                                              
                                              00 00 00 00  00 00 00 00  00 00 00 00  00 00 00 00  ................               93.2.352                                              
                                              00 00 00 00  00 00 00 00  00 00 00 00  00 00 00 00  ................               93.2.368                                              
                                              00 00 00 00  00 00 00 00  00 00 00 00  00 00 00 00  ................               93.2.384                                              
                                              00 00 00 00  00 00 00 00  00 00 00 00  00 00 00 00  ................               93.2.400                                              
                                              00 00 00 00  00 00 00 00  00 00 00 00  00 00 00 00  ................               93.2.416                                              
                                              00 00 00 00  00 00 00 00  00 00 00 00  00 00 00 00  ................               93.2.432                                              
                                              00 00 00 00  00 00 00 00  00 00 00 00  00 00 00 00  ................               93.2.448                                              
                                              00 00 00 00  00 00 00 00  00 00 00 00  00 00 00 00  ................               93.2.464                                              
                                              00 00 00 00  00 00 00 00  00 00 00 00  00 00 00 00  ................               93.2.480                                              
                                              00 00 00 00  00 00 00 00  00 00 00 00  00 00 00 00  ................               93.2.496                                              
  32                                   CMD    25 00 00 00  00 00 00 00  00 00                     READ CAPACITY     109us        97.1.0        2024/08/22  10:20:41.451  classpnp      
  31.2                             31  OUT    55 53 42 43  f0 ca 7c 7f  08 00 00 00  80 00 0a 25  USBC...........%  352us        98.1.0        2024/08/22  10:20:41.452  classpnp      
                                              00 00 00 00  00 00 00 00  00 00 00 00  00 00 00     ...............                98.1.16                                               
  31.1                              8  IN     03 9a 33 f3  00 00 02 00                            ..3.....          681us        99.1.0        2024/08/22  10:20:41.452  classpnp      
  31.1                             13  IN     55 53 42 53  f0 ca 7c 7f  00 00 00 00  00           USBS.........     268us       100.1.0        2024/08/22  10:20:41.452  classpnp      
  32                                8  IN     03 9a 33 f3  00 00 02 00                            ..3.....            4us        97.2.0        2024/08/22  10:20:41.452                
  32                                   CMD    25 00 00 00  00 00 00 00  00 00                     READ CAPACITY      40us       101.1.0        2024/08/22  10:20:41.453  classpnp      
  31.2                             31  OUT    55 53 42 43  00 a5 72 7d  08 00 00 00  80 00 0a 25  USBC..r........%  314us       102.1.0        2024/08/22  10:20:41.453  classpnp      
                                              00 00 00 00  00 00 00 00  00 00 00 00  00 00 00     ...............               102.1.16                                               
  31.1                              8  IN     03 9a 33 f3  00 00 02 00                            ..3.....          1.9ms       103.1.0        2024/08/22  10:20:41.455  classpnp      
  31.1                             13  IN     55 53 42 53  00 a5 72 7d  00 00 00 00  00           USBS..r......     298us       104.1.0        2024/08/22  10:20:41.455  classpnp      
  32                                8  IN     03 9a 33 f3  00 00 02 00                            ..3.....            3us       101.2.0        2024/08/22  10:20:41.455                
  32                                   CMD    28 00 00 00  00 00 00 00  01 00                     READ               20us       105.1.0        2024/08/22  10:20:41.455  classpnp      
  31.2                             31  OUT    55 53 42 43  f0 ca 7c 7f  00 02 00 00  80 00 0a 28  USBC...........(  329us       106.1.0        2024/08/22  10:20:41.455  classpnp      
                                              00 00 00 00  00 00 00 01  00 00 00 00  00 00 00     ...............               106.1.16                                               
  31.1                            512  IN     33 c0 8e d0  bc 00 7c 8e  c0 8e d8 be  00 7c bf 00  3...............  1.3ms       107.1.0        2024/08/22  10:20:41.457  classpnp      
                                              06 b9 00 02  fc f3 a4 50  68 1c 06 cb  fb b9 04 00  .......Ph.......              107.1.16                                               
                                              bd be 07 80  7e 00 00 7c  0b 0f 85 0e  01 83 c5 10  ................              107.1.32                                               
                                              e2 f1 cd 18  88 56 00 55  c6 46 11 05  c6 46 10 00  .....V.U.F...F..              107.1.48                                               
                                              b4 41 bb aa  55 cd 13 5d  72 0f 81 fb  55 aa 75 09  .A..U..]r...U.u.              107.1.64                                               
                                              f7 c1 01 00  74 03 fe 46  10 66 60 80  7e 10 00 74  ....t..F.f`....t              107.1.80                                               
                                              26 66 68 00  00 00 00 66  ff 76 08 68  00 00 68 00  &fh....f.v.h..h.              107.1.96                                               
                                              7c 68 01 00  68 10 00 b4  42 8a 56 00  8b f4 cd 13  .h..h...B.V.....              107.1.112                                              
                                              9f 83 c4 10  9e eb 14 b8  01 02 bb 00  7c 8a 56 00  ..............V.              107.1.128                                              
                                              8a 76 01 8a  4e 02 8a 6e  03 cd 13 66  61 73 1c fe  .v..N..n...fas..              107.1.144                                              
                                              4e 11 75 0c  80 7e 00 80  0f 84 8a 00  b2 80 eb 84  N.u.............              107.1.160                                              
                                              55 32 e4 8a  56 00 cd 13  5d eb 9e 81  3e fe 7d 55  U2..V...]...>..U              107.1.176                                              
                                              aa 75 6e ff  76 00 e8 8d  00 75 17 fa  b0 d1 e6 64  .un.v....u.....d              107.1.192                                              
                                              e8 83 00 b0  df e6 60 e8  7c 00 b0 ff  e6 64 e8 75  ......`......d.u              107.1.208                                              
                                              00 fb b8 00  bb cd 1a 66  23 c0 75 3b  66 81 fb 54  .......f#.u;f..T              107.1.224                                              
                                              43 50 41 75  32 81 f9 02  01 72 2c 66  68 07 bb 00  CPAu2....r,fh...              107.1.240                                              
                                              00 66 68 00  02 00 00 66  68 08 00 00  00 66 53 66  .fh....fh....fSf              107.1.256                                              
                                              53 66 55 66  68 00 00 00  00 66 68 00  7c 00 00 66  SfUfh....fh....f              107.1.272                                              
                                              61 68 00 00  07 cd 1a 5a  32 f6 ea 00  7c 00 00 cd  ah.....Z2.......              107.1.288                                              
                                              18 a0 b7 07  eb 08 a0 b6  07 eb 03 a0  b5 07 32 e4  ..............2.              107.1.304                                              
                                              05 00 07 8b  f0 ac 3c 00  74 09 bb 07  00 b4 0e cd  ......<.t.......              107.1.320                                              
                                              10 eb f2 f4  eb fd 2b c9  e4 64 eb 00  24 02 e0 f8  ......+..d..$...              107.1.336                                              
                                              24 02 c3 49  6e 76 61 6c  69 64 20 70  61 72 74 69  $..Invalid parti              107.1.352                                              
                                              74 69 6f 6e  20 74 61 62  6c 65 00 45  72 72 6f 72  tion table.Error              107.1.368                                              
                                              20 6c 6f 61  64 69 6e 67  20 6f 70 65  72 61 74 69   loading operati              107.1.384                                              
                                              6e 67 20 73  79 73 74 65  6d 00 4d 69  73 73 69 6e  ng system.Missin              107.1.400                                              
                                              67 20 6f 70  65 72 61 74  69 6e 67 20  73 79 73 74  g operating syst              107.1.416                                              
                                              65 6d 00 00  00 63 7b 9a  ca 58 3c 43  00 00 80 20  em...c...X<C...               107.1.432                                              
                                              21 00 07 fe  ff ff 00 08  00 00 00 28  9a 03 00 00  !..........(....              107.1.448                                              
                                              00 00 00 00  00 00 00 00  00 00 00 00  00 00 00 00  ................              107.1.464                                              
                                              00 00 00 00  00 00 00 00  00 00 00 00  00 00 00 00  ................              107.1.480                                              
                                              00 00 00 00  00 00 00 00  00 00 00 00  00 00 55 aa  ..............U.              107.1.496                                              
  31.1                             13  IN     55 53 42 53  f0 ca 7c 7f  00 00 00 00  00           USBS.........     277us       108.1.0        2024/08/22  10:20:41.457  classpnp      
  32                              512  IN     33 c0 8e d0  bc 00 7c 8e  c0 8e d8 be  00 7c bf 00  3...............    3us       105.2.0        2024/08/22  10:20:41.457                
                                              06 b9 00 02  fc f3 a4 50  68 1c 06 cb  fb b9 04 00  .......Ph.......              105.2.16                                               
                                              bd be 07 80  7e 00 00 7c  0b 0f 85 0e  01 83 c5 10  ................              105.2.32                                               
                                              e2 f1 cd 18  88 56 00 55  c6 46 11 05  c6 46 10 00  .....V.U.F...F..              105.2.48                                               
                                              b4 41 bb aa  55 cd 13 5d  72 0f 81 fb  55 aa 75 09  .A..U..]r...U.u.              105.2.64                                               
                                              f7 c1 01 00  74 03 fe 46  10 66 60 80  7e 10 00 74  ....t..F.f`....t              105.2.80                                               
                                              26 66 68 00  00 00 00 66  ff 76 08 68  00 00 68 00  &fh....f.v.h..h.              105.2.96                                               
                                              7c 68 01 00  68 10 00 b4  42 8a 56 00  8b f4 cd 13  .h..h...B.V.....              105.2.112                                              
                                              9f 83 c4 10  9e eb 14 b8  01 02 bb 00  7c 8a 56 00  ..............V.              105.2.128                                              
                                              8a 76 01 8a  4e 02 8a 6e  03 cd 13 66  61 73 1c fe  .v..N..n...fas..              105.2.144                                              
                                              4e 11 75 0c  80 7e 00 80  0f 84 8a 00  b2 80 eb 84  N.u.............              105.2.160                                              
                                              55 32 e4 8a  56 00 cd 13  5d eb 9e 81  3e fe 7d 55  U2..V...]...>..U              105.2.176                                              
                                              aa 75 6e ff  76 00 e8 8d  00 75 17 fa  b0 d1 e6 64  .un.v....u.....d              105.2.192                                              
                                              e8 83 00 b0  df e6 60 e8  7c 00 b0 ff  e6 64 e8 75  ......`......d.u              105.2.208                                              
                                              00 fb b8 00  bb cd 1a 66  23 c0 75 3b  66 81 fb 54  .......f#.u;f..T              105.2.224                                              
                                              43 50 41 75  32 81 f9 02  01 72 2c 66  68 07 bb 00  CPAu2....r,fh...              105.2.240                                              
                                              00 66 68 00  02 00 00 66  68 08 00 00  00 66 53 66  .fh....fh....fSf              105.2.256                                              
                                              53 66 55 66  68 00 00 00  00 66 68 00  7c 00 00 66  SfUfh....fh....f              105.2.272                                              
                                              61 68 00 00  07 cd 1a 5a  32 f6 ea 00  7c 00 00 cd  ah.....Z2.......              105.2.288                                              
                                              18 a0 b7 07  eb 08 a0 b6  07 eb 03 a0  b5 07 32 e4  ..............2.              105.2.304                                              
                                              05 00 07 8b  f0 ac 3c 00  74 09 bb 07  00 b4 0e cd  ......<.t.......              105.2.320                                              
                                              10 eb f2 f4  eb fd 2b c9  e4 64 eb 00  24 02 e0 f8  ......+..d..$...              105.2.336                                              
                                              24 02 c3 49  6e 76 61 6c  69 64 20 70  61 72 74 69  $..Invalid parti              105.2.352                                              
                                              74 69 6f 6e  20 74 61 62  6c 65 00 45  72 72 6f 72  tion table.Error              105.2.368                                              
                                              20 6c 6f 61  64 69 6e 67  20 6f 70 65  72 61 74 69   loading operati              105.2.384                                              
                                              6e 67 20 73  79 73 74 65  6d 00 4d 69  73 73 69 6e  ng system.Missin              105.2.400                                              
                                              67 20 6f 70  65 72 61 74  69 6e 67 20  73 79 73 74  g operating syst              105.2.416                                              
                                              65 6d 00 00  00 63 7b 9a  ca 58 3c 43  00 00 80 20  em...c...X<C...               105.2.432                                              
                                              21 00 07 fe  ff ff 00 08  00 00 00 28  9a 03 00 00  !..........(....              105.2.448                                              
                                              00 00 00 00  00 00 00 00  00 00 00 00  00 00 00 00  ................              105.2.464                                              
                                              00 00 00 00  00 00 00 00  00 00 00 00  00 00 00 00  ................              105.2.480                                              
                                              00 00 00 00  00 00 00 00  00 00 00 00  00 00 55 aa  ..............U.              105.2.496                                              
  32                                   CMD    28 00 00 00  08 00 00 00  01 00                     READ               22us       109.1.0        2024/08/22  10:20:41.457  classpnp      
  31.2                             31  OUT    55 53 42 43  00 a5 72 7d  00 02 00 00  80 00 0a 28  USBC..r........(  343us       110.1.0        2024/08/22  10:20:41.457  classpnp      
                                              00 00 00 08  00 00 00 01  00 00 00 00  00 00 00     ...............               110.1.16                                               
  31.1                            512  IN     eb 52 90 4e  54 46 53 20  20 20 20 00  02 08 00 00  .R.NTFS    .....  1.4ms       111.1.0        2024/08/22  10:20:41.459  classpnp      
                                              00 00 00 00  00 f8 00 00  3f 00 ff 00  00 08 00 00  ........?.......              111.1.16                                               
                                              00 00 00 00  80 00 00 00  ff 27 9a 03  00 00 00 00  .........'......              111.1.32                                               
                                              00 00 0c 00  00 00 00 00  02 00 00 00  00 00 00 00  ................              111.1.48                                               
                                              f6 00 00 00  01 00 00 00  26 8e 2a 3e  d6 2a 3e f8  ........&.*>.*>.              111.1.64                                               
                                              00 00 00 00  fa 33 c0 8e  d0 bc 00 7c  fb 68 c0 07  .....3.......h..              111.1.80                                               
                                              1f 1e 68 66  00 cb 88 16  0e 00 66 81  3e 03 00 4e  ..hf......f.>..N              111.1.96                                               
                                              54 46 53 75  15 b4 41 bb  aa 55 cd 13  72 0c 81 fb  TFSu..A..U..r...              111.1.112                                              
                                              55 aa 75 06  f7 c1 01 00  75 03 e9 dd  00 1e 83 ec  U.u.....u.......              111.1.128                                              
                                              18 68 1a 00  b4 48 8a 16  0e 00 8b f4  16 1f cd 13  .h...H..........              111.1.144                                              
                                              9f 83 c4 18  9e 58 1f 72  e1 3b 06 0b  00 75 db a3  .....X.r.;...u..              111.1.160                                              
                                              0f 00 c1 2e  0f 00 04 1e  5a 33 db b9  00 20 2b c8  ........Z3... +.              111.1.176                                              
                                              66 ff 06 11  00 03 16 0f  00 8e c2 ff  06 16 00 e8  f...............              111.1.192                                              
                                              4b 00 2b c8  77 ef b8 00  bb cd 1a 66  23 c0 75 2d  K.+.w......f#.u-              111.1.208                                              
                                              66 81 fb 54  43 50 41 75  24 81 f9 02  01 72 1e 16  f..TCPAu$....r..              111.1.224                                              
                                              68 07 bb 16  68 52 11 16  68 09 00 66  53 66 53 66  h...hR..h..fSfSf              111.1.240                                              
                                              55 16 16 16  68 b8 01 66  61 0e 07 cd  1a 33 c0 bf  U...h..fa....3..              111.1.256                                              
                                              0a 13 b9 f6  0c fc f3 aa  e9 fe 01 90  90 66 60 1e  .............f`.              111.1.272                                              
                                              06 66 a1 11  00 66 03 06  1c 00 1e 66  68 00 00 00  .f...f.....fh...              111.1.288                                              
                                              00 66 50 06  53 68 01 00  68 10 00 b4  42 8a 16 0e  .fP.Sh..h...B...              111.1.304                                              
                                              00 16 1f 8b  f4 cd 13 66  59 5b 5a 66  59 66 59 1f  .......fY[ZfYfY.              111.1.320                                              
                                              0f 82 16 00  66 ff 06 11  00 03 16 0f  00 8e c2 ff  ....f...........              111.1.336                                              
                                              0e 16 00 75  bc 07 1f 66  61 c3 a1 f6  01 e8 09 00  ...u...fa.......              111.1.352                                              
                                              a1 fa 01 e8  03 00 f4 eb  fd 8b f0 ac  3c 00 74 09  ............<.t.              111.1.368                                              
                                              b4 0e bb 07  00 cd 10 eb  f2 c3 0d 0a  41 20 64 69  ............A di              111.1.384                                              
                                              73 6b 20 72  65 61 64 20  65 72 72 6f  72 20 6f 63  sk read error oc              111.1.400                                              
                                              63 75 72 72  65 64 00 0d  0a 42 4f 4f  54 4d 47 52  curred...BOOTMGR              111.1.416                                              
                                              20 69 73 20  63 6f 6d 70  72 65 73 73  65 64 00 0d   is compressed..              111.1.432                                              
                                              0a 50 72 65  73 73 20 43  74 72 6c 2b  41 6c 74 2b  .Press Ctrl+Alt+              111.1.448                                              
                                              44 65 6c 20  74 6f 20 72  65 73 74 61  72 74 0d 0a  Del to restart..              111.1.464                                              
                                              00 00 00 00  00 00 00 00  00 00 00 00  00 00 00 00  ................              111.1.480                                              
                                              00 00 00 00  00 00 8a 01  a7 01 bf 01  00 00 55 aa  ..............U.              111.1.496                                              
  31.1                             13  IN     55 53 42 53  00 a5 72 7d  00 00 00 00  00           USBS..r......     277us       112.1.0        2024/08/22  10:20:41.459  classpnp      
  32                              512  IN     eb 52 90 4e  54 46 53 20  20 20 20 00  02 08 00 00  .R.NTFS    .....    3us       109.2.0        2024/08/22  10:20:41.459                
                                              00 00 00 00  00 f8 00 00  3f 00 ff 00  00 08 00 00  ........?.......              109.2.16                                               
                                              00 00 00 00  80 00 00 00  ff 27 9a 03  00 00 00 00  .........'......              109.2.32                                               
                                              00 00 0c 00  00 00 00 00  02 00 00 00  00 00 00 00  ................              109.2.48                                               
                                              f6 00 00 00  01 00 00 00  26 8e 2a 3e  d6 2a 3e f8  ........&.*>.*>.              109.2.64                                               
                                              00 00 00 00  fa 33 c0 8e  d0 bc 00 7c  fb 68 c0 07  .....3.......h..              109.2.80                                               
                                              1f 1e 68 66  00 cb 88 16  0e 00 66 81  3e 03 00 4e  ..hf......f.>..N              109.2.96                                               
                                              54 46 53 75  15 b4 41 bb  aa 55 cd 13  72 0c 81 fb  TFSu..A..U..r...              109.2.112                                              
                                              55 aa 75 06  f7 c1 01 00  75 03 e9 dd  00 1e 83 ec  U.u.....u.......              109.2.128                                              
                                              18 68 1a 00  b4 48 8a 16  0e 00 8b f4  16 1f cd 13  .h...H..........              109.2.144                                              
                                              9f 83 c4 18  9e 58 1f 72  e1 3b 06 0b  00 75 db a3  .....X.r.;...u..              109.2.160                                              
                                              0f 00 c1 2e  0f 00 04 1e  5a 33 db b9  00 20 2b c8  ........Z3... +.              109.2.176                                              
                                              66 ff 06 11  00 03 16 0f  00 8e c2 ff  06 16 00 e8  f...............              109.2.192                                              
                                              4b 00 2b c8  77 ef b8 00  bb cd 1a 66  23 c0 75 2d  K.+.w......f#.u-              109.2.208                                              
                                              66 81 fb 54  43 50 41 75  24 81 f9 02  01 72 1e 16  f..TCPAu$....r..              109.2.224                                              
                                              68 07 bb 16  68 52 11 16  68 09 00 66  53 66 53 66  h...hR..h..fSfSf              109.2.240                                              
                                              55 16 16 16  68 b8 01 66  61 0e 07 cd  1a 33 c0 bf  U...h..fa....3..              109.2.256                                              
                                              0a 13 b9 f6  0c fc f3 aa  e9 fe 01 90  90 66 60 1e  .............f`.              109.2.272                                              
                                              06 66 a1 11  00 66 03 06  1c 00 1e 66  68 00 00 00  .f...f.....fh...              109.2.288                                              
                                              00 66 50 06  53 68 01 00  68 10 00 b4  42 8a 16 0e  .fP.Sh..h...B...              109.2.304                                              
                                              00 16 1f 8b  f4 cd 13 66  59 5b 5a 66  59 66 59 1f  .......fY[ZfYfY.              109.2.320                                              
                                              0f 82 16 00  66 ff 06 11  00 03 16 0f  00 8e c2 ff  ....f...........              109.2.336                                              
                                              0e 16 00 75  bc 07 1f 66  61 c3 a1 f6  01 e8 09 00  ...u...fa.......              109.2.352                                              
                                              a1 fa 01 e8  03 00 f4 eb  fd 8b f0 ac  3c 00 74 09  ............<.t.              109.2.368                                              
                                              b4 0e bb 07  00 cd 10 eb  f2 c3 0d 0a  41 20 64 69  ............A di              109.2.384                                              
                                              73 6b 20 72  65 61 64 20  65 72 72 6f  72 20 6f 63  sk read error oc              109.2.400                                              
                                              63 75 72 72  65 64 00 0d  0a 42 4f 4f  54 4d 47 52  curred...BOOTMGR              109.2.416                                              
                                              20 69 73 20  63 6f 6d 70  72 65 73 73  65 64 00 0d   is compressed..              109.2.432                                              
                                              0a 50 72 65  73 73 20 43  74 72 6c 2b  41 6c 74 2b  .Press Ctrl+Alt+              109.2.448                                              
                                              44 65 6c 20  74 6f 20 72  65 73 74 61  72 74 0d 0a  Del to restart..              109.2.464                                              
                                              00 00 00 00  00 00 00 00  00 00 00 00  00 00 00 00  ................              109.2.480                                              
                                              00 00 00 00  00 00 8a 01  a7 01 bf 01  00 00 55 aa  ..............U.              109.2.496                                              
  32                                   CMD    1a 00 3f 00  c0 00                                  MODE SENSE 3F     1.3ms       113.1.0        2024/08/22  10:20:41.460  classpnp      
  31.2                             31  OUT    55 53 42 43  00 a5 72 7d  c0 00 00 00  80 00 06 1a  USBC..r.........  1.4ms       114.1.0        2024/08/22  10:20:41.462  classpnp      
                                              00 3f 00 c0  00 00 00 00  00 00 00 00  00 00 00     .?.............               114.1.16                                               
  31.1                             80  IN     4f 00 00 00  05 1e f0 00  00 00 02 00  00 00 00 00  O...............  2.0ms       115.1.0        2024/08/22  10:20:41.464  classpnp      
                                              00 00 00 00  00 00 00 00  00 00 00 00  00 00 00 00  ................              115.1.16                                               
                                              00 00 00 00  08 12 00 00  00 00 00 00  00 00 00 00  ................              115.1.32                                               
                                              00 00 00 00  00 00 00 00  1c 0a 00 00  00 00 00 00  ................              115.1.48                                               
                                              00 00 00 00  01 0a 80 10  00 00 00 00  02 00 00 00  ................              115.1.64                                               
  31.1                             13  IN     55 53 42 53  00 a5 72 7d  70 00 00 00  00           USBS..r.p....     1.6ms       116.1.0        2024/08/22  10:20:41.466  classpnp      
  32                               80  IN     4f 00 00 00  05 1e f0 00  00 00 02 00  00 00 00 00  O...............    7us       113.2.0        2024/08/22  10:20:41.466                
                                              00 00 00 00  00 00 00 00  00 00 00 00  00 00 00 00  ................              113.2.16                                               
                                              00 00 00 00  08 12 00 00  00 00 00 00  00 00 00 00  ................              113.2.32                                               
                                              00 00 00 00  00 00 00 00  1c 0a 00 00  00 00 00 00  ................              113.2.48                                               
                                              00 00 00 00  01 0a 80 10  00 00 00 00  02 00 00 00  ................              113.2.64                                               
  32                                   SSTS   12                                                  data overrun        0us       113.3.0        2024/08/22  10:20:41.466                
  32                                   CMD    00 00 00 00  00 00                                  TEST UNIT READY    23us       117.1.0        2024/08/22  10:20:41.466  fvevol        
  31.2                             31  OUT    55 53 42 43  10 e0 79 7f  00 00 00 00  00 00 06 00  USBC..y.........  1.9ms       118.1.0        2024/08/22  10:20:41.468  fvevol        
                                              00 00 00 00  00 00 00 00  00 00 00 00  00 00 00     ...............               118.1.16                                               
  31.1                             13  IN     55 53 42 53  10 e0 79 7f  00 00 00 00  00           USBS..y......     2.0ms       119.1.0        2024/08/22  10:20:41.470  fvevol        
  32                                   ok                                                                             7us       117.2.0        2024/08/22  10:20:41.470                
  32                                   CMD    00 00 00 00  00 00                                  TEST UNIT READY    12us       120.1.0        2024/08/22  10:20:41.470  unknown       
  32                                   CMD    25 00 00 00  00 00 00 00  00 00                     READ CAPACITY      17us       121.1.0        2024/08/22  10:20:41.470  classpnp      
  31.2                             31  OUT    55 53 42 43  20 fb dd 7e  00 00 00 00  00 00 06 00  USBC ...........  1.9ms       122.1.0        2024/08/22  10:20:41.472  unknown       
                                              00 00 00 00  00 00 00 00  00 00 00 00  00 00 00     ...............               122.1.16                                               
  31.1                             13  IN     55 53 42 53  20 fb dd 7e  00 00 00 00  00           USBS ........     2.0ms       123.1.0        2024/08/22  10:20:41.474  unknown       
  32                                   ok                                                                           112us       120.2.0        2024/08/22  10:20:41.474                
  31.2                             31  OUT    55 53 42 43  00 a5 72 7d  08 00 00 00  80 00 0a 25  USBC..r........%  354us       124.1.0        2024/08/22  10:20:41.474  classpnp      
                                              00 00 00 00  00 00 00 00  00 00 00 00  00 00 00     ...............               124.1.16                                               
  31.1                              8  IN     03 9a 33 f3  00 00 02 00                            ..3.....          952us       125.1.0        2024/08/22  10:20:41.475  classpnp      
  31.1                             13  IN     55 53 42 53  00 a5 72 7d  00 00 00 00  00           USBS..r......     295us       126.1.0        2024/08/22  10:20:41.476  classpnp      
  32                                8  IN     03 9a 33 f3  00 00 02 00                            ..3.....            2us       121.2.0        2024/08/22  10:20:41.476                
  32                                   CMD    25 00 00 00  00 00 00 00  00 00                     READ CAPACITY      13us       127.1.0        2024/08/22  10:20:41.476  classpnp      
  31.2                             31  OUT    55 53 42 43  f0 ca 7c 7f  08 00 00 00  80 00 0a 25  USBC...........%  301us       128.1.0        2024/08/22  10:20:41.476  classpnp      
                                              00 00 00 00  00 00 00 00  00 00 00 00  00 00 00     ...............               128.1.16                                               
  31.1                              8  IN     03 9a 33 f3  00 00 02 00                            ..3.....          1.8ms       129.1.0        2024/08/22  10:20:41.478  classpnp      
  31.1                             13  IN     55 53 42 53  f0 ca 7c 7f  00 00 00 00  00           USBS.........     274us       130.1.0        2024/08/22  10:20:41.478  classpnp      
  32                                8  IN     03 9a 33 f3  00 00 02 00                            ..3.....            8us       127.2.0        2024/08/22  10:20:41.478                
  32                                   CMD    28 00 00 00  00 00 00 00  01 00                     READ               18us       131.1.0        2024/08/22  10:20:41.478  classpnp      
  31.2                             31  OUT    55 53 42 43  f0 ca 7c 7f  00 02 00 00  80 00 0a 28  USBC...........(  335us       132.1.0        2024/08/22  10:20:41.478  classpnp      
                                              00 00 00 00  00 00 00 01  00 00 00 00  00 00 00     ...............               132.1.16                                               
  31.1                            512  IN     33 c0 8e d0  bc 00 7c 8e  c0 8e d8 be  00 7c bf 00  3...............  1.5ms       133.1.0        2024/08/22  10:20:41.480  classpnp      
                                              06 b9 00 02  fc f3 a4 50  68 1c 06 cb  fb b9 04 00  .......Ph.......              133.1.16                                               
                                              bd be 07 80  7e 00 00 7c  0b 0f 85 0e  01 83 c5 10  ................              133.1.32                                               
                                              e2 f1 cd 18  88 56 00 55  c6 46 11 05  c6 46 10 00  .....V.U.F...F..              133.1.48                                               
                                              b4 41 bb aa  55 cd 13 5d  72 0f 81 fb  55 aa 75 09  .A..U..]r...U.u.              133.1.64                                               
                                              f7 c1 01 00  74 03 fe 46  10 66 60 80  7e 10 00 74  ....t..F.f`....t              133.1.80                                               
                                              26 66 68 00  00 00 00 66  ff 76 08 68  00 00 68 00  &fh....f.v.h..h.              133.1.96                                               
                                              7c 68 01 00  68 10 00 b4  42 8a 56 00  8b f4 cd 13  .h..h...B.V.....              133.1.112                                              
                                              9f 83 c4 10  9e eb 14 b8  01 02 bb 00  7c 8a 56 00  ..............V.              133.1.128                                              
                                              8a 76 01 8a  4e 02 8a 6e  03 cd 13 66  61 73 1c fe  .v..N..n...fas..              133.1.144                                              
                                              4e 11 75 0c  80 7e 00 80  0f 84 8a 00  b2 80 eb 84  N.u.............              133.1.160                                              
                                              55 32 e4 8a  56 00 cd 13  5d eb 9e 81  3e fe 7d 55  U2..V...]...>..U              133.1.176                                              
                                              aa 75 6e ff  76 00 e8 8d  00 75 17 fa  b0 d1 e6 64  .un.v....u.....d              133.1.192                                              
                                              e8 83 00 b0  df e6 60 e8  7c 00 b0 ff  e6 64 e8 75  ......`......d.u              133.1.208                                              
                                              00 fb b8 00  bb cd 1a 66  23 c0 75 3b  66 81 fb 54  .......f#.u;f..T              133.1.224                                              
                                              43 50 41 75  32 81 f9 02  01 72 2c 66  68 07 bb 00  CPAu2....r,fh...              133.1.240                                              
                                              00 66 68 00  02 00 00 66  68 08 00 00  00 66 53 66  .fh....fh....fSf              133.1.256                                              
                                              53 66 55 66  68 00 00 00  00 66 68 00  7c 00 00 66  SfUfh....fh....f              133.1.272                                              
                                              61 68 00 00  07 cd 1a 5a  32 f6 ea 00  7c 00 00 cd  ah.....Z2.......              133.1.288                                              
                                              18 a0 b7 07  eb 08 a0 b6  07 eb 03 a0  b5 07 32 e4  ..............2.              133.1.304                                              
                                              05 00 07 8b  f0 ac 3c 00  74 09 bb 07  00 b4 0e cd  ......<.t.......              133.1.320                                              
                                              10 eb f2 f4  eb fd 2b c9  e4 64 eb 00  24 02 e0 f8  ......+..d..$...              133.1.336                                              
                                              24 02 c3 49  6e 76 61 6c  69 64 20 70  61 72 74 69  $..Invalid parti              133.1.352                                              
                                              74 69 6f 6e  20 74 61 62  6c 65 00 45  72 72 6f 72  tion table.Error              133.1.368                                              
                                              20 6c 6f 61  64 69 6e 67  20 6f 70 65  72 61 74 69   loading operati              133.1.384                                              
                                              6e 67 20 73  79 73 74 65  6d 00 4d 69  73 73 69 6e  ng system.Missin              133.1.400                                              
                                              67 20 6f 70  65 72 61 74  69 6e 67 20  73 79 73 74  g operating syst              133.1.416                                              
                                              65 6d 00 00  00 63 7b 9a  ca 58 3c 43  00 00 80 20  em...c...X<C...               133.1.432                                              
                                              21 00 07 fe  ff ff 00 08  00 00 00 28  9a 03 00 00  !..........(....              133.1.448                                              
                                              00 00 00 00  00 00 00 00  00 00 00 00  00 00 00 00  ................              133.1.464                                              
                                              00 00 00 00  00 00 00 00  00 00 00 00  00 00 00 00  ................              133.1.480                                              
                                              00 00 00 00  00 00 00 00  00 00 00 00  00 00 55 aa  ..............U.              133.1.496                                              
  31.1                             13  IN     55 53 42 53  f0 ca 7c 7f  00 00 00 00  00           USBS.........     309us       134.1.0        2024/08/22  10:20:41.480  classpnp      
  32                              512  IN     33 c0 8e d0  bc 00 7c 8e  c0 8e d8 be  00 7c bf 00  3...............    5us       131.2.0        2024/08/22  10:20:41.480                
                                              06 b9 00 02  fc f3 a4 50  68 1c 06 cb  fb b9 04 00  .......Ph.......              131.2.16                                               
                                              bd be 07 80  7e 00 00 7c  0b 0f 85 0e  01 83 c5 10  ................              131.2.32                                               
                                              e2 f1 cd 18  88 56 00 55  c6 46 11 05  c6 46 10 00  .....V.U.F...F..              131.2.48                                               
                                              b4 41 bb aa  55 cd 13 5d  72 0f 81 fb  55 aa 75 09  .A..U..]r...U.u.              131.2.64                                               
                                              f7 c1 01 00  74 03 fe 46  10 66 60 80  7e 10 00 74  ....t..F.f`....t              131.2.80                                               
                                              26 66 68 00  00 00 00 66  ff 76 08 68  00 00 68 00  &fh....f.v.h..h.              131.2.96                                               
                                              7c 68 01 00  68 10 00 b4  42 8a 56 00  8b f4 cd 13  .h..h...B.V.....              131.2.112                                              
                                              9f 83 c4 10  9e eb 14 b8  01 02 bb 00  7c 8a 56 00  ..............V.              131.2.128                                              
                                              8a 76 01 8a  4e 02 8a 6e  03 cd 13 66  61 73 1c fe  .v..N..n...fas..              131.2.144                                              
                                              4e 11 75 0c  80 7e 00 80  0f 84 8a 00  b2 80 eb 84  N.u.............              131.2.160                                              
                                              55 32 e4 8a  56 00 cd 13  5d eb 9e 81  3e fe 7d 55  U2..V...]...>..U              131.2.176                                              
                                              aa 75 6e ff  76 00 e8 8d  00 75 17 fa  b0 d1 e6 64  .un.v....u.....d              131.2.192                                              
                                              e8 83 00 b0  df e6 60 e8  7c 00 b0 ff  e6 64 e8 75  ......`......d.u              131.2.208                                              
                                              00 fb b8 00  bb cd 1a 66  23 c0 75 3b  66 81 fb 54  .......f#.u;f..T              131.2.224                                              
                                              43 50 41 75  32 81 f9 02  01 72 2c 66  68 07 bb 00  CPAu2....r,fh...              131.2.240                                              
                                              00 66 68 00  02 00 00 66  68 08 00 00  00 66 53 66  .fh....fh....fSf              131.2.256                                              
                                              53 66 55 66  68 00 00 00  00 66 68 00  7c 00 00 66  SfUfh....fh....f              131.2.272                                              
                                              61 68 00 00  07 cd 1a 5a  32 f6 ea 00  7c 00 00 cd  ah.....Z2.......              131.2.288                                              
                                              18 a0 b7 07  eb 08 a0 b6  07 eb 03 a0  b5 07 32 e4  ..............2.              131.2.304                                              
                                              05 00 07 8b  f0 ac 3c 00  74 09 bb 07  00 b4 0e cd  ......<.t.......              131.2.320                                              
                                              10 eb f2 f4  eb fd 2b c9  e4 64 eb 00  24 02 e0 f8  ......+..d..$...              131.2.336                                              
                                              24 02 c3 49  6e 76 61 6c  69 64 20 70  61 72 74 69  $..Invalid parti              131.2.352                                              
                                              74 69 6f 6e  20 74 61 62  6c 65 00 45  72 72 6f 72  tion table.Error              131.2.368                                              
                                              20 6c 6f 61  64 69 6e 67  20 6f 70 65  72 61 74 69   loading operati              131.2.384                                              
                                              6e 67 20 73  79 73 74 65  6d 00 4d 69  73 73 69 6e  ng system.Missin              131.2.400                                              
                                              67 20 6f 70  65 72 61 74  69 6e 67 20  73 79 73 74  g operating syst              131.2.416                                              
                                              65 6d 00 00  00 63 7b 9a  ca 58 3c 43  00 00 80 20  em...c...X<C...               131.2.432                                              
                                              21 00 07 fe  ff ff 00 08  00 00 00 28  9a 03 00 00  !..........(....              131.2.448                                              
                                              00 00 00 00  00 00 00 00  00 00 00 00  00 00 00 00  ................              131.2.464                                              
                                              00 00 00 00  00 00 00 00  00 00 00 00  00 00 00 00  ................              131.2.480                                              
                                              00 00 00 00  00 00 00 00  00 00 00 00  00 00 55 aa  ..............U.              131.2.496                                              
  32                                   CMD    25 00 00 00  00 00 00 00  00 00                     READ CAPACITY      98us       135.1.0        2024/08/22  10:20:41.480  classpnp      
  31.2                             31  OUT    55 53 42 43  00 a5 72 7d  08 00 00 00  80 00 0a 25  USBC..r........%  343us       136.1.0        2024/08/22  10:20:41.481  classpnp      
                                              00 00 00 00  00 00 00 00  00 00 00 00  00 00 00     ...............               136.1.16                                               
  31.1                              8  IN     03 9a 33 f3  00 00 02 00                            ..3.....          1.0ms       137.1.0        2024/08/22  10:20:41.482  classpnp      
  31.1                             13  IN     55 53 42 53  00 a5 72 7d  00 00 00 00  00           USBS..r......     306us       138.1.0        2024/08/22  10:20:41.482  classpnp      
  32                                8  IN     03 9a 33 f3  00 00 02 00                            ..3.....            2us       135.2.0        2024/08/22  10:20:41.482                
  32                                   CMD    25 00 00 00  00 00 00 00  00 00                     READ CAPACITY      67us       139.1.0        2024/08/22  10:20:41.482  classpnp      
  31.2                             31  OUT    55 53 42 43  f0 ca 7c 7f  08 00 00 00  80 00 0a 25  USBC...........%  297us       140.1.0        2024/08/22  10:20:41.482  classpnp      
                                              00 00 00 00  00 00 00 00  00 00 00 00  00 00 00     ...............               140.1.16                                               
  31.1                              8  IN     03 9a 33 f3  00 00 02 00                            ..3.....          1.3ms       141.1.0        2024/08/22  10:20:41.484  classpnp      
  31.1                             13  IN     55 53 42 53  f0 ca 7c 7f  00 00 00 00  00           USBS.........     272us       142.1.0        2024/08/22  10:20:41.484  classpnp      
  32                                8  IN     03 9a 33 f3  00 00 02 00                            ..3.....            2us       139.2.0        2024/08/22  10:20:41.484                
  32                                   CMD    25 00 00 00  00 00 00 00  00 00                     READ CAPACITY       6us       143.1.0        2024/08/22  10:20:41.484  classpnp      
  31.2                             31  OUT    55 53 42 43  f0 ca 7c 7f  08 00 00 00  80 00 0a 25  USBC...........%  308us       144.1.0        2024/08/22  10:20:41.484  classpnp      
                                              00 00 00 00  00 00 00 00  00 00 00 00  00 00 00     ...............               144.1.16                                               
  31.1                              8  IN     03 9a 33 f3  00 00 02 00                            ..3.....          1.4ms       145.1.0        2024/08/22  10:20:41.486  classpnp      
  31.1                             13  IN     55 53 42 53  f0 ca 7c 7f  00 00 00 00  00           USBS.........     312us       146.1.0        2024/08/22  10:20:41.486  classpnp      
  32                                8  IN     03 9a 33 f3  00 00 02 00                            ..3.....            3us       143.2.0        2024/08/22  10:20:41.486                
  32                                   CMD    28 00 00 00  00 00 00 00  01 00                     READ               21us       147.1.0        2024/08/22  10:20:41.486  classpnp      
  31.2                             31  OUT    55 53 42 43  f0 ca 7c 7f  00 02 00 00  80 00 0a 28  USBC...........(  361us       148.1.0        2024/08/22  10:20:41.486  classpnp      
                                              00 00 00 00  00 00 00 01  00 00 00 00  00 00 00     ...............               148.1.16                                               
  31.1                            512  IN     33 c0 8e d0  bc 00 7c 8e  c0 8e d8 be  00 7c bf 00  3...............  1.0ms       149.1.0        2024/08/22  10:20:41.487  classpnp      
                                              06 b9 00 02  fc f3 a4 50  68 1c 06 cb  fb b9 04 00  .......Ph.......              149.1.16                                               
                                              bd be 07 80  7e 00 00 7c  0b 0f 85 0e  01 83 c5 10  ................              149.1.32                                               
                                              e2 f1 cd 18  88 56 00 55  c6 46 11 05  c6 46 10 00  .....V.U.F...F..              149.1.48                                               
                                              b4 41 bb aa  55 cd 13 5d  72 0f 81 fb  55 aa 75 09  .A..U..]r...U.u.              149.1.64                                               
                                              f7 c1 01 00  74 03 fe 46  10 66 60 80  7e 10 00 74  ....t..F.f`....t              149.1.80                                               
                                              26 66 68 00  00 00 00 66  ff 76 08 68  00 00 68 00  &fh....f.v.h..h.              149.1.96                                               
                                              7c 68 01 00  68 10 00 b4  42 8a 56 00  8b f4 cd 13  .h..h...B.V.....              149.1.112                                              
                                              9f 83 c4 10  9e eb 14 b8  01 02 bb 00  7c 8a 56 00  ..............V.              149.1.128                                              
                                              8a 76 01 8a  4e 02 8a 6e  03 cd 13 66  61 73 1c fe  .v..N..n...fas..              149.1.144                                              
                                              4e 11 75 0c  80 7e 00 80  0f 84 8a 00  b2 80 eb 84  N.u.............              149.1.160                                              
                                              55 32 e4 8a  56 00 cd 13  5d eb 9e 81  3e fe 7d 55  U2..V...]...>..U              149.1.176                                              
                                              aa 75 6e ff  76 00 e8 8d  00 75 17 fa  b0 d1 e6 64  .un.v....u.....d              149.1.192                                              
                                              e8 83 00 b0  df e6 60 e8  7c 00 b0 ff  e6 64 e8 75  ......`......d.u              149.1.208                                              
                                              00 fb b8 00  bb cd 1a 66  23 c0 75 3b  66 81 fb 54  .......f#.u;f..T              149.1.224                                              
                                              43 50 41 75  32 81 f9 02  01 72 2c 66  68 07 bb 00  CPAu2....r,fh...              149.1.240                                              
                                              00 66 68 00  02 00 00 66  68 08 00 00  00 66 53 66  .fh....fh....fSf              149.1.256                                              
                                              53 66 55 66  68 00 00 00  00 66 68 00  7c 00 00 66  SfUfh....fh....f              149.1.272                                              
                                              61 68 00 00  07 cd 1a 5a  32 f6 ea 00  7c 00 00 cd  ah.....Z2.......              149.1.288                                              
                                              18 a0 b7 07  eb 08 a0 b6  07 eb 03 a0  b5 07 32 e4  ..............2.              149.1.304                                              
                                              05 00 07 8b  f0 ac 3c 00  74 09 bb 07  00 b4 0e cd  ......<.t.......              149.1.320                                              
                                              10 eb f2 f4  eb fd 2b c9  e4 64 eb 00  24 02 e0 f8  ......+..d..$...              149.1.336                                              
                                              24 02 c3 49  6e 76 61 6c  69 64 20 70  61 72 74 69  $..Invalid parti              149.1.352                                              
                                              74 69 6f 6e  20 74 61 62  6c 65 00 45  72 72 6f 72  tion table.Error              149.1.368                                              
                                              20 6c 6f 61  64 69 6e 67  20 6f 70 65  72 61 74 69   loading operati              149.1.384                                              
                                              6e 67 20 73  79 73 74 65  6d 00 4d 69  73 73 69 6e  ng system.Missin              149.1.400                                              
                                              67 20 6f 70  65 72 61 74  69 6e 67 20  73 79 73 74  g operating syst              149.1.416                                              
                                              65 6d 00 00  00 63 7b 9a  ca 58 3c 43  00 00 80 20  em...c...X<C...               149.1.432                                              
                                              21 00 07 fe  ff ff 00 08  00 00 00 28  9a 03 00 00  !..........(....              149.1.448                                              
                                              00 00 00 00  00 00 00 00  00 00 00 00  00 00 00 00  ................              149.1.464                                              
                                              00 00 00 00  00 00 00 00  00 00 00 00  00 00 00 00  ................              149.1.480                                              
                                              00 00 00 00  00 00 00 00  00 00 00 00  00 00 55 aa  ..............U.              149.1.496                                              
  31.1                             13  IN     55 53 42 53  f0 ca 7c 7f  00 00 00 00  00           USBS.........     306us       150.1.0        2024/08/22  10:20:41.488  classpnp      
  32                              512  IN     33 c0 8e d0  bc 00 7c 8e  c0 8e d8 be  00 7c bf 00  3...............    5us       147.2.0        2024/08/22  10:20:41.488                
                                              06 b9 00 02  fc f3 a4 50  68 1c 06 cb  fb b9 04 00  .......Ph.......              147.2.16                                               
                                              bd be 07 80  7e 00 00 7c  0b 0f 85 0e  01 83 c5 10  ................              147.2.32                                               
                                              e2 f1 cd 18  88 56 00 55  c6 46 11 05  c6 46 10 00  .....V.U.F...F..              147.2.48                                               
                                              b4 41 bb aa  55 cd 13 5d  72 0f 81 fb  55 aa 75 09  .A..U..]r...U.u.              147.2.64                                               
                                              f7 c1 01 00  74 03 fe 46  10 66 60 80  7e 10 00 74  ....t..F.f`....t              147.2.80                                               
                                              26 66 68 00  00 00 00 66  ff 76 08 68  00 00 68 00  &fh....f.v.h..h.              147.2.96                                               
                                              7c 68 01 00  68 10 00 b4  42 8a 56 00  8b f4 cd 13  .h..h...B.V.....              147.2.112                                              
                                              9f 83 c4 10  9e eb 14 b8  01 02 bb 00  7c 8a 56 00  ..............V.              147.2.128                                              
                                              8a 76 01 8a  4e 02 8a 6e  03 cd 13 66  61 73 1c fe  .v..N..n...fas..              147.2.144                                              
                                              4e 11 75 0c  80 7e 00 80  0f 84 8a 00  b2 80 eb 84  N.u.............              147.2.160                                              
                                              55 32 e4 8a  56 00 cd 13  5d eb 9e 81  3e fe 7d 55  U2..V...]...>..U              147.2.176                                              
                                              aa 75 6e ff  76 00 e8 8d  00 75 17 fa  b0 d1 e6 64  .un.v....u.....d              147.2.192                                              
                                              e8 83 00 b0  df e6 60 e8  7c 00 b0 ff  e6 64 e8 75  ......`......d.u              147.2.208                                              
                                              00 fb b8 00  bb cd 1a 66  23 c0 75 3b  66 81 fb 54  .......f#.u;f..T              147.2.224                                              
                                              43 50 41 75  32 81 f9 02  01 72 2c 66  68 07 bb 00  CPAu2....r,fh...              147.2.240                                              
                                              00 66 68 00  02 00 00 66  68 08 00 00  00 66 53 66  .fh....fh....fSf              147.2.256                                              
                                              53 66 55 66  68 00 00 00  00 66 68 00  7c 00 00 66  SfUfh....fh....f              147.2.272                                              
                                              61 68 00 00  07 cd 1a 5a  32 f6 ea 00  7c 00 00 cd  ah.....Z2.......              147.2.288                                              
                                              18 a0 b7 07  eb 08 a0 b6  07 eb 03 a0  b5 07 32 e4  ..............2.              147.2.304                                              
                                              05 00 07 8b  f0 ac 3c 00  74 09 bb 07  00 b4 0e cd  ......<.t.......              147.2.320                                              
                                              10 eb f2 f4  eb fd 2b c9  e4 64 eb 00  24 02 e0 f8  ......+..d..$...              147.2.336                                              
                                              24 02 c3 49  6e 76 61 6c  69 64 20 70  61 72 74 69  $..Invalid parti              147.2.352                                              
                                              74 69 6f 6e  20 74 61 62  6c 65 00 45  72 72 6f 72  tion table.Error              147.2.368                                              
                                              20 6c 6f 61  64 69 6e 67  20 6f 70 65  72 61 74 69   loading operati              147.2.384                                              
                                              6e 67 20 73  79 73 74 65  6d 00 4d 69  73 73 69 6e  ng system.Missin              147.2.400                                              
                                              67 20 6f 70  65 72 61 74  69 6e 67 20  73 79 73 74  g operating syst              147.2.416                                              
                                              65 6d 00 00  00 63 7b 9a  ca 58 3c 43  00 00 80 20  em...c...X<C...               147.2.432                                              
                                              21 00 07 fe  ff ff 00 08  00 00 00 28  9a 03 00 00  !..........(....              147.2.448                                              
                                              00 00 00 00  00 00 00 00  00 00 00 00  00 00 00 00  ................              147.2.464                                              
                                              00 00 00 00  00 00 00 00  00 00 00 00  00 00 00 00  ................              147.2.480                                              
                                              00 00 00 00  00 00 00 00  00 00 00 00  00 00 55 aa  ..............U.              147.2.496                                              
  32                                   CMD    28 00 00 00  08 00 00 00  10 00                     READ               99us       151.1.0        2024/08/22  10:20:41.488  classpnp      
  31.2                             31  OUT    55 53 42 43  f0 ca 7c 7f  00 20 00 00  80 00 0a 28  USBC..... .....(  236us       152.1.0        2024/08/22  10:20:41.488  classpnp      
                                              00 00 00 08  00 00 00 10  00 00 00 00  00 00 00     ...............               152.1.16                                               
  31.1                           8192  IN     eb 52 90 4e  54 46 53 20  20 20 20 00  02 08 00 00  .R.NTFS    .....  2.2ms       153.1.0        2024/08/22  10:20:41.490  classpnp      
                                              00 00 00 00  00 f8 00 00  3f 00 ff 00  00 08 00 00  ........?.......              153.1.16                                               
                                              00 00 00 00  80 00 00 00  ff 27 9a 03  00 00 00 00  .........'......              153.1.32                                               
                                              00 00 0c 00  00 00 00 00  02 00 00 00  00 00 00 00  ................              153.1.48                                               
                                              f6 00 00 00  01 00 00 00  26 8e 2a 3e  d6 2a 3e f8  ........&.*>.*>.              153.1.64                                               
                                              00 00 00 00  fa 33 c0 8e  d0 bc 00 7c  fb 68 c0 07  .....3.......h..              153.1.80                                               
                                              1f 1e 68 66  00 cb 88 16  0e 00 66 81  3e 03 00 4e  ..hf......f.>..N              153.1.96                                               
                                              54 46 53 75  15 b4 41 bb  aa 55 cd 13  72 0c 81 fb  TFSu..A..U..r...              153.1.112                                              
                                              55 aa 75 06  f7 c1 01 00  75 03 e9 dd  00 1e 83 ec  U.u.....u.......              153.1.128                                              
                                              18 68 1a 00  b4 48 8a 16  0e 00 8b f4  16 1f cd 13  .h...H..........              153.1.144                                              
                                              9f 83 c4 18  9e 58 1f 72  e1 3b 06 0b  00 75 db a3  .....X.r.;...u..              153.1.160                                              
                                              0f 00 c1 2e  0f 00 04 1e  5a 33 db b9  00 20 2b c8  ........Z3... +.              153.1.176                                              
                                              66 ff 06 11  00 03 16 0f  00 8e c2 ff  06 16 00 e8  f...............              153.1.192                                              
                                              4b 00 2b c8  77 ef b8 00  bb cd 1a 66  23 c0 75 2d  K.+.w......f#.u-              153.1.208                                              
                                              66 81 fb 54  43 50 41 75  24 81 f9 02  01 72 1e 16  f..TCPAu$....r..              153.1.224                                              
                                              68 07 bb 16  68 52 11 16  68 09 00 66  53 66 53 66  h...hR..h..fSfSf              153.1.240                                              
                                              55 16 16 16  68 b8 01 66  61 0e 07 cd  1a 33 c0 bf  U...h..fa....3..              153.1.256                                              
                                              0a 13 b9 f6  0c fc f3 aa  e9 fe 01 90  90 66 60 1e  .............f`.              153.1.272                                              
                                              06 66 a1 11  00 66 03 06  1c 00 1e 66  68 00 00 00  .f...f.....fh...              153.1.288                                              
                                              00 66 50 06  53 68 01 00  68 10 00 b4  42 8a 16 0e  .fP.Sh..h...B...              153.1.304                                              
                                              00 16 1f 8b  f4 cd 13 66  59 5b 5a 66  59 66 59 1f  .......fY[ZfYfY.              153.1.320                                              
                                              0f 82 16 00  66 ff 06 11  00 03 16 0f  00 8e c2 ff  ....f...........              153.1.336                                              
                                              0e 16 00 75  bc 07 1f 66  61 c3 a1 f6  01 e8 09 00  ...u...fa.......              153.1.352                                              
                                              a1 fa 01 e8  03 00 f4 eb  fd 8b f0 ac  3c 00 74 09  ............<.t.              153.1.368                                              
                                              b4 0e bb 07  00 cd 10 eb  f2 c3 0d 0a  41 20 64 69  ............A di              153.1.384                                              
                                              73 6b 20 72  65 61 64 20  65 72 72 6f  72 20 6f 63  sk read error oc              153.1.400                                              
                                              63 75 72 72  65 64 00 0d  0a 42 4f 4f  54 4d 47 52  curred...BOOTMGR              153.1.416                                              
                                              20 69 73 20  63 6f 6d 70  72 65 73 73  65 64 00 0d   is compressed..              153.1.432                                              
                                              0a 50 72 65  73 73 20 43  74 72 6c 2b  41 6c 74 2b  .Press Ctrl+Alt+              153.1.448                                              
                                              44 65 6c 20  74 6f 20 72  65 73 74 61  72 74 0d 0a  Del to restart..              153.1.464                                              
                                              00 00 00 00  00 00 00 00  00 00 00 00  00 00 00 00  ................              153.1.480                                              
                                              00 00 00 00  00 00 8a 01  a7 01 bf 01  00 00 55 aa  ..............U.              153.1.496                                              
                                              07 00 42 00  4f 00 4f 00  54 00 4d 00  47 00 52 00  ..B.O.O.T.M.G.R.              153.1.512                                              
                                              04 00 24 00  49 00 33 00  30 00 00 d4  00 00 00 24  ..$.I.3.0......$              153.1.528                                              
                                              00 00 00 00  00 00 00 00  00 00 00 00  00 00 00 00  ................              153.1.544                                              
                                              00 00 00 00  00 00 00 00  00 00 00 00  00 00 00 00  ................              153.1.560                                              
                                              00 00 00 00  00 00 00 00  00 00 00 00  00 00 00 00  ................              153.1.576                                              
                                              00 00 00 00  00 00 e9 c0  00 90 05 00  4e 00 54 00  ............N.T.              153.1.592                                              
                                              4c 00 44 00  52 00 07 00  42 00 4f 00  4f 00 54 00  L.D.R...B.O.O.T.              153.1.608                                              
                                              54 00 47 00  54 00 07 00  42 00 4f 00  4f 00 54 00  T.G.T...B.O.O.T.              153.1.624                                              
                                              4e 00 58 00  54 00 00 00  00 00 00 00  00 00 00 00  N.X.T...........              153.1.640                                              
                                              00 00 00 00  00 00 00 00  00 00 0d 0a  41 6e 20 6f  ............An o              153.1.656                                              
                                              70 65 72 61  74 69 6e 67  20 73 79 73  74 65 6d 20  perating system               153.1.672                                              
                                              77 61 73 6e  27 74 20 66  6f 75 6e 64  2e 20 54 72  wasn't found. Tr              153.1.688                                              
                                              79 20 64 69  73 63 6f 6e  6e 65 63 74  69 6e 67 20  y disconnecting               153.1.704                                              
                                              61 6e 79 20  64 72 69 76  65 73 20 74  68 61 74 20  any drives that               153.1.720                                              
                                              64 6f 6e 27  74 0d 0a 63  6f 6e 74 61  69 6e 20 61  don't..contain a              153.1.736                                              
                                              6e 20 6f 70  65 72 61 74  69 6e 67 20  73 79 73 74  n operating syst              153.1.752                                              
                                              65 6d 2e 00  00 00 00 00  00 00 00 00  00 00 00 00  em..............              153.1.768                                              
                                              00 00 00 00  00 00 00 9a  02 66 0f b7  06 0b 00 66  .........f.....f              153.1.784                                              
                                              0f b6 1e 0d  00 66 f7 e3  66 a3 52 02  66 8b 0e 40  .....f..f.R.f..@              153.1.800                                              
                                              00 80 f9 00  0f 8f 0e 00  f6 d9 66 b8  01 00 00 00  ..........f.....              153.1.816                                              
                                              66 d3 e0 eb  08 90 66 a1  52 02 66 f7  e1 66 a3 86  f.....f.R.f..f..              153.1.832                                              
                                              02 66 0f b7  1e 0b 00 66  33 d2 66 f7  f3 66 a3 56  .f.....f3.f..f.V              153.1.848                                              
                                              02 e8 a2 04  66 8b 0e 4e  02 66 89 0e  26 02 66 03  ....f..N.f..&.f.              153.1.864                                              
                                              0e 86 02 66  89 0e 2a 02  66 03 0e 86  02 66 89 0e  ...f..*.f....f..              153.1.880                                              
                                              2e 02 66 03  0e 86 02 66  89 0e 3e 02  66 03 0e 86  ..f....f..>.f...              153.1.896                                              
                                              02 66 89 0e  46 02 66 b8  90 00 00 00  66 8b 0e 26  .f..F.f.....f..&              153.1.912                                              
                                              02 e8 90 09  66 0b c0 0f  84 bf fd 66  a3 32 02 66  ....f......f.2.f              153.1.928                                              
                                              b8 a0 00 00  00 66 8b 0e  2a 02 e8 77  09 66 a3 36  .....f..*..w.f.6              153.1.944                                              
                                              02 66 b8 b0  00 00 00 66  8b 0e 2e 02  e8 65 09 66  .f.....f.....e.f              153.1.960                                              
                                              a3 3a 02 66  a1 32 02 66  0b c0 0f 84  8c fd 67 80  .:.f.2.f......g.              153.1.976                                              
                                              78 08 00 0f  85 83 fd 67  66 8d 50 10  67 03 42 04  x......gf.P.g.B.              153.1.992                                              
                                              67 66 0f b6  48 0c 66 89  0e 92 02 67  66 8b 48 08  gf..H.f....gf.H.              153.1.1008                                             
                                              66 89 0e 8e  02 66 a1 8e  02 66 0f b7  0e 0b 00 66  f....f...f.....f              153.1.1024                                             
                                              33 d2 66 f7  f1 66 a3 96  02 66 a1 46  02 66 03 06  3.f..f...f.F.f..              153.1.1040                                             
                                              8e 02 66 a3  4a 02 66 83  3e 36 02 00  0f 84 1d 00  ..f.J.f.>6......              153.1.1056                                             
                                              66 83 3e 3a  02 00 0f 84  30 fd 66 8b  1e 3a 02 1e  f.>:....0.f..:..              153.1.1072                                             
                                              07 66 8b 3e  4a 02 66 a1  2e 02 e8 ed  01 e8 2c 0d  .f.>J.f.......,.              153.1.1088                                             
                                              66 0b c0 0f  84 03 00 e8  42 0e 66 0f  b7 0e 00 02  f.......B.f.....              153.1.1104                                             
                                              66 b8 02 02  00 00 e8 22  08 66 0b c0  0f 85 16 00  f......".f......              153.1.1120                                             
                                              66 0f b7 0e  5a 02 66 b8  5c 02 00 00  e8 0c 08 66  f...Z.f.\......f              153.1.1136                                             
                                              0b c0 0f 84  78 0e 67 66  8b 00 1e 07  66 8b 3e 3e  ....x.gf....f.>>              153.1.1152                                             
                                              02 e8 3f 06  66 a1 3e 02  66 bb 20 00  00 00 66 b9  ..?.f.>.f. ...f.              153.1.1168                                             
                                              00 00 00 00  66 ba 00 00  00 00 e8 e4  00 66 85 c0  ....f........f..              153.1.1184                                             
                                              0f 85 23 00  66 a1 3e 02  66 bb 80 00  00 00 66 b9  ..#.f.>.f.....f.              153.1.1200                                             
                                              00 00 00 00  66 ba 00 00  00 00 e8 c4  00 66 0b c0  ....f........f..              153.1.1216                                             
                                              0f 85 44 00  e9 27 0e 66  33 d2 66 b9  80 00 00 00  ..D..'.f3.f.....              153.1.1232                                             
                                              66 a1 3e 02  e8 ca 08 66  0b c0 0f 84  10 0e 1e 07  f.>....f........              153.1.1248                                             
                                              66 8b 3e 3e  02 e8 db 05  66 a1 3e 02  66 bb 80 00  f.>>....f.>.f...              153.1.1264                                             
                                              00 00 66 b9  00 00 00 00  66 ba 00 00  00 00 e8 80  ..f.....f.......              153.1.1280                                             
                                              00 66 0b c0  0f 84 e6 0d  67 66 0f b7  58 0c 66 81  .f......gf..X.f.              153.1.1296                                             
                                              e3 ff 00 00  00 0f 85 db  0d 66 8b d8  68 00 20 07  .........f..h. .              153.1.1312                                             
                                              66 2b ff 66  a1 3e 02 e8  00 01 68 00  20 07 66 2b  f+.f.>....h. .f+              153.1.1328                                             
                                              ff 66 a1 3e  02 e8 ac 0a  8a 16 0e 00  b8 e8 03 8e  .f.>............              153.1.1344                                             
                                              c0 8d 36 0b  00 2b c0 68  00 20 50 cb  06 1e 66 60  ..6..+.h. P...f`              153.1.1360                                             
                                              66 8b da 66  0f b6 0e 0d  00 66 f7 e1  66 a3 11 00  f..f.....f..f...              153.1.1376                                             
                                              66 8b c3 66  f7 e1 a3 16  00 8b df 83  e3 0f 8c c0  f..f............              153.1.1392                                             
                                              66 c1 ef 04  03 c7 50 07  e8 92 fb 66  61 90 1f 07  f.....P....fa...              153.1.1408                                             
                                              c3 67 03 40  14 67 66 83  38 ff 0f 84  4c 00 67 66  .g.@.gf.8...L.gf              153.1.1424                                             
                                              39 18 0f 85  33 00 66 0b  c9 0f 85 0a  00 67 80 78  9...3.f......g.x              153.1.1440                                             
                                              09 00 0f 85  23 00 c3 67  3a 48 09 0f  85 1a 00 66  ....#..g:H.....f              153.1.1456                                             
                                              8b f0 67 03  70 0a e8 97  06 66 51 1e  07 66 8b fa  ..g.p....fQ..f..              153.1.1472                                             
                                              f3 a7 66 59  0f 85 01 00  c3 67 66 83  78 04 00 0f  ..fY.....gf.x...              153.1.1488                                             
                                              84 07 00 67  66 03 40 04  eb ab 66 2b  c0 c3 66 8b  ...gf.@...f+..f.              153.1.1504                                             
                                              f3 e8 6c 06  67 66 03 00  67 f7 40 0c  02 00 0f 85  ..l.gf..g.@.....              153.1.1520                                             
                                              34 00 67 66  8d 50 10 67  3a 4a 40 0f  85 18 00 67  4.gf.P.g:J@....g              153.1.1536                                             
                                              66 8d 72 42  e8 49 06 66  51 1e 07 66  8b fb f3 a7  f.rB.I.fQ..f....              153.1.1552                                             
                                              66 59 0f 85  01 00 c3 67  83 78 08 00  0f 84 06 00  fY.....g.x......              153.1.1568                                             
                                              67 03 40 08  eb c2 66 33  c0 c3 67 80  7b 08 00 0f  g.@...f3..g.....              153.1.1584                                             
                                              85 1c 00 06  1e 66 60 67  66 8d 53 10  67 66 8b 0a  .....f`gf.S.gf..              153.1.1600                                             
                                              66 8b f3 67  03 72 04 f3  a4 66 61 90  1f 07 c3 66  f..g.r...fa....f              153.1.1616                                             
                                              50 67 66 8d  53 10 66 85  c0 0f 85 0a  00 67 66 8b  Pgf.S.f......gf.              153.1.1632                                             
                                              4a 08 66 41  eb 11 90 67  66 8b 42 18  66 33 d2 66  J.fA...gf.B.f3.f              153.1.1648                                             
                                              f7 36 52 02  66 8b c8 66  2b c0 66 5e  e8 01 00 c3  .6R.f..f+.f^....              153.1.1664                                             
                                              06 1e 66 60  67 80 7b 08  01 0f 84 03  00 e9 ca fa  ..f`g...........              153.1.1680                                             
                                              66 83 f9 00  0f 85 06 00  66 61 90 1f  07 c3 66 53  f.......fa....fS              153.1.1696                                             
                                              66 50 66 51  66 56 66 57  06 e8 91 04  66 8b d1 07  fPfQfVfW....f...              153.1.1712                                             
                                              66 5f 66 5e  66 59 66 85  c0 0f 84 34  00 66 3b ca  f_f^fYf....4.f;.              153.1.1728                                             
                                              0f 8d 03 00  66 8b d1 e8  82 fe 66 2b  ca 66 8b da  ....f.....f+.f..              153.1.1744                                             
                                              66 8b c2 66  0f b6 16 0d  00 66 f7 e2  66 0f b7 16  f..f.....f..f...              153.1.1760                                             
                                              0b 00 66 f7  e2 66 03 f8  66 58 66 03  c3 66 5b eb  ..f..f..fXf..f[.              153.1.1776                                             
                                              9f 66 85 f6  0f 84 62 fa  66 51 66 57  06 67 66 0f  .f....b.fQfW.gf.              153.1.1792                                             
                                              b6 43 09 66  85 c0 0f 84  20 00 66 d1  e0 66 2b e0  .C.f.... .f..f+.              153.1.1808                                             
                                              66 8b fc 66  54 66 56 67  66 0f b7 73  0a 66 03 f3  f..fTfVgf..s.f..              153.1.1824                                             
                                              66 8b c8 f3  a4 66 5e eb  03 90 66 50  66 50 67 66  f....f^...fPfPgf              153.1.1840                                             
                                              8b 03 66 50  67 66 8b 43  18 66 50 67  66 8b 56 20  ..fPgf.C.fPgf.V               153.1.1856                                             
                                              66 85 d2 0f  84 0b 00 66  8b fe 1e 07  66 8b c2 e8  f......f....f...              153.1.1872                                             
                                              71 03 66 8b  c6 66 5a 66  59 66 42 66  51 66 56 e8  q.f..fZfYfBfQfV.              153.1.1888                                             
                                              3f 06 66 85  c0 0f 84 f1  f9 66 5e 66  59 66 8b fe  ?.f......f^fYf..              153.1.1904                                             
                                              1e 07 e8 4e  03 66 8b c6  66 8b d9 66  59 66 5a 66  ...N.f..f..fYfZf              153.1.1920                                             
                                              51 66 56 66  d1 e9 e8 f8  fd 66 85 c0  0f 84 ca f9  QfVf.....f......              153.1.1936                                             
                                              66 5e 66 59  66 03 e1 07  66 5f 66 59  66 8b d0 66  f^fYf...f_fYf..f              153.1.1952                                             
                                              58 66 5b 66  8b da e9 f5  fe 06 1e 66  60 26 67 66  Xf[f.......f`&gf              153.1.1968                                             
                                              0f b7 5f 04  26 67 66 0f  b7 4f 06 66  0b c9 0f 84  .._.&gf..O.f....              153.1.1984                                             
                                              98 f9 66 03  df 66 83 c3  02 66 81 c7  fe 01 00 00  ..f..f...f......              153.1.2000                                             
                                              66 49 66 0b  c9 0f 84 17  00 26 67 8b  03 26 67 89  fIf......&g..&g.              153.1.2016                                             
                                              07 66 83 c3  02 66 81 c7  00 02 00 00  66 49 eb e2  .f...f......fI..              153.1.2032                                             
                                              66 61 90 1f  07 c3 06 1e  66 60 66 b8  01 00 00 00  fa......f`f.....              153.1.2048                                             
                                              66 a3 22 02  66 a1 1e 02  66 03 06 86  02 66 a3 8a  f.".f...f....f..              153.1.2064                                             
                                              02 66 03 06  86 02 66 a3  4e 02 66 a1  30 00 66 0f  .f....f.N.f.0.f.              153.1.2080                                             
                                              b6 1e 0d 00  66 f7 e3 66  8b 1e 4e 02  66 89 07 66  ....f..f..N.f..f              153.1.2096                                             
                                              a3 11 00 83  c3 04 66 a1  56 02 66 89  07 a3 16 00  ......f.V.f.....              153.1.2112                                             
                                              83 c3 04 66  89 1e 4e 02  66 8b 1e 1e  02 1e 07 e8  ...f..N.f.......              153.1.2128                                             
                                              bb f8 66 8b  fb e8 51 ff  66 a1 1e 02  66 bb 20 00  ..f...Q.f...f. .              153.1.2144                                             
                                              00 00 66 b9  00 00 00 00  66 ba 00 00  00 00 e8 10  ..f.....f.......              153.1.2160                                             
                                              fd 66 0b c0  0f 84 19 01  66 8b d8 1e  07 66 8b 3e  .f......f....f.>              153.1.2176                                             
                                              1a 02 66 33  c0 e8 a2 fd  66 8b 1e 1a  02 66 81 3f  ..f3....f....f.?              153.1.2192                                             
                                              80 00 00 00  0f 84 eb 00  03 5f 04 eb  f0 66 53 66  ........._...fSf              153.1.2208                                             
                                              8b 47 10 66  f7 26 56 02  66 50 66 33  d2 66 0f b6  .G.f.&V.fPf3.f..              153.1.2224                                             
                                              1e 0d 00 66  f7 f3 66 52  e8 dc 00 66  0b c0 0f 84  ...f..fR...f....              153.1.2240                                             
                                              98 f8 66 8b  0e 56 02 66  0f b6 1e 0d  00 66 f7 e3  ..f..V.f.....f..              153.1.2256                                             
                                              66 5a 66 03  c2 66 8b 1e  4e 02 66 89  07 83 c3 04  fZf..f..N.f.....              153.1.2272                                             
                                              66 0f b6 06  0d 00 66 2b  c2 66 3b c1  0f 86 03 00  f.....f+.f;.....              153.1.2288                                             
                                              66 8b c1 66  89 07 66 2b  c8 66 5a 0f  84 75 00 66  f..f..f+.fZ..u.f              153.1.2304                                             
                                              03 c2 66 50  66 33 d2 66  0f b6 1e 0d  00 66 f7 f3  ..fPf3.f.....f..              153.1.2320                                             
                                              66 51 e8 82  00 66 59 66  0b c0 0f 84  3c f8 66 0f  fQ...fYf....<.f.              153.1.2336                                             
                                              b6 1e 0d 00  66 f7 e3 66  8b 1e 4e 02  66 8b 17 83  ....f..f..N.f...              153.1.2352                                             
                                              c3 04 66 03  17 66 3b d0  0f 85 15 00  66 0f b6 06  ..f..f;.....f...              153.1.2368                                             
                                              0d 00 66 3b  c1 0f 86 03  00 66 8b c1  66 01 07 eb  ..f;.....f..f...              153.1.2384                                             
                                              a5 83 c3 04  66 89 1e 4e  02 66 89 07  83 c3 04 66  ....f..N.f.....f              153.1.2400                                             
                                              0f b6 06 0d  00 66 3b c1  0f 86 03 00  66 8b c1 66  .....f;.....f..f              153.1.2416                                             
                                              89 07 eb 82  83 c3 04 66  ff 06 22 02  66 89 1e 4e  .......f..".f..N              153.1.2432                                             
                                              02 66 5b 03  5f 04 66 81  3f 80 00 00  00 0f 84 0c  .f[._.f.?.......              153.1.2448                                             
                                              ff 66 61 90  1f 07 c3 66  8b d0 66 8b  0e 22 02 66  .fa....f..f..".f              153.1.2464                                             
                                              8b 36 8a 02  66 03 36 86  02 66 52 66  51 66 52 66  .6..f.6..fRfQfRf              153.1.2480                                             
                                              8b 1e 8a 02  66 8b 3e 56  02 66 8b 04  66 a3 11 00  ....f.>V.f..f...              153.1.2496                                             
                                              83 c6 04 66  8b 04 a3 16  00 83 c6 04  1e 07 e8 3c  ...f...........<              153.1.2512                                             
                                              f7 66 2b f8  0f 84 08 00  f7 26 0b 00  03 d8 eb d9  .f+......&......              153.1.2528                                             
                                              66 8b 3e 8a  02 1e 07 e8  bf fd 66 a1  8a 02 66 bb  f.>.......f...f.              153.1.2544                                             
                                              80 00 00 00  66 b9 00 00  00 00 66 8b  d1 e8 81 fb  ....f.....f.....              153.1.2560                                             
                                              66 0b c0 0f  84 53 f7 66  8b d8 66 58  66 56 e8 2c  f....S.f..fXfV.,              153.1.2576                                             
                                              01 66 5e 66  0b c0 0f 84  05 00 66 5b  66 5b c3 66  .f^f......f[f[.f              153.1.2592                                             
                                              59 66 5a e2  84 66 33 c0  c3 06 1e 66  60 66 50 66  YfZ..f3....f`fPf              153.1.2608                                             
                                              51 66 33 d2  66 0f b6 1e  0d 00 66 f7  f3 66 52 66  Qf3.f.....f..fRf              153.1.2624                                             
                                              57 e8 53 ff  66 5f 66 0b  c0 0f 84 0d  f7 66 0f b6  W.S.f_f......f..              153.1.2640                                             
                                              1e 0d 00 66  f7 e3 66 5a  66 03 c2 66  a3 11 00 66  ...f..fZf..f...f              153.1.2656                                             
                                              59 66 0f b6  1e 0d 00 66  3b cb 0f 8e  13 00 89 1e  Yf.....f;.......              153.1.2672                                             
                                              16 00 66 2b  cb 66 58 66  03 c3 66 50  66 51 eb 14  ..f+.fXf..fPfQ..              153.1.2688                                             
                                              90 66 58 66  03 c1 66 50  89 0e 16 00  66 b9 00 00  .fXf..fP....f...              153.1.2704                                             
                                              00 00 66 51  06 66 57 8b  df 83 e3 0f  8c c0 66 c1  ..fQ.fW.......f.              153.1.2720                                             
                                              ef 04 03 c7  50 07 e8 64  f6 66 5f 07  66 03 3e 52  ....P..d.f_.f.>R              153.1.2736                                             
                                              02 66 59 66  58 66 83 f9  00 0f 8f 70  ff 66 61 90  .fYfXf.....p.fa.              153.1.2752                                             
                                              1f 07 c3 06  1e 66 60 66  f7 26 56 02  66 8b 0e 56  .....f`f.&V.f..V              153.1.2768                                             
                                              02 e8 55 ff  e8 d2 fc 66  61 90 1f 07  c3 06 1e 66  ..U....fa......f              153.1.2784                                             
                                              60 66 f7 26  92 02 66 8b  1e 36 02 66  8b 0e 92 02  `f.&..f..6.f....              153.1.2800                                             
                                              66 8b 36 2a  02 1e 07 66  8b 3e 46 02  e8 81 fb e8  f.6*...f.>F.....              153.1.2816                                             
                                              a7 fc 66 61  90 1f 07 c3  66 50 66 53  66 51 66 8b  ..fa....fPfSfQf.              153.1.2832                                             
                                              1e 4a 02 66  8b c8 66 c1  e8 03 66 83  e1 07 66 03  .J.f..f...f...f.              153.1.2848                                             
                                              d8 66 b8 01  00 00 00 66  d3 e0 67 84  03 0f 84 04  .f.....f..g.....              153.1.2864                                             
                                              00 f8 eb 02  90 f9 66 59  66 5b 66 58  c3 67 80 7b  ......fYf[fX.g..              153.1.2880                                             
                                              08 01 0f 84  04 00 66 2b  c0 c3 67 66  8d 73 10 67  ......f+..gf.s.g              153.1.2896                                             
                                              66 8b 56 08  66 3b c2 0f  87 0b 00 67  66 8b 16 66  f.V.f;.....gf..f              153.1.2912                                             
                                              3b c2 0f 83  04 00 66 2b  c0 c3 67 03  5e 10 66 2b  ;.....f+..g.^.f+              153.1.2928                                             
                                              f6 67 80 3b  00 0f 84 3e  00 e8 81 00  66 03 f1 e8  .g.;...>....f...              153.1.2944                                             
                                              39 00 66 03  ca 66 3b c1  0f 8c 21 00  66 8b d1 66  9.f..f;...!.f..f              153.1.2960                                             
                                              50 67 66 0f  b6 0b 66 8b  c1 66 83 e0  0f 66 c1 e9  Pgf...f..f...f..              153.1.2976                                             
                                              04 66 03 d9  66 03 d8 66  43 66 58 eb  c4 66 2b c8  .f..f..fCfX..f+.              153.1.2992                                             
                                              66 2b c2 66  03 c6 c3 66  2b c0 c3 66  2b c9 67 8a  f+.f...f+..f+.g.              153.1.3008                                             
                                              0b 80 e1 0f  66 83 f9 00  0f 85 04 00  66 2b c9 c3  ....f.......f+..              153.1.3024                                             
                                              66 53 66 52  66 03 d9 67  66 0f be 13  66 49 66 4b  fSfRf..gf...fIfK              153.1.3040                                             
                                              66 83 f9 00  0f 84 0d 00  66 c1 e2 08  67 8a 13 66  f.......f...g..f              153.1.3056                                             
                                              4b 66 49 eb  eb 66 8b ca  66 5a 66 5b  c3 66 53 66  KfI..f..fZf[.fSf              153.1.3072                                             
                                              52 66 2b d2  67 8a 13 66  83 e2 0f 66  2b c9 67 8a  Rf+.g..f...f+.g.              153.1.3088                                             
                                              0b c0 e9 04  66 83 f9 00  0f 85 08 00  66 2b c9 66  ....f.......f+.f              153.1.3104                                             
                                              5a 66 5b c3  66 03 da 66  03 d9 67 66  0f be 13 66  Zf[.f..f..gf...f              153.1.3120                                             
                                              49 66 4b 66  83 f9 00 0f  84 0d 00 66  c1 e2 08 67  IfKf.......f...g              153.1.3136                                             
                                              8a 13 66 4b  66 49 eb eb  66 8b ca 66  5a 66 5b c3  ..fKfI..f..fZf[.              153.1.3152                                             
                                              66 0b c9 0f  85 01 00 c3  66 51 66 56  67 83 3e 61  f.......fQfVg.>a              153.1.3168                                             
                                              0f 8c 0c 00  67 83 3e 7a  0f 8f 04 00  67 83 2e 20  ....g.>z....g..               153.1.3184                                             
  31.1                             13  IN     55 53 42 53  f0 ca 7c 7f  00 00 00 00  00           USBS.........     285us       154.1.0        2024/08/22  10:20:41.491  classpnp      
  32                             8192  IN     eb 52 90 4e  54 46 53 20  20 20 20 00  02 08 00 00  .R.NTFS    .....    3us       151.2.0        2024/08/22  10:20:41.491                
                                              00 00 00 00  00 f8 00 00  3f 00 ff 00  00 08 00 00  ........?.......              151.2.16                                               
                                              00 00 00 00  80 00 00 00  ff 27 9a 03  00 00 00 00  .........'......              151.2.32                                               
                                              00 00 0c 00  00 00 00 00  02 00 00 00  00 00 00 00  ................              151.2.48                                               
                                              f6 00 00 00  01 00 00 00  26 8e 2a 3e  d6 2a 3e f8  ........&.*>.*>.              151.2.64                                               
                                              00 00 00 00  fa 33 c0 8e  d0 bc 00 7c  fb 68 c0 07  .....3.......h..              151.2.80                                               
                                              1f 1e 68 66  00 cb 88 16  0e 00 66 81  3e 03 00 4e  ..hf......f.>..N              151.2.96                                               
                                              54 46 53 75  15 b4 41 bb  aa 55 cd 13  72 0c 81 fb  TFSu..A..U..r...              151.2.112                                              
                                              55 aa 75 06  f7 c1 01 00  75 03 e9 dd  00 1e 83 ec  U.u.....u.......              151.2.128                                              
                                              18 68 1a 00  b4 48 8a 16  0e 00 8b f4  16 1f cd 13  .h...H..........              151.2.144                                              
                                              9f 83 c4 18  9e 58 1f 72  e1 3b 06 0b  00 75 db a3  .....X.r.;...u..              151.2.160                                              
                                              0f 00 c1 2e  0f 00 04 1e  5a 33 db b9  00 20 2b c8  ........Z3... +.              151.2.176                                              
                                              66 ff 06 11  00 03 16 0f  00 8e c2 ff  06 16 00 e8  f...............              151.2.192                                              
                                              4b 00 2b c8  77 ef b8 00  bb cd 1a 66  23 c0 75 2d  K.+.w......f#.u-              151.2.208                                              
                                              66 81 fb 54  43 50 41 75  24 81 f9 02  01 72 1e 16  f..TCPAu$....r..              151.2.224                                              
                                              68 07 bb 16  68 52 11 16  68 09 00 66  53 66 53 66  h...hR..h..fSfSf              151.2.240                                              
                                              55 16 16 16  68 b8 01 66  61 0e 07 cd  1a 33 c0 bf  U...h..fa....3..              151.2.256                                              
                                              0a 13 b9 f6  0c fc f3 aa  e9 fe 01 90  90 66 60 1e  .............f`.              151.2.272                                              
                                              06 66 a1 11  00 66 03 06  1c 00 1e 66  68 00 00 00  .f...f.....fh...              151.2.288                                              
                                              00 66 50 06  53 68 01 00  68 10 00 b4  42 8a 16 0e  .fP.Sh..h...B...              151.2.304                                              
                                              00 16 1f 8b  f4 cd 13 66  59 5b 5a 66  59 66 59 1f  .......fY[ZfYfY.              151.2.320                                              
                                              0f 82 16 00  66 ff 06 11  00 03 16 0f  00 8e c2 ff  ....f...........              151.2.336                                              
                                              0e 16 00 75  bc 07 1f 66  61 c3 a1 f6  01 e8 09 00  ...u...fa.......              151.2.352                                              
                                              a1 fa 01 e8  03 00 f4 eb  fd 8b f0 ac  3c 00 74 09  ............<.t.              151.2.368                                              
                                              b4 0e bb 07  00 cd 10 eb  f2 c3 0d 0a  41 20 64 69  ............A di              151.2.384                                              
                                              73 6b 20 72  65 61 64 20  65 72 72 6f  72 20 6f 63  sk read error oc              151.2.400                                              
                                              63 75 72 72  65 64 00 0d  0a 42 4f 4f  54 4d 47 52  curred...BOOTMGR              151.2.416                                              
                                              20 69 73 20  63 6f 6d 70  72 65 73 73  65 64 00 0d   is compressed..              151.2.432                                              
                                              0a 50 72 65  73 73 20 43  74 72 6c 2b  41 6c 74 2b  .Press Ctrl+Alt+              151.2.448                                              
                                              44 65 6c 20  74 6f 20 72  65 73 74 61  72 74 0d 0a  Del to restart..              151.2.464                                              
                                              00 00 00 00  00 00 00 00  00 00 00 00  00 00 00 00  ................              151.2.480                                              
                                              00 00 00 00  00 00 8a 01  a7 01 bf 01  00 00 55 aa  ..............U.              151.2.496                                              
                                              07 00 42 00  4f 00 4f 00  54 00 4d 00  47 00 52 00  ..B.O.O.T.M.G.R.              151.2.512                                              
                                              04 00 24 00  49 00 33 00  30 00 00 d4  00 00 00 24  ..$.I.3.0......$              151.2.528                                              
                                              00 00 00 00  00 00 00 00  00 00 00 00  00 00 00 00  ................              151.2.544                                              
                                              00 00 00 00  00 00 00 00  00 00 00 00  00 00 00 00  ................              151.2.560                                              
                                              00 00 00 00  00 00 00 00  00 00 00 00  00 00 00 00  ................              151.2.576                                              
                                              00 00 00 00  00 00 e9 c0  00 90 05 00  4e 00 54 00  ............N.T.              151.2.592                                              
                                              4c 00 44 00  52 00 07 00  42 00 4f 00  4f 00 54 00  L.D.R...B.O.O.T.              151.2.608                                              
                                              54 00 47 00  54 00 07 00  42 00 4f 00  4f 00 54 00  T.G.T...B.O.O.T.              151.2.624                                              
                                              4e 00 58 00  54 00 00 00  00 00 00 00  00 00 00 00  N.X.T...........              151.2.640                                              
                                              00 00 00 00  00 00 00 00  00 00 0d 0a  41 6e 20 6f  ............An o              151.2.656                                              
                                              70 65 72 61  74 69 6e 67  20 73 79 73  74 65 6d 20  perating system               151.2.672                                              
                                              77 61 73 6e  27 74 20 66  6f 75 6e 64  2e 20 54 72  wasn't found. Tr              151.2.688                                              
                                              79 20 64 69  73 63 6f 6e  6e 65 63 74  69 6e 67 20  y disconnecting               151.2.704                                              
                                              61 6e 79 20  64 72 69 76  65 73 20 74  68 61 74 20  any drives that               151.2.720                                              
                                              64 6f 6e 27  74 0d 0a 63  6f 6e 74 61  69 6e 20 61  don't..contain a              151.2.736                                              
                                              6e 20 6f 70  65 72 61 74  69 6e 67 20  73 79 73 74  n operating syst              151.2.752                                              
                                              65 6d 2e 00  00 00 00 00  00 00 00 00  00 00 00 00  em..............              151.2.768                                              
                                              00 00 00 00  00 00 00 9a  02 66 0f b7  06 0b 00 66  .........f.....f              151.2.784                                              
                                              0f b6 1e 0d  00 66 f7 e3  66 a3 52 02  66 8b 0e 40  .....f..f.R.f..@              151.2.800                                              
                                              00 80 f9 00  0f 8f 0e 00  f6 d9 66 b8  01 00 00 00  ..........f.....              151.2.816                                              
                                              66 d3 e0 eb  08 90 66 a1  52 02 66 f7  e1 66 a3 86  f.....f.R.f..f..              151.2.832                                              
                                              02 66 0f b7  1e 0b 00 66  33 d2 66 f7  f3 66 a3 56  .f.....f3.f..f.V              151.2.848                                              
                                              02 e8 a2 04  66 8b 0e 4e  02 66 89 0e  26 02 66 03  ....f..N.f..&.f.              151.2.864                                              
                                              0e 86 02 66  89 0e 2a 02  66 03 0e 86  02 66 89 0e  ...f..*.f....f..              151.2.880                                              
                                              2e 02 66 03  0e 86 02 66  89 0e 3e 02  66 03 0e 86  ..f....f..>.f...              151.2.896                                              
                                              02 66 89 0e  46 02 66 b8  90 00 00 00  66 8b 0e 26  .f..F.f.....f..&              151.2.912                                              
                                              02 e8 90 09  66 0b c0 0f  84 bf fd 66  a3 32 02 66  ....f......f.2.f              151.2.928                                              
                                              b8 a0 00 00  00 66 8b 0e  2a 02 e8 77  09 66 a3 36  .....f..*..w.f.6              151.2.944                                              
                                              02 66 b8 b0  00 00 00 66  8b 0e 2e 02  e8 65 09 66  .f.....f.....e.f              151.2.960                                              
                                              a3 3a 02 66  a1 32 02 66  0b c0 0f 84  8c fd 67 80  .:.f.2.f......g.              151.2.976                                              
                                              78 08 00 0f  85 83 fd 67  66 8d 50 10  67 03 42 04  x......gf.P.g.B.              151.2.992                                              
                                              67 66 0f b6  48 0c 66 89  0e 92 02 67  66 8b 48 08  gf..H.f....gf.H.              151.2.1008                                             
                                              66 89 0e 8e  02 66 a1 8e  02 66 0f b7  0e 0b 00 66  f....f...f.....f              151.2.1024                                             
                                              33 d2 66 f7  f1 66 a3 96  02 66 a1 46  02 66 03 06  3.f..f...f.F.f..              151.2.1040                                             
                                              8e 02 66 a3  4a 02 66 83  3e 36 02 00  0f 84 1d 00  ..f.J.f.>6......              151.2.1056                                             
                                              66 83 3e 3a  02 00 0f 84  30 fd 66 8b  1e 3a 02 1e  f.>:....0.f..:..              151.2.1072                                             
                                              07 66 8b 3e  4a 02 66 a1  2e 02 e8 ed  01 e8 2c 0d  .f.>J.f.......,.              151.2.1088                                             
                                              66 0b c0 0f  84 03 00 e8  42 0e 66 0f  b7 0e 00 02  f.......B.f.....              151.2.1104                                             
                                              66 b8 02 02  00 00 e8 22  08 66 0b c0  0f 85 16 00  f......".f......              151.2.1120                                             
                                              66 0f b7 0e  5a 02 66 b8  5c 02 00 00  e8 0c 08 66  f...Z.f.\......f              151.2.1136                                             
                                              0b c0 0f 84  78 0e 67 66  8b 00 1e 07  66 8b 3e 3e  ....x.gf....f.>>              151.2.1152                                             
                                              02 e8 3f 06  66 a1 3e 02  66 bb 20 00  00 00 66 b9  ..?.f.>.f. ...f.              151.2.1168                                             
                                              00 00 00 00  66 ba 00 00  00 00 e8 e4  00 66 85 c0  ....f........f..              151.2.1184                                             
                                              0f 85 23 00  66 a1 3e 02  66 bb 80 00  00 00 66 b9  ..#.f.>.f.....f.              151.2.1200                                             
                                              00 00 00 00  66 ba 00 00  00 00 e8 c4  00 66 0b c0  ....f........f..              151.2.1216                                             
                                              0f 85 44 00  e9 27 0e 66  33 d2 66 b9  80 00 00 00  ..D..'.f3.f.....              151.2.1232                                             
                                              66 a1 3e 02  e8 ca 08 66  0b c0 0f 84  10 0e 1e 07  f.>....f........              151.2.1248                                             
                                              66 8b 3e 3e  02 e8 db 05  66 a1 3e 02  66 bb 80 00  f.>>....f.>.f...              151.2.1264                                             
                                              00 00 66 b9  00 00 00 00  66 ba 00 00  00 00 e8 80  ..f.....f.......              151.2.1280                                             
                                              00 66 0b c0  0f 84 e6 0d  67 66 0f b7  58 0c 66 81  .f......gf..X.f.              151.2.1296                                             
                                              e3 ff 00 00  00 0f 85 db  0d 66 8b d8  68 00 20 07  .........f..h. .              151.2.1312                                             
                                              66 2b ff 66  a1 3e 02 e8  00 01 68 00  20 07 66 2b  f+.f.>....h. .f+              151.2.1328                                             
                                              ff 66 a1 3e  02 e8 ac 0a  8a 16 0e 00  b8 e8 03 8e  .f.>............              151.2.1344                                             
                                              c0 8d 36 0b  00 2b c0 68  00 20 50 cb  06 1e 66 60  ..6..+.h. P...f`              151.2.1360                                             
                                              66 8b da 66  0f b6 0e 0d  00 66 f7 e1  66 a3 11 00  f..f.....f..f...              151.2.1376                                             
                                              66 8b c3 66  f7 e1 a3 16  00 8b df 83  e3 0f 8c c0  f..f............              151.2.1392                                             
                                              66 c1 ef 04  03 c7 50 07  e8 92 fb 66  61 90 1f 07  f.....P....fa...              151.2.1408                                             
                                              c3 67 03 40  14 67 66 83  38 ff 0f 84  4c 00 67 66  .g.@.gf.8...L.gf              151.2.1424                                             
                                              39 18 0f 85  33 00 66 0b  c9 0f 85 0a  00 67 80 78  9...3.f......g.x              151.2.1440                                             
                                              09 00 0f 85  23 00 c3 67  3a 48 09 0f  85 1a 00 66  ....#..g:H.....f              151.2.1456                                             
                                              8b f0 67 03  70 0a e8 97  06 66 51 1e  07 66 8b fa  ..g.p....fQ..f..              151.2.1472                                             
                                              f3 a7 66 59  0f 85 01 00  c3 67 66 83  78 04 00 0f  ..fY.....gf.x...              151.2.1488                                             
                                              84 07 00 67  66 03 40 04  eb ab 66 2b  c0 c3 66 8b  ...gf.@...f+..f.              151.2.1504                                             
                                              f3 e8 6c 06  67 66 03 00  67 f7 40 0c  02 00 0f 85  ..l.gf..g.@.....              151.2.1520                                             
                                              34 00 67 66  8d 50 10 67  3a 4a 40 0f  85 18 00 67  4.gf.P.g:J@....g              151.2.1536                                             
                                              66 8d 72 42  e8 49 06 66  51 1e 07 66  8b fb f3 a7  f.rB.I.fQ..f....              151.2.1552                                             
                                              66 59 0f 85  01 00 c3 67  83 78 08 00  0f 84 06 00  fY.....g.x......              151.2.1568                                             
                                              67 03 40 08  eb c2 66 33  c0 c3 67 80  7b 08 00 0f  g.@...f3..g.....              151.2.1584                                             
                                              85 1c 00 06  1e 66 60 67  66 8d 53 10  67 66 8b 0a  .....f`gf.S.gf..              151.2.1600                                             
                                              66 8b f3 67  03 72 04 f3  a4 66 61 90  1f 07 c3 66  f..g.r...fa....f              151.2.1616                                             
                                              50 67 66 8d  53 10 66 85  c0 0f 85 0a  00 67 66 8b  Pgf.S.f......gf.              151.2.1632                                             
                                              4a 08 66 41  eb 11 90 67  66 8b 42 18  66 33 d2 66  J.fA...gf.B.f3.f              151.2.1648                                             
                                              f7 36 52 02  66 8b c8 66  2b c0 66 5e  e8 01 00 c3  .6R.f..f+.f^....              151.2.1664                                             
                                              06 1e 66 60  67 80 7b 08  01 0f 84 03  00 e9 ca fa  ..f`g...........              151.2.1680                                             
                                              66 83 f9 00  0f 85 06 00  66 61 90 1f  07 c3 66 53  f.......fa....fS              151.2.1696                                             
                                              66 50 66 51  66 56 66 57  06 e8 91 04  66 8b d1 07  fPfQfVfW....f...              151.2.1712                                             
                                              66 5f 66 5e  66 59 66 85  c0 0f 84 34  00 66 3b ca  f_f^fYf....4.f;.              151.2.1728                                             
                                              0f 8d 03 00  66 8b d1 e8  82 fe 66 2b  ca 66 8b da  ....f.....f+.f..              151.2.1744                                             
                                              66 8b c2 66  0f b6 16 0d  00 66 f7 e2  66 0f b7 16  f..f.....f..f...              151.2.1760                                             
                                              0b 00 66 f7  e2 66 03 f8  66 58 66 03  c3 66 5b eb  ..f..f..fXf..f[.              151.2.1776                                             
                                              9f 66 85 f6  0f 84 62 fa  66 51 66 57  06 67 66 0f  .f....b.fQfW.gf.              151.2.1792                                             
                                              b6 43 09 66  85 c0 0f 84  20 00 66 d1  e0 66 2b e0  .C.f.... .f..f+.              151.2.1808                                             
                                              66 8b fc 66  54 66 56 67  66 0f b7 73  0a 66 03 f3  f..fTfVgf..s.f..              151.2.1824                                             
                                              66 8b c8 f3  a4 66 5e eb  03 90 66 50  66 50 67 66  f....f^...fPfPgf              151.2.1840                                             
                                              8b 03 66 50  67 66 8b 43  18 66 50 67  66 8b 56 20  ..fPgf.C.fPgf.V               151.2.1856                                             
                                              66 85 d2 0f  84 0b 00 66  8b fe 1e 07  66 8b c2 e8  f......f....f...              151.2.1872                                             
                                              71 03 66 8b  c6 66 5a 66  59 66 42 66  51 66 56 e8  q.f..fZfYfBfQfV.              151.2.1888                                             
                                              3f 06 66 85  c0 0f 84 f1  f9 66 5e 66  59 66 8b fe  ?.f......f^fYf..              151.2.1904                                             
                                              1e 07 e8 4e  03 66 8b c6  66 8b d9 66  59 66 5a 66  ...N.f..f..fYfZf              151.2.1920                                             
                                              51 66 56 66  d1 e9 e8 f8  fd 66 85 c0  0f 84 ca f9  QfVf.....f......              151.2.1936                                             
                                              66 5e 66 59  66 03 e1 07  66 5f 66 59  66 8b d0 66  f^fYf...f_fYf..f              151.2.1952                                             
                                              58 66 5b 66  8b da e9 f5  fe 06 1e 66  60 26 67 66  Xf[f.......f`&gf              151.2.1968                                             
                                              0f b7 5f 04  26 67 66 0f  b7 4f 06 66  0b c9 0f 84  .._.&gf..O.f....              151.2.1984                                             
                                              98 f9 66 03  df 66 83 c3  02 66 81 c7  fe 01 00 00  ..f..f...f......              151.2.2000                                             
                                              66 49 66 0b  c9 0f 84 17  00 26 67 8b  03 26 67 89  fIf......&g..&g.              151.2.2016                                             
                                              07 66 83 c3  02 66 81 c7  00 02 00 00  66 49 eb e2  .f...f......fI..              151.2.2032                                             
                                              66 61 90 1f  07 c3 06 1e  66 60 66 b8  01 00 00 00  fa......f`f.....              151.2.2048                                             
                                              66 a3 22 02  66 a1 1e 02  66 03 06 86  02 66 a3 8a  f.".f...f....f..              151.2.2064                                             
                                              02 66 03 06  86 02 66 a3  4e 02 66 a1  30 00 66 0f  .f....f.N.f.0.f.              151.2.2080                                             
                                              b6 1e 0d 00  66 f7 e3 66  8b 1e 4e 02  66 89 07 66  ....f..f..N.f..f              151.2.2096                                             
                                              a3 11 00 83  c3 04 66 a1  56 02 66 89  07 a3 16 00  ......f.V.f.....              151.2.2112                                             
                                              83 c3 04 66  89 1e 4e 02  66 8b 1e 1e  02 1e 07 e8  ...f..N.f.......              151.2.2128                                             
                                              bb f8 66 8b  fb e8 51 ff  66 a1 1e 02  66 bb 20 00  ..f...Q.f...f. .              151.2.2144                                             
                                              00 00 66 b9  00 00 00 00  66 ba 00 00  00 00 e8 10  ..f.....f.......              151.2.2160                                             
                                              fd 66 0b c0  0f 84 19 01  66 8b d8 1e  07 66 8b 3e  .f......f....f.>              151.2.2176                                             
                                              1a 02 66 33  c0 e8 a2 fd  66 8b 1e 1a  02 66 81 3f  ..f3....f....f.?              151.2.2192                                             
                                              80 00 00 00  0f 84 eb 00  03 5f 04 eb  f0 66 53 66  ........._...fSf              151.2.2208                                             
                                              8b 47 10 66  f7 26 56 02  66 50 66 33  d2 66 0f b6  .G.f.&V.fPf3.f..              151.2.2224                                             
                                              1e 0d 00 66  f7 f3 66 52  e8 dc 00 66  0b c0 0f 84  ...f..fR...f....              151.2.2240                                             
                                              98 f8 66 8b  0e 56 02 66  0f b6 1e 0d  00 66 f7 e3  ..f..V.f.....f..              151.2.2256                                             
                                              66 5a 66 03  c2 66 8b 1e  4e 02 66 89  07 83 c3 04  fZf..f..N.f.....              151.2.2272                                             
                                              66 0f b6 06  0d 00 66 2b  c2 66 3b c1  0f 86 03 00  f.....f+.f;.....              151.2.2288                                             
                                              66 8b c1 66  89 07 66 2b  c8 66 5a 0f  84 75 00 66  f..f..f+.fZ..u.f              151.2.2304                                             
                                              03 c2 66 50  66 33 d2 66  0f b6 1e 0d  00 66 f7 f3  ..fPf3.f.....f..              151.2.2320                                             
                                              66 51 e8 82  00 66 59 66  0b c0 0f 84  3c f8 66 0f  fQ...fYf....<.f.              151.2.2336                                             
                                              b6 1e 0d 00  66 f7 e3 66  8b 1e 4e 02  66 8b 17 83  ....f..f..N.f...              151.2.2352                                             
                                              c3 04 66 03  17 66 3b d0  0f 85 15 00  66 0f b6 06  ..f..f;.....f...              151.2.2368                                             
                                              0d 00 66 3b  c1 0f 86 03  00 66 8b c1  66 01 07 eb  ..f;.....f..f...              151.2.2384                                             
                                              a5 83 c3 04  66 89 1e 4e  02 66 89 07  83 c3 04 66  ....f..N.f.....f              151.2.2400                                             
                                              0f b6 06 0d  00 66 3b c1  0f 86 03 00  66 8b c1 66  .....f;.....f..f              151.2.2416                                             
                                              89 07 eb 82  83 c3 04 66  ff 06 22 02  66 89 1e 4e  .......f..".f..N              151.2.2432                                             
                                              02 66 5b 03  5f 04 66 81  3f 80 00 00  00 0f 84 0c  .f[._.f.?.......              151.2.2448                                             
                                              ff 66 61 90  1f 07 c3 66  8b d0 66 8b  0e 22 02 66  .fa....f..f..".f              151.2.2464                                             
                                              8b 36 8a 02  66 03 36 86  02 66 52 66  51 66 52 66  .6..f.6..fRfQfRf              151.2.2480                                             
                                              8b 1e 8a 02  66 8b 3e 56  02 66 8b 04  66 a3 11 00  ....f.>V.f..f...              151.2.2496                                             
                                              83 c6 04 66  8b 04 a3 16  00 83 c6 04  1e 07 e8 3c  ...f...........<              151.2.2512                                             
                                              f7 66 2b f8  0f 84 08 00  f7 26 0b 00  03 d8 eb d9  .f+......&......              151.2.2528                                             
                                              66 8b 3e 8a  02 1e 07 e8  bf fd 66 a1  8a 02 66 bb  f.>.......f...f.              151.2.2544                                             
                                              80 00 00 00  66 b9 00 00  00 00 66 8b  d1 e8 81 fb  ....f.....f.....              151.2.2560                                             
                                              66 0b c0 0f  84 53 f7 66  8b d8 66 58  66 56 e8 2c  f....S.f..fXfV.,              151.2.2576                                             
                                              01 66 5e 66  0b c0 0f 84  05 00 66 5b  66 5b c3 66  .f^f......f[f[.f              151.2.2592                                             
                                              59 66 5a e2  84 66 33 c0  c3 06 1e 66  60 66 50 66  YfZ..f3....f`fPf              151.2.2608                                             
                                              51 66 33 d2  66 0f b6 1e  0d 00 66 f7  f3 66 52 66  Qf3.f.....f..fRf              151.2.2624                                             
                                              57 e8 53 ff  66 5f 66 0b  c0 0f 84 0d  f7 66 0f b6  W.S.f_f......f..              151.2.2640                                             
                                              1e 0d 00 66  f7 e3 66 5a  66 03 c2 66  a3 11 00 66  ...f..fZf..f...f              151.2.2656                                             
                                              59 66 0f b6  1e 0d 00 66  3b cb 0f 8e  13 00 89 1e  Yf.....f;.......              151.2.2672                                             
                                              16 00 66 2b  cb 66 58 66  03 c3 66 50  66 51 eb 14  ..f+.fXf..fPfQ..              151.2.2688                                             
                                              90 66 58 66  03 c1 66 50  89 0e 16 00  66 b9 00 00  .fXf..fP....f...              151.2.2704                                             
                                              00 00 66 51  06 66 57 8b  df 83 e3 0f  8c c0 66 c1  ..fQ.fW.......f.              151.2.2720                                             
                                              ef 04 03 c7  50 07 e8 64  f6 66 5f 07  66 03 3e 52  ....P..d.f_.f.>R              151.2.2736                                             
                                              02 66 59 66  58 66 83 f9  00 0f 8f 70  ff 66 61 90  .fYfXf.....p.fa.              151.2.2752                                             
                                              1f 07 c3 06  1e 66 60 66  f7 26 56 02  66 8b 0e 56  .....f`f.&V.f..V              151.2.2768                                             
                                              02 e8 55 ff  e8 d2 fc 66  61 90 1f 07  c3 06 1e 66  ..U....fa......f              151.2.2784                                             
                                              60 66 f7 26  92 02 66 8b  1e 36 02 66  8b 0e 92 02  `f.&..f..6.f....              151.2.2800                                             
                                              66 8b 36 2a  02 1e 07 66  8b 3e 46 02  e8 81 fb e8  f.6*...f.>F.....              151.2.2816                                             
                                              a7 fc 66 61  90 1f 07 c3  66 50 66 53  66 51 66 8b  ..fa....fPfSfQf.              151.2.2832                                             
                                              1e 4a 02 66  8b c8 66 c1  e8 03 66 83  e1 07 66 03  .J.f..f...f...f.              151.2.2848                                             
                                              d8 66 b8 01  00 00 00 66  d3 e0 67 84  03 0f 84 04  .f.....f..g.....              151.2.2864                                             
                                              00 f8 eb 02  90 f9 66 59  66 5b 66 58  c3 67 80 7b  ......fYf[fX.g..              151.2.2880                                             
                                              08 01 0f 84  04 00 66 2b  c0 c3 67 66  8d 73 10 67  ......f+..gf.s.g              151.2.2896                                             
                                              66 8b 56 08  66 3b c2 0f  87 0b 00 67  66 8b 16 66  f.V.f;.....gf..f              151.2.2912                                             
                                              3b c2 0f 83  04 00 66 2b  c0 c3 67 03  5e 10 66 2b  ;.....f+..g.^.f+              151.2.2928                                             
                                              f6 67 80 3b  00 0f 84 3e  00 e8 81 00  66 03 f1 e8  .g.;...>....f...              151.2.2944                                             
                                              39 00 66 03  ca 66 3b c1  0f 8c 21 00  66 8b d1 66  9.f..f;...!.f..f              151.2.2960                                             
                                              50 67 66 0f  b6 0b 66 8b  c1 66 83 e0  0f 66 c1 e9  Pgf...f..f...f..              151.2.2976                                             
                                              04 66 03 d9  66 03 d8 66  43 66 58 eb  c4 66 2b c8  .f..f..fCfX..f+.              151.2.2992                                             
                                              66 2b c2 66  03 c6 c3 66  2b c0 c3 66  2b c9 67 8a  f+.f...f+..f+.g.              151.2.3008                                             
                                              0b 80 e1 0f  66 83 f9 00  0f 85 04 00  66 2b c9 c3  ....f.......f+..              151.2.3024                                             
                                              66 53 66 52  66 03 d9 67  66 0f be 13  66 49 66 4b  fSfRf..gf...fIfK              151.2.3040                                             
                                              66 83 f9 00  0f 84 0d 00  66 c1 e2 08  67 8a 13 66  f.......f...g..f              151.2.3056                                             
                                              4b 66 49 eb  eb 66 8b ca  66 5a 66 5b  c3 66 53 66  KfI..f..fZf[.fSf              151.2.3072                                             
                                              52 66 2b d2  67 8a 13 66  83 e2 0f 66  2b c9 67 8a  Rf+.g..f...f+.g.              151.2.3088                                             
                                              0b c0 e9 04  66 83 f9 00  0f 85 08 00  66 2b c9 66  ....f.......f+.f              151.2.3104                                             
                                              5a 66 5b c3  66 03 da 66  03 d9 67 66  0f be 13 66  Zf[.f..f..gf...f              151.2.3120                                             
                                              49 66 4b 66  83 f9 00 0f  84 0d 00 66  c1 e2 08 67  IfKf.......f...g              151.2.3136                                             
                                              8a 13 66 4b  66 49 eb eb  66 8b ca 66  5a 66 5b c3  ..fKfI..f..fZf[.              151.2.3152                                             
                                              66 0b c9 0f  85 01 00 c3  66 51 66 56  67 83 3e 61  f.......fQfVg.>a              151.2.3168                                             
                                              0f 8c 0c 00  67 83 3e 7a  0f 8f 04 00  67 83 2e 20  ....g.>z....g..               151.2.3184                                             
  32                                   CMD    00 00 00 00  00 00                                  TEST UNIT READY   3.2ms       155.1.0        2024/08/22  10:20:41.494  unknown       
  31.2                             31  OUT    55 53 42 43  10 e0 79 7f  00 00 00 00  00 00 06 00  USBC..y.........  1.8ms       156.1.0        2024/08/22  10:20:41.496  unknown       
                                              00 00 00 00  00 00 00 00  00 00 00 00  00 00 00     ...............               156.1.16                                               
  31.1                             13  IN     55 53 42 53  10 e0 79 7f  00 00 00 00  00           USBS..y......     1.9ms       157.1.0        2024/08/22  10:20:41.498  unknown       
  32                                   ok                                                                             7us       155.2.0        2024/08/22  10:20:41.498                
  32                                   CMD    1a 00 3f 00  c0 00                                  MODE SENSE 3F      24us       158.1.0        2024/08/22  10:20:41.498  classpnp      
  31.2                             31  OUT    55 53 42 43  00 a5 72 7d  c0 00 00 00  80 00 06 1a  USBC..r.........  1.9ms       159.1.0        2024/08/22  10:20:41.500  classpnp      
                                              00 3f 00 c0  00 00 00 00  00 00 00 00  00 00 00     .?.............               159.1.16                                               
  31.1                             80  IN     4f 00 00 00  05 1e f0 00  00 00 02 00  00 00 00 00  O...............  2.0ms       160.1.0        2024/08/22  10:20:41.502  classpnp      
                                              00 00 00 00  00 00 00 00  00 00 00 00  00 00 00 00  ................              160.1.16                                               
                                              00 00 00 00  08 12 00 00  00 00 00 00  00 00 00 00  ................              160.1.32                                               
                                              00 00 00 00  00 00 00 00  1c 0a 00 00  00 00 00 00  ................              160.1.48                                               
                                              00 00 00 00  01 0a 80 10  00 00 00 00  02 00 00 00  ................              160.1.64                                               
  31.1                             13  IN     55 53 42 53  00 a5 72 7d  70 00 00 00  00           USBS..r.p....     2.4ms       161.1.0        2024/08/22  10:20:41.504  classpnp      
  32                               80  IN     4f 00 00 00  05 1e f0 00  00 00 02 00  00 00 00 00  O...............    4us       158.2.0        2024/08/22  10:20:41.504                
                                              00 00 00 00  00 00 00 00  00 00 00 00  00 00 00 00  ................              158.2.16                                               
                                              00 00 00 00  08 12 00 00  00 00 00 00  00 00 00 00  ................              158.2.32                                               
                                              00 00 00 00  00 00 00 00  1c 0a 00 00  00 00 00 00  ................              158.2.48                                               
                                              00 00 00 00  01 0a 80 10  00 00 00 00  02 00 00 00  ................              158.2.64                                               
  32                                   SSTS   12                                                  data overrun        1us       158.3.0        2024/08/22  10:20:41.504                
  32                                   CMD    25 00 00 00  00 00 00 00  00 00                     READ CAPACITY      23us       162.1.0        2024/08/22  10:20:41.504  classpnp      
  31.2                             31  OUT    55 53 42 43  00 a5 72 7d  08 00 00 00  80 00 0a 25  USBC..r........%  386us       163.1.0        2024/08/22  10:20:41.505  classpnp      
                                              00 00 00 00  00 00 00 00  00 00 00 00  00 00 00     ...............               163.1.16                                               
  31.1                              8  IN     03 9a 33 f3  00 00 02 00                            ..3.....          1.6ms       164.1.0        2024/08/22  10:20:41.506  classpnp      
  31.1                             13  IN     55 53 42 53  00 a5 72 7d  00 00 00 00  00           USBS..r......     285us       165.1.0        2024/08/22  10:20:41.507  classpnp      
  32                                8  IN     03 9a 33 f3  00 00 02 00                            ..3.....            4us       162.2.0        2024/08/22  10:20:41.507                
  32                                   CMD    25 00 00 00  00 00 00 00  00 00                     READ CAPACITY      44us       166.1.0        2024/08/22  10:20:41.507  classpnp      
  31.2                             31  OUT    55 53 42 43  00 a5 72 7d  08 00 00 00  80 00 0a 25  USBC..r........%  322us       167.1.0        2024/08/22  10:20:41.507  classpnp      
                                              00 00 00 00  00 00 00 00  00 00 00 00  00 00 00     ...............               167.1.16                                               
  31.1                              8  IN     03 9a 33 f3  00 00 02 00                            ..3.....          2.2ms       168.1.0        2024/08/22  10:20:41.509  classpnp      
  31.1                             13  IN     55 53 42 53  00 a5 72 7d  00 00 00 00  00           USBS..r......     280us       169.1.0        2024/08/22  10:20:41.510  classpnp      
  32                                8  IN     03 9a 33 f3  00 00 02 00                            ..3.....            2us       166.2.0        2024/08/22  10:20:41.510                
  32                                   CMD    25 00 00 00  00 00 00 00  00 00                     READ CAPACITY       8us       170.1.0        2024/08/22  10:20:41.510  classpnp      
  31.2                             31  OUT    55 53 42 43  f0 ca 7c 7f  08 00 00 00  80 00 0a 25  USBC...........%  352us       171.1.0        2024/08/22  10:20:41.510  classpnp      
                                              00 00 00 00  00 00 00 00  00 00 00 00  00 00 00     ...............               171.1.16                                               
  31.1                              8  IN     03 9a 33 f3  00 00 02 00                            ..3.....          5.0ms       172.1.0        2024/08/22  10:20:41.515  classpnp      
  31.1                             13  IN     55 53 42 53  f0 ca 7c 7f  00 00 00 00  00           USBS.........     318us       173.1.0        2024/08/22  10:20:41.515  classpnp      
  32                                8  IN     03 9a 33 f3  00 00 02 00                            ..3.....            4us       170.2.0        2024/08/22  10:20:41.515                
  32                                   CMD    28 00 00 00  00 00 00 00  01 00                     READ               16us       174.1.0        2024/08/22  10:20:41.515  classpnp      
  31.2                             31  OUT    55 53 42 43  f0 ca 7c 7f  00 02 00 00  80 00 0a 28  USBC...........(  406us       175.1.0        2024/08/22  10:20:41.516  classpnp      
                                              00 00 00 00  00 00 00 01  00 00 00 00  00 00 00     ...............               175.1.16                                               
  31.1                            512  IN     33 c0 8e d0  bc 00 7c 8e  c0 8e d8 be  00 7c bf 00  3...............  2.0ms       176.1.0        2024/08/22  10:20:41.518  classpnp      
                                              06 b9 00 02  fc f3 a4 50  68 1c 06 cb  fb b9 04 00  .......Ph.......              176.1.16                                               
                                              bd be 07 80  7e 00 00 7c  0b 0f 85 0e  01 83 c5 10  ................              176.1.32                                               
                                              e2 f1 cd 18  88 56 00 55  c6 46 11 05  c6 46 10 00  .....V.U.F...F..              176.1.48                                               
                                              b4 41 bb aa  55 cd 13 5d  72 0f 81 fb  55 aa 75 09  .A..U..]r...U.u.              176.1.64                                               
                                              f7 c1 01 00  74 03 fe 46  10 66 60 80  7e 10 00 74  ....t..F.f`....t              176.1.80                                               
                                              26 66 68 00  00 00 00 66  ff 76 08 68  00 00 68 00  &fh....f.v.h..h.              176.1.96                                               
                                              7c 68 01 00  68 10 00 b4  42 8a 56 00  8b f4 cd 13  .h..h...B.V.....              176.1.112                                              
                                              9f 83 c4 10  9e eb 14 b8  01 02 bb 00  7c 8a 56 00  ..............V.              176.1.128                                              
                                              8a 76 01 8a  4e 02 8a 6e  03 cd 13 66  61 73 1c fe  .v..N..n...fas..              176.1.144                                              
                                              4e 11 75 0c  80 7e 00 80  0f 84 8a 00  b2 80 eb 84  N.u.............              176.1.160                                              
                                              55 32 e4 8a  56 00 cd 13  5d eb 9e 81  3e fe 7d 55  U2..V...]...>..U              176.1.176                                              
                                              aa 75 6e ff  76 00 e8 8d  00 75 17 fa  b0 d1 e6 64  .un.v....u.....d              176.1.192                                              
                                              e8 83 00 b0  df e6 60 e8  7c 00 b0 ff  e6 64 e8 75  ......`......d.u              176.1.208                                              
                                              00 fb b8 00  bb cd 1a 66  23 c0 75 3b  66 81 fb 54  .......f#.u;f..T              176.1.224                                              
                                              43 50 41 75  32 81 f9 02  01 72 2c 66  68 07 bb 00  CPAu2....r,fh...              176.1.240                                              
                                              00 66 68 00  02 00 00 66  68 08 00 00  00 66 53 66  .fh....fh....fSf              176.1.256                                              
                                              53 66 55 66  68 00 00 00  00 66 68 00  7c 00 00 66  SfUfh....fh....f              176.1.272                                              
                                              61 68 00 00  07 cd 1a 5a  32 f6 ea 00  7c 00 00 cd  ah.....Z2.......              176.1.288                                              
                                              18 a0 b7 07  eb 08 a0 b6  07 eb 03 a0  b5 07 32 e4  ..............2.              176.1.304                                              
                                              05 00 07 8b  f0 ac 3c 00  74 09 bb 07  00 b4 0e cd  ......<.t.......              176.1.320                                              
                                              10 eb f2 f4  eb fd 2b c9  e4 64 eb 00  24 02 e0 f8  ......+..d..$...              176.1.336                                              
                                              24 02 c3 49  6e 76 61 6c  69 64 20 70  61 72 74 69  $..Invalid parti              176.1.352                                              
                                              74 69 6f 6e  20 74 61 62  6c 65 00 45  72 72 6f 72  tion table.Error              176.1.368                                              
                                              20 6c 6f 61  64 69 6e 67  20 6f 70 65  72 61 74 69   loading operati              176.1.384                                              
                                              6e 67 20 73  79 73 74 65  6d 00 4d 69  73 73 69 6e  ng system.Missin              176.1.400                                              
                                              67 20 6f 70  65 72 61 74  69 6e 67 20  73 79 73 74  g operating syst              176.1.416                                              
                                              65 6d 00 00  00 63 7b 9a  ca 58 3c 43  00 00 80 20  em...c...X<C...               176.1.432                                              
                                              21 00 07 fe  ff ff 00 08  00 00 00 28  9a 03 00 00  !..........(....              176.1.448                                              
                                              00 00 00 00  00 00 00 00  00 00 00 00  00 00 00 00  ................              176.1.464                                              
                                              00 00 00 00  00 00 00 00  00 00 00 00  00 00 00 00  ................              176.1.480                                              
                                              00 00 00 00  00 00 00 00  00 00 00 00  00 00 55 aa  ..............U.              176.1.496                                              
  31.1                             13  IN     55 53 42 53  f0 ca 7c 7f  00 00 00 00  00           USBS.........     297us       177.1.0        2024/08/22  10:20:41.518  classpnp      
  32                              512  IN     33 c0 8e d0  bc 00 7c 8e  c0 8e d8 be  00 7c bf 00  3...............    3us       174.2.0        2024/08/22  10:20:41.518                
                                              06 b9 00 02  fc f3 a4 50  68 1c 06 cb  fb b9 04 00  .......Ph.......              174.2.16                                               
                                              bd be 07 80  7e 00 00 7c  0b 0f 85 0e  01 83 c5 10  ................              174.2.32                                               
                                              e2 f1 cd 18  88 56 00 55  c6 46 11 05  c6 46 10 00  .....V.U.F...F..              174.2.48                                               
                                              b4 41 bb aa  55 cd 13 5d  72 0f 81 fb  55 aa 75 09  .A..U..]r...U.u.              174.2.64                                               
                                              f7 c1 01 00  74 03 fe 46  10 66 60 80  7e 10 00 74  ....t..F.f`....t              174.2.80                                               
                                              26 66 68 00  00 00 00 66  ff 76 08 68  00 00 68 00  &fh....f.v.h..h.              174.2.96                                               
                                              7c 68 01 00  68 10 00 b4  42 8a 56 00  8b f4 cd 13  .h..h...B.V.....              174.2.112                                              
                                              9f 83 c4 10  9e eb 14 b8  01 02 bb 00  7c 8a 56 00  ..............V.              174.2.128                                              
                                              8a 76 01 8a  4e 02 8a 6e  03 cd 13 66  61 73 1c fe  .v..N..n...fas..              174.2.144                                              
                                              4e 11 75 0c  80 7e 00 80  0f 84 8a 00  b2 80 eb 84  N.u.............              174.2.160                                              
                                              55 32 e4 8a  56 00 cd 13  5d eb 9e 81  3e fe 7d 55  U2..V...]...>..U              174.2.176                                              
                                              aa 75 6e ff  76 00 e8 8d  00 75 17 fa  b0 d1 e6 64  .un.v....u.....d              174.2.192                                              
                                              e8 83 00 b0  df e6 60 e8  7c 00 b0 ff  e6 64 e8 75  ......`......d.u              174.2.208                                              
                                              00 fb b8 00  bb cd 1a 66  23 c0 75 3b  66 81 fb 54  .......f#.u;f..T              174.2.224                                              
                                              43 50 41 75  32 81 f9 02  01 72 2c 66  68 07 bb 00  CPAu2....r,fh...              174.2.240                                              
                                              00 66 68 00  02 00 00 66  68 08 00 00  00 66 53 66  .fh....fh....fSf              174.2.256                                              
                                              53 66 55 66  68 00 00 00  00 66 68 00  7c 00 00 66  SfUfh....fh....f              174.2.272                                              
                                              61 68 00 00  07 cd 1a 5a  32 f6 ea 00  7c 00 00 cd  ah.....Z2.......              174.2.288                                              
                                              18 a0 b7 07  eb 08 a0 b6  07 eb 03 a0  b5 07 32 e4  ..............2.              174.2.304                                              
                                              05 00 07 8b  f0 ac 3c 00  74 09 bb 07  00 b4 0e cd  ......<.t.......              174.2.320                                              
                                              10 eb f2 f4  eb fd 2b c9  e4 64 eb 00  24 02 e0 f8  ......+..d..$...              174.2.336                                              
                                              24 02 c3 49  6e 76 61 6c  69 64 20 70  61 72 74 69  $..Invalid parti              174.2.352                                              
                                              74 69 6f 6e  20 74 61 62  6c 65 00 45  72 72 6f 72  tion table.Error              174.2.368                                              
                                              20 6c 6f 61  64 69 6e 67  20 6f 70 65  72 61 74 69   loading operati              174.2.384                                              
                                              6e 67 20 73  79 73 74 65  6d 00 4d 69  73 73 69 6e  ng system.Missin              174.2.400                                              
                                              67 20 6f 70  65 72 61 74  69 6e 67 20  73 79 73 74  g operating syst              174.2.416                                              
                                              65 6d 00 00  00 63 7b 9a  ca 58 3c 43  00 00 80 20  em...c...X<C...               174.2.432                                              
                                              21 00 07 fe  ff ff 00 08  00 00 00 28  9a 03 00 00  !..........(....              174.2.448                                              
                                              00 00 00 00  00 00 00 00  00 00 00 00  00 00 00 00  ................              174.2.464                                              
                                              00 00 00 00  00 00 00 00  00 00 00 00  00 00 00 00  ................              174.2.480                                              
                                              00 00 00 00  00 00 00 00  00 00 00 00  00 00 55 aa  ..............U.              174.2.496                                              
  32                                   CMD    1e 00 00 00  01 00                                  MEDIA REMOVAL      77us       178.1.0        2024/08/22  10:20:41.518  classpnp      
  31.2                             31  OUT    55 53 42 43  10 e0 79 7f  00 00 00 00  00 00 06 1e  USBC..y.........  2.5ms       179.1.0        2024/08/22  10:20:41.521  classpnp      
                                              00 00 00 01  00 00 00 00  00 00 00 00  00 00 00     ...............               179.1.16                                               
  31.1                             13  IN     55 53 42 53  10 e0 79 7f  00 00 00 00  01           USBS..y......     2.0ms       180.1.0        2024/08/22  10:20:41.523  classpnp      
  31.2                             31  OUT    55 53 42 43  10 e0 79 7f  12 00 00 00  80 00 0c 03  USBC..y.........  2.0ms       181.1.0        2024/08/22  10:20:41.525  classpnp      
                                              00 00 00 12  00 00 00 00  00 00 00 00  00 00 00     ...............               181.1.16                                               
  31.1                             18  IN     70 00 05 00  00 00 00 0a  00 00 00 00  20 00 00 00  p........... ...  2.1ms       182.1.0        2024/08/22  10:20:41.527  classpnp      
                                              00 00                                               ..                            182.1.16                                               
  31.1                             13  IN     55 53 42 53  10 e0 79 7f  00 00 00 00  00           USBS..y......     1.9ms       183.1.0        2024/08/22  10:20:41.529  classpnp      
  32                               18  SENSE  70 00 05 00  00 00 00 0a  00 00 00 00  20 00 00 00  illegal request     5us       178.2.0        2024/08/22  10:20:41.529                
                                              00 00                                                                             178.2.16                                               
  32                                   CMD    25 00 00 00  00 00 00 00  00 00                     READ CAPACITY      41us       184.1.0        2024/08/22  10:20:41.529  classpnp      
  31.2                             31  OUT    55 53 42 43  00 a5 72 7d  08 00 00 00  80 00 0a 25  USBC..r........%  368us       185.1.0        2024/08/22  10:20:41.529  classpnp      
                                              00 00 00 00  00 00 00 00  00 00 00 00  00 00 00     ...............               185.1.16                                               
  31.1                              8  IN     03 9a 33 f3  00 00 02 00                            ..3.....          1.5ms       186.1.0        2024/08/22  10:20:41.531  classpnp      
  31.1                             13  IN     55 53 42 53  00 a5 72 7d  00 00 00 00  00           USBS..r......     273us       187.1.0        2024/08/22  10:20:41.531  classpnp      
  32                                8  IN     03 9a 33 f3  00 00 02 00                            ..3.....            3us       184.2.0        2024/08/22  10:20:41.531                
  32                                   CMD    28 00 00 00  00 02 00 00  01 00                     READ               13us       188.1.0        2024/08/22  10:20:41.531  classpnp      
  31.2                             31  OUT    55 53 42 43  f0 ca 7c 7f  00 02 00 00  80 00 0a 28  USBC...........(  298us       189.1.0        2024/08/22  10:20:41.531  classpnp      
                                              00 00 00 00  02 00 00 01  00 00 00 00  00 00 00     ...............               189.1.16                                               
  31.1                            512  IN     00 00 00 00  00 00 00 00  00 00 00 00  00 00 00 00  ................  1.3ms       190.1.0        2024/08/22  10:20:41.533  classpnp      
                                              00 00 00 00  00 00 00 00  00 00 00 00  00 00 00 00  ................              190.1.16                                               
                                              00 00 00 00  00 00 00 00  00 00 00 00  00 00 00 00  ................              190.1.32                                               
                                              00 00 00 00  00 00 00 00  00 00 00 00  00 00 00 00  ................              190.1.48                                               
                                              00 00 00 00  00 00 00 00  00 00 00 00  00 00 00 00  ................              190.1.64                                               
                                              00 00 00 00  00 00 00 00  00 00 00 00  00 00 00 00  ................              190.1.80                                               
                                              00 00 00 00  00 00 00 00  00 00 00 00  00 00 00 00  ................              190.1.96                                               
                                              00 00 00 00  00 00 00 00  00 00 00 00  00 00 00 00  ................              190.1.112                                              
                                              00 00 00 00  00 00 00 00  00 00 00 00  00 00 00 00  ................              190.1.128                                              
                                              00 00 00 00  00 00 00 00  00 00 00 00  00 00 00 00  ................              190.1.144                                              
                                              00 00 00 00  00 00 00 00  00 00 00 00  00 00 00 00  ................              190.1.160                                              
                                              00 00 00 00  00 00 00 00  00 00 00 00  00 00 00 00  ................              190.1.176                                              
                                              00 00 00 00  00 00 00 00  00 00 00 00  00 00 00 00  ................              190.1.192                                              
                                              00 00 00 00  00 00 00 00  00 00 00 00  00 00 00 00  ................              190.1.208                                              
                                              00 00 00 00  00 00 00 00  00 00 00 00  00 00 00 00  ................              190.1.224                                              
                                              00 00 00 00  00 00 00 00  00 00 00 00  00 00 00 00  ................              190.1.240                                              
                                              00 00 00 00  00 00 00 00  00 00 00 00  00 00 00 00  ................              190.1.256                                              
                                              00 00 00 00  00 00 00 00  00 00 00 00  00 00 00 00  ................              190.1.272                                              
                                              00 00 00 00  00 00 00 00  00 00 00 00  00 00 00 00  ................              190.1.288                                              
                                              00 00 00 00  00 00 00 00  00 00 00 00  00 00 00 00  ................              190.1.304                                              
                                              00 00 00 00  00 00 00 00  00 00 00 00  00 00 00 00  ................              190.1.320                                              
                                              00 00 00 00  00 00 00 00  00 00 00 00  00 00 00 00  ................              190.1.336                                              
                                              00 00 00 00  00 00 00 00  00 00 00 00  00 00 00 00  ................              190.1.352                                              
                                              00 00 00 00  00 00 00 00  00 00 00 00  00 00 00 00  ................              190.1.368                                              
                                              00 00 00 00  00 00 00 00  00 00 00 00  00 00 00 00  ................              190.1.384                                              
                                              00 00 00 00  00 00 00 00  00 00 00 00  00 00 00 00  ................              190.1.400                                              
                                              00 00 00 00  00 00 00 00  00 00 00 00  00 00 00 00  ................              190.1.416                                              
                                              00 00 00 00  00 00 00 00  00 00 00 00  00 00 00 00  ................              190.1.432                                              
                                              00 00 00 00  00 00 00 00  00 00 00 00  00 00 00 00  ................              190.1.448                                              
                                              00 00 00 00  00 00 00 00  00 00 00 00  00 00 00 00  ................              190.1.464                                              
                                              00 00 00 00  00 00 00 00  00 00 00 00  00 00 00 00  ................              190.1.480                                              
                                              00 00 00 00  00 00 00 00  00 00 00 00  00 00 00 00  ................              190.1.496                                              
  31.1                             13  IN     55 53 42 53  f0 ca 7c 7f  00 00 00 00  00           USBS.........     287us       191.1.0        2024/08/22  10:20:41.533  classpnp      
  32                              512  IN     00 00 00 00  00 00 00 00  00 00 00 00  00 00 00 00  ................    3us       188.2.0        2024/08/22  10:20:41.533                
                                              00 00 00 00  00 00 00 00  00 00 00 00  00 00 00 00  ................              188.2.16                                               
                                              00 00 00 00  00 00 00 00  00 00 00 00  00 00 00 00  ................              188.2.32                                               
                                              00 00 00 00  00 00 00 00  00 00 00 00  00 00 00 00  ................              188.2.48                                               
                                              00 00 00 00  00 00 00 00  00 00 00 00  00 00 00 00  ................              188.2.64                                               
                                              00 00 00 00  00 00 00 00  00 00 00 00  00 00 00 00  ................              188.2.80                                               
                                              00 00 00 00  00 00 00 00  00 00 00 00  00 00 00 00  ................              188.2.96                                               
                                              00 00 00 00  00 00 00 00  00 00 00 00  00 00 00 00  ................              188.2.112                                              
                                              00 00 00 00  00 00 00 00  00 00 00 00  00 00 00 00  ................              188.2.128                                              
                                              00 00 00 00  00 00 00 00  00 00 00 00  00 00 00 00  ................              188.2.144                                              
                                              00 00 00 00  00 00 00 00  00 00 00 00  00 00 00 00  ................              188.2.160                                              
                                              00 00 00 00  00 00 00 00  00 00 00 00  00 00 00 00  ................              188.2.176                                              
                                              00 00 00 00  00 00 00 00  00 00 00 00  00 00 00 00  ................              188.2.192                                              
                                              00 00 00 00  00 00 00 00  00 00 00 00  00 00 00 00  ................              188.2.208                                              
                                              00 00 00 00  00 00 00 00  00 00 00 00  00 00 00 00  ................              188.2.224                                              
                                              00 00 00 00  00 00 00 00  00 00 00 00  00 00 00 00  ................              188.2.240                                              
                                              00 00 00 00  00 00 00 00  00 00 00 00  00 00 00 00  ................              188.2.256                                              
                                              00 00 00 00  00 00 00 00  00 00 00 00  00 00 00 00  ................              188.2.272                                              
                                              00 00 00 00  00 00 00 00  00 00 00 00  00 00 00 00  ................              188.2.288                                              
                                              00 00 00 00  00 00 00 00  00 00 00 00  00 00 00 00  ................              188.2.304                                              
                                              00 00 00 00  00 00 00 00  00 00 00 00  00 00 00 00  ................              188.2.320                                              
                                              00 00 00 00  00 00 00 00  00 00 00 00  00 00 00 00  ................              188.2.336                                              
                                              00 00 00 00  00 00 00 00  00 00 00 00  00 00 00 00  ................              188.2.352                                              
                                              00 00 00 00  00 00 00 00  00 00 00 00  00 00 00 00  ................              188.2.368                                              
                                              00 00 00 00  00 00 00 00  00 00 00 00  00 00 00 00  ................              188.2.384                                              
                                              00 00 00 00  00 00 00 00  00 00 00 00  00 00 00 00  ................              188.2.400                                              
                                              00 00 00 00  00 00 00 00  00 00 00 00  00 00 00 00  ................              188.2.416                                              
                                              00 00 00 00  00 00 00 00  00 00 00 00  00 00 00 00  ................              188.2.432                                              
                                              00 00 00 00  00 00 00 00  00 00 00 00  00 00 00 00  ................              188.2.448                                              
                                              00 00 00 00  00 00 00 00  00 00 00 00  00 00 00 00  ................              188.2.464                                              
                                              00 00 00 00  00 00 00 00  00 00 00 00  00 00 00 00  ................              188.2.480                                              
                                              00 00 00 00  00 00 00 00  00 00 00 00  00 00 00 00  ................              188.2.496                                              
  32                                   CMD    28 00 00 00  08 00 00 00  01 00                     READ              129us       192.1.0        2024/08/22  10:20:41.533  classpnp      
  31.2                             31  OUT    55 53 42 43  f0 ca 7c 7f  00 02 00 00  80 00 0a 28  USBC...........(  363us       193.1.0        2024/08/22  10:20:41.534  classpnp      
                                              00 00 00 08  00 00 00 01  00 00 00 00  00 00 00     ...............               193.1.16                                               
  31.1                            512  IN     eb 52 90 4e  54 46 53 20  20 20 20 00  02 08 00 00  .R.NTFS    .....  1.2ms       194.1.0        2024/08/22  10:20:41.535  classpnp      
                                              00 00 00 00  00 f8 00 00  3f 00 ff 00  00 08 00 00  ........?.......              194.1.16                                               
                                              00 00 00 00  80 00 00 00  ff 27 9a 03  00 00 00 00  .........'......              194.1.32                                               
                                              00 00 0c 00  00 00 00 00  02 00 00 00  00 00 00 00  ................              194.1.48                                               
                                              f6 00 00 00  01 00 00 00  26 8e 2a 3e  d6 2a 3e f8  ........&.*>.*>.              194.1.64                                               
                                              00 00 00 00  fa 33 c0 8e  d0 bc 00 7c  fb 68 c0 07  .....3.......h..              194.1.80                                               
                                              1f 1e 68 66  00 cb 88 16  0e 00 66 81  3e 03 00 4e  ..hf......f.>..N              194.1.96                                               
                                              54 46 53 75  15 b4 41 bb  aa 55 cd 13  72 0c 81 fb  TFSu..A..U..r...              194.1.112                                              
                                              55 aa 75 06  f7 c1 01 00  75 03 e9 dd  00 1e 83 ec  U.u.....u.......              194.1.128                                              
                                              18 68 1a 00  b4 48 8a 16  0e 00 8b f4  16 1f cd 13  .h...H..........              194.1.144                                              
                                              9f 83 c4 18  9e 58 1f 72  e1 3b 06 0b  00 75 db a3  .....X.r.;...u..              194.1.160                                              
                                              0f 00 c1 2e  0f 00 04 1e  5a 33 db b9  00 20 2b c8  ........Z3... +.              194.1.176                                              
                                              66 ff 06 11  00 03 16 0f  00 8e c2 ff  06 16 00 e8  f...............              194.1.192                                              
                                              4b 00 2b c8  77 ef b8 00  bb cd 1a 66  23 c0 75 2d  K.+.w......f#.u-              194.1.208                                              
                                              66 81 fb 54  43 50 41 75  24 81 f9 02  01 72 1e 16  f..TCPAu$....r..              194.1.224                                              
                                              68 07 bb 16  68 52 11 16  68 09 00 66  53 66 53 66  h...hR..h..fSfSf              194.1.240                                              
                                              55 16 16 16  68 b8 01 66  61 0e 07 cd  1a 33 c0 bf  U...h..fa....3..              194.1.256                                              
                                              0a 13 b9 f6  0c fc f3 aa  e9 fe 01 90  90 66 60 1e  .............f`.              194.1.272                                              
                                              06 66 a1 11  00 66 03 06  1c 00 1e 66  68 00 00 00  .f...f.....fh...              194.1.288                                              
                                              00 66 50 06  53 68 01 00  68 10 00 b4  42 8a 16 0e  .fP.Sh..h...B...              194.1.304                                              
                                              00 16 1f 8b  f4 cd 13 66  59 5b 5a 66  59 66 59 1f  .......fY[ZfYfY.              194.1.320                                              
                                              0f 82 16 00  66 ff 06 11  00 03 16 0f  00 8e c2 ff  ....f...........              194.1.336                                              
                                              0e 16 00 75  bc 07 1f 66  61 c3 a1 f6  01 e8 09 00  ...u...fa.......              194.1.352                                              
                                              a1 fa 01 e8  03 00 f4 eb  fd 8b f0 ac  3c 00 74 09  ............<.t.              194.1.368                                              
                                              b4 0e bb 07  00 cd 10 eb  f2 c3 0d 0a  41 20 64 69  ............A di              194.1.384                                              
                                              73 6b 20 72  65 61 64 20  65 72 72 6f  72 20 6f 63  sk read error oc              194.1.400                                              
                                              63 75 72 72  65 64 00 0d  0a 42 4f 4f  54 4d 47 52  curred...BOOTMGR              194.1.416                                              
                                              20 69 73 20  63 6f 6d 70  72 65 73 73  65 64 00 0d   is compressed..              194.1.432                                              
                                              0a 50 72 65  73 73 20 43  74 72 6c 2b  41 6c 74 2b  .Press Ctrl+Alt+              194.1.448                                              
                                              44 65 6c 20  74 6f 20 72  65 73 74 61  72 74 0d 0a  Del to restart..              194.1.464                                              
                                              00 00 00 00  00 00 00 00  00 00 00 00  00 00 00 00  ................              194.1.480                                              
                                              00 00 00 00  00 00 8a 01  a7 01 bf 01  00 00 55 aa  ..............U.              194.1.496                                              
  31.1                             13  IN     55 53 42 53  f0 ca 7c 7f  00 00 00 00  00           USBS.........     277us       195.1.0        2024/08/22  10:20:41.535  classpnp      
  32                              512  IN     eb 52 90 4e  54 46 53 20  20 20 20 00  02 08 00 00  .R.NTFS    .....    3us       192.2.0        2024/08/22  10:20:41.535                
                                              00 00 00 00  00 f8 00 00  3f 00 ff 00  00 08 00 00  ........?.......              192.2.16                                               
                                              00 00 00 00  80 00 00 00  ff 27 9a 03  00 00 00 00  .........'......              192.2.32                                               
                                              00 00 0c 00  00 00 00 00  02 00 00 00  00 00 00 00  ................              192.2.48                                               
                                              f6 00 00 00  01 00 00 00  26 8e 2a 3e  d6 2a 3e f8  ........&.*>.*>.              192.2.64                                               
                                              00 00 00 00  fa 33 c0 8e  d0 bc 00 7c  fb 68 c0 07  .....3.......h..              192.2.80                                               
                                              1f 1e 68 66  00 cb 88 16  0e 00 66 81  3e 03 00 4e  ..hf......f.>..N              192.2.96                                               
                                              54 46 53 75  15 b4 41 bb  aa 55 cd 13  72 0c 81 fb  TFSu..A..U..r...              192.2.112                                              
                                              55 aa 75 06  f7 c1 01 00  75 03 e9 dd  00 1e 83 ec  U.u.....u.......              192.2.128                                              
                                              18 68 1a 00  b4 48 8a 16  0e 00 8b f4  16 1f cd 13  .h...H..........              192.2.144                                              
                                              9f 83 c4 18  9e 58 1f 72  e1 3b 06 0b  00 75 db a3  .....X.r.;...u..              192.2.160                                              
                                              0f 00 c1 2e  0f 00 04 1e  5a 33 db b9  00 20 2b c8  ........Z3... +.              192.2.176                                              
                                              66 ff 06 11  00 03 16 0f  00 8e c2 ff  06 16 00 e8  f...............              192.2.192                                              
                                              4b 00 2b c8  77 ef b8 00  bb cd 1a 66  23 c0 75 2d  K.+.w......f#.u-              192.2.208                                              
                                              66 81 fb 54  43 50 41 75  24 81 f9 02  01 72 1e 16  f..TCPAu$....r..              192.2.224                                              
                                              68 07 bb 16  68 52 11 16  68 09 00 66  53 66 53 66  h...hR..h..fSfSf              192.2.240                                              
                                              55 16 16 16  68 b8 01 66  61 0e 07 cd  1a 33 c0 bf  U...h..fa....3..              192.2.256                                              
                                              0a 13 b9 f6  0c fc f3 aa  e9 fe 01 90  90 66 60 1e  .............f`.              192.2.272                                              
                                              06 66 a1 11  00 66 03 06  1c 00 1e 66  68 00 00 00  .f...f.....fh...              192.2.288                                              
                                              00 66 50 06  53 68 01 00  68 10 00 b4  42 8a 16 0e  .fP.Sh..h...B...              192.2.304                                              
                                              00 16 1f 8b  f4 cd 13 66  59 5b 5a 66  59 66 59 1f  .......fY[ZfYfY.              192.2.320                                              
                                              0f 82 16 00  66 ff 06 11  00 03 16 0f  00 8e c2 ff  ....f...........              192.2.336                                              
                                              0e 16 00 75  bc 07 1f 66  61 c3 a1 f6  01 e8 09 00  ...u...fa.......              192.2.352                                              
                                              a1 fa 01 e8  03 00 f4 eb  fd 8b f0 ac  3c 00 74 09  ............<.t.              192.2.368                                              
                                              b4 0e bb 07  00 cd 10 eb  f2 c3 0d 0a  41 20 64 69  ............A di              192.2.384                                              
                                              73 6b 20 72  65 61 64 20  65 72 72 6f  72 20 6f 63  sk read error oc              192.2.400                                              
                                              63 75 72 72  65 64 00 0d  0a 42 4f 4f  54 4d 47 52  curred...BOOTMGR              192.2.416                                              
                                              20 69 73 20  63 6f 6d 70  72 65 73 73  65 64 00 0d   is compressed..              192.2.432                                              
                                              0a 50 72 65  73 73 20 43  74 72 6c 2b  41 6c 74 2b  .Press Ctrl+Alt+              192.2.448                                              
                                              44 65 6c 20  74 6f 20 72  65 73 74 61  72 74 0d 0a  Del to restart..              192.2.464                                              
                                              00 00 00 00  00 00 00 00  00 00 00 00  00 00 00 00  ................              192.2.480                                              
                                              00 00 00 00  00 00 8a 01  a7 01 bf 01  00 00 55 aa  ..............U.              192.2.496                                              
  32                                   CMD    28 00 03 9a  2f ff 00 00  01 00                     READ              132us       196.1.0        2024/08/22  10:20:41.535  classpnp      
  31.2                             31  OUT    55 53 42 43  f0 ca 7c 7f  00 02 00 00  80 00 0a 28  USBC...........(  332us       197.1.0        2024/08/22  10:20:41.536  classpnp      
                                              00 03 9a 2f  ff 00 00 01  00 00 00 00  00 00 00     .../...........               197.1.16                                               
  31.1                            512  IN     eb 52 90 4e  54 46 53 20  20 20 20 00  02 08 00 00  .R.NTFS    .....  2.2ms       198.1.0        2024/08/22  10:20:41.538  classpnp      
                                              00 00 00 00  00 f8 00 00  3f 00 ff 00  00 08 00 00  ........?.......              198.1.16                                               
                                              00 00 00 00  80 00 00 00  ff 27 9a 03  00 00 00 00  .........'......              198.1.32                                               
                                              00 00 0c 00  00 00 00 00  02 00 00 00  00 00 00 00  ................              198.1.48                                               
                                              f6 00 00 00  01 00 00 00  26 8e 2a 3e  d6 2a 3e f8  ........&.*>.*>.              198.1.64                                               
                                              00 00 00 00  fa 33 c0 8e  d0 bc 00 7c  fb 68 c0 07  .....3.......h..              198.1.80                                               
                                              1f 1e 68 66  00 cb 88 16  0e 00 66 81  3e 03 00 4e  ..hf......f.>..N              198.1.96                                               
                                              54 46 53 75  15 b4 41 bb  aa 55 cd 13  72 0c 81 fb  TFSu..A..U..r...              198.1.112                                              
                                              55 aa 75 06  f7 c1 01 00  75 03 e9 dd  00 1e 83 ec  U.u.....u.......              198.1.128                                              
                                              18 68 1a 00  b4 48 8a 16  0e 00 8b f4  16 1f cd 13  .h...H..........              198.1.144                                              
                                              9f 83 c4 18  9e 58 1f 72  e1 3b 06 0b  00 75 db a3  .....X.r.;...u..              198.1.160                                              
                                              0f 00 c1 2e  0f 00 04 1e  5a 33 db b9  00 20 2b c8  ........Z3... +.              198.1.176                                              
                                              66 ff 06 11  00 03 16 0f  00 8e c2 ff  06 16 00 e8  f...............              198.1.192                                              
                                              4b 00 2b c8  77 ef b8 00  bb cd 1a 66  23 c0 75 2d  K.+.w......f#.u-              198.1.208                                              
                                              66 81 fb 54  43 50 41 75  24 81 f9 02  01 72 1e 16  f..TCPAu$....r..              198.1.224                                              
                                              68 07 bb 16  68 52 11 16  68 09 00 66  53 66 53 66  h...hR..h..fSfSf              198.1.240                                              
                                              55 16 16 16  68 b8 01 66  61 0e 07 cd  1a 33 c0 bf  U...h..fa....3..              198.1.256                                              
                                              0a 13 b9 f6  0c fc f3 aa  e9 fe 01 90  90 66 60 1e  .............f`.              198.1.272                                              
                                              06 66 a1 11  00 66 03 06  1c 00 1e 66  68 00 00 00  .f...f.....fh...              198.1.288                                              
                                              00 66 50 06  53 68 01 00  68 10 00 b4  42 8a 16 0e  .fP.Sh..h...B...              198.1.304                                              
                                              00 16 1f 8b  f4 cd 13 66  59 5b 5a 66  59 66 59 1f  .......fY[ZfYfY.              198.1.320                                              
                                              0f 82 16 00  66 ff 06 11  00 03 16 0f  00 8e c2 ff  ....f...........              198.1.336                                              
                                              0e 16 00 75  bc 07 1f 66  61 c3 a1 f6  01 e8 09 00  ...u...fa.......              198.1.352                                              
                                              a1 fa 01 e8  03 00 f4 eb  fd 8b f0 ac  3c 00 74 09  ............<.t.              198.1.368                                              
                                              b4 0e bb 07  00 cd 10 eb  f2 c3 0d 0a  41 20 64 69  ............A di              198.1.384                                              
                                              73 6b 20 72  65 61 64 20  65 72 72 6f  72 20 6f 63  sk read error oc              198.1.400                                              
                                              63 75 72 72  65 64 00 0d  0a 42 4f 4f  54 4d 47 52  curred...BOOTMGR              198.1.416                                              
                                              20 69 73 20  63 6f 6d 70  72 65 73 73  65 64 00 0d   is compressed..              198.1.432                                              
                                              0a 50 72 65  73 73 20 43  74 72 6c 2b  41 6c 74 2b  .Press Ctrl+Alt+              198.1.448                                              
                                              44 65 6c 20  74 6f 20 72  65 73 74 61  72 74 0d 0a  Del to restart..              198.1.464                                              
                                              00 00 00 00  00 00 00 00  00 00 00 00  00 00 00 00  ................              198.1.480                                              
                                              00 00 00 00  00 00 8a 01  a7 01 bf 01  00 00 55 aa  ..............U.              198.1.496                                              
  31.1                             13  IN     55 53 42 53  f0 ca 7c 7f  00 00 00 00  00           USBS.........     284us       199.1.0        2024/08/22  10:20:41.538  classpnp      
  32                              512  IN     eb 52 90 4e  54 46 53 20  20 20 20 00  02 08 00 00  .R.NTFS    .....    3us       196.2.0        2024/08/22  10:20:41.538                
                                              00 00 00 00  00 f8 00 00  3f 00 ff 00  00 08 00 00  ........?.......              196.2.16                                               
                                              00 00 00 00  80 00 00 00  ff 27 9a 03  00 00 00 00  .........'......              196.2.32                                               
                                              00 00 0c 00  00 00 00 00  02 00 00 00  00 00 00 00  ................              196.2.48                                               
                                              f6 00 00 00  01 00 00 00  26 8e 2a 3e  d6 2a 3e f8  ........&.*>.*>.              196.2.64                                               
                                              00 00 00 00  fa 33 c0 8e  d0 bc 00 7c  fb 68 c0 07  .....3.......h..              196.2.80                                               
                                              1f 1e 68 66  00 cb 88 16  0e 00 66 81  3e 03 00 4e  ..hf......f.>..N              196.2.96                                               
                                              54 46 53 75  15 b4 41 bb  aa 55 cd 13  72 0c 81 fb  TFSu..A..U..r...              196.2.112                                              
                                              55 aa 75 06  f7 c1 01 00  75 03 e9 dd  00 1e 83 ec  U.u.....u.......              196.2.128                                              
                                              18 68 1a 00  b4 48 8a 16  0e 00 8b f4  16 1f cd 13  .h...H..........              196.2.144                                              
                                              9f 83 c4 18  9e 58 1f 72  e1 3b 06 0b  00 75 db a3  .....X.r.;...u..              196.2.160                                              
                                              0f 00 c1 2e  0f 00 04 1e  5a 33 db b9  00 20 2b c8  ........Z3... +.              196.2.176                                              
                                              66 ff 06 11  00 03 16 0f  00 8e c2 ff  06 16 00 e8  f...............              196.2.192                                              
                                              4b 00 2b c8  77 ef b8 00  bb cd 1a 66  23 c0 75 2d  K.+.w......f#.u-              196.2.208                                              
                                              66 81 fb 54  43 50 41 75  24 81 f9 02  01 72 1e 16  f..TCPAu$....r..              196.2.224                                              
                                              68 07 bb 16  68 52 11 16  68 09 00 66  53 66 53 66  h...hR..h..fSfSf              196.2.240                                              
                                              55 16 16 16  68 b8 01 66  61 0e 07 cd  1a 33 c0 bf  U...h..fa....3..              196.2.256                                              
                                              0a 13 b9 f6  0c fc f3 aa  e9 fe 01 90  90 66 60 1e  .............f`.              196.2.272                                              
                                              06 66 a1 11  00 66 03 06  1c 00 1e 66  68 00 00 00  .f...f.....fh...              196.2.288                                              
                                              00 66 50 06  53 68 01 00  68 10 00 b4  42 8a 16 0e  .fP.Sh..h...B...              196.2.304                                              
                                              00 16 1f 8b  f4 cd 13 66  59 5b 5a 66  59 66 59 1f  .......fY[ZfYfY.              196.2.320                                              
                                              0f 82 16 00  66 ff 06 11  00 03 16 0f  00 8e c2 ff  ....f...........              196.2.336                                              
                                              0e 16 00 75  bc 07 1f 66  61 c3 a1 f6  01 e8 09 00  ...u...fa.......              196.2.352                                              
                                              a1 fa 01 e8  03 00 f4 eb  fd 8b f0 ac  3c 00 74 09  ............<.t.              196.2.368                                              
                                              b4 0e bb 07  00 cd 10 eb  f2 c3 0d 0a  41 20 64 69  ............A di              196.2.384                                              
                                              73 6b 20 72  65 61 64 20  65 72 72 6f  72 20 6f 63  sk read error oc              196.2.400                                              
                                              63 75 72 72  65 64 00 0d  0a 42 4f 4f  54 4d 47 52  curred...BOOTMGR              196.2.416                                              
                                              20 69 73 20  63 6f 6d 70  72 65 73 73  65 64 00 0d   is compressed..              196.2.432                                              
                                              0a 50 72 65  73 73 20 43  74 72 6c 2b  41 6c 74 2b  .Press Ctrl+Alt+              196.2.448                                              
                                              44 65 6c 20  74 6f 20 72  65 73 74 61  72 74 0d 0a  Del to restart..              196.2.464                                              
                                              00 00 00 00  00 00 00 00  00 00 00 00  00 00 00 00  ................              196.2.480                                              
                                              00 00 00 00  00 00 8a 01  a7 01 bf 01  00 00 55 aa  ..............U.              196.2.496                                              
  32                                   CMD    28 00 00 60  08 00 00 00  08 00                     READ               73us       200.1.0        2024/08/22  10:20:41.538  classpnp      
  31.2                             31  OUT    55 53 42 43  00 a5 72 7d  00 10 00 00  80 00 0a 28  USBC..r........(  389us       201.1.0        2024/08/22  10:20:41.539  classpnp      
                                              00 00 60 08  00 00 00 08  00 00 00 00  00 00 00     ..`............               201.1.16                                               
  31.1                           4096  IN     46 49 4c 45  30 00 03 00  63 15 00 01  00 00 00 00  FILE0...c.......  2.3ms       202.1.0        2024/08/22  10:20:41.541  classpnp      
                                              01 00 01 00  38 00 01 00  a0 01 00 00  00 04 00 00  ....8...........              202.1.16                                               
                                              00 00 00 00  00 00 00 00  07 00 00 00  00 00 00 00  ................              202.1.32                                               
                                              05 00 00 00  00 00 00 00  10 00 00 00  60 00 00 00  ............`...              202.1.48                                               
                                              00 00 18 00  00 00 00 00  48 00 00 00  18 00 00 00  ........H.......              202.1.64                                               
                                              e4 71 b4 27  d5 0b d9 01  e4 71 b4 27  d5 0b d9 01  .q.'.....q.'....              202.1.80                                               
                                              e4 71 b4 27  d5 0b d9 01  e4 71 b4 27  d5 0b d9 01  .q.'.....q.'....              202.1.96                                               
                                              06 00 00 00  00 00 00 00  00 00 00 00  00 00 00 00  ................              202.1.112                                              
                                              00 00 00 00  00 01 00 00  00 00 00 00  00 00 00 00  ................              202.1.128                                              
                                              00 00 00 00  00 00 00 00  30 00 00 00  68 00 00 00  ........0...h...              202.1.144                                              
                                              00 00 18 00  00 00 03 00  4a 00 00 00  18 00 01 00  ........J.......              202.1.160                                              
                                              05 00 00 00  00 00 05 00  e4 71 b4 27  d5 0b d9 01  .........q.'....              202.1.176                                              
                                              e4 71 b4 27  d5 0b d9 01  e4 71 b4 27  d5 0b d9 01  .q.'.....q.'....              202.1.192                                              
                                              e4 71 b4 27  d5 0b d9 01  00 40 00 00  00 00 00 00  .q.'.....@......              202.1.208                                              
                                              00 40 00 00  00 00 00 00  06 00 00 00  00 00 00 00  .@..............              202.1.224                                              
                                              04 03 24 00  4d 00 46 00  54 00 00 00  00 00 00 00  ..$.M.F.T.......              202.1.240                                              
                                              80 00 00 00  48 00 00 00  01 00 40 00  00 00 06 00  ....H.....@.....              202.1.256                                              
                                              00 00 00 00  00 00 00 00  3f 00 00 00  00 00 00 00  ........?.......              202.1.272                                              
                                              40 00 00 00  00 00 00 00  00 00 04 00  00 00 00 00  @...............              202.1.288                                              
                                              00 00 04 00  00 00 00 00  00 00 04 00  00 00 00 00  ................              202.1.304                                              
                                              31 40 00 00  0c 00 00 00  b0 00 00 00  50 00 00 00  1@..........P...              202.1.320                                              
                                              01 00 40 00  00 00 05 00  00 00 00 00  00 00 00 00  ..@.............              202.1.336                                              
                                              01 00 00 00  00 00 00 00  40 00 00 00  00 00 00 00  ........@.......              202.1.352                                              
                                              00 20 00 00  00 00 00 00  08 10 00 00  00 00 00 00  . ..............              202.1.368                                              
                                              08 10 00 00  00 00 00 00  31 01 ff ff  0b 31 01 26  ........1....1.&              202.1.384                                              
                                              00 f4 00 00  00 00 00 00  ff ff ff ff  00 00 00 00  ................              202.1.400                                              
                                              00 00 04 00  00 00 00 00  00 00 04 00  00 00 00 00  ................              202.1.416                                              
                                              00 00 04 00  00 00 00 00  31 40 00 00  0c 00 00 00  ........1@......              202.1.432                                              
                                              b0 00 00 00  50 00 00 00  01 00 40 00  00 00 05 00  ....P.....@.....              202.1.448                                              
                                              00 00 00 00  00 00 00 00  01 00 00 00  00 00 00 00  ................              202.1.464                                              
                                              40 00 00 00  00 00 00 00  00 20 00 00  00 00 00 00  @........ ......              202.1.480                                              
                                              08 10 00 00  00 00 00 00  08 10 00 00  00 00 05 00  ................              202.1.496                                              
                                              31 01 ff ff  0b 31 01 26  00 f4 00 00  00 00 00 00  1....1.&........              202.1.512                                              
                                              ff ff ff ff  00 00 00 00  00 00 00 00  00 00 00 00  ................              202.1.528                                              
                                              00 00 00 00  00 00 00 00  00 00 00 00  00 00 00 00  ................              202.1.544                                              
                                              00 00 00 00  00 00 00 00  00 00 00 00  00 00 00 00  ................              202.1.560                                              
                                              00 00 00 00  00 00 00 00  00 00 00 00  00 00 00 00  ................              202.1.576                                              
                                              00 00 00 00  00 00 00 00  00 00 00 00  00 00 00 00  ................              202.1.592                                              
                                              00 00 00 00  00 00 00 00  00 00 00 00  00 00 00 00  ................              202.1.608                                              
                                              00 00 00 00  00 00 00 00  00 00 00 00  00 00 00 00  ................              202.1.624                                              
                                              00 00 00 00  00 00 00 00  00 00 00 00  00 00 00 00  ................              202.1.640                                              
                                              00 00 00 00  00 00 00 00  00 00 00 00  00 00 00 00  ................              202.1.656                                              
                                              00 00 00 00  00 00 00 00  00 00 00 00  00 00 00 00  ................              202.1.672                                              
                                              00 00 00 00  00 00 00 00  00 00 00 00  00 00 00 00  ................              202.1.688                                              
                                              00 00 00 00  00 00 00 00  00 00 00 00  00 00 00 00  ................              202.1.704                                              
                                              00 00 00 00  00 00 00 00  00 00 00 00  00 00 00 00  ................              202.1.720                                              
                                              00 00 00 00  00 00 00 00  00 00 00 00  00 00 00 00  ................              202.1.736                                              
                                              00 00 00 00  00 00 00 00  00 00 00 00  00 00 00 00  ................              202.1.752                                              
                                              00 00 00 00  00 00 00 00  00 00 00 00  00 00 00 00  ................              202.1.768                                              
                                              00 00 00 00  00 00 00 00  00 00 00 00  00 00 00 00  ................              202.1.784                                              
                                              00 00 00 00  00 00 00 00  00 00 00 00  00 00 00 00  ................              202.1.800                                              
                                              00 00 00 00  00 00 00 00  00 00 00 00  00 00 00 00  ................              202.1.816                                              
                                              00 00 00 00  00 00 00 00  00 00 00 00  00 00 00 00  ................              202.1.832                                              
                                              00 00 00 00  00 00 00 00  00 00 00 00  00 00 00 00  ................              202.1.848                                              
                                              00 00 00 00  00 00 00 00  00 00 00 00  00 00 00 00  ................              202.1.864                                              
                                              00 00 00 00  00 00 00 00  00 00 00 00  00 00 00 00  ................              202.1.880                                              
                                              00 00 00 00  00 00 00 00  00 00 00 00  00 00 00 00  ................              202.1.896                                              
                                              00 00 00 00  00 00 00 00  00 00 00 00  00 00 00 00  ................              202.1.912                                              
                                              00 00 00 00  00 00 00 00  00 00 00 00  00 00 00 00  ................              202.1.928                                              
                                              00 00 00 00  00 00 00 00  00 00 00 00  00 00 00 00  ................              202.1.944                                              
                                              00 00 00 00  00 00 00 00  00 00 00 00  00 00 00 00  ................              202.1.960                                              
                                              00 00 00 00  00 00 00 00  00 00 00 00  00 00 00 00  ................              202.1.976                                              
                                              00 00 00 00  00 00 00 00  00 00 00 00  00 00 00 00  ................              202.1.992                                              
                                              00 00 00 00  00 00 00 00  00 00 00 00  00 00 05 00  ................              202.1.1008                                             
                                              46 49 4c 45  30 00 03 00  ab 15 00 01  00 00 00 00  FILE0...........              202.1.1024                                             
                                              01 00 01 00  38 00 01 00  58 01 00 00  00 04 00 00  ....8...X.......              202.1.1040                                             
                                              00 00 00 00  00 00 00 00  04 00 00 00  01 00 00 00  ................              202.1.1056                                             
                                              05 00 00 00  00 00 00 00  10 00 00 00  60 00 00 00  ............`...              202.1.1072                                             
                                              00 00 18 00  00 00 00 00  48 00 00 00  18 00 00 00  ........H.......              202.1.1088                                             
                                              e4 71 b4 27  d5 0b d9 01  e4 71 b4 27  d5 0b d9 01  .q.'.....q.'....              202.1.1104                                             
                                              e4 71 b4 27  d5 0b d9 01  e4 71 b4 27  d5 0b d9 01  .q.'.....q.'....              202.1.1120                                             
                                              06 00 00 00  00 00 00 00  00 00 00 00  00 00 00 00  ................              202.1.1136                                             
                                              00 00 00 00  00 01 00 00  00 00 00 00  00 00 00 00  ................              202.1.1152                                             
                                              00 00 00 00  00 00 00 00  30 00 00 00  70 00 00 00  ........0...p...              202.1.1168                                             
                                              00 00 18 00  00 00 02 00  52 00 00 00  18 00 01 00  ........R.......              202.1.1184                                             
                                              05 00 00 00  00 00 05 00  e4 71 b4 27  d5 0b d9 01  .........q.'....              202.1.1200                                             
                                              e4 71 b4 27  d5 0b d9 01  e4 71 b4 27  d5 0b d9 01  .q.'.....q.'....              202.1.1216                                             
                                              e4 71 b4 27  d5 0b d9 01  00 10 00 00  00 00 00 00  .q.'............              202.1.1232                                             
                                              00 10 00 00  00 00 00 00  06 00 00 00  00 00 00 00  ................              202.1.1248                                             
                                              08 03 24 00  4d 00 46 00  54 00 4d 00  69 00 72 00  ..$.M.F.T.M.i.r.              202.1.1264                                             
                                              72 00 00 00  00 00 00 00  80 00 00 00  48 00 00 00  r...........H...              202.1.1280                                             
                                              01 00 40 00  00 00 01 00  00 00 00 00  00 00 00 00  ..@.............              202.1.1296                                             
                                              00 00 00 00  00 00 00 00  40 00 00 00  00 00 00 00  ........@.......              202.1.1312                                             
                                              00 10 00 00  00 00 00 00  00 10 00 00  00 00 00 00  ................              202.1.1328                                             
                                              00 10 00 00  00 00 00 00  11 01 02 00  00 00 00 00  ................              202.1.1344                                             
                                              ff ff ff ff  00 00 00 00  15 00 00 00  f4 33 3e 46  .............3>F              202.1.1360                                             
                                              f2 2a 36 3a  88 61 5b 76  e9 03 00 00  01 02 00 00  .*6:.a[v........              202.1.1376                                             
                                              00 00 00 05  20 00 00 00  20 02 00 00  00 00 00 00  .... ... .......              202.1.1392                                             
                                              80 00 00 00  48 00 00 00  01 00 40 00  00 00 01 00  ....H.....@.....              202.1.1408                                             
                                              00 00 00 00  00 00 00 00  00 00 00 00  00 00 00 00  ................              202.1.1424                                             
                                              40 00 00 00  00 00 00 00  00 10 00 00  00 00 00 00  @...............              202.1.1440                                             
                                              00 10 00 00  00 00 00 00  00 10 00 00  00 00 00 00  ................              202.1.1456                                             
                                              11 01 02 00  00 00 00 00  ff ff ff ff  00 00 00 00  ................              202.1.1472                                             
                                              00 00 00 00  00 00 00 00  00 00 00 00  00 00 00 00  ................              202.1.1488                                             
                                              00 00 00 00  00 00 00 00  00 00 00 00  00 00 00 00  ................              202.1.1504                                             
                                              00 00 00 00  00 00 00 00  00 00 00 00  00 00 05 00  ................              202.1.1520                                             
                                              00 00 00 00  00 00 00 00  00 00 00 00  00 00 00 00  ................              202.1.1536                                             
                                              00 00 00 00  00 00 00 00  00 00 00 00  00 00 00 00  ................              202.1.1552                                             
                                              00 00 00 00  00 00 00 00  00 00 00 00  00 00 00 00  ................              202.1.1568                                             
                                              00 00 00 00  00 00 00 00  00 00 00 00  00 00 00 00  ................              202.1.1584                                             
                                              00 00 00 00  00 00 00 00  00 00 00 00  00 00 00 00  ................              202.1.1600                                             
                                              00 00 00 00  00 00 00 00  00 00 00 00  00 00 00 00  ................              202.1.1616                                             
                                              00 00 00 00  00 00 00 00  00 00 00 00  00 00 00 00  ................              202.1.1632                                             
                                              00 00 00 00  00 00 00 00  00 00 00 00  00 00 00 00  ................              202.1.1648                                             
                                              00 00 00 00  00 00 00 00  00 00 00 00  00 00 00 00  ................              202.1.1664                                             
                                              00 00 00 00  00 00 00 00  00 00 00 00  00 00 00 00  ................              202.1.1680                                             
                                              00 00 00 00  00 00 00 00  00 00 00 00  00 00 00 00  ................              202.1.1696                                             
                                              00 00 00 00  00 00 00 00  00 00 00 00  00 00 00 00  ................              202.1.1712                                             
                                              00 00 00 00  00 00 00 00  00 00 00 00  00 00 00 00  ................              202.1.1728                                             
                                              00 00 00 00  00 00 00 00  00 00 00 00  00 00 00 00  ................              202.1.1744                                             
                                              00 00 00 00  00 00 00 00  00 00 00 00  00 00 00 00  ................              202.1.1760                                             
                                              00 00 00 00  00 00 00 00  00 00 00 00  00 00 00 00  ................              202.1.1776                                             
                                              00 00 00 00  00 00 00 00  00 00 00 00  00 00 00 00  ................              202.1.1792                                             
                                              00 00 00 00  00 00 00 00  00 00 00 00  00 00 00 00  ................              202.1.1808                                             
                                              00 00 00 00  00 00 00 00  00 00 00 00  00 00 00 00  ................              202.1.1824                                             
                                              00 00 00 00  00 00 00 00  00 00 00 00  00 00 00 00  ................              202.1.1840                                             
                                              00 00 00 00  00 00 00 00  00 00 00 00  00 00 00 00  ................              202.1.1856                                             
                                              00 00 00 00  00 00 00 00  00 00 00 00  00 00 00 00  ................              202.1.1872                                             
                                              00 00 00 00  00 00 00 00  00 00 00 00  00 00 00 00  ................              202.1.1888                                             
                                              00 00 00 00  00 00 00 00  00 00 00 00  00 00 00 00  ................              202.1.1904                                             
                                              00 00 00 00  00 00 00 00  00 00 00 00  00 00 00 00  ................              202.1.1920                                             
                                              00 00 00 00  00 00 00 00  00 00 00 00  00 00 00 00  ................              202.1.1936                                             
                                              00 00 00 00  00 00 00 00  00 00 00 00  00 00 00 00  ................              202.1.1952                                             
                                              00 00 00 00  00 00 00 00  00 00 00 00  00 00 00 00  ................              202.1.1968                                             
                                              00 00 00 00  00 00 00 00  00 00 00 00  00 00 00 00  ................              202.1.1984                                             
                                              00 00 00 00  00 00 00 00  00 00 00 00  00 00 00 00  ................              202.1.2000                                             
                                              00 00 00 00  00 00 00 00  00 00 00 00  00 00 00 00  ................              202.1.2016                                             
                                              00 00 00 00  00 00 00 00  00 00 00 00  00 00 05 00  ................              202.1.2032                                             
                                              46 49 4c 45  30 00 03 00  f3 15 00 01  00 00 00 00  FILE0...........              202.1.2048                                             
                                              02 00 01 00  38 00 01 00  58 01 00 00  00 04 00 00  ....8...X.......              202.1.2064                                             
                                              00 00 00 00  00 00 00 00  04 00 00 00  02 00 00 00  ................              202.1.2080                                             
                                              05 00 00 00  00 00 00 00  10 00 00 00  60 00 00 00  ............`...              202.1.2096                                             
                                              00 00 18 00  00 00 00 00  48 00 00 00  18 00 00 00  ........H.......              202.1.2112                                             
                                              e4 71 b4 27  d5 0b d9 01  e4 71 b4 27  d5 0b d9 01  .q.'.....q.'....              202.1.2128                                             
                                              e4 71 b4 27  d5 0b d9 01  e4 71 b4 27  d5 0b d9 01  .q.'.....q.'....              202.1.2144                                             
                                              06 00 00 00  00 00 00 00  00 00 00 00  00 00 00 00  ................              202.1.2160                                             
                                              00 00 00 00  00 01 00 00  00 00 00 00  00 00 00 00  ................              202.1.2176                                             
                                              00 00 00 00  00 00 00 00  30 00 00 00  70 00 00 00  ........0...p...              202.1.2192                                             
                                              00 00 18 00  00 00 02 00  52 00 00 00  18 00 01 00  ........R.......              202.1.2208                                             
                                              05 00 00 00  00 00 05 00  e4 71 b4 27  d5 0b d9 01  .........q.'....              202.1.2224                                             
                                              e4 71 b4 27  d5 0b d9 01  e4 71 b4 27  d5 0b d9 01  .q.'.....q.'....              202.1.2240                                             
                                              e4 71 b4 27  d5 0b d9 01  00 40 86 02  00 00 00 00  .q.'.....@......              202.1.2256                                             
                                              00 40 86 02  00 00 00 00  06 00 00 00  00 00 00 00  .@..............              202.1.2272                                             
                                              08 03 24 00  4c 00 6f 00  67 00 46 00  69 00 6c 00  ..$.L.o.g.F.i.l.              202.1.2288                                             
                                              65 00 00 00  00 00 00 00  80 00 00 00  48 00 00 00  e...........H...              202.1.2304                                             
                                              01 00 40 00  00 00 01 00  00 00 00 00  00 00 00 00  ..@.............              202.1.2320                                             
                                              63 28 00 00  00 00 00 00  40 00 00 00  00 00 00 00  c(......@.......              202.1.2336                                             
                                              00 40 86 02  00 00 00 00  00 40 86 02  00 00 00 00  .@.......@......              202.1.2352                                             
                                              00 40 86 02  00 00 00 00  32 64 28 b4  d6 0b 00 00  .@......2d(.....              202.1.2368                                             
                                              ff ff ff ff  00 00 00 00  15 00 00 00  f4 33 3e 46  .............3>F              202.1.2384                                             
                                              f2 2a 36 3a  88 61 5b 76  e9 03 00 00  01 02 00 00  .*6:.a[v........              202.1.2400                                             
                                              00 00 00 05  20 00 00 00  20 02 00 00  00 00 00 00  .... ... .......              202.1.2416                                             
                                              80 00 00 00  48 00 00 00  01 00 40 00  00 00 01 00  ....H.....@.....              202.1.2432                                             
                                              00 00 00 00  00 00 00 00  63 28 00 00  00 00 00 00  ........c(......              202.1.2448                                             
                                              40 00 00 00  00 00 00 00  00 40 86 02  00 00 00 00  @........@......              202.1.2464                                             
                                              00 40 86 02  00 00 00 00  00 40 86 02  00 00 00 00  .@.......@......              202.1.2480                                             
                                              32 64 28 b4  d6 0b 00 00  ff ff ff ff  00 00 00 00  2d(.............              202.1.2496                                             
                                              00 00 00 00  00 00 00 00  00 00 00 00  00 00 00 00  ................              202.1.2512                                             
                                              00 00 00 00  00 00 00 00  00 00 00 00  00 00 00 00  ................              202.1.2528                                             
                                              00 00 00 00  00 00 00 00  00 00 00 00  00 00 05 00  ................              202.1.2544                                             
                                              00 00 00 00  00 00 00 00  00 00 00 00  00 00 00 00  ................              202.1.2560                                             
                                              00 00 00 00  00 00 00 00  00 00 00 00  00 00 00 00  ................              202.1.2576                                             
                                              00 00 00 00  00 00 00 00  00 00 00 00  00 00 00 00  ................              202.1.2592                                             
                                              00 00 00 00  00 00 00 00  00 00 00 00  00 00 00 00  ................              202.1.2608                                             
                                              00 00 00 00  00 00 00 00  00 00 00 00  00 00 00 00  ................              202.1.2624                                             
                                              00 00 00 00  00 00 00 00  00 00 00 00  00 00 00 00  ................              202.1.2640                                             
                                              00 00 00 00  00 00 00 00  00 00 00 00  00 00 00 00  ................              202.1.2656                                             
                                              00 00 00 00  00 00 00 00  00 00 00 00  00 00 00 00  ................              202.1.2672                                             
                                              00 00 00 00  00 00 00 00  00 00 00 00  00 00 00 00  ................              202.1.2688                                             
                                              00 00 00 00  00 00 00 00  00 00 00 00  00 00 00 00  ................              202.1.2704                                             
                                              00 00 00 00  00 00 00 00  00 00 00 00  00 00 00 00  ................              202.1.2720                                             
                                              00 00 00 00  00 00 00 00  00 00 00 00  00 00 00 00  ................              202.1.2736                                             
                                              00 00 00 00  00 00 00 00  00 00 00 00  00 00 00 00  ................              202.1.2752                                             
                                              00 00 00 00  00 00 00 00  00 00 00 00  00 00 00 00  ................              202.1.2768                                             
                                              00 00 00 00  00 00 00 00  00 00 00 00  00 00 00 00  ................              202.1.2784                                             
                                              00 00 00 00  00 00 00 00  00 00 00 00  00 00 00 00  ................              202.1.2800                                             
                                              00 00 00 00  00 00 00 00  00 00 00 00  00 00 00 00  ................              202.1.2816                                             
                                              00 00 00 00  00 00 00 00  00 00 00 00  00 00 00 00  ................              202.1.2832                                             
                                              00 00 00 00  00 00 00 00  00 00 00 00  00 00 00 00  ................              202.1.2848                                             
                                              00 00 00 00  00 00 00 00  00 00 00 00  00 00 00 00  ................              202.1.2864                                             
                                              00 00 00 00  00 00 00 00  00 00 00 00  00 00 00 00  ................              202.1.2880                                             
                                              00 00 00 00  00 00 00 00  00 00 00 00  00 00 00 00  ................              202.1.2896                                             
                                              00 00 00 00  00 00 00 00  00 00 00 00  00 00 00 00  ................              202.1.2912                                             
                                              00 00 00 00  00 00 00 00  00 00 00 00  00 00 00 00  ................              202.1.2928                                             
                                              00 00 00 00  00 00 00 00  00 00 00 00  00 00 00 00  ................              202.1.2944                                             
                                              00 00 00 00  00 00 00 00  00 00 00 00  00 00 00 00  ................              202.1.2960                                             
                                              00 00 00 00  00 00 00 00  00 00 00 00  00 00 00 00  ................              202.1.2976                                             
                                              00 00 00 00  00 00 00 00  00 00 00 00  00 00 00 00  ................              202.1.2992                                             
                                              00 00 00 00  00 00 00 00  00 00 00 00  00 00 00 00  ................              202.1.3008                                             
                                              00 00 00 00  00 00 00 00  00 00 00 00  00 00 00 00  ................              202.1.3024                                             
                                              00 00 00 00  00 00 00 00  00 00 00 00  00 00 00 00  ................              202.1.3040                                             
                                              00 00 00 00  00 00 00 00  00 00 00 00  00 00 05 00  ................              202.1.3056                                             
                                              46 49 4c 45  30 00 03 00  61 08 00 01  00 00 00 00  FILE0...a.......              202.1.3072                                             
                                              03 00 01 00  38 00 01 00  70 01 00 00  00 04 00 00  ....8...p.......              202.1.3088                                             
                                              00 00 00 00  00 00 00 00  06 00 00 00  03 00 00 00  ................              202.1.3104                                             
                                              05 00 00 00  00 00 00 00  10 00 00 00  60 00 00 00  ............`...              202.1.3120                                             
                                              00 00 18 00  00 00 00 00  48 00 00 00  18 00 00 00  ........H.......              202.1.3136                                             
                                              e4 71 b4 27  d5 0b d9 01  e4 71 b4 27  d5 0b d9 01  .q.'.....q.'....              202.1.3152                                             
                                              e4 71 b4 27  d5 0b d9 01  e4 71 b4 27  d5 0b d9 01  .q.'.....q.'....              202.1.3168                                             
                                              06 00 00 00  00 00 00 00  00 00 00 00  00 00 00 00  ................              202.1.3184                                             
  31.1                             13  IN     55 53 42 53  00 a5 72 7d  00 00 00 00  00           USBS..r......     273us       203.1.0        2024/08/22  10:20:41.541  classpnp      
  32                             4096  IN     46 49 4c 45  30 00 03 00  63 15 00 01  00 00 00 00  FILE0...c.......    2us       200.2.0        2024/08/22  10:20:41.541                
                                              01 00 01 00  38 00 01 00  a0 01 00 00  00 04 00 00  ....8...........              200.2.16                                               
                                              00 00 00 00  00 00 00 00  07 00 00 00  00 00 00 00  ................              200.2.32                                               
                                              05 00 00 00  00 00 00 00  10 00 00 00  60 00 00 00  ............`...              200.2.48                                               
                                              00 00 18 00  00 00 00 00  48 00 00 00  18 00 00 00  ........H.......              200.2.64                                               
                                              e4 71 b4 27  d5 0b d9 01  e4 71 b4 27  d5 0b d9 01  .q.'.....q.'....              200.2.80                                               
                                              e4 71 b4 27  d5 0b d9 01  e4 71 b4 27  d5 0b d9 01  .q.'.....q.'....              200.2.96                                               
                                              06 00 00 00  00 00 00 00  00 00 00 00  00 00 00 00  ................              200.2.112                                              
                                              00 00 00 00  00 01 00 00  00 00 00 00  00 00 00 00  ................              200.2.128                                              
                                              00 00 00 00  00 00 00 00  30 00 00 00  68 00 00 00  ........0...h...              200.2.144                                              
                                              00 00 18 00  00 00 03 00  4a 00 00 00  18 00 01 00  ........J.......              200.2.160                                              
                                              05 00 00 00  00 00 05 00  e4 71 b4 27  d5 0b d9 01  .........q.'....              200.2.176                                              
                                              e4 71 b4 27  d5 0b d9 01  e4 71 b4 27  d5 0b d9 01  .q.'.....q.'....              200.2.192                                              
                                              e4 71 b4 27  d5 0b d9 01  00 40 00 00  00 00 00 00  .q.'.....@......              200.2.208                                              
                                              00 40 00 00  00 00 00 00  06 00 00 00  00 00 00 00  .@..............              200.2.224                                              
                                              04 03 24 00  4d 00 46 00  54 00 00 00  00 00 00 00  ..$.M.F.T.......              200.2.240                                              
                                              80 00 00 00  48 00 00 00  01 00 40 00  00 00 06 00  ....H.....@.....              200.2.256                                              
                                              00 00 00 00  00 00 00 00  3f 00 00 00  00 00 00 00  ........?.......              200.2.272                                              
                                              40 00 00 00  00 00 00 00  00 00 04 00  00 00 00 00  @...............              200.2.288                                              
                                              00 00 04 00  00 00 00 00  00 00 04 00  00 00 00 00  ................              200.2.304                                              
                                              31 40 00 00  0c 00 00 00  b0 00 00 00  50 00 00 00  1@..........P...              200.2.320                                              
                                              01 00 40 00  00 00 05 00  00 00 00 00  00 00 00 00  ..@.............              200.2.336                                              
                                              01 00 00 00  00 00 00 00  40 00 00 00  00 00 00 00  ........@.......              200.2.352                                              
                                              00 20 00 00  00 00 00 00  08 10 00 00  00 00 00 00  . ..............              200.2.368                                              
                                              08 10 00 00  00 00 00 00  31 01 ff ff  0b 31 01 26  ........1....1.&              200.2.384                                              
                                              00 f4 00 00  00 00 00 00  ff ff ff ff  00 00 00 00  ................              200.2.400                                              
                                              00 00 04 00  00 00 00 00  00 00 04 00  00 00 00 00  ................              200.2.416                                              
                                              00 00 04 00  00 00 00 00  31 40 00 00  0c 00 00 00  ........1@......              200.2.432                                              
                                              b0 00 00 00  50 00 00 00  01 00 40 00  00 00 05 00  ....P.....@.....              200.2.448                                              
                                              00 00 00 00  00 00 00 00  01 00 00 00  00 00 00 00  ................              200.2.464                                              
                                              40 00 00 00  00 00 00 00  00 20 00 00  00 00 00 00  @........ ......              200.2.480                                              
                                              08 10 00 00  00 00 00 00  08 10 00 00  00 00 05 00  ................              200.2.496                                              
                                              31 01 ff ff  0b 31 01 26  00 f4 00 00  00 00 00 00  1....1.&........              200.2.512                                              
                                              ff ff ff ff  00 00 00 00  00 00 00 00  00 00 00 00  ................              200.2.528                                              
                                              00 00 00 00  00 00 00 00  00 00 00 00  00 00 00 00  ................              200.2.544                                              
                                              00 00 00 00  00 00 00 00  00 00 00 00  00 00 00 00  ................              200.2.560                                              
                                              00 00 00 00  00 00 00 00  00 00 00 00  00 00 00 00  ................              200.2.576                                              
                                              00 00 00 00  00 00 00 00  00 00 00 00  00 00 00 00  ................              200.2.592                                              
                                              00 00 00 00  00 00 00 00  00 00 00 00  00 00 00 00  ................              200.2.608                                              
                                              00 00 00 00  00 00 00 00  00 00 00 00  00 00 00 00  ................              200.2.624                                              
                                              00 00 00 00  00 00 00 00  00 00 00 00  00 00 00 00  ................              200.2.640                                              
                                              00 00 00 00  00 00 00 00  00 00 00 00  00 00 00 00  ................              200.2.656                                              
                                              00 00 00 00  00 00 00 00  00 00 00 00  00 00 00 00  ................              200.2.672                                              
                                              00 00 00 00  00 00 00 00  00 00 00 00  00 00 00 00  ................              200.2.688                                              
                                              00 00 00 00  00 00 00 00  00 00 00 00  00 00 00 00  ................              200.2.704                                              
                                              00 00 00 00  00 00 00 00  00 00 00 00  00 00 00 00  ................              200.2.720                                              
                                              00 00 00 00  00 00 00 00  00 00 00 00  00 00 00 00  ................              200.2.736                                              
                                              00 00 00 00  00 00 00 00  00 00 00 00  00 00 00 00  ................              200.2.752                                              
                                              00 00 00 00  00 00 00 00  00 00 00 00  00 00 00 00  ................              200.2.768                                              
                                              00 00 00 00  00 00 00 00  00 00 00 00  00 00 00 00  ................              200.2.784                                              
                                              00 00 00 00  00 00 00 00  00 00 00 00  00 00 00 00  ................              200.2.800                                              
                                              00 00 00 00  00 00 00 00  00 00 00 00  00 00 00 00  ................              200.2.816                                              
                                              00 00 00 00  00 00 00 00  00 00 00 00  00 00 00 00  ................              200.2.832                                              
                                              00 00 00 00  00 00 00 00  00 00 00 00  00 00 00 00  ................              200.2.848                                              
                                              00 00 00 00  00 00 00 00  00 00 00 00  00 00 00 00  ................              200.2.864                                              
                                              00 00 00 00  00 00 00 00  00 00 00 00  00 00 00 00  ................              200.2.880                                              
                                              00 00 00 00  00 00 00 00  00 00 00 00  00 00 00 00  ................              200.2.896                                              
                                              00 00 00 00  00 00 00 00  00 00 00 00  00 00 00 00  ................              200.2.912                                              
                                              00 00 00 00  00 00 00 00  00 00 00 00  00 00 00 00  ................              200.2.928                                              
                                              00 00 00 00  00 00 00 00  00 00 00 00  00 00 00 00  ................              200.2.944                                              
                                              00 00 00 00  00 00 00 00  00 00 00 00  00 00 00 00  ................              200.2.960                                              
                                              00 00 00 00  00 00 00 00  00 00 00 00  00 00 00 00  ................              200.2.976                                              
                                              00 00 00 00  00 00 00 00  00 00 00 00  00 00 00 00  ................              200.2.992                                              
                                              00 00 00 00  00 00 00 00  00 00 00 00  00 00 05 00  ................              200.2.1008                                             
                                              46 49 4c 45  30 00 03 00  ab 15 00 01  00 00 00 00  FILE0...........              200.2.1024                                             
                                              01 00 01 00  38 00 01 00  58 01 00 00  00 04 00 00  ....8...X.......              200.2.1040                                             
                                              00 00 00 00  00 00 00 00  04 00 00 00  01 00 00 00  ................              200.2.1056                                             
                                              05 00 00 00  00 00 00 00  10 00 00 00  60 00 00 00  ............`...              200.2.1072                                             
                                              00 00 18 00  00 00 00 00  48 00 00 00  18 00 00 00  ........H.......              200.2.1088                                             
                                              e4 71 b4 27  d5 0b d9 01  e4 71 b4 27  d5 0b d9 01  .q.'.....q.'....              200.2.1104                                             
                                              e4 71 b4 27  d5 0b d9 01  e4 71 b4 27  d5 0b d9 01  .q.'.....q.'....              200.2.1120                                             
                                              06 00 00 00  00 00 00 00  00 00 00 00  00 00 00 00  ................              200.2.1136                                             
                                              00 00 00 00  00 01 00 00  00 00 00 00  00 00 00 00  ................              200.2.1152                                             
                                              00 00 00 00  00 00 00 00  30 00 00 00  70 00 00 00  ........0...p...              200.2.1168                                             
                                              00 00 18 00  00 00 02 00  52 00 00 00  18 00 01 00  ........R.......              200.2.1184                                             
                                              05 00 00 00  00 00 05 00  e4 71 b4 27  d5 0b d9 01  .........q.'....              200.2.1200                                             
                                              e4 71 b4 27  d5 0b d9 01  e4 71 b4 27  d5 0b d9 01  .q.'.....q.'....              200.2.1216                                             
                                              e4 71 b4 27  d5 0b d9 01  00 10 00 00  00 00 00 00  .q.'............              200.2.1232                                             
                                              00 10 00 00  00 00 00 00  06 00 00 00  00 00 00 00  ................              200.2.1248                                             
                                              08 03 24 00  4d 00 46 00  54 00 4d 00  69 00 72 00  ..$.M.F.T.M.i.r.              200.2.1264                                             
                                              72 00 00 00  00 00 00 00  80 00 00 00  48 00 00 00  r...........H...              200.2.1280                                             
                                              01 00 40 00  00 00 01 00  00 00 00 00  00 00 00 00  ..@.............              200.2.1296                                             
                                              00 00 00 00  00 00 00 00  40 00 00 00  00 00 00 00  ........@.......              200.2.1312                                             
                                              00 10 00 00  00 00 00 00  00 10 00 00  00 00 00 00  ................              200.2.1328                                             
                                              00 10 00 00  00 00 00 00  11 01 02 00  00 00 00 00  ................              200.2.1344                                             
                                              ff ff ff ff  00 00 00 00  15 00 00 00  f4 33 3e 46  .............3>F              200.2.1360                                             
                                              f2 2a 36 3a  88 61 5b 76  e9 03 00 00  01 02 00 00  .*6:.a[v........              200.2.1376                                             
                                              00 00 00 05  20 00 00 00  20 02 00 00  00 00 00 00  .... ... .......              200.2.1392                                             
                                              80 00 00 00  48 00 00 00  01 00 40 00  00 00 01 00  ....H.....@.....              200.2.1408                                             
                                              00 00 00 00  00 00 00 00  00 00 00 00  00 00 00 00  ................              200.2.1424                                             
                                              40 00 00 00  00 00 00 00  00 10 00 00  00 00 00 00  @...............              200.2.1440                                             
                                              00 10 00 00  00 00 00 00  00 10 00 00  00 00 00 00  ................              200.2.1456                                             
                                              11 01 02 00  00 00 00 00  ff ff ff ff  00 00 00 00  ................              200.2.1472                                             
                                              00 00 00 00  00 00 00 00  00 00 00 00  00 00 00 00  ................              200.2.1488                                             
                                              00 00 00 00  00 00 00 00  00 00 00 00  00 00 00 00  ................              200.2.1504                                             
                                              00 00 00 00  00 00 00 00  00 00 00 00  00 00 05 00  ................              200.2.1520                                             
                                              00 00 00 00  00 00 00 00  00 00 00 00  00 00 00 00  ................              200.2.1536                                             
                                              00 00 00 00  00 00 00 00  00 00 00 00  00 00 00 00  ................              200.2.1552                                             
                                              00 00 00 00  00 00 00 00  00 00 00 00  00 00 00 00  ................              200.2.1568                                             
                                              00 00 00 00  00 00 00 00  00 00 00 00  00 00 00 00  ................              200.2.1584                                             
                                              00 00 00 00  00 00 00 00  00 00 00 00  00 00 00 00  ................              200.2.1600                                             
                                              00 00 00 00  00 00 00 00  00 00 00 00  00 00 00 00  ................              200.2.1616                                             
                                              00 00 00 00  00 00 00 00  00 00 00 00  00 00 00 00  ................              200.2.1632                                             
                                              00 00 00 00  00 00 00 00  00 00 00 00  00 00 00 00  ................              200.2.1648                                             
                                              00 00 00 00  00 00 00 00  00 00 00 00  00 00 00 00  ................              200.2.1664                                             
                                              00 00 00 00  00 00 00 00  00 00 00 00  00 00 00 00  ................              200.2.1680                                             
                                              00 00 00 00  00 00 00 00  00 00 00 00  00 00 00 00  ................              200.2.1696                                             
                                              00 00 00 00  00 00 00 00  00 00 00 00  00 00 00 00  ................              200.2.1712                                             
                                              00 00 00 00  00 00 00 00  00 00 00 00  00 00 00 00  ................              200.2.1728                                             
                                              00 00 00 00  00 00 00 00  00 00 00 00  00 00 00 00  ................              200.2.1744                                             
                                              00 00 00 00  00 00 00 00  00 00 00 00  00 00 00 00  ................              200.2.1760                                             
                                              00 00 00 00  00 00 00 00  00 00 00 00  00 00 00 00  ................              200.2.1776                                             
                                              00 00 00 00  00 00 00 00  00 00 00 00  00 00 00 00  ................              200.2.1792                                             
                                              00 00 00 00  00 00 00 00  00 00 00 00  00 00 00 00  ................              200.2.1808                                             
                                              00 00 00 00  00 00 00 00  00 00 00 00  00 00 00 00  ................              200.2.1824                                             
                                              00 00 00 00  00 00 00 00  00 00 00 00  00 00 00 00  ................              200.2.1840                                             
                                              00 00 00 00  00 00 00 00  00 00 00 00  00 00 00 00  ................              200.2.1856                                             
                                              00 00 00 00  00 00 00 00  00 00 00 00  00 00 00 00  ................              200.2.1872                                             
                                              00 00 00 00  00 00 00 00  00 00 00 00  00 00 00 00  ................              200.2.1888                                             
                                              00 00 00 00  00 00 00 00  00 00 00 00  00 00 00 00  ................              200.2.1904                                             
                                              00 00 00 00  00 00 00 00  00 00 00 00  00 00 00 00  ................              200.2.1920                                             
                                              00 00 00 00  00 00 00 00  00 00 00 00  00 00 00 00  ................              200.2.1936                                             
                                              00 00 00 00  00 00 00 00  00 00 00 00  00 00 00 00  ................              200.2.1952                                             
                                              00 00 00 00  00 00 00 00  00 00 00 00  00 00 00 00  ................              200.2.1968                                             
                                              00 00 00 00  00 00 00 00  00 00 00 00  00 00 00 00  ................              200.2.1984                                             
                                              00 00 00 00  00 00 00 00  00 00 00 00  00 00 00 00  ................              200.2.2000                                             
                                              00 00 00 00  00 00 00 00  00 00 00 00  00 00 00 00  ................              200.2.2016                                             
                                              00 00 00 00  00 00 00 00  00 00 00 00  00 00 05 00  ................              200.2.2032                                             
                                              46 49 4c 45  30 00 03 00  f3 15 00 01  00 00 00 00  FILE0...........              200.2.2048                                             
                                              02 00 01 00  38 00 01 00  58 01 00 00  00 04 00 00  ....8...X.......              200.2.2064                                             
                                              00 00 00 00  00 00 00 00  04 00 00 00  02 00 00 00  ................              200.2.2080                                             
                                              05 00 00 00  00 00 00 00  10 00 00 00  60 00 00 00  ............`...              200.2.2096                                             
                                              00 00 18 00  00 00 00 00  48 00 00 00  18 00 00 00  ........H.......              200.2.2112                                             
                                              e4 71 b4 27  d5 0b d9 01  e4 71 b4 27  d5 0b d9 01  .q.'.....q.'....              200.2.2128                                             
                                              e4 71 b4 27  d5 0b d9 01  e4 71 b4 27  d5 0b d9 01  .q.'.....q.'....              200.2.2144                                             
                                              06 00 00 00  00 00 00 00  00 00 00 00  00 00 00 00  ................              200.2.2160                                             
                                              00 00 00 00  00 01 00 00  00 00 00 00  00 00 00 00  ................              200.2.2176                                             
                                              00 00 00 00  00 00 00 00  30 00 00 00  70 00 00 00  ........0...p...              200.2.2192                                             
                                              00 00 18 00  00 00 02 00  52 00 00 00  18 00 01 00  ........R.......              200.2.2208                                             
                                              05 00 00 00  00 00 05 00  e4 71 b4 27  d5 0b d9 01  .........q.'....              200.2.2224                                             
                                              e4 71 b4 27  d5 0b d9 01  e4 71 b4 27  d5 0b d9 01  .q.'.....q.'....              200.2.2240                                             
                                              e4 71 b4 27  d5 0b d9 01  00 40 86 02  00 00 00 00  .q.'.....@......              200.2.2256                                             
                                              00 40 86 02  00 00 00 00  06 00 00 00  00 00 00 00  .@..............              200.2.2272                                             
                                              08 03 24 00  4c 00 6f 00  67 00 46 00  69 00 6c 00  ..$.L.o.g.F.i.l.              200.2.2288                                             
                                              65 00 00 00  00 00 00 00  80 00 00 00  48 00 00 00  e...........H...              200.2.2304                                             
                                              01 00 40 00  00 00 01 00  00 00 00 00  00 00 00 00  ..@.............              200.2.2320                                             
                                              63 28 00 00  00 00 00 00  40 00 00 00  00 00 00 00  c(......@.......              200.2.2336                                             
                                              00 40 86 02  00 00 00 00  00 40 86 02  00 00 00 00  .@.......@......              200.2.2352                                             
                                              00 40 86 02  00 00 00 00  32 64 28 b4  d6 0b 00 00  .@......2d(.....              200.2.2368                                             
                                              ff ff ff ff  00 00 00 00  15 00 00 00  f4 33 3e 46  .............3>F              200.2.2384                                             
                                              f2 2a 36 3a  88 61 5b 76  e9 03 00 00  01 02 00 00  .*6:.a[v........              200.2.2400                                             
                                              00 00 00 05  20 00 00 00  20 02 00 00  00 00 00 00  .... ... .......              200.2.2416                                             
                                              80 00 00 00  48 00 00 00  01 00 40 00  00 00 01 00  ....H.....@.....              200.2.2432                                             
                                              00 00 00 00  00 00 00 00  63 28 00 00  00 00 00 00  ........c(......              200.2.2448                                             
                                              40 00 00 00  00 00 00 00  00 40 86 02  00 00 00 00  @........@......              200.2.2464                                             
                                              00 40 86 02  00 00 00 00  00 40 86 02  00 00 00 00  .@.......@......              200.2.2480                                             
                                              32 64 28 b4  d6 0b 00 00  ff ff ff ff  00 00 00 00  2d(.............              200.2.2496                                             
                                              00 00 00 00  00 00 00 00  00 00 00 00  00 00 00 00  ................              200.2.2512                                             
                                              00 00 00 00  00 00 00 00  00 00 00 00  00 00 00 00  ................              200.2.2528                                             
                                              00 00 00 00  00 00 00 00  00 00 00 00  00 00 05 00  ................              200.2.2544                                             
                                              00 00 00 00  00 00 00 00  00 00 00 00  00 00 00 00  ................              200.2.2560                                             
                                              00 00 00 00  00 00 00 00  00 00 00 00  00 00 00 00  ................              200.2.2576                                             
                                              00 00 00 00  00 00 00 00  00 00 00 00  00 00 00 00  ................              200.2.2592                                             
                                              00 00 00 00  00 00 00 00  00 00 00 00  00 00 00 00  ................              200.2.2608                                             
                                              00 00 00 00  00 00 00 00  00 00 00 00  00 00 00 00  ................              200.2.2624                                             
                                              00 00 00 00  00 00 00 00  00 00 00 00  00 00 00 00  ................              200.2.2640                                             
                                              00 00 00 00  00 00 00 00  00 00 00 00  00 00 00 00  ................              200.2.2656                                             
                                              00 00 00 00  00 00 00 00  00 00 00 00  00 00 00 00  ................              200.2.2672                                             
                                              00 00 00 00  00 00 00 00  00 00 00 00  00 00 00 00  ................              200.2.2688                                             
                                              00 00 00 00  00 00 00 00  00 00 00 00  00 00 00 00  ................              200.2.2704                                             
                                              00 00 00 00  00 00 00 00  00 00 00 00  00 00 00 00  ................              200.2.2720                                             
                                              00 00 00 00  00 00 00 00  00 00 00 00  00 00 00 00  ................              200.2.2736                                             
                                              00 00 00 00  00 00 00 00  00 00 00 00  00 00 00 00  ................              200.2.2752                                             
                                              00 00 00 00  00 00 00 00  00 00 00 00  00 00 00 00  ................              200.2.2768                                             
                                              00 00 00 00  00 00 00 00  00 00 00 00  00 00 00 00  ................              200.2.2784                                             
                                              00 00 00 00  00 00 00 00  00 00 00 00  00 00 00 00  ................              200.2.2800                                             
                                              00 00 00 00  00 00 00 00  00 00 00 00  00 00 00 00  ................              200.2.2816                                             
                                              00 00 00 00  00 00 00 00  00 00 00 00  00 00 00 00  ................              200.2.2832                                             
                                              00 00 00 00  00 00 00 00  00 00 00 00  00 00 00 00  ................              200.2.2848                                             
                                              00 00 00 00  00 00 00 00  00 00 00 00  00 00 00 00  ................              200.2.2864                                             
                                              00 00 00 00  00 00 00 00  00 00 00 00  00 00 00 00  ................              200.2.2880                                             
                                              00 00 00 00  00 00 00 00  00 00 00 00  00 00 00 00  ................              200.2.2896                                             
                                              00 00 00 00  00 00 00 00  00 00 00 00  00 00 00 00  ................              200.2.2912                                             
                                              00 00 00 00  00 00 00 00  00 00 00 00  00 00 00 00  ................              200.2.2928                                             
                                              00 00 00 00  00 00 00 00  00 00 00 00  00 00 00 00  ................              200.2.2944                                             
                                              00 00 00 00  00 00 00 00  00 00 00 00  00 00 00 00  ................              200.2.2960                                             
                                              00 00 00 00  00 00 00 00  00 00 00 00  00 00 00 00  ................              200.2.2976                                             
                                              00 00 00 00  00 00 00 00  00 00 00 00  00 00 00 00  ................              200.2.2992                                             
                                              00 00 00 00  00 00 00 00  00 00 00 00  00 00 00 00  ................              200.2.3008                                             
                                              00 00 00 00  00 00 00 00  00 00 00 00  00 00 00 00  ................              200.2.3024                                             
                                              00 00 00 00  00 00 00 00  00 00 00 00  00 00 00 00  ................              200.2.3040                                             
                                              00 00 00 00  00 00 00 00  00 00 00 00  00 00 05 00  ................              200.2.3056                                             
                                              46 49 4c 45  30 00 03 00  61 08 00 01  00 00 00 00  FILE0...a.......              200.2.3072                                             
                                              03 00 01 00  38 00 01 00  70 01 00 00  00 04 00 00  ....8...p.......              200.2.3088                                             
                                              00 00 00 00  00 00 00 00  06 00 00 00  03 00 00 00  ................              200.2.3104                                             
                                              05 00 00 00  00 00 00 00  10 00 00 00  60 00 00 00  ............`...              200.2.3120                                             
                                              00 00 18 00  00 00 00 00  48 00 00 00  18 00 00 00  ........H.......              200.2.3136                                             
                                              e4 71 b4 27  d5 0b d9 01  e4 71 b4 27  d5 0b d9 01  .q.'.....q.'....              200.2.3152                                             
                                              e4 71 b4 27  d5 0b d9 01  e4 71 b4 27  d5 0b d9 01  .q.'.....q.'....              200.2.3168                                             
                                              06 00 00 00  00 00 00 00  00 00 00 00  00 00 00 00  ................              200.2.3184                                             
  32                                   CMD    28 00 00 00  08 10 00 00  08 00                     READ               45us       204.1.0        2024/08/22  10:20:41.541  classpnp      
  31.2                             31  OUT    55 53 42 43  00 a5 72 7d  00 10 00 00  80 00 0a 28  USBC..r........(  314us       205.1.0        2024/08/22  10:20:41.542  classpnp      
                                              00 00 00 08  10 00 00 08  00 00 00 00  00 00 00     ...............               205.1.16                                               
  31.1                           4096  IN     46 49 4c 45  30 00 03 00  63 15 00 01  00 00 00 00  FILE0...c.......  2.2ms       206.1.0        2024/08/22  10:20:41.544  classpnp      
                                              01 00 01 00  38 00 01 00  a0 01 00 00  00 04 00 00  ....8...........              206.1.16                                               
                                              00 00 00 00  00 00 00 00  07 00 00 00  00 00 00 00  ................              206.1.32                                               
                                              05 00 00 00  00 00 00 00  10 00 00 00  60 00 00 00  ............`...              206.1.48                                               
                                              00 00 18 00  00 00 00 00  48 00 00 00  18 00 00 00  ........H.......              206.1.64                                               
                                              e4 71 b4 27  d5 0b d9 01  e4 71 b4 27  d5 0b d9 01  .q.'.....q.'....              206.1.80                                               
                                              e4 71 b4 27  d5 0b d9 01  e4 71 b4 27  d5 0b d9 01  .q.'.....q.'....              206.1.96                                               
                                              06 00 00 00  00 00 00 00  00 00 00 00  00 00 00 00  ................              206.1.112                                              
                                              00 00 00 00  00 01 00 00  00 00 00 00  00 00 00 00  ................              206.1.128                                              
                                              00 00 00 00  00 00 00 00  30 00 00 00  68 00 00 00  ........0...h...              206.1.144                                              
                                              00 00 18 00  00 00 03 00  4a 00 00 00  18 00 01 00  ........J.......              206.1.160                                              
                                              05 00 00 00  00 00 05 00  e4 71 b4 27  d5 0b d9 01  .........q.'....              206.1.176                                              
                                              e4 71 b4 27  d5 0b d9 01  e4 71 b4 27  d5 0b d9 01  .q.'.....q.'....              206.1.192                                              
                                              e4 71 b4 27  d5 0b d9 01  00 40 00 00  00 00 00 00  .q.'.....@......              206.1.208                                              
                                              00 40 00 00  00 00 00 00  06 00 00 00  00 00 00 00  .@..............              206.1.224                                              
                                              04 03 24 00  4d 00 46 00  54 00 00 00  00 00 00 00  ..$.M.F.T.......              206.1.240                                              
                                              80 00 00 00  48 00 00 00  01 00 40 00  00 00 06 00  ....H.....@.....              206.1.256                                              
                                              00 00 00 00  00 00 00 00  3f 00 00 00  00 00 00 00  ........?.......              206.1.272                                              
                                              40 00 00 00  00 00 00 00  00 00 04 00  00 00 00 00  @...............              206.1.288                                              
                                              00 00 04 00  00 00 00 00  00 00 04 00  00 00 00 00  ................              206.1.304                                              
                                              31 40 00 00  0c 00 00 00  b0 00 00 00  50 00 00 00  1@..........P...              206.1.320                                              
                                              01 00 40 00  00 00 05 00  00 00 00 00  00 00 00 00  ..@.............              206.1.336                                              
                                              01 00 00 00  00 00 00 00  40 00 00 00  00 00 00 00  ........@.......              206.1.352                                              
                                              00 20 00 00  00 00 00 00  08 10 00 00  00 00 00 00  . ..............              206.1.368                                              
                                              08 10 00 00  00 00 00 00  31 01 ff ff  0b 31 01 26  ........1....1.&              206.1.384                                              
                                              00 f4 00 00  00 00 00 00  ff ff ff ff  00 00 00 00  ................              206.1.400                                              
                                              00 00 04 00  00 00 00 00  00 00 04 00  00 00 00 00  ................              206.1.416                                              
                                              00 00 04 00  00 00 00 00  31 40 00 00  0c 00 00 00  ........1@......              206.1.432                                              
                                              b0 00 00 00  50 00 00 00  01 00 40 00  00 00 05 00  ....P.....@.....              206.1.448                                              
                                              00 00 00 00  00 00 00 00  01 00 00 00  00 00 00 00  ................              206.1.464                                              
                                              40 00 00 00  00 00 00 00  00 20 00 00  00 00 00 00  @........ ......              206.1.480                                              
                                              08 10 00 00  00 00 00 00  08 10 00 00  00 00 05 00  ................              206.1.496                                              
                                              31 01 ff ff  0b 31 01 26  00 f4 00 00  00 00 00 00  1....1.&........              206.1.512                                              
                                              ff ff ff ff  00 00 00 00  00 00 00 00  00 00 00 00  ................              206.1.528                                              
                                              00 00 00 00  00 00 00 00  00 00 00 00  00 00 00 00  ................              206.1.544                                              
                                              00 00 00 00  00 00 00 00  00 00 00 00  00 00 00 00  ................              206.1.560                                              
                                              00 00 00 00  00 00 00 00  00 00 00 00  00 00 00 00  ................              206.1.576                                              
                                              00 00 00 00  00 00 00 00  00 00 00 00  00 00 00 00  ................              206.1.592                                              
                                              00 00 00 00  00 00 00 00  00 00 00 00  00 00 00 00  ................              206.1.608                                              
                                              00 00 00 00  00 00 00 00  00 00 00 00  00 00 00 00  ................              206.1.624                                              
                                              00 00 00 00  00 00 00 00  00 00 00 00  00 00 00 00  ................              206.1.640                                              
                                              00 00 00 00  00 00 00 00  00 00 00 00  00 00 00 00  ................              206.1.656                                              
                                              00 00 00 00  00 00 00 00  00 00 00 00  00 00 00 00  ................              206.1.672                                              
                                              00 00 00 00  00 00 00 00  00 00 00 00  00 00 00 00  ................              206.1.688                                              
                                              00 00 00 00  00 00 00 00  00 00 00 00  00 00 00 00  ................              206.1.704                                              
                                              00 00 00 00  00 00 00 00  00 00 00 00  00 00 00 00  ................              206.1.720                                              
                                              00 00 00 00  00 00 00 00  00 00 00 00  00 00 00 00  ................              206.1.736                                              
                                              00 00 00 00  00 00 00 00  00 00 00 00  00 00 00 00  ................              206.1.752                                              
                                              00 00 00 00  00 00 00 00  00 00 00 00  00 00 00 00  ................              206.1.768                                              
                                              00 00 00 00  00 00 00 00  00 00 00 00  00 00 00 00  ................              206.1.784                                              
                                              00 00 00 00  00 00 00 00  00 00 00 00  00 00 00 00  ................              206.1.800                                              
                                              00 00 00 00  00 00 00 00  00 00 00 00  00 00 00 00  ................              206.1.816                                              
                                              00 00 00 00  00 00 00 00  00 00 00 00  00 00 00 00  ................              206.1.832                                              
                                              00 00 00 00  00 00 00 00  00 00 00 00  00 00 00 00  ................              206.1.848                                              
                                              00 00 00 00  00 00 00 00  00 00 00 00  00 00 00 00  ................              206.1.864                                              
                                              00 00 00 00  00 00 00 00  00 00 00 00  00 00 00 00  ................              206.1.880                                              
                                              00 00 00 00  00 00 00 00  00 00 00 00  00 00 00 00  ................              206.1.896                                              
                                              00 00 00 00  00 00 00 00  00 00 00 00  00 00 00 00  ................              206.1.912                                              
                                              00 00 00 00  00 00 00 00  00 00 00 00  00 00 00 00  ................              206.1.928                                              
                                              00 00 00 00  00 00 00 00  00 00 00 00  00 00 00 00  ................              206.1.944                                              
                                              00 00 00 00  00 00 00 00  00 00 00 00  00 00 00 00  ................              206.1.960                                              
                                              00 00 00 00  00 00 00 00  00 00 00 00  00 00 00 00  ................              206.1.976                                              
                                              00 00 00 00  00 00 00 00  00 00 00 00  00 00 00 00  ................              206.1.992                                              
                                              00 00 00 00  00 00 00 00  00 00 00 00  00 00 05 00  ................              206.1.1008                                             
                                              46 49 4c 45  30 00 03 00  ab 15 00 01  00 00 00 00  FILE0...........              206.1.1024                                             
                                              01 00 01 00  38 00 01 00  58 01 00 00  00 04 00 00  ....8...X.......              206.1.1040                                             
                                              00 00 00 00  00 00 00 00  04 00 00 00  01 00 00 00  ................              206.1.1056                                             
                                              05 00 00 00  00 00 00 00  10 00 00 00  60 00 00 00  ............`...              206.1.1072                                             
                                              00 00 18 00  00 00 00 00  48 00 00 00  18 00 00 00  ........H.......              206.1.1088                                             
                                              e4 71 b4 27  d5 0b d9 01  e4 71 b4 27  d5 0b d9 01  .q.'.....q.'....              206.1.1104                                             
                                              e4 71 b4 27  d5 0b d9 01  e4 71 b4 27  d5 0b d9 01  .q.'.....q.'....              206.1.1120                                             
                                              06 00 00 00  00 00 00 00  00 00 00 00  00 00 00 00  ................              206.1.1136                                             
                                              00 00 00 00  00 01 00 00  00 00 00 00  00 00 00 00  ................              206.1.1152                                             
                                              00 00 00 00  00 00 00 00  30 00 00 00  70 00 00 00  ........0...p...              206.1.1168                                             
                                              00 00 18 00  00 00 02 00  52 00 00 00  18 00 01 00  ........R.......              206.1.1184                                             
                                              05 00 00 00  00 00 05 00  e4 71 b4 27  d5 0b d9 01  .........q.'....              206.1.1200                                             
                                              e4 71 b4 27  d5 0b d9 01  e4 71 b4 27  d5 0b d9 01  .q.'.....q.'....              206.1.1216                                             
                                              e4 71 b4 27  d5 0b d9 01  00 10 00 00  00 00 00 00  .q.'............              206.1.1232                                             
                                              00 10 00 00  00 00 00 00  06 00 00 00  00 00 00 00  ................              206.1.1248                                             
                                              08 03 24 00  4d 00 46 00  54 00 4d 00  69 00 72 00  ..$.M.F.T.M.i.r.              206.1.1264                                             
                                              72 00 00 00  00 00 00 00  80 00 00 00  48 00 00 00  r...........H...              206.1.1280                                             
                                              01 00 40 00  00 00 01 00  00 00 00 00  00 00 00 00  ..@.............              206.1.1296                                             
                                              00 00 00 00  00 00 00 00  40 00 00 00  00 00 00 00  ........@.......              206.1.1312                                             
                                              00 10 00 00  00 00 00 00  00 10 00 00  00 00 00 00  ................              206.1.1328                                             
                                              00 10 00 00  00 00 00 00  11 01 02 00  00 00 00 00  ................              206.1.1344                                             
                                              ff ff ff ff  00 00 00 00  15 00 00 00  f4 33 3e 46  .............3>F              206.1.1360                                             
                                              f2 2a 36 3a  88 61 5b 76  e9 03 00 00  01 02 00 00  .*6:.a[v........              206.1.1376                                             
                                              00 00 00 05  20 00 00 00  20 02 00 00  00 00 00 00  .... ... .......              206.1.1392                                             
                                              80 00 00 00  48 00 00 00  01 00 40 00  00 00 01 00  ....H.....@.....              206.1.1408                                             
                                              00 00 00 00  00 00 00 00  00 00 00 00  00 00 00 00  ................              206.1.1424                                             
                                              40 00 00 00  00 00 00 00  00 10 00 00  00 00 00 00  @...............              206.1.1440                                             
                                              00 10 00 00  00 00 00 00  00 10 00 00  00 00 00 00  ................              206.1.1456                                             
                                              11 01 02 00  00 00 00 00  ff ff ff ff  00 00 00 00  ................              206.1.1472                                             
                                              00 00 00 00  00 00 00 00  00 00 00 00  00 00 00 00  ................              206.1.1488                                             
                                              00 00 00 00  00 00 00 00  00 00 00 00  00 00 00 00  ................              206.1.1504                                             
                                              00 00 00 00  00 00 00 00  00 00 00 00  00 00 05 00  ................              206.1.1520                                             
                                              00 00 00 00  00 00 00 00  00 00 00 00  00 00 00 00  ................              206.1.1536                                             
                                              00 00 00 00  00 00 00 00  00 00 00 00  00 00 00 00  ................              206.1.1552                                             
                                              00 00 00 00  00 00 00 00  00 00 00 00  00 00 00 00  ................              206.1.1568                                             
                                              00 00 00 00  00 00 00 00  00 00 00 00  00 00 00 00  ................              206.1.1584                                             
                                              00 00 00 00  00 00 00 00  00 00 00 00  00 00 00 00  ................              206.1.1600                                             
                                              00 00 00 00  00 00 00 00  00 00 00 00  00 00 00 00  ................              206.1.1616                                             
                                              00 00 00 00  00 00 00 00  00 00 00 00  00 00 00 00  ................              206.1.1632                                             
                                              00 00 00 00  00 00 00 00  00 00 00 00  00 00 00 00  ................              206.1.1648                                             
                                              00 00 00 00  00 00 00 00  00 00 00 00  00 00 00 00  ................              206.1.1664                                             
                                              00 00 00 00  00 00 00 00  00 00 00 00  00 00 00 00  ................              206.1.1680                                             
                                              00 00 00 00  00 00 00 00  00 00 00 00  00 00 00 00  ................              206.1.1696                                             
                                              00 00 00 00  00 00 00 00  00 00 00 00  00 00 00 00  ................              206.1.1712                                             
                                              00 00 00 00  00 00 00 00  00 00 00 00  00 00 00 00  ................              206.1.1728                                             
                                              00 00 00 00  00 00 00 00  00 00 00 00  00 00 00 00  ................              206.1.1744                                             
                                              00 00 00 00  00 00 00 00  00 00 00 00  00 00 00 00  ................              206.1.1760                                             
                                              00 00 00 00  00 00 00 00  00 00 00 00  00 00 00 00  ................              206.1.1776                                             
                                              00 00 00 00  00 00 00 00  00 00 00 00  00 00 00 00  ................              206.1.1792                                             
                                              00 00 00 00  00 00 00 00  00 00 00 00  00 00 00 00  ................              206.1.1808                                             
                                              00 00 00 00  00 00 00 00  00 00 00 00  00 00 00 00  ................              206.1.1824                                             
                                              00 00 00 00  00 00 00 00  00 00 00 00  00 00 00 00  ................              206.1.1840                                             
                                              00 00 00 00  00 00 00 00  00 00 00 00  00 00 00 00  ................              206.1.1856                                             
                                              00 00 00 00  00 00 00 00  00 00 00 00  00 00 00 00  ................              206.1.1872                                             
                                              00 00 00 00  00 00 00 00  00 00 00 00  00 00 00 00  ................              206.1.1888                                             
                                              00 00 00 00  00 00 00 00  00 00 00 00  00 00 00 00  ................              206.1.1904                                             
                                              00 00 00 00  00 00 00 00  00 00 00 00  00 00 00 00  ................              206.1.1920                                             
                                              00 00 00 00  00 00 00 00  00 00 00 00  00 00 00 00  ................              206.1.1936                                             
                                              00 00 00 00  00 00 00 00  00 00 00 00  00 00 00 00  ................              206.1.1952                                             
                                              00 00 00 00  00 00 00 00  00 00 00 00  00 00 00 00  ................              206.1.1968                                             
                                              00 00 00 00  00 00 00 00  00 00 00 00  00 00 00 00  ................              206.1.1984                                             
                                              00 00 00 00  00 00 00 00  00 00 00 00  00 00 00 00  ................              206.1.2000                                             
                                              00 00 00 00  00 00 00 00  00 00 00 00  00 00 00 00  ................              206.1.2016                                             
                                              00 00 00 00  00 00 00 00  00 00 00 00  00 00 05 00  ................              206.1.2032                                             
                                              46 49 4c 45  30 00 03 00  f3 15 00 01  00 00 00 00  FILE0...........              206.1.2048                                             
                                              02 00 01 00  38 00 01 00  58 01 00 00  00 04 00 00  ....8...X.......              206.1.2064                                             
                                              00 00 00 00  00 00 00 00  04 00 00 00  02 00 00 00  ................              206.1.2080                                             
                                              05 00 00 00  00 00 00 00  10 00 00 00  60 00 00 00  ............`...              206.1.2096                                             
                                              00 00 18 00  00 00 00 00  48 00 00 00  18 00 00 00  ........H.......              206.1.2112                                             
                                              e4 71 b4 27  d5 0b d9 01  e4 71 b4 27  d5 0b d9 01  .q.'.....q.'....              206.1.2128                                             
                                              e4 71 b4 27  d5 0b d9 01  e4 71 b4 27  d5 0b d9 01  .q.'.....q.'....              206.1.2144                                             
                                              06 00 00 00  00 00 00 00  00 00 00 00  00 00 00 00  ................              206.1.2160                                             
                                              00 00 00 00  00 01 00 00  00 00 00 00  00 00 00 00  ................              206.1.2176                                             
                                              00 00 00 00  00 00 00 00  30 00 00 00  70 00 00 00  ........0...p...              206.1.2192                                             
                                              00 00 18 00  00 00 02 00  52 00 00 00  18 00 01 00  ........R.......              206.1.2208                                             
                                              05 00 00 00  00 00 05 00  e4 71 b4 27  d5 0b d9 01  .........q.'....              206.1.2224                                             
                                              e4 71 b4 27  d5 0b d9 01  e4 71 b4 27  d5 0b d9 01  .q.'.....q.'....              206.1.2240                                             
                                              e4 71 b4 27  d5 0b d9 01  00 40 86 02  00 00 00 00  .q.'.....@......              206.1.2256                                             
                                              00 40 86 02  00 00 00 00  06 00 00 00  00 00 00 00  .@..............              206.1.2272                                             
                                              08 03 24 00  4c 00 6f 00  67 00 46 00  69 00 6c 00  ..$.L.o.g.F.i.l.              206.1.2288                                             
                                              65 00 00 00  00 00 00 00  80 00 00 00  48 00 00 00  e...........H...              206.1.2304                                             
                                              01 00 40 00  00 00 01 00  00 00 00 00  00 00 00 00  ..@.............              206.1.2320                                             
                                              63 28 00 00  00 00 00 00  40 00 00 00  00 00 00 00  c(......@.......              206.1.2336                                             
                                              00 40 86 02  00 00 00 00  00 40 86 02  00 00 00 00  .@.......@......              206.1.2352                                             
                                              00 40 86 02  00 00 00 00  32 64 28 b4  d6 0b 00 00  .@......2d(.....              206.1.2368                                             
                                              ff ff ff ff  00 00 00 00  15 00 00 00  f4 33 3e 46  .............3>F              206.1.2384                                             
                                              f2 2a 36 3a  88 61 5b 76  e9 03 00 00  01 02 00 00  .*6:.a[v........              206.1.2400                                             
                                              00 00 00 05  20 00 00 00  20 02 00 00  00 00 00 00  .... ... .......              206.1.2416                                             
                                              80 00 00 00  48 00 00 00  01 00 40 00  00 00 01 00  ....H.....@.....              206.1.2432                                             
                                              00 00 00 00  00 00 00 00  63 28 00 00  00 00 00 00  ........c(......              206.1.2448                                             
                                              40 00 00 00  00 00 00 00  00 40 86 02  00 00 00 00  @........@......              206.1.2464                                             
                                              00 40 86 02  00 00 00 00  00 40 86 02  00 00 00 00  .@.......@......              206.1.2480                                             
                                              32 64 28 b4  d6 0b 00 00  ff ff ff ff  00 00 00 00  2d(.............              206.1.2496                                             
                                              00 00 00 00  00 00 00 00  00 00 00 00  00 00 00 00  ................              206.1.2512                                             
                                              00 00 00 00  00 00 00 00  00 00 00 00  00 00 00 00  ................              206.1.2528                                             
                                              00 00 00 00  00 00 00 00  00 00 00 00  00 00 05 00  ................              206.1.2544                                             
                                              00 00 00 00  00 00 00 00  00 00 00 00  00 00 00 00  ................              206.1.2560                                             
                                              00 00 00 00  00 00 00 00  00 00 00 00  00 00 00 00  ................              206.1.2576                                             
                                              00 00 00 00  00 00 00 00  00 00 00 00  00 00 00 00  ................              206.1.2592                                             
                                              00 00 00 00  00 00 00 00  00 00 00 00  00 00 00 00  ................              206.1.2608                                             
                                              00 00 00 00  00 00 00 00  00 00 00 00  00 00 00 00  ................              206.1.2624                                             
                                              00 00 00 00  00 00 00 00  00 00 00 00  00 00 00 00  ................              206.1.2640                                             
                                              00 00 00 00  00 00 00 00  00 00 00 00  00 00 00 00  ................              206.1.2656                                             
                                              00 00 00 00  00 00 00 00  00 00 00 00  00 00 00 00  ................              206.1.2672                                             
                                              00 00 00 00  00 00 00 00  00 00 00 00  00 00 00 00  ................              206.1.2688                                             
                                              00 00 00 00  00 00 00 00  00 00 00 00  00 00 00 00  ................              206.1.2704                                             
                                              00 00 00 00  00 00 00 00  00 00 00 00  00 00 00 00  ................              206.1.2720                                             
                                              00 00 00 00  00 00 00 00  00 00 00 00  00 00 00 00  ................              206.1.2736                                             
                                              00 00 00 00  00 00 00 00  00 00 00 00  00 00 00 00  ................              206.1.2752                                             
                                              00 00 00 00  00 00 00 00  00 00 00 00  00 00 00 00  ................              206.1.2768                                             
                                              00 00 00 00  00 00 00 00  00 00 00 00  00 00 00 00  ................              206.1.2784                                             
                                              00 00 00 00  00 00 00 00  00 00 00 00  00 00 00 00  ................              206.1.2800                                             
                                              00 00 00 00  00 00 00 00  00 00 00 00  00 00 00 00  ................              206.1.2816                                             
                                              00 00 00 00  00 00 00 00  00 00 00 00  00 00 00 00  ................              206.1.2832                                             
                                              00 00 00 00  00 00 00 00  00 00 00 00  00 00 00 00  ................              206.1.2848                                             
                                              00 00 00 00  00 00 00 00  00 00 00 00  00 00 00 00  ................              206.1.2864                                             
                                              00 00 00 00  00 00 00 00  00 00 00 00  00 00 00 00  ................              206.1.2880                                             
                                              00 00 00 00  00 00 00 00  00 00 00 00  00 00 00 00  ................              206.1.2896                                             
                                              00 00 00 00  00 00 00 00  00 00 00 00  00 00 00 00  ................              206.1.2912                                             
                                              00 00 00 00  00 00 00 00  00 00 00 00  00 00 00 00  ................              206.1.2928                                             
                                              00 00 00 00  00 00 00 00  00 00 00 00  00 00 00 00  ................              206.1.2944                                             
                                              00 00 00 00  00 00 00 00  00 00 00 00  00 00 00 00  ................              206.1.2960                                             
                                              00 00 00 00  00 00 00 00  00 00 00 00  00 00 00 00  ................              206.1.2976                                             
                                              00 00 00 00  00 00 00 00  00 00 00 00  00 00 00 00  ................              206.1.2992                                             
                                              00 00 00 00  00 00 00 00  00 00 00 00  00 00 00 00  ................              206.1.3008                                             
                                              00 00 00 00  00 00 00 00  00 00 00 00  00 00 00 00  ................              206.1.3024                                             
                                              00 00 00 00  00 00 00 00  00 00 00 00  00 00 00 00  ................              206.1.3040                                             
                                              00 00 00 00  00 00 00 00  00 00 00 00  00 00 05 00  ................              206.1.3056                                             
                                              46 49 4c 45  30 00 03 00  61 08 00 01  00 00 00 00  FILE0...a.......              206.1.3072                                             
                                              03 00 01 00  38 00 01 00  70 01 00 00  00 04 00 00  ....8...p.......              206.1.3088                                             
                                              00 00 00 00  00 00 00 00  06 00 00 00  03 00 00 00  ................              206.1.3104                                             
                                              05 00 00 00  00 00 00 00  10 00 00 00  60 00 00 00  ............`...              206.1.3120                                             
                                              00 00 18 00  00 00 00 00  48 00 00 00  18 00 00 00  ........H.......              206.1.3136                                             
                                              e4 71 b4 27  d5 0b d9 01  e4 71 b4 27  d5 0b d9 01  .q.'.....q.'....              206.1.3152                                             
                                              e4 71 b4 27  d5 0b d9 01  e4 71 b4 27  d5 0b d9 01  .q.'.....q.'....              206.1.3168                                             
                                              06 00 00 00  00 00 00 00  00 00 00 00  00 00 00 00  ................              206.1.3184                                             
  31.1                             13  IN     55 53 42 53  00 a5 72 7d  00 00 00 00  00           USBS..r......     311us       207.1.0        2024/08/22  10:20:41.544  classpnp      
  32                             4096  IN     46 49 4c 45  30 00 03 00  63 15 00 01  00 00 00 00  FILE0...c.......    4us       204.2.0        2024/08/22  10:20:41.544                
                                              01 00 01 00  38 00 01 00  a0 01 00 00  00 04 00 00  ....8...........              204.2.16                                               
                                              00 00 00 00  00 00 00 00  07 00 00 00  00 00 00 00  ................              204.2.32                                               
                                              05 00 00 00  00 00 00 00  10 00 00 00  60 00 00 00  ............`...              204.2.48                                               
                                              00 00 18 00  00 00 00 00  48 00 00 00  18 00 00 00  ........H.......              204.2.64                                               
                                              e4 71 b4 27  d5 0b d9 01  e4 71 b4 27  d5 0b d9 01  .q.'.....q.'....              204.2.80                                               
                                              e4 71 b4 27  d5 0b d9 01  e4 71 b4 27  d5 0b d9 01  .q.'.....q.'....              204.2.96                                               
                                              06 00 00 00  00 00 00 00  00 00 00 00  00 00 00 00  ................              204.2.112                                              
                                              00 00 00 00  00 01 00 00  00 00 00 00  00 00 00 00  ................              204.2.128                                              
                                              00 00 00 00  00 00 00 00  30 00 00 00  68 00 00 00  ........0...h...              204.2.144                                              
                                              00 00 18 00  00 00 03 00  4a 00 00 00  18 00 01 00  ........J.......              204.2.160                                              
                                              05 00 00 00  00 00 05 00  e4 71 b4 27  d5 0b d9 01  .........q.'....              204.2.176                                              
                                              e4 71 b4 27  d5 0b d9 01  e4 71 b4 27  d5 0b d9 01  .q.'.....q.'....              204.2.192                                              
                                              e4 71 b4 27  d5 0b d9 01  00 40 00 00  00 00 00 00  .q.'.....@......              204.2.208                                              
                                              00 40 00 00  00 00 00 00  06 00 00 00  00 00 00 00  .@..............              204.2.224                                              
                                              04 03 24 00  4d 00 46 00  54 00 00 00  00 00 00 00  ..$.M.F.T.......              204.2.240                                              
                                              80 00 00 00  48 00 00 00  01 00 40 00  00 00 06 00  ....H.....@.....              204.2.256                                              
                                              00 00 00 00  00 00 00 00  3f 00 00 00  00 00 00 00  ........?.......              204.2.272                                              
                                              40 00 00 00  00 00 00 00  00 00 04 00  00 00 00 00  @...............              204.2.288                                              
                                              00 00 04 00  00 00 00 00  00 00 04 00  00 00 00 00  ................              204.2.304                                              
                                              31 40 00 00  0c 00 00 00  b0 00 00 00  50 00 00 00  1@..........P...              204.2.320                                              
                                              01 00 40 00  00 00 05 00  00 00 00 00  00 00 00 00  ..@.............              204.2.336                                              
                                              01 00 00 00  00 00 00 00  40 00 00 00  00 00 00 00  ........@.......              204.2.352                                              
                                              00 20 00 00  00 00 00 00  08 10 00 00  00 00 00 00  . ..............              204.2.368                                              
                                              08 10 00 00  00 00 00 00  31 01 ff ff  0b 31 01 26  ........1....1.&              204.2.384                                              
                                              00 f4 00 00  00 00 00 00  ff ff ff ff  00 00 00 00  ................              204.2.400                                              
                                              00 00 04 00  00 00 00 00  00 00 04 00  00 00 00 00  ................              204.2.416                                              
                                              00 00 04 00  00 00 00 00  31 40 00 00  0c 00 00 00  ........1@......              204.2.432                                              
                                              b0 00 00 00  50 00 00 00  01 00 40 00  00 00 05 00  ....P.....@.....              204.2.448                                              
                                              00 00 00 00  00 00 00 00  01 00 00 00  00 00 00 00  ................              204.2.464                                              
                                              40 00 00 00  00 00 00 00  00 20 00 00  00 00 00 00  @........ ......              204.2.480                                              
                                              08 10 00 00  00 00 00 00  08 10 00 00  00 00 05 00  ................              204.2.496                                              
                                              31 01 ff ff  0b 31 01 26  00 f4 00 00  00 00 00 00  1....1.&........              204.2.512                                              
                                              ff ff ff ff  00 00 00 00  00 00 00 00  00 00 00 00  ................              204.2.528                                              
                                              00 00 00 00  00 00 00 00  00 00 00 00  00 00 00 00  ................              204.2.544                                              
                                              00 00 00 00  00 00 00 00  00 00 00 00  00 00 00 00  ................              204.2.560                                              
                                              00 00 00 00  00 00 00 00  00 00 00 00  00 00 00 00  ................              204.2.576                                              
                                              00 00 00 00  00 00 00 00  00 00 00 00  00 00 00 00  ................              204.2.592                                              
                                              00 00 00 00  00 00 00 00  00 00 00 00  00 00 00 00  ................              204.2.608                                              
                                              00 00 00 00  00 00 00 00  00 00 00 00  00 00 00 00  ................              204.2.624                                              
                                              00 00 00 00  00 00 00 00  00 00 00 00  00 00 00 00  ................              204.2.640                                              
                                              00 00 00 00  00 00 00 00  00 00 00 00  00 00 00 00  ................              204.2.656                                              
                                              00 00 00 00  00 00 00 00  00 00 00 00  00 00 00 00  ................              204.2.672                                              
                                              00 00 00 00  00 00 00 00  00 00 00 00  00 00 00 00  ................              204.2.688                                              
                                              00 00 00 00  00 00 00 00  00 00 00 00  00 00 00 00  ................              204.2.704                                              
                                              00 00 00 00  00 00 00 00  00 00 00 00  00 00 00 00  ................              204.2.720                                              
                                              00 00 00 00  00 00 00 00  00 00 00 00  00 00 00 00  ................              204.2.736                                              
                                              00 00 00 00  00 00 00 00  00 00 00 00  00 00 00 00  ................              204.2.752                                              
                                              00 00 00 00  00 00 00 00  00 00 00 00  00 00 00 00  ................              204.2.768                                              
                                              00 00 00 00  00 00 00 00  00 00 00 00  00 00 00 00  ................              204.2.784                                              
                                              00 00 00 00  00 00 00 00  00 00 00 00  00 00 00 00  ................              204.2.800                                              
                                              00 00 00 00  00 00 00 00  00 00 00 00  00 00 00 00  ................              204.2.816                                              
                                              00 00 00 00  00 00 00 00  00 00 00 00  00 00 00 00  ................              204.2.832                                              
                                              00 00 00 00  00 00 00 00  00 00 00 00  00 00 00 00  ................              204.2.848                                              
                                              00 00 00 00  00 00 00 00  00 00 00 00  00 00 00 00  ................              204.2.864                                              
                                              00 00 00 00  00 00 00 00  00 00 00 00  00 00 00 00  ................              204.2.880                                              
                                              00 00 00 00  00 00 00 00  00 00 00 00  00 00 00 00  ................              204.2.896                                              
                                              00 00 00 00  00 00 00 00  00 00 00 00  00 00 00 00  ................              204.2.912                                              
                                              00 00 00 00  00 00 00 00  00 00 00 00  00 00 00 00  ................              204.2.928                                              
                                              00 00 00 00  00 00 00 00  00 00 00 00  00 00 00 00  ................              204.2.944                                              
                                              00 00 00 00  00 00 00 00  00 00 00 00  00 00 00 00  ................              204.2.960                                              
                                              00 00 00 00  00 00 00 00  00 00 00 00  00 00 00 00  ................              204.2.976                                              
                                              00 00 00 00  00 00 00 00  00 00 00 00  00 00 00 00  ................              204.2.992                                              
                                              00 00 00 00  00 00 00 00  00 00 00 00  00 00 05 00  ................              204.2.1008                                             
                                              46 49 4c 45  30 00 03 00  ab 15 00 01  00 00 00 00  FILE0...........              204.2.1024                                             
                                              01 00 01 00  38 00 01 00  58 01 00 00  00 04 00 00  ....8...X.......              204.2.1040                                             
                                              00 00 00 00  00 00 00 00  04 00 00 00  01 00 00 00  ................              204.2.1056                                             
                                              05 00 00 00  00 00 00 00  10 00 00 00  60 00 00 00  ............`...              204.2.1072                                             
                                              00 00 18 00  00 00 00 00  48 00 00 00  18 00 00 00  ........H.......              204.2.1088                                             
                                              e4 71 b4 27  d5 0b d9 01  e4 71 b4 27  d5 0b d9 01  .q.'.....q.'....              204.2.1104                                             
                                              e4 71 b4 27  d5 0b d9 01  e4 71 b4 27  d5 0b d9 01  .q.'.....q.'....              204.2.1120                                             
                                              06 00 00 00  00 00 00 00  00 00 00 00  00 00 00 00  ................              204.2.1136                                             
                                              00 00 00 00  00 01 00 00  00 00 00 00  00 00 00 00  ................              204.2.1152                                             
                                              00 00 00 00  00 00 00 00  30 00 00 00  70 00 00 00  ........0...p...              204.2.1168                                             
                                              00 00 18 00  00 00 02 00  52 00 00 00  18 00 01 00  ........R.......              204.2.1184                                             
                                              05 00 00 00  00 00 05 00  e4 71 b4 27  d5 0b d9 01  .........q.'....              204.2.1200                                             
                                              e4 71 b4 27  d5 0b d9 01  e4 71 b4 27  d5 0b d9 01  .q.'.....q.'....              204.2.1216                                             
                                              e4 71 b4 27  d5 0b d9 01  00 10 00 00  00 00 00 00  .q.'............              204.2.1232                                             
                                              00 10 00 00  00 00 00 00  06 00 00 00  00 00 00 00  ................              204.2.1248                                             
                                              08 03 24 00  4d 00 46 00  54 00 4d 00  69 00 72 00  ..$.M.F.T.M.i.r.              204.2.1264                                             
                                              72 00 00 00  00 00 00 00  80 00 00 00  48 00 00 00  r...........H...              204.2.1280                                             
                                              01 00 40 00  00 00 01 00  00 00 00 00  00 00 00 00  ..@.............              204.2.1296                                             
                                              00 00 00 00  00 00 00 00  40 00 00 00  00 00 00 00  ........@.......              204.2.1312                                             
                                              00 10 00 00  00 00 00 00  00 10 00 00  00 00 00 00  ................              204.2.1328                                             
                                              00 10 00 00  00 00 00 00  11 01 02 00  00 00 00 00  ................              204.2.1344                                             
                                              ff ff ff ff  00 00 00 00  15 00 00 00  f4 33 3e 46  .............3>F              204.2.1360                                             
                                              f2 2a 36 3a  88 61 5b 76  e9 03 00 00  01 02 00 00  .*6:.a[v........              204.2.1376                                             
                                              00 00 00 05  20 00 00 00  20 02 00 00  00 00 00 00  .... ... .......              204.2.1392                                             
                                              80 00 00 00  48 00 00 00  01 00 40 00  00 00 01 00  ....H.....@.....              204.2.1408                                             
                                              00 00 00 00  00 00 00 00  00 00 00 00  00 00 00 00  ................              204.2.1424                                             
                                              40 00 00 00  00 00 00 00  00 10 00 00  00 00 00 00  @...............              204.2.1440                                             
                                              00 10 00 00  00 00 00 00  00 10 00 00  00 00 00 00  ................              204.2.1456                                             
                                              11 01 02 00  00 00 00 00  ff ff ff ff  00 00 00 00  ................              204.2.1472                                             
                                              00 00 00 00  00 00 00 00  00 00 00 00  00 00 00 00  ................              204.2.1488                                             
                                              00 00 00 00  00 00 00 00  00 00 00 00  00 00 00 00  ................              204.2.1504                                             
                                              00 00 00 00  00 00 00 00  00 00 00 00  00 00 05 00  ................              204.2.1520                                             
                                              00 00 00 00  00 00 00 00  00 00 00 00  00 00 00 00  ................              204.2.1536                                             
                                              00 00 00 00  00 00 00 00  00 00 00 00  00 00 00 00  ................              204.2.1552                                             
                                              00 00 00 00  00 00 00 00  00 00 00 00  00 00 00 00  ................              204.2.1568                                             
                                              00 00 00 00  00 00 00 00  00 00 00 00  00 00 00 00  ................              204.2.1584                                             
                                              00 00 00 00  00 00 00 00  00 00 00 00  00 00 00 00  ................              204.2.1600                                             
                                              00 00 00 00  00 00 00 00  00 00 00 00  00 00 00 00  ................              204.2.1616                                             
                                              00 00 00 00  00 00 00 00  00 00 00 00  00 00 00 00  ................              204.2.1632                                             
                                              00 00 00 00  00 00 00 00  00 00 00 00  00 00 00 00  ................              204.2.1648                                             
                                              00 00 00 00  00 00 00 00  00 00 00 00  00 00 00 00  ................              204.2.1664                                             
                                              00 00 00 00  00 00 00 00  00 00 00 00  00 00 00 00  ................              204.2.1680                                             
                                              00 00 00 00  00 00 00 00  00 00 00 00  00 00 00 00  ................              204.2.1696                                             
                                              00 00 00 00  00 00 00 00  00 00 00 00  00 00 00 00  ................              204.2.1712                                             
                                              00 00 00 00  00 00 00 00  00 00 00 00  00 00 00 00  ................              204.2.1728                                             
                                              00 00 00 00  00 00 00 00  00 00 00 00  00 00 00 00  ................              204.2.1744                                             
                                              00 00 00 00  00 00 00 00  00 00 00 00  00 00 00 00  ................              204.2.1760                                             
                                              00 00 00 00  00 00 00 00  00 00 00 00  00 00 00 00  ................              204.2.1776                                             
                                              00 00 00 00  00 00 00 00  00 00 00 00  00 00 00 00  ................              204.2.1792                                             
                                              00 00 00 00  00 00 00 00  00 00 00 00  00 00 00 00  ................              204.2.1808                                             
                                              00 00 00 00  00 00 00 00  00 00 00 00  00 00 00 00  ................              204.2.1824                                             
                                              00 00 00 00  00 00 00 00  00 00 00 00  00 00 00 00  ................              204.2.1840                                             
                                              00 00 00 00  00 00 00 00  00 00 00 00  00 00 00 00  ................              204.2.1856                                             
                                              00 00 00 00  00 00 00 00  00 00 00 00  00 00 00 00  ................              204.2.1872                                             
                                              00 00 00 00  00 00 00 00  00 00 00 00  00 00 00 00  ................              204.2.1888                                             
                                              00 00 00 00  00 00 00 00  00 00 00 00  00 00 00 00  ................              204.2.1904                                             
                                              00 00 00 00  00 00 00 00  00 00 00 00  00 00 00 00  ................              204.2.1920                                             
                                              00 00 00 00  00 00 00 00  00 00 00 00  00 00 00 00  ................              204.2.1936                                             
                                              00 00 00 00  00 00 00 00  00 00 00 00  00 00 00 00  ................              204.2.1952                                             
                                              00 00 00 00  00 00 00 00  00 00 00 00  00 00 00 00  ................              204.2.1968                                             
                                              00 00 00 00  00 00 00 00  00 00 00 00  00 00 00 00  ................              204.2.1984                                             
                                              00 00 00 00  00 00 00 00  00 00 00 00  00 00 00 00  ................              204.2.2000                                             
                                              00 00 00 00  00 00 00 00  00 00 00 00  00 00 00 00  ................              204.2.2016                                             
                                              00 00 00 00  00 00 00 00  00 00 00 00  00 00 05 00  ................              204.2.2032                                             
                                              46 49 4c 45  30 00 03 00  f3 15 00 01  00 00 00 00  FILE0...........              204.2.2048                                             
                                              02 00 01 00  38 00 01 00  58 01 00 00  00 04 00 00  ....8...X.......              204.2.2064                                             
                                              00 00 00 00  00 00 00 00  04 00 00 00  02 00 00 00  ................              204.2.2080                                             
                                              05 00 00 00  00 00 00 00  10 00 00 00  60 00 00 00  ............`...              204.2.2096                                             
                                              00 00 18 00  00 00 00 00  48 00 00 00  18 00 00 00  ........H.......              204.2.2112                                             
                                              e4 71 b4 27  d5 0b d9 01  e4 71 b4 27  d5 0b d9 01  .q.'.....q.'....              204.2.2128                                             
                                              e4 71 b4 27  d5 0b d9 01  e4 71 b4 27  d5 0b d9 01  .q.'.....q.'....              204.2.2144                                             
                                              06 00 00 00  00 00 00 00  00 00 00 00  00 00 00 00  ................              204.2.2160                                             
                                              00 00 00 00  00 01 00 00  00 00 00 00  00 00 00 00  ................              204.2.2176                                             
                                              00 00 00 00  00 00 00 00  30 00 00 00  70 00 00 00  ........0...p...              204.2.2192                                             
                                              00 00 18 00  00 00 02 00  52 00 00 00  18 00 01 00  ........R.......              204.2.2208                                             
                                              05 00 00 00  00 00 05 00  e4 71 b4 27  d5 0b d9 01  .........q.'....              204.2.2224                                             
                                              e4 71 b4 27  d5 0b d9 01  e4 71 b4 27  d5 0b d9 01  .q.'.....q.'....              204.2.2240                                             
                                              e4 71 b4 27  d5 0b d9 01  00 40 86 02  00 00 00 00  .q.'.....@......              204.2.2256                                             
                                              00 40 86 02  00 00 00 00  06 00 00 00  00 00 00 00  .@..............              204.2.2272                                             
                                              08 03 24 00  4c 00 6f 00  67 00 46 00  69 00 6c 00  ..$.L.o.g.F.i.l.              204.2.2288                                             
                                              65 00 00 00  00 00 00 00  80 00 00 00  48 00 00 00  e...........H...              204.2.2304                                             
                                              01 00 40 00  00 00 01 00  00 00 00 00  00 00 00 00  ..@.............              204.2.2320                                             
                                              63 28 00 00  00 00 00 00  40 00 00 00  00 00 00 00  c(......@.......              204.2.2336                                             
                                              00 40 86 02  00 00 00 00  00 40 86 02  00 00 00 00  .@.......@......              204.2.2352                                             
                                              00 40 86 02  00 00 00 00  32 64 28 b4  d6 0b 00 00  .@......2d(.....              204.2.2368                                             
                                              ff ff ff ff  00 00 00 00  15 00 00 00  f4 33 3e 46  .............3>F              204.2.2384                                             
                                              f2 2a 36 3a  88 61 5b 76  e9 03 00 00  01 02 00 00  .*6:.a[v........              204.2.2400                                             
                                              00 00 00 05  20 00 00 00  20 02 00 00  00 00 00 00  .... ... .......              204.2.2416                                             
                                              80 00 00 00  48 00 00 00  01 00 40 00  00 00 01 00  ....H.....@.....              204.2.2432                                             
                                              00 00 00 00  00 00 00 00  63 28 00 00  00 00 00 00  ........c(......              204.2.2448                                             
                                              40 00 00 00  00 00 00 00  00 40 86 02  00 00 00 00  @........@......              204.2.2464                                             
                                              00 40 86 02  00 00 00 00  00 40 86 02  00 00 00 00  .@.......@......              204.2.2480                                             
                                              32 64 28 b4  d6 0b 00 00  ff ff ff ff  00 00 00 00  2d(.............              204.2.2496                                             
                                              00 00 00 00  00 00 00 00  00 00 00 00  00 00 00 00  ................              204.2.2512                                             
                                              00 00 00 00  00 00 00 00  00 00 00 00  00 00 00 00  ................              204.2.2528                                             
                                              00 00 00 00  00 00 00 00  00 00 00 00  00 00 05 00  ................              204.2.2544                                             
                                              00 00 00 00  00 00 00 00  00 00 00 00  00 00 00 00  ................              204.2.2560                                             
                                              00 00 00 00  00 00 00 00  00 00 00 00  00 00 00 00  ................              204.2.2576                                             
                                              00 00 00 00  00 00 00 00  00 00 00 00  00 00 00 00  ................              204.2.2592                                             
                                              00 00 00 00  00 00 00 00  00 00 00 00  00 00 00 00  ................              204.2.2608                                             
                                              00 00 00 00  00 00 00 00  00 00 00 00  00 00 00 00  ................              204.2.2624                                             
                                              00 00 00 00  00 00 00 00  00 00 00 00  00 00 00 00  ................              204.2.2640                                             
                                              00 00 00 00  00 00 00 00  00 00 00 00  00 00 00 00  ................              204.2.2656                                             
                                              00 00 00 00  00 00 00 00  00 00 00 00  00 00 00 00  ................              204.2.2672                                             
                                              00 00 00 00  00 00 00 00  00 00 00 00  00 00 00 00  ................              204.2.2688                                             
                                              00 00 00 00  00 00 00 00  00 00 00 00  00 00 00 00  ................              204.2.2704                                             
                                              00 00 00 00  00 00 00 00  00 00 00 00  00 00 00 00  ................              204.2.2720                                             
                                              00 00 00 00  00 00 00 00  00 00 00 00  00 00 00 00  ................              204.2.2736                                             
                                              00 00 00 00  00 00 00 00  00 00 00 00  00 00 00 00  ................              204.2.2752                                             
                                              00 00 00 00  00 00 00 00  00 00 00 00  00 00 00 00  ................              204.2.2768                                             
                                              00 00 00 00  00 00 00 00  00 00 00 00  00 00 00 00  ................              204.2.2784                                             
                                              00 00 00 00  00 00 00 00  00 00 00 00  00 00 00 00  ................              204.2.2800                                             
                                              00 00 00 00  00 00 00 00  00 00 00 00  00 00 00 00  ................              204.2.2816                                             
                                              00 00 00 00  00 00 00 00  00 00 00 00  00 00 00 00  ................              204.2.2832                                             
                                              00 00 00 00  00 00 00 00  00 00 00 00  00 00 00 00  ................              204.2.2848                                             
                                              00 00 00 00  00 00 00 00  00 00 00 00  00 00 00 00  ................              204.2.2864                                             
                                              00 00 00 00  00 00 00 00  00 00 00 00  00 00 00 00  ................              204.2.2880                                             
                                              00 00 00 00  00 00 00 00  00 00 00 00  00 00 00 00  ................              204.2.2896                                             
                                              00 00 00 00  00 00 00 00  00 00 00 00  00 00 00 00  ................              204.2.2912                                             
                                              00 00 00 00  00 00 00 00  00 00 00 00  00 00 00 00  ................              204.2.2928                                             
                                              00 00 00 00  00 00 00 00  00 00 00 00  00 00 00 00  ................              204.2.2944                                             
                                              00 00 00 00  00 00 00 00  00 00 00 00  00 00 00 00  ................              204.2.2960                                             
                                              00 00 00 00  00 00 00 00  00 00 00 00  00 00 00 00  ................              204.2.2976                                             
                                              00 00 00 00  00 00 00 00  00 00 00 00  00 00 00 00  ................              204.2.2992                                             
                                              00 00 00 00  00 00 00 00  00 00 00 00  00 00 00 00  ................              204.2.3008                                             
                                              00 00 00 00  00 00 00 00  00 00 00 00  00 00 00 00  ................              204.2.3024                                             
                                              00 00 00 00  00 00 00 00  00 00 00 00  00 00 00 00  ................              204.2.3040                                             
                                              00 00 00 00  00 00 00 00  00 00 00 00  00 00 05 00  ................              204.2.3056                                             
                                              46 49 4c 45  30 00 03 00  61 08 00 01  00 00 00 00  FILE0...a.......              204.2.3072                                             
                                              03 00 01 00  38 00 01 00  70 01 00 00  00 04 00 00  ....8...p.......              204.2.3088                                             
                                              00 00 00 00  00 00 00 00  06 00 00 00  03 00 00 00  ................              204.2.3104                                             
                                              05 00 00 00  00 00 00 00  10 00 00 00  60 00 00 00  ............`...              204.2.3120                                             
                                              00 00 18 00  00 00 00 00  48 00 00 00  18 00 00 00  ........H.......              204.2.3136                                             
                                              e4 71 b4 27  d5 0b d9 01  e4 71 b4 27  d5 0b d9 01  .q.'.....q.'....              204.2.3152                                             
                                              e4 71 b4 27  d5 0b d9 01  e4 71 b4 27  d5 0b d9 01  .q.'.....q.'....              204.2.3168                                             
                                              06 00 00 00  00 00 00 00  00 00 00 00  00 00 00 00  ................              204.2.3184                                             
  32                                   CMD    28 00 00 5e  bd a0 00 00  08 00                     READ               79us       208.1.0        2024/08/22  10:20:41.544  classpnp      
  31.2                             31  OUT    55 53 42 43  00 a5 72 7d  00 10 00 00  80 00 0a 28  USBC..r........(  381us       209.1.0        2024/08/22  10:20:41.545  classpnp      
                                              00 00 5e bd  a0 00 00 08  00 00 00 00  00 00 00     ..^............               209.1.16                                               
