root@android:/ # cat /sys/kernel/debug/usb/usbmon/2u | grep "025:"
d84a1e00 1616257513 S Ci:2:025:0 s 80 06 0100 0000 0012 18 <
d84a1e00 1616257711 C Ci:2:025:0 0 18 = 12010002 00000040 cd148a16 01000103 0201
d84a1e00 1616257739 S Ci:2:025:0 s 80 06 0200 0000 0009 9 <
d84a1e00 1616257946 C Ci:2:025:0 0 9 = 09022000 010100c0 c8
d84a1e00 1616257963 S Ci:2:025:0 s 80 06 0200 0000 0020 32 <
d84a1e00 1616258130 C Ci:2:025:0 0 32 = 09022000 010100c0 c8090400 00020806 50000705 81020002 00070502 02000200
d84a1e00 1616258152 S Ci:2:025:0 s 80 06 0300 0000 00ff 255 <
d84a1e00 1616258317 C Ci:2:025:0 0 4 = 04030904
d84a1e00 1616258331 S Ci:2:025:0 s 80 06 0303 0409 00ff 255 <
d84a1e00 1616258506 C Ci:2:025:0 0 48 = 30035500 53004200 20004d00 61007300 73002000 53007400 6f007200 61006700
d84a1e00 1616258525 S Ci:2:025:0 s 80 06 0301 0409 00ff 255 <
d84a1e00 1616258716 C Ci:2:025:0 0 26 = 1a035500 53004200 20004400 65007600 69006300 65002000 2000
d84a1e00 1616258746 S Ci:2:025:0 s 80 06 0302 0409 00ff 255 <
d84a1e00 1616258962 C Ci:2:025:0 0 26 = 1a033800 31003600 38003200 30003100 33003000 38003000 3600
d84a1e00 1616259475 S Co:2:025:0 s 00 09 0001 0000 0000 0
d84a1e00 1616259673 C Co:2:025:0 0 0
d1045a80 1617354118 S Bo:2:025:2 -115 31 = 55534243 00000000 08000000 80000a25 00000000 00000000 00000000 000000
d1045a80 1617354280 C Bo:2:025:2 0 31 >
d1045a80 1617354361 S Bi:2:025:1 -115 8 <
d1045a80 1617354542 C Bi:2:025:1 0 8 = 0072fcbf 00000200
d8b32180 1617356371 S Bi:2:025:1 -115 13 <
d8b32180 1617356541 C Bi:2:025:1 0 13 = 55534253 00000000 00000000 00
d8b32180 1617356725 S Bo:2:025:2 -115 31 = 55534243 01000000 00020000 80000a28 00000000 00000001 00000000 000000
d8b32180 1617356898 C Bo:2:025:2 0 31 >
d8b32180 1617356967 S Bi:2:025:1 -115 512 <
d8b32180 1617358292 C Bi:2:025:1 0 512 = faeb7c6c 62614c49 4c4f0100 15045a00 00000000 61df2344 e849c000 01e949c0
d8b32180 1617358405 S Bi:2:025:1 -115 13 <
d8b32180 1617358531 C Bi:2:025:1 0 13 = 55534253 01000000 00000000 00
d8b32180 1617358679 S Bo:2:025:2 -115 31 = 55534243 02000000 00020000 80000a28 00000000 00000001 00000000 000000
d8b32180 1617358774 C Bo:2:025:2 0 31 >
d8b32180 1617358830 S Bi:2:025:1 -115 512 <
d8b32180 1617358905 C Bi:2:025:1 0 512 = faeb7c6c 62614c49 4c4f0100 15045a00 00000000 61df2344 e849c000 01e949c0
d8b32180 1617358954 S Bi:2:025:1 -115 13 <
d8b32180 1617359030 C Bi:2:025:1 0 13 = 55534253 02000000 00000000 00
d8b32180 1617359106 S Bo:2:025:2 -115 31 = 55534243 03000000 00020000 80000a28 00000000 80000001 00000000 000000
d8b32180 1617359275 C Bo:2:025:2 0 31 >
d8b32180 1617359411 S Bi:2:025:1 -115 512 <
d8b32180 1617359752 C Bi:2:025:1 0 512 = eb58904d 53444f53 352e3000 0208a606 02000000 00f80000 3f00ff00 80000000
d8b32180 1617359826 S Bi:2:025:1 -115 13 <
d8b32180 1617359899 C Bi:2:025:1 0 13 = 55534253 03000000 00000000 00
d8b32180 1617360020 S Bo:2:025:2 -115 31 = 55534243 04000000 00200000 80000a28 00000000 80000010 00000000 000000
d8b32180 1617360151 C Bo:2:025:2 0 31 >
d8b32180 1617360221 S Bi:2:025:1 -115 8192 <
d8b32180 1617360604 C Bi:2:025:1 0 8192 = eb58904d 53444f53 352e3000 0208a606 02000000 00f80000 3f00ff00 80000000
d8b32180 1617360683 S Bi:2:025:1 -115 13 <
d8b32180 1617360784 C Bi:2:025:1 0 13 = 55534253 04000000 00000000 00
d8b32180 1617361150 S Bo:2:025:2 -115 31 = 55534243 05000000 00400000 80000a28 00000007 26000020 00000000 000000
d8b32180 1617361289 C Bo:2:025:2 0 31 >
d8b32180 1617361389 S Bi:2:025:1 -115 16384 <
d8b32180 1617362276 C Bi:2:025:1 0 16384 = f8ffff0f ffffffff ffffff0f ffffff0f ffffff0f ffffff0f ffffff0f ffffff0f
d8b32180 1617362389 S Bi:2:025:1 -115 13 <
d8b32180 1617362526 C Bi:2:025:1 0 13 = 55534253 05000000 00000000 00
d8b32180 1617362692 S Bo:2:025:2 -115 31 = 55534243 06000000 00400000 80000a28 00000007 46000020 00000000 000000
d8b32180 1617362782 C Bo:2:025:2 0 31 >
d8b32180 1617362850 S Bi:2:025:1 -115 16384 <
d8b32180 1617363396 C Bi:2:025:1 0 16384 = 00000000 00000000 00000000 00000000 00000000 00000000 00000000 00000000
d8b32300 1617363524 S Bi:2:025:1 -115 13 <
d8b32300 1617363682 C Bi:2:025:1 0 13 = 55534253 06000000 00000000 00
d8b32b00 1617363840 S Bo:2:025:2 -115 31 = 55534243 07000000 00400000 80000a28 00000007 66000020 00000000 000000
d8b32b00 1617363894 C Bo:2:025:2 0 31 >
d8b32b00 1617363959 S Bi:2:025:1 -115 16384 <
d8b32b00 1617364496 C Bi:2:025:1 0 16384 = 00000000 00000000 00000000 00000000 00000000 00000000 00000000 00000000
d8b32b00 1617364599 S Bi:2:025:1 -115 13 <
d8b32b00 1617364656 C Bi:2:025:1 0 13 = 55534253 07000000 00000000 00
d8b32b00 1617364794 S Bo:2:025:2 -115 31 = 55534243 08000000 00400000 80000a28 00000007 86000020 00000000 000000
d8b32b00 1617364894 C Bo:2:025:2 0 31 >
d8b32b00 1617364959 S Bi:2:025:1 -115 16384 <
d8b32b00 1617365512 C Bi:2:025:1 0 16384 = 00000000 00000000 00000000 00000000 00000000 00000000 00000000 00000000
d8b32b00 1617365626 S Bi:2:025:1 -115 13 <
d8b32b00 1617365701 C Bi:2:025:1 0 13 = 55534253 08000000 00000000 00
d8b32b00 1617365897 S Bo:2:025:2 -115 31 = 55534243 09000000 00400000 80000a28 00000007 a6000020 00000000 000000
d8b32b00 1617366024 C Bo:2:025:2 0 31 >
d8b32b00 1617366098 S Bi:2:025:1 -115 16384 <
d8b32b00 1617366685 C Bi:2:025:1 0 16384 = 00000000 00000000 00000000 00000000 00000000 00000000 00000000 00000000
d8b32b00 1617366796 S Bi:2:025:1 -115 13 <
d8b32b00 1617366897 C Bi:2:025:1 0 13 = 55534253 09000000 00000000 00
d8b32b00 1617367114 S Bo:2:025:2 -115 31 = 55534243 0a000000 00400000 80000a28 00000007 c6000020 00000000 000000
d8b32b00 1617367273 C Bo:2:025:2 0 31 >
d8b32b00 1617367435 S Bi:2:025:1 -115 16384 <
d8b32b00 1617367947 C Bi:2:025:1 0 16384 = 00000000 00000000 00000000 00000000 00000000 00000000 00000000 00000000
d8b32b00 1617368047 S Bi:2:025:1 -115 13 <
d8b32b00 1617368150 C Bi:2:025:1 0 13 = 55534253 0a000000 00000000 00
d8b32b00 1617368326 S Bo:2:025:2 -115 31 = 55534243 0b000000 00400000 80000a28 00000007 e6000020 00000000 000000
d8b32b00 1617368401 C Bo:2:025:2 0 31 >
d8b32b00 1617368480 S Bi:2:025:1 -115 16384 <
d8b32b00 1617369009 C Bi:2:025:1 0 16384 = 00000000 00000000 00000000 00000000 00000000 00000000 00000000 00000000
d8b32b00 1617369141 S Bi:2:025:1 -115 13 <
d8b32b00 1617369266 C Bi:2:025:1 0 13 = 55534253 0b000000 00000000 00
d8b32b00 1617369557 S Bo:2:025:2 -115 31 = 55534243 0c000000 00400000 80000a28 00000008 06000020 00000000 000000
d8b32b00 1617369649 C Bo:2:025:2 0 31 >
d8b32b00 1617369754 S Bi:2:025:1 -115 16384 <
d8b32b00 1617370303 C Bi:2:025:1 0 16384 = 00000000 00000000 00000000 00000000 00000000 00000000 00000000 00000000
d84a1200 1617370457 S Bi:2:025:1 -115 13 <
d84a1200 1617370552 C Bi:2:025:1 0 13 = 55534253 0c000000 00000000 00
d84a1800 1617370705 S Bo:2:025:2 -115 31 = 55534243 0d000000 00400000 80000a28 00000008 26000020 00000000 000000
d84a1800 1617370778 C Bo:2:025:2 0 31 >
d84a1e00 1617370917 S Bi:2:025:1 -115 16384 <
d84a1e00 1617371414 C Bi:2:025:1 0 16384 = 00000000 00000000 00000000 00000000 00000000 00000000 00000000 00000000
d84a1d80 1617371584 S Bi:2:025:1 -115 13 <
d84a1d80 1617371657 C Bi:2:025:1 0 13 = 55534253 0d000000 00000000 00
d84a1d00 1617371870 S Bo:2:025:2 -115 31 = 55534243 0e000000 00400000 80000a28 00000008 46000020 00000000 000000
d84a1d00 1617372046 C Bo:2:025:2 0 31 >
d84a1880 1617372461 S Bi:2:025:1 -115 16384 <
d84a1880 1617373009 C Bi:2:025:1 0 16384 = 00000000 00000000 00000000 00000000 00000000 00000000 00000000 00000000
d84a1f00 1617373210 S Bi:2:025:1 -115 13 <
d84a1f00 1617373280 C Bi:2:025:1 0 13 = 55534253 0e000000 00000000 00
d84a1700 1617373451 S Bo:2:025:2 -115 31 = 55534243 0f000000 00400000 80000a28 00000008 66000020 00000000 000000
d84a1700 1617373527 C Bo:2:025:2 0 31 >
d8b32b00 1617373602 S Bi:2:025:1 -115 16384 <
d8b32b00 1617374123 C Bi:2:025:1 0 16384 = 00000000 00000000 00000000 00000000 00000000 00000000 00000000 00000000
d8b32b00 1617374275 S Bi:2:025:1 -115 13 <
d8b32b00 1617374403 C Bi:2:025:1 0 13 = 55534253 0f000000 00000000 00
d8b32b00 1617374605 S Bo:2:025:2 -115 31 = 55534243 10000000 00400000 80000a28 00000008 86000020 00000000 000000
d8b32b00 1617374783 C Bo:2:025:2 0 31 >
d8b32b00 1617374884 S Bi:2:025:1 -115 16384 <
d8b32b00 1617375445 C Bi:2:025:1 0 16384 = 00000000 00000000 00000000 00000000 00000000 00000000 00000000 00000000
d8b32b00 1617375563 S Bi:2:025:1 -115 13 <
d8b32b00 1617375651 C Bi:2:025:1 0 13 = 55534253 10000000 00000000 00
d8b32b00 1617375883 S Bo:2:025:2 -115 31 = 55534243 11000000 00400000 80000a28 00000008 a6000020 00000000 000000
d8b32b00 1617376045 C Bo:2:025:2 0 31 >
d8b32b00 1617376126 S Bi:2:025:1 -115 16384 <
d8b32b00 1617376716 C Bi:2:025:1 0 16384 = 00000000 00000000 00000000 00000000 00000000 00000000 00000000 00000000
d8b32b00 1617376826 S Bi:2:025:1 -115 13 <
d8b32b00 1617376898 C Bi:2:025:1 0 13 = 55534253 11000000 00000000 00
d8b32b00 1617377054 S Bo:2:025:2 -115 31 = 55534243 12000000 00400000 80000a28 00000008 c6000020 00000000 000000
d8b32b00 1617377153 C Bo:2:025:2 0 31 >
d8b32680 1617377227 S Bi:2:025:1 -115 16384 <
d8b32680 1617377820 C Bi:2:025:1 0 16384 = 00000000 00000000 00000000 00000000 00000000 00000000 00000000 00000000
d84a1100 1617377942 S Bi:2:025:1 -115 13 <
d84a1100 1617378041 C Bi:2:025:1 0 13 = 55534253 12000000 00000000 00
d8b32000 1617379134 S Bo:2:025:2 -115 31 = 55534243 13000000 00400000 80000a28 00000008 e6000020 00000000 000000
d8b32000 1617379272 C Bo:2:025:2 0 31 >
d84a1100 1617379363 S Bi:2:025:1 -115 16384 <
d84a1100 1617379933 C Bi:2:025:1 0 16384 = 00000000 00000000 00000000 00000000 00000000 00000000 00000000 00000000
d84a1100 1617380014 S Bi:2:025:1 -115 13 <
d84a1100 1617380140 C Bi:2:025:1 0 13 = 55534253 13000000 00000000 00
d84a1100 1617380600 S Bo:2:025:2 -115 31 = 55534243 14000000 00400000 80000a28 00000009 06000020 00000000 000000
d84a1100 1617380643 C Bo:2:025:2 0 31 >
d84a1100 1617380751 S Bi:2:025:1 -115 16384 <
d84a1100 1617381315 C Bi:2:025:1 0 16384 = 00000000 00000000 00000000 00000000 00000000 00000000 00000000 00000000
d84a1100 1617381391 S Bi:2:025:1 -115 13 <
d84a1100 1617381521 C Bi:2:025:1 0 13 = 55534253 14000000 00000000 00
d84a1100 1617381662 S Bo:2:025:2 -115 31 = 55534243 15000000 00400000 80000a28 00000009 26000020 00000000 000000
d84a1100 1617381773 C Bo:2:025:2 0 31 >
d84a1100 1617381830 S Bi:2:025:1 -115 16384 <
d84a1100 1617382431 C Bi:2:025:1 0 16384 = 00000000 00000000 00000000 00000000 00000000 00000000 00000000 00000000
d84a1100 1617382519 S Bi:2:025:1 -115 13 <
d84a1100 1617382652 C Bi:2:025:1 0 13 = 55534253 15000000 00000000 00
d84a1100 1617382779 S Bo:2:025:2 -115 31 = 55534243 16000000 00400000 80000a28 00000009 46000020 00000000 000000
d84a1100 1617382897 C Bo:2:025:2 0 31 >
d84a1100 1617382957 S Bi:2:025:1 -115 16384 <
d84a1100 1617383568 C Bi:2:025:1 0 16384 = 00000000 00000000 00000000 00000000 00000000 00000000 00000000 00000000
d84a1100 1617383642 S Bi:2:025:1 -115 13 <
d84a1100 1617383776 C Bi:2:025:1 0 13 = 55534253 16000000 00000000 00
d84a1100 1617383973 S Bo:2:025:2 -115 31 = 55534243 17000000 00400000 80000a28 00000009 66000020 00000000 000000
d84a1100 1617384044 C Bo:2:025:2 0 31 >
d84a1100 1617384166 S Bi:2:025:1 -115 16384 <
d84a1100 1617384703 C Bi:2:025:1 0 16384 = 00000000 00000000 00000000 00000000 00000000 00000000 00000000 00000000
d84a1100 1617384792 S Bi:2:025:1 -115 13 <
d84a1100 1617384899 C Bi:2:025:1 0 13 = 55534253 17000000 00000000 00
d84a1100 1617385052 S Bo:2:025:2 -115 31 = 55534243 18000000 00400000 80000a28 00000009 86000020 00000000 000000
d84a1100 1617385144 C Bo:2:025:2 0 31 >
d84a1100 1617385234 S Bi:2:025:1 -115 16384 <
d84a1100 1617385815 C Bi:2:025:1 0 16384 = 00000000 00000000 00000000 00000000 00000000 00000000 00000000 00000000
d84a1100 1617385898 S Bi:2:025:1 -115 13 <
d84a1100 1617386014 C Bi:2:025:1 0 13 = 55534253 18000000 00000000 00
d84a1100 1617386148 S Bo:2:025:2 -115 31 = 55534243 19000000 00400000 80000a28 00000009 a6000020 00000000 000000
d84a1100 1617386279 C Bo:2:025:2 0 31 >
d84a1100 1617386423 S Bi:2:025:1 -115 16384 <
d84a1100 1617386945 C Bi:2:025:1 0 16384 = 00000000 00000000 00000000 00000000 00000000 00000000 00000000 00000000
d84a1100 1617387052 S Bi:2:025:1 -115 13 <
d84a1100 1617387147 C Bi:2:025:1 0 13 = 55534253 19000000 00000000 00
d84a1100 1617387291 S Bo:2:025:2 -115 31 = 55534243 1a000000 00400000 80000a28 00000009 c6000020 00000000 000000
d84a1100 1617387397 C Bo:2:025:2 0 31 >
d84a1100 1617387457 S Bi:2:025:1 -115 16384 <
d84a1100 1617388068 C Bi:2:025:1 0 16384 = 00000000 00000000 00000000 00000000 00000000 00000000 00000000 00000000
d84a1100 1617388166 S Bi:2:025:1 -115 13 <
d84a1100 1617388271 C Bi:2:025:1 0 13 = 55534253 1a000000 00000000 00
d84a1100 1617388410 S Bo:2:025:2 -115 31 = 55534243 1b000000 00400000 80000a28 00000009 e6000020 00000000 000000
d84a1100 1617388459 C Bo:2:025:2 0 31 >
d84a1780 1617388624 S Bi:2:025:1 -115 16384 <
d84a1780 1617389175 C Bi:2:025:1 0 16384 = 00000000 00000000 00000000 00000000 00000000 00000000 00000000 00000000
d8b32700 1617389259 S Bi:2:025:1 -115 13 <
d8b32700 1617389397 C Bi:2:025:1 0 13 = 55534253 1b000000 00000000 00
d8b32700 1617389550 S Bo:2:025:2 -115 31 = 55534243 1c000000 00400000 80000a28 0000000a 06000020 00000000 000000
d8b32700 1617389639 C Bo:2:025:2 0 31 >
d8b32700 1617389714 S Bi:2:025:1 -115 16384 <
d8b32700 1617390308 C Bi:2:025:1 0 16384 = 00000000 00000000 00000000 00000000 00000000 00000000 00000000 00000000
d8b32700 1617390380 S Bi:2:025:1 -115 13 <
d8b32700 1617390521 C Bi:2:025:1 0 13 = 55534253 1c000000 00000000 00
d8b32700 1617390707 S Bo:2:025:2 -115 31 = 55534243 1d000000 00400000 80000a28 0000000a 26000020 00000000 000000
d8b32700 1617390773 C Bo:2:025:2 0 31 >
d8b32700 1617390855 S Bi:2:025:1 -115 16384 <
d8b32700 1617391393 C Bi:2:025:1 0 16384 = 00000000 00000000 00000000 00000000 00000000 00000000 00000000 00000000
d8b32700 1617391481 S Bi:2:025:1 -115 13 <
d8b32700 1617391658 C Bi:2:025:1 0 13 = 55534253 1d000000 00000000 00
d8b32400 1617391789 S Bo:2:025:2 -115 31 = 55534243 1e000000 00400000 80000a28 0000000a 46000020 00000000 000000
d8b32400 1617391896 C Bo:2:025:2 0 31 >
d8b32780 1617391943 S Bi:2:025:1 -115 16384 <
d8b32780 1617392494 C Bi:2:025:1 0 16384 = 00000000 00000000 00000000 00000000 00000000 00000000 00000000 00000000
d84a1e80 1617392567 S Bi:2:025:1 -115 13 <
d84a1e80 1617392649 C Bi:2:025:1 0 13 = 55534253 1e000000 00000000 00
d84a1e80 1617392790 S Bo:2:025:2 -115 31 = 55534243 1f000000 00400000 80000a28 0000000a 66000020 00000000 000000
d84a1e80 1617392906 C Bo:2:025:2 0 31 >
d84a1e80 1617393131 S Bi:2:025:1 -115 16384 <
d84a1e80 1617393703 C Bi:2:025:1 0 16384 = 00000000 00000000 00000000 00000000 00000000 00000000 00000000 00000000
d84a1e80 1617393801 S Bi:2:025:1 -115 13 <
d84a1e80 1617393895 C Bi:2:025:1 0 13 = 55534253 1f000000 00000000 00
d84a1e80 1617394103 S Bo:2:025:2 -115 31 = 55534243 20000000 00400000 80000a28 0000000a 86000020 00000000 000000
d84a1e80 1617394163 C Bo:2:025:2 0 31 >
d84a1a00 1617394241 S Bi:2:025:1 -115 16384 <
d84a1a00 1617394805 C Bi:2:025:1 0 16384 = 00000000 00000000 00000000 00000000 00000000 00000000 00000000 00000000
d84a1680 1617394894 S Bi:2:025:1 -115 13 <
d84a1680 1617395044 C Bi:2:025:1 0 13 = 55534253 20000000 00000000 00
d1045b80 1617395179 S Bo:2:025:2 -115 31 = 55534243 21000000 00400000 80000a28 0000000a a6000020 00000000 000000
d1045b80 1617395277 C Bo:2:025:2 0 31 >
d1045b80 1617396043 S Bi:2:025:1 -115 16384 <
d1045b80 1617396556 C Bi:2:025:1 0 16384 = 00000000 00000000 00000000 00000000 00000000 00000000 00000000 00000000
d1045b80 1617396641 S Bi:2:025:1 -115 13 <
d1045b80 1617396787 C Bi:2:025:1 0 13 = 55534253 21000000 00000000 00
d1045b80 1617397327 S Bo:2:025:2 -115 31 = 55534243 22000000 00400000 80000a28 0000000a c6000020 00000000 000000
d1045b80 1617397391 C Bo:2:025:2 0 31 >
d1045b80 1617397659 S Bi:2:025:1 -115 16384 <
d1045b80 1617398176 C Bi:2:025:1 0 16384 = 00000000 00000000 00000000 00000000 00000000 00000000 00000000 00000000
d1045b80 1617398420 S Bi:2:025:1 -115 13 <
d1045b80 1617398522 C Bi:2:025:1 0 13 = 55534253 22000000 00000000 00
d1045b80 1617398658 S Bo:2:025:2 -115 31 = 55534243 23000000 00400000 80000a28 0000000a e6000020 00000000 000000
d1045b80 1617398779 C Bo:2:025:2 0 31 >
d1045b80 1617398841 S Bi:2:025:1 -115 16384 <
d1045b80 1617399418 C Bi:2:025:1 0 16384 = 00000000 00000000 00000000 00000000 00000000 00000000 00000000 00000000
d1045b80 1617399493 S Bi:2:025:1 -115 13 <
d1045b80 1617399649 C Bi:2:025:1 0 13 = 55534253 23000000 00000000 00
d1045b80 1617399795 S Bo:2:025:2 -115 31 = 55534243 24000000 00400000 80000a28 0000000b 06000020 00000000 000000
d1045b80 1617399893 C Bo:2:025:2 0 31 >
d1045b80 1617400187 S Bi:2:025:1 -115 16384 <
d1045b80 1617400711 C Bi:2:025:1 0 16384 = 00000000 00000000 00000000 00000000 00000000 00000000 00000000 00000000
d1045b80 1617400796 S Bi:2:025:1 -115 13 <
d1045b80 1617400897 C Bi:2:025:1 0 13 = 55534253 24000000 00000000 00
d1045b80 1617401042 S Bo:2:025:2 -115 31 = 55534243 25000000 00400000 80000a28 0000000b 26000020 00000000 000000
d1045b80 1617401140 C Bo:2:025:2 0 31 >
d1045b80 1617401251 S Bi:2:025:1 -115 16384 <
d1045b80 1617401818 C Bi:2:025:1 0 16384 = 00000000 00000000 00000000 00000000 00000000 00000000 00000000 00000000
d1045b80 1617401883 S Bi:2:025:1 -115 13 <
d1045b80 1617402040 C Bi:2:025:1 0 13 = 55534253 25000000 00000000 00
d1045b80 1617402169 S Bo:2:025:2 -115 31 = 55534243 26000000 00400000 80000a28 0000000b 46000020 00000000 000000
d1045b80 1617402289 C Bo:2:025:2 0 31 >
d1045b80 1617402349 S Bi:2:025:1 -115 16384 <
d1045b80 1617402953 C Bi:2:025:1 0 16384 = 00000000 00000000 00000000 00000000 00000000 00000000 00000000 00000000
d1045b80 1617403050 S Bi:2:025:1 -115 13 <
d1045b80 1617403150 C Bi:2:025:1 0 13 = 55534253 26000000 00000000 00
d1045b80 1617403294 S Bo:2:025:2 -115 31 = 55534243 27000000 00400000 80000a28 0000000b 66000020 00000000 000000
d1045b80 1617403381 C Bo:2:025:2 0 31 >
d1045b80 1617403678 S Bi:2:025:1 -115 16384 <
d1045b80 1617404191 C Bi:2:025:1 0 16384 = 00000000 00000000 00000000 00000000 00000000 00000000 00000000 00000000
d1045b80 1617404267 S Bi:2:025:1 -115 13 <
d1045b80 1617404397 C Bi:2:025:1 0 13 = 55534253 27000000 00000000 00
d1045b80 1617404543 S Bo:2:025:2 -115 31 = 55534243 28000000 00400000 80000a28 0000000b 86000020 00000000 000000
d1045b80 1617404656 C Bo:2:025:2 0 31 >
d1045b80 1617404797 S Bi:2:025:1 -115 16384 <
d1045b80 1617405245 C Bi:2:025:1 0 16384 = 00000000 00000000 00000000 00000000 00000000 00000000 00000000 00000000
d1045b80 1617405410 S Bi:2:025:1 -115 13 <
d1045b80 1617405539 C Bi:2:025:1 0 13 = 55534253 28000000 00000000 00
d1045b80 1617405701 S Bo:2:025:2 -115 31 = 55534243 29000000 00400000 80000a28 0000000b a6000020 00000000 000000
d1045b80 1617405770 C Bo:2:025:2 0 31 >
d1045b80 1617405987 S Bi:2:025:1 -115 16384 <
d1045b80 1617406569 C Bi:2:025:1 0 16384 = 00000000 00000000 00000000 00000000 00000000 00000000 00000000 00000000
d1045b80 1617406642 S Bi:2:025:1 -115 13 <
d1045b80 1617406780 C Bi:2:025:1 0 13 = 55534253 29000000 00000000 00
d1045b80 1617406910 S Bo:2:025:2 -115 31 = 55534243 2a000000 00400000 80000a28 0000000b c6000020 00000000 000000
d1045b80 1617407020 C Bo:2:025:2 0 31 >
d1045b80 1617407172 S Bi:2:025:1 -115 16384 <
d1045b80 1617407716 C Bi:2:025:1 0 16384 = 00000000 00000000 00000000 00000000 00000000 00000000 00000000 00000000
d1045b80 1617407804 S Bi:2:025:1 -115 13 <
d1045b80 1617407902 C Bi:2:025:1 0 13 = 55534253 2a000000 00000000 00
d1045b80 1617408062 S Bo:2:025:2 -115 31 = 55534243 2b000000 00400000 80000a28 0000000b e6000020 00000000 000000
d1045b80 1617408139 C Bo:2:025:2 0 31 >
d1045b80 1617408461 S Bi:2:025:1 -115 16384 <
d1045b80 1617409056 C Bi:2:025:1 0 16384 = 00000000 00000000 00000000 00000000 00000000 00000000 00000000 00000000
d1045b80 1617409379 S Bi:2:025:1 -115 13 <
d1045b80 1617409433 C Bi:2:025:1 0 13 = 55534253 2b000000 00000000 00
d1045b80 1617409600 S Bo:2:025:2 -115 31 = 55534243 2c000000 00400000 80000a28 0000000c 06000020 00000000 000000
d1045b80 1617409647 C Bo:2:025:2 0 31 >
d1045b80 1617409947 S Bi:2:025:1 -115 16384 <
d1045b80 1617410441 C Bi:2:025:1 0 16384 = 00000000 00000000 00000000 00000000 00000000 00000000 00000000 00000000
d1045b80 1617410508 S Bi:2:025:1 -115 13 <
d1045b80 1617410649 C Bi:2:025:1 0 13 = 55534253 2c000000 00000000 00
d1045b80 1617410796 S Bo:2:025:2 -115 31 = 55534243 2d000000 00400000 80000a28 0000000c 26000020 00000000 000000
d1045b80 1617410888 C Bo:2:025:2 0 31 >
d1045b80 1617411439 S Bi:2:025:1 -115 16384 <
d1045b80 1617411953 C Bi:2:025:1 0 16384 = 00000000 00000000 00000000 00000000 00000000 00000000 00000000 00000000
d1045b80 1617412025 S Bi:2:025:1 -115 13 <
d1045b80 1617412149 C Bi:2:025:1 0 13 = 55534253 2d000000 00000000 00
d1045b80 1617412287 S Bo:2:025:2 -115 31 = 55534243 2e000000 00400000 80000a28 0000000c 46000020 00000000 000000
d1045b80 1617412390 C Bo:2:025:2 0 31 >
d1045800 1617412481 S Bi:2:025:1 -115 16384 <
d1045800 1617413031 C Bi:2:025:1 0 16384 = 00000000 00000000 00000000 00000000 00000000 00000000 00000000 00000000
d1045280 1617413098 S Bi:2:025:1 -115 13 <
d1045280 1617413147 C Bi:2:025:1 0 13 = 55534253 2e000000 00000000 00
d84a1180 1617413285 S Bo:2:025:2 -115 31 = 55534243 2f000000 00400000 80000a28 0000000c 66000020 00000000 000000
d84a1180 1617413405 C Bo:2:025:2 0 31 >
d84a1180 1617413587 S Bi:2:025:1 -115 16384 <
d84a1180 1617414056 C Bi:2:025:1 0 16384 = 00000000 00000000 00000000 00000000 00000000 00000000 00000000 00000000
d84a1180 1617414170 S Bi:2:025:1 -115 13 <
d84a1180 1617414273 C Bi:2:025:1 0 13 = 55534253 2f000000 00000000 00
d84a1180 1617414419 S Bo:2:025:2 -115 31 = 55534243 30000000 00400000 80000a28 0000000c 86000020 00000000 000000
d84a1180 1617414516 C Bo:2:025:2 0 31 >
d84a1180 1617414713 S Bi:2:025:1 -115 16384 <
d84a1180 1617415297 C Bi:2:025:1 0 16384 = 00000000 00000000 00000000 00000000 00000000 00000000 00000000 00000000
d84a1180 1617415391 S Bi:2:025:1 -115 13 <
d84a1180 1617415439 C Bi:2:025:1 0 13 = 55534253 30000000 00000000 00
d84a1180 1617415567 S Bo:2:025:2 -115 31 = 55534243 31000000 00400000 80000a28 0000000c a6000020 00000000 000000
d84a1180 1617415640 C Bo:2:025:2 0 31 >
d84a1180 1617415723 S Bi:2:025:1 -115 16384 <
d84a1180 1617416255 C Bi:2:025:1 0 16384 = 00000000 00000000 00000000 00000000 00000000 00000000 00000000 00000000
d84a1180 1617416334 S Bi:2:025:1 -115 13 <
d84a1180 1617416400 C Bi:2:025:1 0 13 = 55534253 31000000 00000000 00
d84a1180 1617416532 S Bo:2:025:2 -115 31 = 55534243 32000000 00400000 80000a28 0000000c c6000020 00000000 000000
d84a1180 1617416659 C Bo:2:025:2 0 31 >
d84a1180 1617416720 S Bi:2:025:1 -115 16384 <
d84a1180 1617417253 C Bi:2:025:1 0 16384 = 00000000 00000000 00000000 00000000 00000000 00000000 00000000 00000000
d84a1180 1617417328 S Bi:2:025:1 -115 13 <
d84a1180 1617417398 C Bi:2:025:1 0 13 = 55534253 32000000 00000000 00
d84a1180 1617417546 S Bo:2:025:2 -115 31 = 55534243 33000000 00400000 80000a28 0000000c e6000020 00000000 000000
d84a1180 1617417642 C Bo:2:025:2 0 31 >
d1045180 1617417704 S Bi:2:025:1 -115 16384 <
d1045180 1617418241 C Bi:2:025:1 0 16384 = 00000000 00000000 00000000 00000000 00000000 00000000 00000000 00000000
d1045180 1617418497 S Bi:2:025:1 -115 13 <
d1045180 1617418570 C Bi:2:025:1 0 13 = 55534253 33000000 00000000 00
d1045180 1617418703 S Bo:2:025:2 -115 31 = 55534243 34000000 00400000 80000a28 0000000d 06000020 00000000 000000
d1045180 1617418775 C Bo:2:025:2 0 31 >
d1045180 1617418921 S Bi:2:025:1 -115 16384 <
d1045180 1617419391 C Bi:2:025:1 0 16384 = 00000000 00000000 00000000 00000000 00000000 00000000 00000000 00000000
d84d1e00 1617419605 S Bi:2:025:1 -115 13 <
d84d1e00 1617419782 C Bi:2:025:1 0 13 = 55534253 34000000 00000000 00
d84d1e00 1617419959 S Bo:2:025:2 -115 31 = 55534243 35000000 00400000 80000a28 0000000d 26000020 00000000 000000
d84d1e00 1617420043 C Bo:2:025:2 0 31 >
d84d1e00 1617420286 S Bi:2:025:1 -115 16384 <
d84d1e00 1617420827 C Bi:2:025:1 0 16384 = 00000000 00000000 00000000 00000000 00000000 00000000 00000000 00000000
d84d1e00 1617420909 S Bi:2:025:1 -115 13 <
d84d1e00 1617421033 C Bi:2:025:1 0 13 = 55534253 35000000 00000000 00
d84d1e00 1617421163 S Bo:2:025:2 -115 31 = 55534243 36000000 00400000 80000a28 0000000d 46000020 00000000 000000
d84d1e00 1617421268 C Bo:2:025:2 0 31 >
d84d1e00 1617421465 S Bi:2:025:1 -115 16384 <
d84d1e00 1617422065 C Bi:2:025:1 0 16384 = 00000000 00000000 00000000 00000000 00000000 00000000 00000000 00000000
d84d1e00 1617422143 S Bi:2:025:1 -115 13 <
d84d1e00 1617422279 C Bi:2:025:1 0 13 = 55534253 36000000 00000000 00
d1045880 1617422572 S Bo:2:025:2 -115 31 = 55534243 37000000 00400000 80000a28 0000000d 66000020 00000000 000000
d1045880 1617422640 C Bo:2:025:2 0 31 >
d1045880 1617422725 S Bi:2:025:1 -115 16384 <
d1045880 1617423252 C Bi:2:025:1 0 16384 = 00000000 00000000 00000000 00000000 00000000 00000000 00000000 00000000
d1045880 1617423326 S Bi:2:025:1 -115 13 <
d1045880 1617423398 C Bi:2:025:1 0 13 = 55534253 37000000 00000000 00
d1045880 1617423541 S Bo:2:025:2 -115 31 = 55534243 38000000 00400000 80000a28 0000000d 86000020 00000000 000000
d1045880 1617423640 C Bo:2:025:2 0 31 >
d1045880 1617423838 S Bi:2:025:1 -115 16384 <
d1045880 1617424418 C Bi:2:025:1 0 16384 = 00000000 00000000 00000000 00000000 00000000 00000000 00000000 00000000
d1045880 1617424508 S Bi:2:025:1 -115 13 <
d1045880 1617424650 C Bi:2:025:1 0 13 = 55534253 38000000 00000000 00
d1045880 1617424808 S Bo:2:025:2 -115 31 = 55534243 39000000 00400000 80000a28 0000000d a6000020 00000000 000000
d1045880 1617424890 C Bo:2:025:2 0 31 >
d1045880 1617425200 S Bi:2:025:1 -115 16384 <
d1045880 1617425682 C Bi:2:025:1 0 16384 = 00000000 00000000 00000000 00000000 00000000 00000000 00000000 00000000
d1045880 1617425758 S Bi:2:025:1 -115 13 <
d1045880 1617425896 C Bi:2:025:1 0 13 = 55534253 39000000 00000000 00
d1045880 1617426311 S Bo:2:025:2 -115 31 = 55534243 3a000000 00400000 80000a28 0000000d c6000020 00000000 000000
d1045880 1617426410 C Bo:2:025:2 0 31 >
d1045880 1617426532 S Bi:2:025:1 -115 16384 <
d1045880 1617427026 C Bi:2:025:1 0 16384 = 00000000 00000000 00000000 00000000 00000000 00000000 00000000 00000000
d1045880 1617427097 S Bi:2:025:1 -115 13 <
d1045880 1617427146 C Bi:2:025:1 0 13 = 55534253 3a000000 00000000 00
d1045880 1617427270 S Bo:2:025:2 -115 31 = 55534243 3b000000 00400000 80000a28 0000000d e6000020 00000000 000000
d1045880 1617427398 C Bo:2:025:2 0 31 >
d1045880 1617427577 S Bi:2:025:1 -115 16384 <
d1045880 1617428078 C Bi:2:025:1 0 16384 = 00000000 00000000 00000000 00000000 00000000 00000000 00000000 00000000
d1045880 1617428330 S Bi:2:025:1 -115 13 <
d1045880 1617428431 C Bi:2:025:1 0 13 = 55534253 3b000000 00000000 00
d1045880 1617428693 S Bo:2:025:2 -115 31 = 55534243 3c000000 00400000 80000a28 0000000e 06000020 00000000 000000
d1045880 1617428788 C Bo:2:025:2 0 31 >
d1045880 1617428922 S Bi:2:025:1 -115 16384 <
d1045880 1617429454 C Bi:2:025:1 0 16384 = 00000000 00000000 00000000 00000000 00000000 00000000 00000000 00000000
d1045880 1617429523 S Bi:2:025:1 -115 13 <
d1045880 1617429647 C Bi:2:025:1 0 13 = 55534253 3c000000 00000000 00
d1045880 1617429940 S Bo:2:025:2 -115 31 = 55534243 3d000000 00400000 80000a28 0000000e 26000020 00000000 000000
d1045880 1617430040 C Bo:2:025:2 0 31 >
d1045880 1617430135 S Bi:2:025:1 -115 16384 <
d1045880 1617430714 C Bi:2:025:1 0 16384 = 00000000 00000000 00000000 00000000 00000000 00000000 00000000 00000000
d1045880 1617430800 S Bi:2:025:1 -115 13 <
d1045880 1617430897 C Bi:2:025:1 0 13 = 55534253 3d000000 00000000 00
d1045880 1617431186 S Bo:2:025:2 -115 31 = 55534243 3e000000 00400000 80000a28 0000000e 46000020 00000000 000000
d1045880 1617431281 C Bo:2:025:2 0 31 >
d1045880 1617431425 S Bi:2:025:1 -115 16384 <
d1045880 1617431944 C Bi:2:025:1 0 16384 = 00000000 00000000 00000000 00000000 00000000 00000000 00000000 00000000
d1045880 1617432033 S Bi:2:025:1 -115 13 <
d1045880 1617432147 C Bi:2:025:1 0 13 = 55534253 3e000000 00000000 00
d1045880 1617432377 S Bo:2:025:2 -115 31 = 55534243 3f000000 00400000 80000a28 0000000e 66000020 00000000 000000
d1045880 1617432416 C Bo:2:025:2 0 31 >
d1045880 1617432615 S Bi:2:025:1 -115 16384 <
d1045880 1617433205 C Bi:2:025:1 0 16384 = 00000000 00000000 00000000 00000000 00000000 00000000 00000000 00000000
d1045600 1617433528 S Bi:2:025:1 -115 13 <
d1045600 1617433649 C Bi:2:025:1 0 13 = 55534253 3f000000 00000000 00
d1045c00 1617433940 S Bo:2:025:2 -115 31 = 55534243 40000000 00400000 80000a28 0000000e 86000020 00000000 000000
d1045c00 1617434046 C Bo:2:025:2 0 31 >
d1045680 1617434179 S Bi:2:025:1 -115 16384 <
d1045680 1617434692 C Bi:2:025:1 0 16384 = 00000000 00000000 00000000 00000000 00000000 00000000 00000000 00000000
d84a1c80 1617434783 S Bi:2:025:1 -115 13 <
d84a1c80 1617434898 C Bi:2:025:1 0 13 = 55534253 40000000 00000000 00
d84a1c80 1617435274 S Bo:2:025:2 -115 31 = 55534243 41000000 00400000 80000a28 0000000e a6000020 00000000 000000
d84a1c80 1617435365 C Bo:2:025:2 0 31 >
d84a1f80 1617435467 S Bi:2:025:1 -115 16384 <
d84a1f80 1617436066 C Bi:2:025:1 0 16384 = 00000000 00000000 00000000 00000000 00000000 00000000 00000000 00000000
d84a1c00 1617436133 S Bi:2:025:1 -115 13 <
d84a1c00 1617436274 C Bi:2:025:1 0 13 = 55534253 41000000 00000000 00
d8b32780 1617436526 S Bo:2:025:2 -115 31 = 55534243 42000000 00400000 80000a28 0000000e c6000020 00000000 000000
d8b32780 1617436641 C Bo:2:025:2 0 31 >
d8b32780 1617436715 S Bi:2:025:1 -115 16384 <
d8b32780 1617437282 C Bi:2:025:1 0 16384 = 00000000 00000000 00000000 00000000 00000000 00000000 00000000 00000000
d8b32780 1617437384 S Bi:2:025:1 -115 13 <
d8b32780 1617437533 C Bi:2:025:1 0 13 = 55534253 42000000 00000000 00
d8b32780 1617437858 S Bo:2:025:2 -115 31 = 55534243 43000000 00400000 80000a28 0000000e e6000020 00000000 000000
d8b32780 1617437930 C Bo:2:025:2 0 31 >
d8b32780 1617438062 S Bi:2:025:1 -115 16384 <
d8b32780 1617438557 C Bi:2:025:1 0 16384 = 00000000 00000000 00000000 00000000 00000000 00000000 00000000 00000000
d8b32780 1617438659 S Bi:2:025:1 -115 13 <
d8b32780 1617438780 C Bi:2:025:1 0 13 = 55534253 43000000 00000000 00
d8b32780 1617439174 S Bo:2:025:2 -115 31 = 55534243 44000000 00400000 80000a28 0000000f 06000020 00000000 000000
d8b32780 1617439266 C Bo:2:025:2 0 31 >
d8b32780 1617439339 S Bi:2:025:1 -115 16384 <
d8b32780 1617439931 C Bi:2:025:1 0 16384 = 00000000 00000000 00000000 00000000 00000000 00000000 00000000 00000000
d8b32780 1617440031 S Bi:2:025:1 -115 13 <
d8b32780 1617440146 C Bi:2:025:1 0 13 = 55534253 44000000 00000000 00
d8b32780 1617440383 S Bo:2:025:2 -115 31 = 55534243 45000000 00400000 80000a28 0000000f 26000020 00000000 000000
d8b32780 1617440489 C Bo:2:025:2 0 31 >
d8b32780 1617440544 S Bi:2:025:1 -115 16384 <
d8b32780 1617441122 C Bi:2:025:1 0 16384 = 00000000 00000000 00000000 00000000 00000000 00000000 00000000 00000000
d1045400 1617441225 S Bi:2:025:1 -115 13 <
d1045400 1617441301 C Bi:2:025:1 0 13 = 55534253 45000000 00000000 00
d1045400 1617441570 S Bo:2:025:2 -115 31 = 55534243 46000000 00400000 80000a28 0000000f 46000020 00000000 000000
d1045400 1617441660 C Bo:2:025:2 0 31 >
d1045400 1617441770 S Bi:2:025:1 -115 16384 <
d1045400 1617442330 C Bi:2:025:1 0 16384 = 00000000 00000000 00000000 00000000 00000000 00000000 00000000 00000000
d1045400 1617442510 S Bi:2:025:1 -115 13 <
d1045400 1617442658 C Bi:2:025:1 0 13 = 55534253 46000000 00000000 00
d1045400 1617443073 S Bo:2:025:2 -115 31 = 55534243 47000000 00400000 80000a28 0000000f 66000020 00000000 000000
d1045400 1617443142 C Bo:2:025:2 0 31 >
d1045400 1617443222 S Bi:2:025:1 -115 16384 <
d1045400 1617443818 C Bi:2:025:1 0 16384 = 00000000 00000000 00000000 00000000 00000000 00000000 00000000 00000000
d1045400 1617443933 S Bi:2:025:1 -115 13 <
d1045400 1617444037 C Bi:2:025:1 0 13 = 55534253 47000000 00000000 00
d1045400 1617444409 S Bo:2:025:2 -115 31 = 55534243 48000000 00400000 80000a28 0000000f 86000020 00000000 000000
d1045400 1617444491 C Bo:2:025:2 0 31 >
d1045400 1617444554 S Bi:2:025:1 -115 16384 <
d1045400 1617445077 C Bi:2:025:1 0 16384 = 00000000 00000000 00000000 00000000 00000000 00000000 00000000 00000000
d1045400 1617445190 S Bi:2:025:1 -115 13 <
d1045400 1617445274 C Bi:2:025:1 0 13 = 55534253 48000000 00000000 00
d1045400 1617445561 S Bo:2:025:2 -115 31 = 55534243 49000000 00400000 80000a28 0000000f a6000020 00000000 000000
d1045400 1617445649 C Bo:2:025:2 0 31 >
d1045400 1617445772 S Bi:2:025:1 -115 16384 <
d1045400 1617446316 C Bi:2:025:1 0 16384 = 00000000 00000000 00000000 00000000 00000000 00000000 00000000 00000000
d1045400 1617446447 S Bi:2:025:1 -115 13 <
d1045400 1617446522 C Bi:2:025:1 0 13 = 55534253 49000000 00000000 00
d1045400 1617446770 S Bo:2:025:2 -115 31 = 55534243 4a000000 00400000 80000a28 0000000f c6000020 00000000 000000
d1045400 1617446888 C Bo:2:025:2 0 31 >
d1045400 1617446947 S Bi:2:025:1 -115 16384 <
d1045400 1617447488 C Bi:2:025:1 0 16384 = 00000000 00000000 00000000 00000000 00000000 00000000 00000000 00000000
d1045400 1617447560 S Bi:2:025:1 -115 13 <
d1045400 1617447648 C Bi:2:025:1 0 13 = 55534253 4a000000 00000000 00
d1045400 1617447880 S Bo:2:025:2 -115 31 = 55534243 4b000000 00400000 80000a28 0000000f e6000020 00000000 000000
d1045400 1617447997 C Bo:2:025:2 0 31 >
d1045400 1617448122 S Bi:2:025:1 -115 16384 <
d1045400 1617448967 C Bi:2:025:1 0 16384 = 00000000 00000000 00000000 00000000 00000000 00000000 00000000 00000000
d1045400 1617449079 S Bi:2:025:1 -115 13 <
d1045400 1617449146 C Bi:2:025:1 0 13 = 55534253 4b000000 00000000 00
d1045400 1617449615 S Bo:2:025:2 -115 31 = 55534243 4c000000 00400000 80000a28 00000010 06000020 00000000 000000
d1045400 1617449770 C Bo:2:025:2 0 31 >
d1045400 1617449897 S Bi:2:025:1 -115 16384 <
d1045400 1617450491 C Bi:2:025:1 0 16384 = 00000000 00000000 00000000 00000000 00000000 00000000 00000000 00000000
d1045400 1617450657 S Bi:2:025:1 -115 13 <
d1045400 1617450781 C Bi:2:025:1 0 13 = 55534253 4c000000 00000000 00
d1045400 1617451155 S Bo:2:025:2 -115 31 = 55534243 4d000000 00400000 80000a28 00000010 26000020 00000000 000000
d1045400 1617451267 C Bo:2:025:2 0 31 >
d1045400 1617451342 S Bi:2:025:1 -115 16384 <
d1045400 1617451931 C Bi:2:025:1 0 16384 = 00000000 00000000 00000000 00000000 00000000 00000000 00000000 00000000
d8b32400 1617452092 S Bi:2:025:1 -115 13 <
d8b32400 1617452152 C Bi:2:025:1 0 13 = 55534253 4d000000 00000000 00
d8b32400 1617452297 S Bo:2:025:2 -115 31 = 55534243 4e000000 00400000 80000a28 00000010 46000020 00000000 000000
d8b32400 1617452415 C Bo:2:025:2 0 31 >
d1045400 1617452688 S Bi:2:025:1 -115 16384 <
d1045400 1617453208 C Bi:2:025:1 0 16384 = 00000000 00000000 00000000 00000000 00000000 00000000 00000000 00000000
d1045400 1617453280 S Bi:2:025:1 -115 13 <
d1045400 1617453400 C Bi:2:025:1 0 13 = 55534253 4e000000 00000000 00
d1045400 1617453632 S Bo:2:025:2 -115 31 = 55534243 4f000000 00400000 80000a28 00000010 66000020 00000000 000000
d1045400 1617453745 C Bo:2:025:2 0 31 >
d1045400 1617453799 S Bi:2:025:1 -115 16384 <
d1045400 1617454320 C Bi:2:025:1 0 16384 = 00000000 00000000 00000000 00000000 00000000 00000000 00000000 00000000
d84a1c00 1617454475 S Bi:2:025:1 -115 13 <
d84a1c00 1617454525 C Bi:2:025:1 0 13 = 55534253 4f000000 00000000 00
d84a1c00 1617454765 S Bo:2:025:2 -115 31 = 55534243 50000000 00400000 80000a28 00000010 86000020 00000000 000000
d84a1c00 1617454883 C Bo:2:025:2 0 31 >
d84a1c00 1617455032 S Bi:2:025:1 -115 16384 <
d84a1c00 1617455557 C Bi:2:025:1 0 16384 = 00000000 00000000 00000000 00000000 00000000 00000000 00000000 00000000
d84a1c00 1617455625 S Bi:2:025:1 -115 13 <
d84a1c00 1617455778 C Bi:2:025:1 0 13 = 55534253 50000000 00000000 00
d84a1c00 1617456017 S Bo:2:025:2 -115 31 = 55534243 51000000 00400000 80000a28 00000010 a6000020 00000000 000000
d84a1c00 1617456136 C Bo:2:025:2 0 31 >
d84a1c00 1617456192 S Bi:2:025:1 -115 16384 <
d84a1c00 1617456722 C Bi:2:025:1 0 16384 = 00000000 00000000 00000000 00000000 00000000 00000000 00000000 00000000
d84a1c00 1617456823 S Bi:2:025:1 -115 13 <
d84a1c00 1617456898 C Bi:2:025:1 0 13 = 55534253 51000000 00000000 00
d84a1c00 1617457162 S Bo:2:025:2 -115 31 = 55534243 52000000 00400000 80000a28 00000010 c6000020 00000000 000000
d84a1c00 1617457283 C Bo:2:025:2 0 31 >
d84a1c00 1617457355 S Bi:2:025:1 -115 16384 <
d84a1c00 1617457960 C Bi:2:025:1 0 16384 = 00000000 00000000 00000000 00000000 00000000 00000000 00000000 00000000
d84a1c00 1617458305 S Bi:2:025:1 -115 13 <
d84a1c00 1617458406 C Bi:2:025:1 0 13 = 55534253 52000000 00000000 00
d84a1f80 1617458722 S Bo:2:025:2 -115 31 = 55534243 53000000 00400000 80000a28 00000010 e6000020 00000000 000000
d84a1f80 1617458792 C Bo:2:025:2 0 31 >
d8b32700 1617458854 S Bi:2:025:1 -115 16384 <
d8b32700 1617459442 C Bi:2:025:1 0 16384 = 00000000 00000000 00000000 00000000 00000000 00000000 00000000 00000000
d8b32700 1617459524 S Bi:2:025:1 -115 13 <
d8b32700 1617459650 C Bi:2:025:1 0 13 = 55534253 53000000 00000000 00
d8b32700 1617459781 S Bo:2:025:2 -115 31 = 55534243 54000000 00400000 80000a28 00000011 06000020 00000000 000000
d8b32700 1617459894 C Bo:2:025:2 0 31 >
d8b32700 1617459957 S Bi:2:025:1 -115 16384 <
d8b32700 1617460517 C Bi:2:025:1 0 16384 = 00000000 00000000 00000000 00000000 00000000 00000000 00000000 00000000
d84a1c80 1617460618 S Bi:2:025:1 -115 13 <
d84a1c80 1617460691 C Bi:2:025:1 0 13 = 55534253 54000000 00000000 00
d84a1c80 1617460971 S Bo:2:025:2 -115 31 = 55534243 55000000 00400000 80000a28 00000011 26000020 00000000 000000
d84a1c80 1617461038 C Bo:2:025:2 0 31 >
d84a1c80 1617461180 S Bi:2:025:1 -115 16384 <
d84a1c80 1617461689 C Bi:2:025:1 0 16384 = 00000000 00000000 00000000 00000000 00000000 00000000 00000000 00000000
d84a1c80 1617461763 S Bi:2:025:1 -115 13 <
d84a1c80 1617461906 C Bi:2:025:1 0 13 = 55534253 55000000 00000000 00
d84a1c80 1617462381 S Bo:2:025:2 -115 31 = 55534243 56000000 00400000 80000a28 00000011 46000020 00000000 000000
d84a1c80 1617462499 C Bo:2:025:2 0 31 >
d84a1c80 1617462596 S Bi:2:025:1 -115 16384 <
d84a1c80 1617463196 C Bi:2:025:1 0 16384 = 00000000 00000000 00000000 00000000 00000000 00000000 00000000 00000000
d84a1c80 1617463300 S Bi:2:025:1 -115 13 <
d84a1c80 1617463399 C Bi:2:025:1 0 13 = 55534253 56000000 00000000 00
d84a1c80 1617463705 S Bo:2:025:2 -115 31 = 55534243 57000000 00400000 80000a28 00000011 66000020 00000000 000000
d84a1c80 1617463783 C Bo:2:025:2 0 31 >
d84a1c80 1617463960 S Bi:2:025:1 -115 16384 <
d84a1c80 1617464437 C Bi:2:025:1 0 16384 = 00000000 00000000 00000000 00000000 00000000 00000000 00000000 00000000
d84a1c80 1617464571 S Bi:2:025:1 -115 13 <
d84a1c80 1617464649 C Bi:2:025:1 0 13 = 55534253 57000000 00000000 00
d84a1c80 1617465246 S Bo:2:025:2 -115 31 = 55534243 58000000 00400000 80000a28 00000011 86000020 00000000 000000
d84a1c80 1617465296 C Bo:2:025:2 0 31 >
d84a1c80 1617465466 S Bi:2:025:1 -115 16384 <
d84a1c80 1617466081 C Bi:2:025:1 0 16384 = 00000000 00000000 00000000 00000000 00000000 00000000 00000000 00000000
d84a1c80 1617466176 S Bi:2:025:1 -115 13 <
d84a1c80 1617466273 C Bi:2:025:1 0 13 = 55534253 58000000 00000000 00
d84a1c80 1617466549 S Bo:2:025:2 -115 31 = 55534243 59000000 00400000 80000a28 00000011 a6000020 00000000 000000
d84a1c80 1617466647 C Bo:2:025:2 0 31 >
d84a1c80 1617466710 S Bi:2:025:1 -115 16384 <
d84a1c80 1617467305 C Bi:2:025:1 0 16384 = 00000000 00000000 00000000 00000000 00000000 00000000 00000000 00000000
d84a1c80 1617467384 S Bi:2:025:1 -115 13 <
d84a1c80 1617467530 C Bi:2:025:1 0 13 = 55534253 59000000 00000000 00
d84a1c80 1617467816 S Bo:2:025:2 -115 31 = 55534243 5a000000 00400000 80000a28 00000011 c6000020 00000000 000000
d84a1c80 1617467901 C Bo:2:025:2 0 31 >
d84a1c80 1617467962 S Bi:2:025:1 -115 16384 <
d84a1c80 1617468554 C Bi:2:025:1 0 16384 = 00000000 00000000 00000000 00000000 00000000 00000000 00000000 00000000
d84a1c80 1617468654 S Bi:2:025:1 -115 13 <
d84a1c80 1617468790 C Bi:2:025:1 0 13 = 55534253 5a000000 00000000 00
d84a1c80 1617469154 S Bo:2:025:2 -115 31 = 55534243 5b000000 00400000 80000a28 00000011 e6000020 00000000 000000
d84a1c80 1617469265 C Bo:2:025:2 0 31 >
d84a1c80 1617469329 S Bi:2:025:1 -115 16384 <
d84a1c80 1617469943 C Bi:2:025:1 0 16384 = 00000000 00000000 00000000 00000000 00000000 00000000 00000000 00000000
d1045f80 1617470089 S Bi:2:025:1 -115 13 <
d1045f80 1617470151 C Bi:2:025:1 0 13 = 55534253 5b000000 00000000 00
d1045780 1617470402 S Bo:2:025:2 -115 31 = 55534243 5c000000 00400000 80000a28 00000012 06000020 00000000 000000
d1045780 1617470540 C Bo:2:025:2 0 31 >
d1045480 1617470592 S Bi:2:025:1 -115 16384 <
d1045480 1617471103 C Bi:2:025:1 0 16384 = 00000000 00000000 00000000 00000000 00000000 00000000 00000000 00000000
d1045000 1617471191 S Bi:2:025:1 -115 13 <
d1045000 1617471276 C Bi:2:025:1 0 13 = 55534253 5c000000 00000000 00
d1045c80 1617471551 S Bo:2:025:2 -115 31 = 55534243 5d000000 00400000 80000a28 00000012 26000020 00000000 000000
d1045c80 1617471660 C Bo:2:025:2 0 31 >
d84a1c80 1617471720 S Bi:2:025:1 -115 16384 <
d84a1c80 1617472283 C Bi:2:025:1 0 16384 = 00000000 00000000 00000000 00000000 00000000 00000000 00000000 00000000
d84a1c80 1617472383 S Bi:2:025:1 -115 13 <
d84a1c80 1617472554 C Bi:2:025:1 0 13 = 55534253 5d000000 00000000 00
d84a1c80 1617472817 S Bo:2:025:2 -115 31 = 55534243 5e000000 00400000 80000a28 00000012 46000020 00000000 000000
d84a1c80 1617472911 C Bo:2:025:2 0 31 >
d84a1c80 1617473037 S Bi:2:025:1 -115 16384 <
d84a1c80 1617473553 C Bi:2:025:1 0 16384 = 00000000 00000000 00000000 00000000 00000000 00000000 00000000 00000000
d84a1c80 1617473626 S Bi:2:025:1 -115 13 <
d84a1c80 1617473779 C Bi:2:025:1 0 13 = 55534253 5e000000 00000000 00
d84a1c80 1617474181 S Bo:2:025:2 -115 31 = 55534243 5f000000 00400000 80000a28 00000012 66000020 00000000 000000
d84a1c80 1617474287 C Bo:2:025:2 0 31 >
d84a1c80 1617474438 S Bi:2:025:1 -115 16384 <
d84a1c80 1617474932 C Bi:2:025:1 0 16384 = 00000000 00000000 00000000 00000000 00000000 00000000 00000000 00000000
d84a1c80 1617475021 S Bi:2:025:1 -115 13 <
d84a1c80 1617475150 C Bi:2:025:1 0 13 = 55534253 5f000000 00000000 00
d84a1c80 1617475410 S Bo:2:025:2 -115 31 = 55534243 60000000 00400000 80000a28 00000012 86000020 00000000 000000
d84a1c80 1617475515 C Bo:2:025:2 0 31 >
d84a1c80 1617475584 S Bi:2:025:1 -115 16384 <
d84a1c80 1617476202 C Bi:2:025:1 0 16384 = 00000000 00000000 00000000 00000000 00000000 00000000 00000000 00000000
d84a1c80 1617476291 S Bi:2:025:1 -115 13 <
d84a1c80 1617476401 C Bi:2:025:1 0 13 = 55534253 60000000 00000000 00
d84a1c80 1617476688 S Bo:2:025:2 -115 31 = 55534243 61000000 00400000 80000a28 00000012 a6000020 00000000 000000
d84a1c80 1617476800 C Bo:2:025:2 0 31 >
d84a1c80 1617476930 S Bi:2:025:1 -115 16384 <
d84a1c80 1617477455 C Bi:2:025:1 0 16384 = 00000000 00000000 00000000 00000000 00000000 00000000 00000000 00000000
d84a1c80 1617477551 S Bi:2:025:1 -115 13 <
d84a1c80 1617477618 C Bi:2:025:1 0 13 = 55534253 61000000 00000000 00
d84a1c80 1617477877 S Bo:2:025:2 -115 31 = 55534243 62000000 00400000 80000a28 00000012 c6000020 00000000 000000
d84a1c80 1617477919 C Bo:2:025:2 0 31 >
d84a1c80 1617478030 S Bi:2:025:1 -115 16384 <
d84a1c80 1617478566 C Bi:2:025:1 0 16384 = 00000000 00000000 00000000 00000000 00000000 00000000 00000000 00000000
d84a1c80 1617478648 S Bi:2:025:1 -115 13 <
d84a1c80 1617478779 C Bi:2:025:1 0 13 = 55534253 62000000 00000000 00
d84a1c80 1617479107 S Bo:2:025:2 -115 31 = 55534243 63000000 00400000 80000a28 00000012 e6000020 00000000 000000
d84a1c80 1617479159 C Bo:2:025:2 0 31 >
d84a1c80 1617479217 S Bi:2:025:1 -115 16384 <
d84a1c80 1617479812 C Bi:2:025:1 0 16384 = 00000000 00000000 00000000 00000000 00000000 00000000 00000000 00000000
d84a1c80 1617479893 S Bi:2:025:1 -115 13 <
d84a1c80 1617480024 C Bi:2:025:1 0 13 = 55534253 63000000 00000000 00
d84a1c80 1617480281 S Bo:2:025:2 -115 31 = 55534243 64000000 00400000 80000a28 00000013 06000020 00000000 000000
d84a1c80 1617480365 C Bo:2:025:2 0 31 >
d84a1c80 1617480422 S Bi:2:025:1 -115 16384 <
d84a1c80 1617480956 C Bi:2:025:1 0 16384 = 00000000 00000000 00000000 00000000 00000000 00000000 00000000 00000000
d84a1c80 1617481150 S Bi:2:025:1 -115 13 <
d84a1c80 1617481277 C Bi:2:025:1 0 13 = 55534253 64000000 00000000 00
d1045c80 1617481557 S Bo:2:025:2 -115 31 = 55534243 65000000 00400000 80000a28 00000013 26000020 00000000 000000
d1045c80 1617481649 C Bo:2:025:2 0 31 >
d1045c80 1617481777 S Bi:2:025:1 -115 16384 <
d1045c80 1617482306 C Bi:2:025:1 0 16384 = 00000000 00000000 00000000 00000000 00000000 00000000 00000000 00000000
d1045c80 1617482385 S Bi:2:025:1 -115 13 <
d1045c80 1617482521 C Bi:2:025:1 0 13 = 55534253 65000000 00000000 00
d1045c80 1617482930 S Bo:2:025:2 -115 31 = 55534243 66000000 00400000 80000a28 00000013 46000020 00000000 000000
d1045c80 1617483040 C Bo:2:025:2 0 31 >
d1045c80 1617483206 S Bi:2:025:1 -115 16384 <
d1045c80 1617483829 C Bi:2:025:1 0 16384 = 00000000 00000000 00000000 00000000 00000000 00000000 00000000 00000000
d1045c80 1617484136 S Bi:2:025:1 -115 13 <
d1045c80 1617484275 C Bi:2:025:1 0 13 = 55534253 66000000 00000000 00
d1045c80 1617484625 S Bo:2:025:2 -115 31 = 55534243 67000000 00400000 80000a28 00000013 66000020 00000000 000000
d1045c80 1617484775 C Bo:2:025:2 0 31 >
d1045c80 1617484900 S Bi:2:025:1 -115 16384 <
d1045c80 1617485415 C Bi:2:025:1 0 16384 = 00000000 00000000 00000000 00000000 00000000 00000000 00000000 00000000
d1045000 1617485579 S Bi:2:025:1 -115 13 <
d1045000 1617485645 C Bi:2:025:1 0 13 = 55534253 67000000 00000000 00
d1045480 1617485923 S Bo:2:025:2 -115 31 = 55534243 68000000 00400000 80000a28 00000013 86000020 00000000 000000
d1045480 1617486050 C Bo:2:025:2 0 31 >
d1045780 1617486101 S Bi:2:025:1 -115 16384 <
d1045780 1617486681 C Bi:2:025:1 0 16384 = 00000000 00000000 00000000 00000000 00000000 00000000 00000000 00000000
d84d1e00 1617486751 S Bi:2:025:1 -115 13 <
d84d1e00 1617486896 C Bi:2:025:1 0 13 = 55534253 68000000 00000000 00
d84d1e00 1617487130 S Bo:2:025:2 -115 31 = 55534243 69000000 00400000 80000a28 00000013 a6000020 00000000 000000
d84d1e00 1617487243 C Bo:2:025:2 0 31 >
d84d1e00 1617487321 S Bi:2:025:1 -115 16384 <
d84d1e00 1617487840 C Bi:2:025:1 0 16384 = 00000000 00000000 00000000 00000000 00000000 00000000 00000000 00000000
d84d1b00 1617489086 S Bi:2:025:1 -115 13 <
d84d1b00 1617489146 C Bi:2:025:1 0 13 = 55534253 69000000 00000000 00
d84d1b00 1617489409 S Bo:2:025:2 -115 31 = 55534243 6a000000 00400000 80000a28 00000013 c6000020 00000000 000000
d84d1b00 1617489523 C Bo:2:025:2 0 31 >
d84d1b00 1617489584 S Bi:2:025:1 -115 16384 <
d84d1b00 1617490191 C Bi:2:025:1 0 16384 = 00000000 00000000 00000000 00000000 00000000 00000000 00000000 00000000
d84d1b00 1617490258 S Bi:2:025:1 -115 13 <
d84d1b00 1617490394 C Bi:2:025:1 0 13 = 55534253 6a000000 00000000 00
d84d1b00 1617490715 S Bo:2:025:2 -115 31 = 55534243 6b000000 00400000 80000a28 00000013 e6000020 00000000 000000
d84d1b00 1617490817 C Bo:2:025:2 0 31 >
d84d1b00 1617490877 S Bi:2:025:1 -115 16384 <
d84d1b00 1617491440 C Bi:2:025:1 0 16384 = 00000000 00000000 00000000 00000000 00000000 00000000 00000000 00000000
d84d1b00 1617491514 S Bi:2:025:1 -115 13 <
d84d1b00 1617491647 C Bi:2:025:1 0 13 = 55534253 6b000000 00000000 00
d84d1b00 1617491912 S Bo:2:025:2 -115 31 = 55534243 6c000000 00400000 80000a28 00000014 06000020 00000000 000000
d84d1b00 1617492023 C Bo:2:025:2 0 31 >
d84d1b00 1617492083 S Bi:2:025:1 -115 16384 <
d84d1b00 1617492705 C Bi:2:025:1 0 16384 = 00000000 00000000 00000000 00000000 00000000 00000000 00000000 00000000
d84d1b00 1617492787 S Bi:2:025:1 -115 13 <
d84d1b00 1617492894 C Bi:2:025:1 0 13 = 55534253 6c000000 00000000 00
d84d1b00 1617493234 S Bo:2:025:2 -115 31 = 55534243 6d000000 00400000 80000a28 00000014 26000020 00000000 000000
d84d1b00 1617493293 C Bo:2:025:2 0 31 >
d84d1b00 1617493421 S Bi:2:025:1 -115 16384 <
d84d1b00 1617493932 C Bi:2:025:1 0 16384 = 00000000 00000000 00000000 00000000 00000000 00000000 00000000 00000000
d84d1b00 1617493998 S Bi:2:025:1 -115 13 <
d84d1b00 1617494142 C Bi:2:025:1 0 13 = 55534253 6d000000 00000000 00
d84d1b00 1617494363 S Bo:2:025:2 -115 31 = 55534243 6e000000 00400000 80000a28 00000014 46000020 00000000 000000
d84d1b00 1617494416 C Bo:2:025:2 0 31 >
d84d1b00 1617494465 S Bi:2:025:1 -115 16384 <
d84d1b00 1617495032 C Bi:2:025:1 0 16384 = 00000000 00000000 00000000 00000000 00000000 00000000 00000000 00000000
d84d1b00 1617495162 S Bi:2:025:1 -115 13 <
d84d1b00 1617495270 C Bi:2:025:1 0 13 = 55534253 6e000000 00000000 00
d84d1b00 1617495576 S Bo:2:025:2 -115 31 = 55534243 6f000000 00400000 80000a28 00000014 66000020 00000000 000000
d84d1b00 1617495656 C Bo:2:025:2 0 31 >
d84d1b00 1617495753 S Bi:2:025:1 -115 16384 <
d84d1b00 1617496301 C Bi:2:025:1 0 16384 = 00000000 00000000 00000000 00000000 00000000 00000000 00000000 00000000
d84d1b00 1617496415 S Bi:2:025:1 -115 13 <
d84d1b00 1617496520 C Bi:2:025:1 0 13 = 55534253 6f000000 00000000 00
d84d1b00 1617496797 S Bo:2:025:2 -115 31 = 55534243 70000000 00400000 80000a28 00000014 86000020 00000000 000000
d84d1b00 1617496904 C Bo:2:025:2 0 31 >
d84d1b00 1617496999 S Bi:2:025:1 -115 16384 <
d84d1b00 1617497583 C Bi:2:025:1 0 16384 = 00000000 00000000 00000000 00000000 00000000 00000000 00000000 00000000
d84d1b00 1617497668 S Bi:2:025:1 -115 13 <
d84d1b00 1617497777 C Bi:2:025:1 0 13 = 55534253 70000000 00000000 00
d84d1b00 1617498108 S Bo:2:025:2 -115 31 = 55534243 71000000 00400000 80000a28 00000014 a6000020 00000000 000000
d84d1b00 1617498158 C Bo:2:025:2 0 31 >
d84d1b00 1617498220 S Bi:2:025:1 -115 16384 <
d84d1b00 1617498820 C Bi:2:025:1 0 16384 = 00000000 00000000 00000000 00000000 00000000 00000000 00000000 00000000
d84d1b00 1617498914 S Bi:2:025:1 -115 13 <
d84d1b00 1617499033 C Bi:2:025:1 0 13 = 55534253 71000000 00000000 00
d8b32000 1617501249 S Bo:2:025:2 -115 31 = 55534243 72000000 00400000 80000a28 00000014 c6000020 00000000 000000
d8b32000 1617501395 C Bo:2:025:2 0 31 >
d8b32000 1617501545 S Bi:2:025:1 -115 16384 <
d8b32000 1617502064 C Bi:2:025:1 0 16384 = 00000000 00000000 00000000 00000000 00000000 00000000 00000000 00000000
d84a1180 1617502160 S Bi:2:025:1 -115 13 <
d84a1180 1617502271 C Bi:2:025:1 0 13 = 55534253 72000000 00000000 00
d84a1680 1617502388 S Bo:2:025:2 -115 31 = 55534243 73000000 00400000 80000a28 00000014 e6000020 00000000 000000
d84a1680 1617502520 C Bo:2:025:2 0 31 >
d84a1a00 1617502567 S Bi:2:025:1 -115 16384 <
d84a1a00 1617503129 C Bi:2:025:1 0 16384 = 00000000 00000000 00000000 00000000 00000000 00000000 00000000 00000000
d84a1e80 1617503221 S Bi:2:025:1 -115 13 <
d84a1e80 1617503303 C Bi:2:025:1 0 13 = 55534253 73000000 00000000 00
d84a1780 1617503698 S Bo:2:025:2 -115 31 = 55534243 74000000 00400000 80000a28 00000015 06000020 00000000 000000
d84a1780 1617503770 C Bo:2:025:2 0 31 >
d84a1100 1617503824 S Bi:2:025:1 -115 16384 <
d84a1100 1617504365 C Bi:2:025:1 0 16384 = 00000000 00000000 00000000 00000000 00000000 00000000 00000000 00000000
d84a1700 1617504446 S Bi:2:025:1 -115 13 <
d84a1700 1617504522 C Bi:2:025:1 0 13 = 55534253 74000000 00000000 00
d84a1f00 1617504648 S Bo:2:025:2 -115 31 = 55534243 75000000 00400000 80000a28 00000015 26000020 00000000 000000
d84a1f00 1617504780 C Bo:2:025:2 0 31 >
d84a1880 1617504857 S Bi:2:025:1 -115 16384 <
d84a1880 1617505409 C Bi:2:025:1 0 16384 = 00000000 00000000 00000000 00000000 00000000 00000000 00000000 00000000
d84a1d00 1617505510 S Bi:2:025:1 -115 13 <
d84a1d00 1617505677 C Bi:2:025:1 0 13 = 55534253 75000000 00000000 00
d84a1d80 1617505840 S Bo:2:025:2 -115 31 = 55534243 76000000 00400000 80000a28 00000015 46000020 00000000 000000
d84a1d80 1617505894 C Bo:2:025:2 0 31 >
d84a1e00 1617506063 S Bi:2:025:1 -115 16384 <
d84a1e00 1617506555 C Bi:2:025:1 0 16384 = 00000000 00000000 00000000 00000000 00000000 00000000 00000000 00000000
d1045f80 1617506636 S Bi:2:025:1 -115 13 <
d1045f80 1617506779 C Bi:2:025:1 0 13 = 55534253 76000000 00000000 00
d1045f80 1617506915 S Bo:2:025:2 -115 31 = 55534243 77000000 00400000 80000a28 00000015 66000020 00000000 000000
d1045f80 1617507043 C Bo:2:025:2 0 31 >
d1045f80 1617507112 S Bi:2:025:1 -115 16384 <
d1045f80 1617507632 C Bi:2:025:1 0 16384 = 00000000 00000000 00000000 00000000 00000000 00000000 00000000 00000000
d1045400 1617509820 S Bi:2:025:1 -115 13 <
d1045400 1617509912 C Bi:2:025:1 0 13 = 55534253 77000000 00000000 00
d1045680 1617510125 S Bo:2:025:2 -115 31 = 55534243 78000000 00400000 80000a28 00000015 86000020 00000000 000000
d1045680 1617510281 C Bo:2:025:2 0 31 >
d8b32680 1617511596 S Bi:2:025:1 -115 16384 <
d8b32680 1617512198 C Bi:2:025:1 0 16384 = 00000000 00000000 00000000 00000000 00000000 00000000 00000000 00000000
d8b32680 1617512313 S Bi:2:025:1 -115 13 <
d8b32680 1617512406 C Bi:2:025:1 0 13 = 55534253 78000000 00000000 00
d8b32680 1617512735 S Bo:2:025:2 -115 31 = 55534243 79000000 00400000 80000a28 00000015 a6000020 00000000 000000
d8b32680 1617512815 C Bo:2:025:2 0 31 >
d8b32680 1617512874 S Bi:2:025:1 -115 16384 <
d8b32680 1617513445 C Bi:2:025:1 0 16384 = 00000000 00000000 00000000 00000000 00000000 00000000 00000000 00000000
d8b32680 1617513533 S Bi:2:025:1 -115 13 <
d8b32680 1617513651 C Bi:2:025:1 0 13 = 55534253 79000000 00000000 00
d8b32680 1617513907 S Bo:2:025:2 -115 31 = 55534243 7a000000 00400000 80000a28 00000015 c6000020 00000000 000000
d8b32680 1617514047 C Bo:2:025:2 0 31 >
d8b32680 1617514105 S Bi:2:025:1 -115 16384 <
d8b32680 1617514682 C Bi:2:025:1 0 16384 = 00000000 00000000 00000000 00000000 00000000 00000000 00000000 00000000
d8b32680 1617514765 S Bi:2:025:1 -115 13 <
d8b32680 1617514898 C Bi:2:025:1 0 13 = 55534253 7a000000 00000000 00
d8b32680 1617515456 S Bo:2:025:2 -115 31 = 55534243 7b000000 00400000 80000a28 00000015 e6000020 00000000 000000
d8b32680 1617515532 C Bo:2:025:2 0 31 >
d8b32b00 1617515684 S Bi:2:025:1 -115 16384 <
d8b32b00 1617516194 C Bi:2:025:1 0 16384 = 00000000 00000000 00000000 00000000 00000000 00000000 00000000 00000000
d8b32300 1617516256 S Bi:2:025:1 -115 13 <
d8b32300 1617516396 C Bi:2:025:1 0 13 = 55534253 7b000000 00000000 00
d8b32180 1617516635 S Bo:2:025:2 -115 31 = 55534243 7c000000 00400000 80000a28 00000016 06000020 00000000 000000
d8b32180 1617516753 C Bo:2:025:2 0 31 >
d8b32500 1617516798 S Bi:2:025:1 -115 16384 <
d8b32500 1617517356 C Bi:2:025:1 0 16384 = 00000000 00000000 00000000 00000000 00000000 00000000 00000000 00000000
d84d1380 1617517438 S Bi:2:025:1 -115 13 <
d84d1380 1617517526 C Bi:2:025:1 0 13 = 55534253 7c000000 00000000 00
d84d1380 1617517809 S Bo:2:025:2 -115 31 = 55534243 7d000000 00400000 80000a28 00000016 26000020 00000000 000000
d84d1380 1617517895 C Bo:2:025:2 0 31 >
d84d1500 1617517948 S Bi:2:025:1 -115 16384 <
d84d1500 1617518494 C Bi:2:025:1 0 16384 = 00000000 00000000 00000000 00000000 00000000 00000000 00000000 00000000
d84d1600 1617518555 S Bi:2:025:1 -115 13 <
d84d1600 1617518647 C Bi:2:025:1 0 13 = 55534253 7d000000 00000000 00
d84d1900 1617518868 S Bo:2:025:2 -115 31 = 55534243 7e000000 00400000 80000a28 00000016 46000020 00000000 000000
d84d1900 1617518920 C Bo:2:025:2 0 31 >
d84d1200 1617518964 S Bi:2:025:1 -115 16384 <
d84d1200 1617519564 C Bi:2:025:1 0 16384 = 00000000 00000000 00000000 00000000 00000000 00000000 00000000 00000000
d84d1d00 1617519654 S Bi:2:025:1 -115 13 <
d84d1d00 1617519780 C Bi:2:025:1 0 13 = 55534253 7e000000 00000000 00
d84d1180 1617520010 S Bo:2:025:2 -115 31 = 55534243 7f000000 00400000 80000a28 00000016 66000020 00000000 000000
d84d1180 1617520130 C Bo:2:025:2 0 31 >
d84d1a80 1617520261 S Bi:2:025:1 -115 16384 <
d84d1a80 1617520819 C Bi:2:025:1 0 16384 = 00000000 00000000 00000000 00000000 00000000 00000000 00000000 00000000
d84d1c00 1617520906 S Bi:2:025:1 -115 13 <
d84d1c00 1617521040 C Bi:2:025:1 0 13 = 55534253 7f000000 00000000 00
d84d1980 1617521290 S Bo:2:025:2 -115 31 = 55534243 80000000 00400000 80000a28 00000016 86000020 00000000 000000
d84d1980 1617521399 C Bo:2:025:2 0 31 >
d84d1680 1617521450 S Bi:2:025:1 -115 16384 <
d84d1680 1617522055 C Bi:2:025:1 0 16384 = 00000000 00000000 00000000 00000000 00000000 00000000 00000000 00000000
d84d1700 1617522139 S Bi:2:025:1 -115 13 <
d84d1700 1617522274 C Bi:2:025:1 0 13 = 55534253 80000000 00000000 00
d84d1580 1617522543 S Bo:2:025:2 -115 31 = 55534243 81000000 00400000 80000a28 00000016 a6000020 00000000 000000
d84d1580 1617522648 C Bo:2:025:2 0 31 >
d84d1000 1617522696 S Bi:2:025:1 -115 16384 <
d84d1000 1617523247 C Bi:2:025:1 0 16384 = 00000000 00000000 00000000 00000000 00000000 00000000 00000000 00000000
d84d1300 1617523471 S Bi:2:025:1 -115 13 <
d84d1300 1617523523 C Bi:2:025:1 0 13 = 55534253 81000000 00000000 00
d84d1100 1617523825 S Bo:2:025:2 -115 31 = 55534243 82000000 00400000 80000a28 00000016 c6000020 00000000 000000
d84d1100 1617523908 C Bo:2:025:2 0 31 >
d84d1b80 1617524273 S Bi:2:025:1 -115 16384 <
d84d1b80 1617524828 C Bi:2:025:1 0 16384 = 00000000 00000000 00000000 00000000 00000000 00000000 00000000 00000000
d84d1780 1617524932 S Bi:2:025:1 -115 13 <
d84d1780 1617525051 C Bi:2:025:1 0 13 = 55534253 82000000 00000000 00
d84d1780 1617525320 S Bo:2:025:2 -115 31 = 55534243 83000000 00400000 80000a28 00000016 e6000020 00000000 000000
d84d1780 1617525413 C Bo:2:025:2 0 31 >
d84d1b80 1617525578 S Bi:2:025:1 -115 16384 <
d84d1b80 1617526175 C Bi:2:025:1 0 16384 = 00000000 00000000 00000000 00000000 00000000 00000000 00000000 00000000
d84d1100 1617526265 S Bi:2:025:1 -115 13 <
d84d1100 1617526401 C Bi:2:025:1 0 13 = 55534253 83000000 00000000 00
d84a1800 1617526734 S Bo:2:025:2 -115 31 = 55534243 84000000 00400000 80000a28 00000017 06000020 00000000 000000
d84a1800 1617526802 C Bo:2:025:2 0 31 >
d84a1800 1617526880 S Bi:2:025:1 -115 16384 <
d84a1800 1617527442 C Bi:2:025:1 0 16384 = 00000000 00000000 00000000 00000000 00000000 00000000 00000000 00000000
d84a1800 1617527600 S Bi:2:025:1 -115 13 <
d84a1800 1617527782 C Bi:2:025:1 0 13 = 55534253 84000000 00000000 00
d84a1800 1617528343 S Bo:2:025:2 -115 31 = 55534243 85000000 00400000 80000a28 00000017 26000020 00000000 000000
d84a1800 1617528404 C Bo:2:025:2 0 31 >
d84a1800 1617528488 S Bi:2:025:1 -115 16384 <
d84a1800 1617529056 C Bi:2:025:1 0 16384 = 00000000 00000000 00000000 00000000 00000000 00000000 00000000 00000000
d84a1800 1617529154 S Bi:2:025:1 -115 13 <
d84a1800 1617529273 C Bi:2:025:1 0 13 = 55534253 85000000 00000000 00
d84a1800 1617529553 S Bo:2:025:2 -115 31 = 55534243 86000000 00400000 80000a28 00000017 46000020 00000000 000000
d84a1800 1617529652 C Bo:2:025:2 0 31 >
d84a1800 1617529747 S Bi:2:025:1 -115 16384 <
d84a1800 1617530297 C Bi:2:025:1 0 16384 = 00000000 00000000 00000000 00000000 00000000 00000000 00000000 00000000
d84a1800 1617530388 S Bi:2:025:1 -115 13 <
d84a1800 1617530443 C Bi:2:025:1 0 13 = 55534253 86000000 00000000 00
d84a1800 1617530681 S Bo:2:025:2 -115 31 = 55534243 87000000 00400000 80000a28 00000017 66000020 00000000 000000
d84a1800 1617530794 C Bo:2:025:2 0 31 >
d84a1800 1617530927 S Bi:2:025:1 -115 16384 <
d84a1800 1617531454 C Bi:2:025:1 0 16384 = 00000000 00000000 00000000 00000000 00000000 00000000 00000000 00000000
d84a1800 1617531527 S Bi:2:025:1 -115 13 <
d84a1800 1617531646 C Bi:2:025:1 0 13 = 55534253 87000000 00000000 00
d84a1800 1617532030 S Bo:2:025:2 -115 31 = 55534243 88000000 00400000 80000a28 00000017 86000020 00000000 000000
d84a1800 1617532142 C Bo:2:025:2 0 31 >
d84a1800 1617532205 S Bi:2:025:1 -115 16384 <
d84a1800 1617532807 C Bi:2:025:1 0 16384 = 00000000 00000000 00000000 00000000 00000000 00000000 00000000 00000000
d84a1800 1617532890 S Bi:2:025:1 -115 13 <
d84a1800 1617533033 C Bi:2:025:1 0 13 = 55534253 88000000 00000000 00
d84a1800 1617533284 S Bo:2:025:2 -115 31 = 55534243 89000000 00400000 80000a28 00000017 a6000020 00000000 000000
d84a1800 1617533406 C Bo:2:025:2 0 31 >
d84a1800 1617533528 S Bi:2:025:1 -115 16384 <
d84a1800 1617534079 C Bi:2:025:1 0 16384 = 00000000 00000000 00000000 00000000 00000000 00000000 00000000 00000000
d84a1800 1617534147 S Bi:2:025:1 -115 13 <
d84a1800 1617534275 C Bi:2:025:1 0 13 = 55534253 89000000 00000000 00
d84a1800 1617534547 S Bo:2:025:2 -115 31 = 55534243 8a000000 00400000 80000a28 00000017 c6000020 00000000 000000
d84a1800 1617534646 C Bo:2:025:2 0 31 >
d84a1800 1617534708 S Bi:2:025:1 -115 16384 <
d84a1800 1617535284 C Bi:2:025:1 0 16384 = 00000000 00000000 00000000 00000000 00000000 00000000 00000000 00000000
d84a1800 1617535370 S Bi:2:025:1 -115 13 <
d84a1800 1617535529 C Bi:2:025:1 0 13 = 55534253 8a000000 00000000 00
d84a1800 1617535789 S Bo:2:025:2 -115 31 = 55534243 8b000000 00400000 80000a28 00000017 e6000020 00000000 000000
d84a1800 1617535900 C Bo:2:025:2 0 31 >
d84a1800 1617535962 S Bi:2:025:1 -115 16384 <
d84a1800 1617536543 C Bi:2:025:1 0 16384 = 00000000 00000000 00000000 00000000 00000000 00000000 00000000 00000000
d84a1800 1617536643 S Bi:2:025:1 -115 13 <
d84a1800 1617536779 C Bi:2:025:1 0 13 = 55534253 8b000000 00000000 00
d84a1800 1617537109 S Bo:2:025:2 -115 31 = 55534243 8c000000 00400000 80000a28 00000018 06000020 00000000 000000
d84a1800 1617537267 C Bo:2:025:2 0 31 >
d84a1800 1617537328 S Bi:2:025:1 -115 16384 <
d84a1800 1617538152 C Bi:2:025:1 0 16384 = 00000000 00000000 00000000 00000000 00000000 00000000 00000000 00000000
d84a1800 1617538291 S Bi:2:025:1 -115 13 <
d84a1800 1617538407 C Bi:2:025:1 0 13 = 55534253 8c000000 00000000 00
d84a1800 1617538721 S Bo:2:025:2 -115 31 = 55534243 8d000000 00400000 80000a28 00000018 26000020 00000000 000000
d84a1800 1617538794 C Bo:2:025:2 0 31 >
d84a1800 1617539027 S Bi:2:025:1 -115 16384 <
d84a1800 1617540127 C Bi:2:025:1 0 16384 = 00000000 00000000 00000000 00000000 00000000 00000000 00000000 00000000
d84a1800 1617540222 S Bi:2:025:1 -115 13 <
d84a1800 1617540412 C Bi:2:025:1 0 13 = 55534253 8d000000 00000000 00
d84a1800 1617540841 S Bo:2:025:2 -115 31 = 55534243 8e000000 00400000 80000a28 00000018 46000020 00000000 000000
d84a1800 1617540890 C Bo:2:025:2 0 31 >
d84a1800 1617541010 S Bi:2:025:1 -115 16384 <
d84a1800 1617542129 C Bi:2:025:1 0 16384 = 00000000 00000000 00000000 00000000 00000000 00000000 00000000 00000000
d84a1800 1617542269 S Bi:2:025:1 -115 13 <
d84a1800 1617542410 C Bi:2:025:1 0 13 = 55534253 8e000000 00000000 00
d84a1800 1617542728 S Bo:2:025:2 -115 31 = 55534243 8f000000 00400000 80000a28 00000018 66000020 00000000 000000
d84a1800 1617542798 C Bo:2:025:2 0 31 >
d84a1800 1617542861 S Bi:2:025:1 -115 16384 <
d84a1800 1617543826 C Bi:2:025:1 0 16384 = 00000000 00000000 00000000 00000000 00000000 00000000 00000000 00000000
d84a1800 1617543914 S Bi:2:025:1 -115 13 <
d84a1800 1617544040 C Bi:2:025:1 0 13 = 55534253 8f000000 00000000 00
d84a1800 1617544387 S Bo:2:025:2 -115 31 = 55534243 90000000 00400000 80000a28 00000018 86000020 00000000 000000
d84a1800 1617544515 C Bo:2:025:2 0 31 >
d84a1800 1617544592 S Bi:2:025:1 -115 16384 <
d84a1800 1617545195 C Bi:2:025:1 0 16384 = 00000000 00000000 00000000 00000000 00000000 00000000 00000000 00000000
d84a1800 1617545334 S Bi:2:025:1 -115 13 <
d84a1800 1617545396 C Bi:2:025:1 0 13 = 55534253 90000000 00000000 00
d8b32c80 1617545674 S Bo:2:025:2 -115 31 = 55534243 91000000 00400000 80000a28 00000018 a6000020 00000000 000000
d8b32c80 1617545778 C Bo:2:025:2 0 31 >
d1045c00 1617545880 S Bi:2:025:1 -115 16384 <
d1045c00 1617546408 C Bi:2:025:1 0 16384 = 00000000 00000000 00000000 00000000 00000000 00000000 00000000 00000000
d84d1300 1617546575 S Bi:2:025:1 -115 13 <
d84d1300 1617546662 C Bi:2:025:1 0 13 = 55534253 91000000 00000000 00
d84d1300 1617546975 S Bo:2:025:2 -115 31 = 55534243 92000000 00400000 80000a28 00000018 c6000020 00000000 000000
d84d1300 1617547037 C Bo:2:025:2 0 31 >
d84d1300 1617547128 S Bi:2:025:1 -115 16384 <
d84d1300 1617547691 C Bi:2:025:1 0 16384 = 00000000 00000000 00000000 00000000 00000000 00000000 00000000 00000000
d8b32d80 1617547810 S Bi:2:025:1 -115 13 <
d8b32d80 1617547900 C Bi:2:025:1 0 13 = 55534253 92000000 00000000 00
d8b32900 1617548494 S Bo:2:025:2 -115 31 = 55534243 93000000 00400000 80000a28 00000018 e6000020 00000000 000000
d8b32900 1617548641 C Bo:2:025:2 0 31 >
d8b32080 1617548689 S Bi:2:025:1 -115 16384 <
d8b32080 1617549243 C Bi:2:025:1 0 16384 = 00000000 00000000 00000000 00000000 00000000 00000000 00000000 00000000
d8b32280 1617549321 S Bi:2:025:1 -115 13 <
d8b32280 1617549401 C Bi:2:025:1 0 13 = 55534253 93000000 00000000 00
d8b32a80 1617549681 S Bo:2:025:2 -115 31 = 55534243 94000000 00400000 80000a28 00000019 06000020 00000000 000000
d8b32a80 1617549777 C Bo:2:025:2 0 31 >
d8b32f00 1617549820 S Bi:2:025:1 -115 16384 <
d8b32f00 1617550440 C Bi:2:025:1 0 16384 = 00000000 00000000 00000000 00000000 00000000 00000000 00000000 00000000
d84d1300 1617550519 S Bi:2:025:1 -115 13 <
d84d1300 1617550646 C Bi:2:025:1 0 13 = 55534253 94000000 00000000 00
d84d1300 1617550899 S Bo:2:025:2 -115 31 = 55534243 95000000 00400000 80000a28 00000019 26000020 00000000 000000
d84d1300 1617550999 C Bo:2:025:2 0 31 >
d84d1300 1617551059 S Bi:2:025:1 -115 16384 <
d84d1300 1617551607 C Bi:2:025:1 0 16384 = 00000000 00000000 00000000 00000000 00000000 00000000 00000000 00000000
d84d1300 1617551691 S Bi:2:025:1 -115 13 <
d84d1300 1617551777 C Bi:2:025:1 0 13 = 55534253 95000000 00000000 00
d84d1300 1617552031 S Bo:2:025:2 -115 31 = 55534243 96000000 00400000 80000a28 00000019 46000020 00000000 000000
d84d1300 1617552145 C Bo:2:025:2 0 31 >
d84d1300 1617552207 S Bi:2:025:1 -115 16384 <
d84d1300 1617552803 C Bi:2:025:1 0 16384 = 00000000 00000000 00000000 00000000 00000000 00000000 00000000 00000000
d84d1300 1617552873 S Bi:2:025:1 -115 13 <
d84d1300 1617553035 C Bi:2:025:1 0 13 = 55534253 96000000 00000000 00
d84d1300 1617553346 S Bo:2:025:2 -115 31 = 55534243 97000000 00400000 80000a28 00000019 66000020 00000000 000000
d84d1300 1617553410 C Bo:2:025:2 0 31 >
d84d1000 1617553683 S Bi:2:025:1 -115 16384 <
d84d1000 1617554195 C Bi:2:025:1 0 16384 = 00000000 00000000 00000000 00000000 00000000 00000000 00000000 00000000
d84d1580 1617554266 S Bi:2:025:1 -115 13 <
d84d1580 1617554384 C Bi:2:025:1 0 13 = 55534253 97000000 00000000 00
d84d1700 1617554669 S Bo:2:025:2 -115 31 = 55534243 98000000 00400000 80000a28 00000019 86000020 00000000 000000
d84d1700 1617554780 C Bo:2:025:2 0 31 >
d84d1680 1617555006 S Bi:2:025:1 -115 16384 <
d84d1680 1617555555 C Bi:2:025:1 0 16384 = 00000000 00000000 00000000 00000000 00000000 00000000 00000000 00000000
d84d1980 1617555616 S Bi:2:025:1 -115 13 <
d84d1980 1617555777 C Bi:2:025:1 0 13 = 55534253 98000000 00000000 00
d84d1c00 1617556031 S Bo:2:025:2 -115 31 = 55534243 99000000 00400000 80000a28 00000019 a6000020 00000000 000000
d84d1c00 1617556140 C Bo:2:025:2 0 31 >
d84d1a80 1617556474 S Bi:2:025:1 -115 16384 <
d84d1a80 1617557096 C Bi:2:025:1 0 16384 = 00000000 00000000 00000000 00000000 00000000 00000000 00000000 00000000
d84d1180 1617557327 S Bi:2:025:1 -115 13 <
d84d1180 1617557398 C Bi:2:025:1 0 13 = 55534253 99000000 00000000 00
d84d1d00 1617557729 S Bo:2:025:2 -115 31 = 55534243 9a000000 00400000 80000a28 00000019 c6000020 00000000 000000
d84d1d00 1617557802 C Bo:2:025:2 0 31 >
d84d1200 1617557964 S Bi:2:025:1 -115 16384 <
d84d1200 1617558559 C Bi:2:025:1 0 16384 = 00000000 00000000 00000000 00000000 00000000 00000000 00000000 00000000
d84d1900 1617558650 S Bi:2:025:1 -115 13 <
d84d1900 1617558782 C Bi:2:025:1 0 13 = 55534253 9a000000 00000000 00
d84d1600 1617559029 S Bo:2:025:2 -115 31 = 55534243 9b000000 00400000 80000a28 00000019 e6000020 00000000 000000
d84d1600 1617559132 C Bo:2:025:2 0 31 >
d84d1500 1617559178 S Bi:2:025:1 -115 16384 <
d84d1500 1617559723 C Bi:2:025:1 0 16384 = 00000000 00000000 00000000 00000000 00000000 00000000 00000000 00000000
d84d1380 1617559811 S Bi:2:025:1 -115 13 <
d84d1380 1617559898 C Bi:2:025:1 0 13 = 55534253 9b000000 00000000 00
d84d1b00 1617560120 S Bo:2:025:2 -115 31 = 55534243 9c000000 00400000 80000a28 0000001a 06000020 00000000 000000
d84d1b00 1617560172 C Bo:2:025:2 0 31 >
d84d1e00 1617560220 S Bi:2:025:1 -115 16384 <
d84d1e00 1617560818 C Bi:2:025:1 0 16384 = 00000000 00000000 00000000 00000000 00000000 00000000 00000000 00000000
d84d1e00 1617560910 S Bi:2:025:1 -115 13 <
d84d1e00 1617561031 C Bi:2:025:1 0 13 = 55534253 9c000000 00000000 00
d84d1b00 1617561255 S Bo:2:025:2 -115 31 = 55534243 9d000000 00400000 80000a28 0000001a 26000020 00000000 000000
d84d1b00 1617561391 C Bo:2:025:2 0 31 >
d84d1380 1617561437 S Bi:2:025:1 -115 16384 <
d84d1380 1617561979 C Bi:2:025:1 0 16384 = 00000000 00000000 00000000 00000000 00000000 00000000 00000000 00000000
d84d1500 1617562165 S Bi:2:025:1 -115 13 <
d84d1500 1617562275 C Bi:2:025:1 0 13 = 55534253 9d000000 00000000 00
d84d1600 1617562665 S Bo:2:025:2 -115 31 = 55534243 9e000000 00400000 80000a28 0000001a 46000020 00000000 000000
d84d1600 1617562796 C Bo:2:025:2 0 31 >
d84d1900 1617562840 S Bi:2:025:1 -115 16384 <
d84d1900 1617563442 C Bi:2:025:1 0 16384 = 00000000 00000000 00000000 00000000 00000000 00000000 00000000 00000000
d84d1200 1617563498 S Bi:2:025:1 -115 13 <
d84d1200 1617563647 C Bi:2:025:1 0 13 = 55534253 9e000000 00000000 00
d84d1d00 1617563883 S Bo:2:025:2 -115 31 = 55534243 9f000000 00400000 80000a28 0000001a 66000020 00000000 000000
d84d1d00 1617564032 C Bo:2:025:2 0 31 >
d84d1180 1617564077 S Bi:2:025:1 -115 16384 <
d84d1180 1617564707 C Bi:2:025:1 0 16384 = 00000000 00000000 00000000 00000000 00000000 00000000 00000000 00000000
d84d1a80 1617564769 S Bi:2:025:1 -115 13 <
d84d1a80 1617564899 C Bi:2:025:1 0 13 = 55534253 9f000000 00000000 00
d84d1c00 1617565139 S Bo:2:025:2 -115 31 = 55534243 a0000000 00400000 80000a28 0000001a 86000020 00000000 000000
d84d1c00 1617565251 C Bo:2:025:2 0 31 >
d84d1980 1617565301 S Bi:2:025:1 -115 16384 <
d84d1980 1617565838 C Bi:2:025:1 0 16384 = 00000000 00000000 00000000 00000000 00000000 00000000 00000000 00000000
d84d1680 1617565923 S Bi:2:025:1 -115 13 <
d84d1680 1617566039 C Bi:2:025:1 0 13 = 55534253 a0000000 00000000 00
d84d1700 1617566342 S Bo:2:025:2 -115 31 = 55534243 a1000000 00400000 80000a28 0000001a a6000020 00000000 000000
d84d1700 1617566402 C Bo:2:025:2 0 31 >
d84d1580 1617566455 S Bi:2:025:1 -115 16384 <
d84d1580 1617567055 C Bi:2:025:1 0 16384 = 00000000 00000000 00000000 00000000 00000000 00000000 00000000 00000000
d84d1000 1617567160 S Bi:2:025:1 -115 13 <
d84d1000 1617567274 C Bi:2:025:1 0 13 = 55534253 a1000000 00000000 00
d84d1300 1617567607 S Bo:2:025:2 -115 31 = 55534243 a2000000 00400000 80000a28 0000001a c6000020 00000000 000000
d84d1300 1617567668 C Bo:2:025:2 0 31 >
d84d1100 1617567794 S Bi:2:025:1 -115 16384 <
d84d1100 1617568284 C Bi:2:025:1 0 16384 = 00000000 00000000 00000000 00000000 00000000 00000000 00000000 00000000
d84d1b80 1617568370 S Bi:2:025:1 -115 13 <
d84d1b80 1617568552 C Bi:2:025:1 0 13 = 55534253 a2000000 00000000 00
d84d1780 1617568790 S Bo:2:025:2 -115 31 = 55534243 a3000000 00400000 80000a28 0000001a e6000020 00000000 000000
d84d1780 1617568899 C Bo:2:025:2 0 31 >
d84d1780 1617568948 S Bi:2:025:1 -115 16384 <
d84d1780 1617569543 C Bi:2:025:1 0 16384 = 00000000 00000000 00000000 00000000 00000000 00000000 00000000 00000000
d84d1b80 1617569640 S Bi:2:025:1 -115 13 <
d84d1b80 1617569778 C Bi:2:025:1 0 13 = 55534253 a3000000 00000000 00
d84d1100 1617570039 S Bo:2:025:2 -115 31 = 55534243 a4000000 00400000 80000a28 0000001b 06000020 00000000 000000
d84d1100 1617570159 C Bo:2:025:2 0 31 >
d84d1300 1617570278 S Bi:2:025:1 -115 16384 <
d84d1300 1617570817 C Bi:2:025:1 0 16384 = 00000000 00000000 00000000 00000000 00000000 00000000 00000000 00000000
d84d1000 1617570891 S Bi:2:025:1 -115 13 <
d84d1000 1617571032 C Bi:2:025:1 0 13 = 55534253 a4000000 00000000 00
d84d1580 1617571256 S Bo:2:025:2 -115 31 = 55534243 a5000000 00400000 80000a28 0000001b 26000020 00000000 000000
d84d1580 1617571365 C Bo:2:025:2 0 31 >
d84d1700 1617571413 S Bi:2:025:1 -115 16384 <
d84d1700 1617571949 C Bi:2:025:1 0 16384 = 00000000 00000000 00000000 00000000 00000000 00000000 00000000 00000000
d84d1680 1617572074 S Bi:2:025:1 -115 13 <
d84d1680 1617572161 C Bi:2:025:1 0 13 = 55534253 a5000000 00000000 00
d84d1980 1617572458 S Bo:2:025:2 -115 31 = 55534243 a6000000 00400000 80000a28 0000001b 46000020 00000000 000000
d84d1980 1617572536 C Bo:2:025:2 0 31 >
d84d1c00 1617572623 S Bi:2:025:1 -115 16384 <
d84d1c00 1617573206 C Bi:2:025:1 0 16384 = 00000000 00000000 00000000 00000000 00000000 00000000 00000000 00000000
d84d1c00 1617573277 S Bi:2:025:1 -115 13 <
d84d1c00 1617573397 C Bi:2:025:1 0 13 = 55534253 a6000000 00000000 00
d84d1c00 1617573625 S Bo:2:025:2 -115 31 = 55534243 a7000000 00400000 80000a28 0000001b 66000020 00000000 000000
d84d1c00 1617573667 C Bo:2:025:2 0 31 >
d84d1c00 1617573717 S Bi:2:025:1 -115 16384 <
d84d1c00 1617574297 C Bi:2:025:1 0 16384 = 00000000 00000000 00000000 00000000 00000000 00000000 00000000 00000000
d84d1c00 1617574387 S Bi:2:025:1 -115 13 <
d84d1c00 1617574436 C Bi:2:025:1 0 13 = 55534253 a7000000 00000000 00
d84d1c00 1617574670 S Bo:2:025:2 -115 31 = 55534243 a8000000 00400000 80000a28 0000001b 86000020 00000000 000000
d84d1c00 1617574782 C Bo:2:025:2 0 31 >
d84d1c00 1617574838 S Bi:2:025:1 -115 16384 <
d84d1c00 1617575438 C Bi:2:025:1 0 16384 = 00000000 00000000 00000000 00000000 00000000 00000000 00000000 00000000
d84d1c00 1617575508 S Bi:2:025:1 -115 13 <
d84d1c00 1617575646 C Bi:2:025:1 0 13 = 55534253 a8000000 00000000 00
d84d1c00 1617575874 S Bo:2:025:2 -115 31 = 55534243 a9000000 00400000 80000a28 0000001b a6000020 00000000 000000
d84d1c00 1617575917 C Bo:2:025:2 0 31 >
d84d1c00 1617575972 S Bi:2:025:1 -115 16384 <
d84d1c00 1617576557 C Bi:2:025:1 0 16384 = 00000000 00000000 00000000 00000000 00000000 00000000 00000000 00000000
d84d1c00 1617576669 S Bi:2:025:1 -115 13 <
d84d1c00 1617576784 C Bi:2:025:1 0 13 = 55534253 a9000000 00000000 00
d84d1c00 1617577067 S Bo:2:025:2 -115 31 = 55534243 aa000000 00400000 80000a28 0000001b c6000020 00000000 000000
d84d1c00 1617577141 C Bo:2:025:2 0 31 >
d84d1c00 1617577205 S Bi:2:025:1 -115 16384 <
d84d1c00 1617577819 C Bi:2:025:1 0 16384 = 00000000 00000000 00000000 00000000 00000000 00000000 00000000 00000000
d84d1c00 1617577900 S Bi:2:025:1 -115 13 <
d84d1c00 1617578005 C Bi:2:025:1 0 13 = 55534253 aa000000 00000000 00
d84d1c00 1617578257 S Bo:2:025:2 -115 31 = 55534243 ab000000 00400000 80000a28 0000001b e6000020 00000000 000000
d84d1c00 1617578366 C Bo:2:025:2 0 31 >
d84d1c00 1617578432 S Bi:2:025:1 -115 16384 <
d84d1c00 1617578965 C Bi:2:025:1 0 16384 = 00000000 00000000 00000000 00000000 00000000 00000000 00000000 00000000
d84d1c00 1617579045 S Bi:2:025:1 -115 13 <
d84d1c00 1617579148 C Bi:2:025:1 0 13 = 55534253 ab000000 00000000 00
d84d1c00 1617579406 S Bo:2:025:2 -115 31 = 55534243 ac000000 00400000 80000a28 0000001c 06000020 00000000 000000
d84d1c00 1617579514 C Bo:2:025:2 0 31 >
d84d1c00 1617579571 S Bi:2:025:1 -115 16384 <
d84d1c00 1617580126 C Bi:2:025:1 0 16384 = 00000000 00000000 00000000 00000000 00000000 00000000 00000000 00000000
d84d1a80 1617580196 S Bi:2:025:1 -115 13 <
d84d1a80 1617580306 C Bi:2:025:1 0 13 = 55534253 ac000000 00000000 00
d84d1180 1617580545 S Bo:2:025:2 -115 31 = 55534243 ad000000 00400000 80000a28 0000001c 26000020 00000000 000000
d84d1180 1617580658 C Bo:2:025:2 0 31 >
d84d1d00 1617580699 S Bi:2:025:1 -115 16384 <
d84d1d00 1617581251 C Bi:2:025:1 0 16384 = 00000000 00000000 00000000 00000000 00000000 00000000 00000000 00000000
d84d1200 1617581305 S Bi:2:025:1 -115 13 <
d84d1200 1617581398 C Bi:2:025:1 0 13 = 55534253 ad000000 00000000 00
d84d1900 1617581632 S Bo:2:025:2 -115 31 = 55534243 ae000000 00400000 80000a28 0000001c 46000020 00000000 000000
d84d1900 1617581744 C Bo:2:025:2 0 31 >
d84d1600 1617581850 S Bi:2:025:1 -115 16384 <
d84d1600 1617582401 C Bi:2:025:1 0 16384 = 00000000 00000000 00000000 00000000 00000000 00000000 00000000 00000000
d84d1500 1617582510 S Bi:2:025:1 -115 13 <
d84d1500 1617582649 C Bi:2:025:1 0 13 = 55534253 ae000000 00000000 00
d84d1380 1617582875 S Bo:2:025:2 -115 31 = 55534243 af000000 00400000 80000a28 0000001c 66000020 00000000 000000
d84d1380 1617582919 C Bo:2:025:2 0 31 >
d84d1b00 1617582961 S Bi:2:025:1 -115 16384 <
d84d1b00 1617583553 C Bi:2:025:1 0 16384 = 00000000 00000000 00000000 00000000 00000000 00000000 00000000 00000000
d84d1e00 1617583641 S Bi:2:025:1 -115 13 <
d84d1e00 1617583777 C Bi:2:025:1 0 13 = 55534253 af000000 00000000 00
d84d1e00 1617584047 S Bo:2:025:2 -115 31 = 55534243 b0000000 00400000 80000a28 0000001c 86000020 00000000 000000
d84d1e00 1617584141 C Bo:2:025:2 0 31 >
d84d1b00 1617584257 S Bi:2:025:1 -115 16384 <
d84d1b00 1617584826 C Bi:2:025:1 0 16384 = 00000000 00000000 00000000 00000000 00000000 00000000 00000000 00000000
d84d1380 1617584886 S Bi:2:025:1 -115 13 <
d84d1380 1617585031 C Bi:2:025:1 0 13 = 55534253 b0000000 00000000 00
d84d1500 1617585278 S Bo:2:025:2 -115 31 = 55534243 b1000000 00400000 80000a28 0000001c a6000020 00000000 000000
d84d1500 1617585410 C Bo:2:025:2 0 31 >
d84d1600 1617585452 S Bi:2:025:1 -115 16384 <
d84d1600 1617586036 C Bi:2:025:1 0 16384 = 00000000 00000000 00000000 00000000 00000000 00000000 00000000 00000000
d84d1900 1617586102 S Bi:2:025:1 -115 13 <
d84d1900 1617586159 C Bi:2:025:1 0 13 = 55534253 b1000000 00000000 00
d84d1200 1617586475 S Bo:2:025:2 -115 31 = 55534243 b2000000 00400000 80000a28 0000001c c6000020 00000000 000000
d84d1200 1617586536 C Bo:2:025:2 0 31 >
d84d1d00 1617586583 S Bi:2:025:1 -115 16384 <
d84d1d00 1617587127 C Bi:2:025:1 0 16384 = 00000000 00000000 00000000 00000000 00000000 00000000 00000000 00000000
d84d1180 1617587246 S Bi:2:025:1 -115 13 <
d84d1180 1617587420 C Bi:2:025:1 0 13 = 55534253 b2000000 00000000 00
d84d1a80 1617587763 S Bo:2:025:2 -115 31 = 55534243 b3000000 00400000 80000a28 0000001c e6000020 00000000 000000
d84d1a80 1617587879 C Bo:2:025:2 0 31 >
d84d1c00 1617587932 S Bi:2:025:1 -115 16384 <
d84d1c00 1617588461 C Bi:2:025:1 0 16384 = 00000000 00000000 00000000 00000000 00000000 00000000 00000000 00000000
d84d1980 1617588532 S Bi:2:025:1 -115 13 <
d84d1980 1617588651 C Bi:2:025:1 0 13 = 55534253 b3000000 00000000 00
d84d1680 1617588886 S Bo:2:025:2 -115 31 = 55534243 b4000000 00400000 80000a28 0000001d 06000020 00000000 000000
d84d1680 1617589015 C Bo:2:025:2 0 31 >
d84d1700 1617589061 S Bi:2:025:1 -115 16384 <
d84d1700 1617589705 C Bi:2:025:1 0 16384 = 00000000 00000000 00000000 00000000 00000000 00000000 00000000 00000000
d84d1580 1617589777 S Bi:2:025:1 -115 13 <
d84d1580 1617589903 C Bi:2:025:1 0 13 = 55534253 b4000000 00000000 00
d84d1000 1617590147 S Bo:2:025:2 -115 31 = 55534243 b5000000 00400000 80000a28 0000001d 26000020 00000000 000000
d84d1000 1617590263 C Bo:2:025:2 0 31 >
d84d1300 1617590310 S Bi:2:025:1 -115 16384 <
d84d1300 1617590856 C Bi:2:025:1 0 16384 = 00000000 00000000 00000000 00000000 00000000 00000000 00000000 00000000
d84d1100 1617590927 S Bi:2:025:1 -115 13 <
d84d1100 1617591037 C Bi:2:025:1 0 13 = 55534253 b5000000 00000000 00
d84d1b80 1617591299 S Bo:2:025:2 -115 31 = 55534243 b6000000 00400000 80000a28 0000001d 46000020 00000000 000000
d84d1b80 1617591400 C Bo:2:025:2 0 31 >
d84d1780 1617591450 S Bi:2:025:1 -115 16384 <
d84d1780 1617592000 C Bi:2:025:1 0 16384 = 00000000 00000000 00000000 00000000 00000000 00000000 00000000 00000000
d84d1780 1617592059 S Bi:2:025:1 -115 13 <
d84d1780 1617592153 C Bi:2:025:1 0 13 = 55534253 b6000000 00000000 00
d8b32d00 1617592450 S Bo:2:025:2 -115 31 = 55534243 b7000000 00400000 80000a28 0000001d 66000020 00000000 000000
d8b32d00 1617592535 C Bo:2:025:2 0 31 >
d8b32d00 1617592591 S Bi:2:025:1 -115 16384 <
d8b32d00 1617593195 C Bi:2:025:1 0 16384 = 00000000 00000000 00000000 00000000 00000000 00000000 00000000 00000000
d8b32d00 1617593281 S Bi:2:025:1 -115 13 <
d8b32d00 1617593427 C Bi:2:025:1 0 13 = 55534253 b7000000 00000000 00
d8b32d00 1617593675 S Bo:2:025:2 -115 31 = 55534243 b8000000 00400000 80000a28 0000001d 86000020 00000000 000000
d8b32d00 1617593783 C Bo:2:025:2 0 31 >
d8b32d00 1617593906 S Bi:2:025:1 -115 16384 <
d8b32d00 1617594443 C Bi:2:025:1 0 16384 = 00000000 00000000 00000000 00000000 00000000 00000000 00000000 00000000
d8b32d00 1617594512 S Bi:2:025:1 -115 13 <
d8b32d00 1617594646 C Bi:2:025:1 0 13 = 55534253 b8000000 00000000 00
d8b32d00 1617594889 S Bo:2:025:2 -115 31 = 55534243 b9000000 00400000 80000a28 0000001d a6000020 00000000 000000
d8b32d00 1617594998 C Bo:2:025:2 0 31 >
d8b32d00 1617595049 S Bi:2:025:1 -115 16384 <
d8b32d00 1617595597 C Bi:2:025:1 0 16384 = 00000000 00000000 00000000 00000000 00000000 00000000 00000000 00000000
d8b32d00 1617595678 S Bi:2:025:1 -115 13 <
d8b32d00 1617595801 C Bi:2:025:1 0 13 = 55534253 b9000000 00000000 00
d8b32d00 1617596328 S Bo:2:025:2 -115 31 = 55534243 ba000000 00400000 80000a28 0000001d c6000020 00000000 000000
d8b32d00 1617596391 C Bo:2:025:2 0 31 >
d8b32d00 1617596463 S Bi:2:025:1 -115 16384 <
d8b32d00 1617597066 C Bi:2:025:1 0 16384 = 00000000 00000000 00000000 00000000 00000000 00000000 00000000 00000000
d8b32d00 1617597179 S Bi:2:025:1 -115 13 <
d8b32d00 1617597277 C Bi:2:025:1 0 13 = 55534253 ba000000 00000000 00
d8b32d00 1617597577 S Bo:2:025:2 -115 31 = 55534243 bb000000 00400000 80000a28 0000001d e6000020 00000000 000000
d8b32d00 1617597659 C Bo:2:025:2 0 31 >
d8b32d00 1617597839 S Bi:2:025:1 -115 16384 <
d8b32d00 1617598445 C Bi:2:025:1 0 16384 = 00000000 00000000 00000000 00000000 00000000 00000000 00000000 00000000
d8b32d00 1617598521 S Bi:2:025:1 -115 13 <
d8b32d00 1617598647 C Bi:2:025:1 0 13 = 55534253 bb000000 00000000 00
d8b32d00 1617598963 S Bo:2:025:2 -115 31 = 55534243 bc000000 00400000 80000a28 0000001e 06000020 00000000 000000
d8b32d00 1617599048 C Bo:2:025:2 0 31 >
d8b32d00 1617599300 S Bi:2:025:1 -115 16384 <
d8b32d00 1617599817 C Bi:2:025:1 0 16384 = 00000000 00000000 00000000 00000000 00000000 00000000 00000000 00000000
d8b32d00 1617599901 S Bi:2:025:1 -115 13 <
d8b32d00 1617600023 C Bi:2:025:1 0 13 = 55534253 bc000000 00000000 00
d8b32d00 1617600276 S Bo:2:025:2 -115 31 = 55534243 bd000000 00400000 80000a28 0000001e 26000020 00000000 000000
d8b32d00 1617600367 C Bo:2:025:2 0 31 >
d8b32d00 1617600422 S Bi:2:025:1 -115 16384 <
d8b32d00 1617600947 C Bi:2:025:1 0 16384 = 00000000 00000000 00000000 00000000 00000000 00000000 00000000 00000000
d8b32d00 1617601044 S Bi:2:025:1 -115 13 <
d8b32d00 1617601152 C Bi:2:025:1 0 13 = 55534253 bd000000 00000000 00
d8b32d00 1617601409 S Bo:2:025:2 -115 31 = 55534243 be000000 00400000 80000a28 0000001e 46000020 00000000 000000
d8b32d00 1617601491 C Bo:2:025:2 0 31 >
d8b32d00 1617601546 S Bi:2:025:1 -115 16384 <
d8b32d00 1617602082 C Bi:2:025:1 0 16384 = 00000000 00000000 00000000 00000000 00000000 00000000 00000000 00000000
d8b32d00 1617602158 S Bi:2:025:1 -115 13 <
d8b32d00 1617602274 C Bi:2:025:1 0 13 = 55534253 be000000 00000000 00
d8b32d00 1617602506 S Bo:2:025:2 -115 31 = 55534243 bf000000 00400000 80000a28 0000001e 66000020 00000000 000000
d8b32d00 1617602617 C Bo:2:025:2 0 31 >
d8b32d00 1617602670 S Bi:2:025:1 -115 16384 <
d8b32d00 1617603205 C Bi:2:025:1 0 16384 = 00000000 00000000 00000000 00000000 00000000 00000000 00000000 00000000
d8b32d00 1617603293 S Bi:2:025:1 -115 13 <
d8b32d00 1617603418 C Bi:2:025:1 0 13 = 55534253 bf000000 00000000 00
d8b32d00 1617603652 S Bo:2:025:2 -115 31 = 55534243 c0000000 00400000 80000a28 0000001e 86000020 00000000 000000
d8b32d00 1617603746 C Bo:2:025:2 0 31 >
d8b32d00 1617603800 S Bi:2:025:1 -115 16384 <
d8b32d00 1617604346 C Bi:2:025:1 0 16384 = 00000000 00000000 00000000 00000000 00000000 00000000 00000000 00000000
d8b32d00 1617604540 S Bi:2:025:1 -115 13 <
d8b32d00 1617604649 C Bi:2:025:1 0 13 = 55534253 c0000000 00000000 00
d8b32d00 1617605168 S Bo:2:025:2 -115 31 = 55534243 c1000000 00400000 80000a28 0000001e a6000020 00000000 000000
d8b32d00 1617605265 C Bo:2:025:2 0 31 >
d8b32d00 1617605390 S Bi:2:025:1 -115 16384 <
d8b32d00 1617605933 C Bi:2:025:1 0 16384 = 00000000 00000000 00000000 00000000 00000000 00000000 00000000 00000000
d8b32d00 1617606148 S Bi:2:025:1 -115 13 <
d8b32d00 1617606303 C Bi:2:025:1 0 13 = 55534253 c1000000 00000000 00
d8b32f80 1617606851 S Bo:2:025:2 -115 31 = 55534243 c2000000 00400000 80000a28 0000001e c6000020 00000000 000000
d8b32f80 1617606904 C Bo:2:025:2 0 31 >
d8b32c00 1617607049 S Bi:2:025:1 -115 16384 <
d8b32c00 1617607570 C Bi:2:025:1 0 16384 = 00000000 00000000 00000000 00000000 00000000 00000000 00000000 00000000
d84a1200 1617607657 S Bi:2:025:1 -115 13 <
d84a1200 1617607780 C Bi:2:025:1 0 13 = 55534253 c2000000 00000000 00
d84a1200 1617608226 S Bo:2:025:2 -115 31 = 55534243 c3000000 00400000 80000a28 0000001e e6000020 00000000 000000
d84a1200 1617608269 C Bo:2:025:2 0 31 >
d84a1200 1617608420 S Bi:2:025:1 -115 16384 <
d84a1200 1617608953 C Bi:2:025:1 0 16384 = 00000000 00000000 00000000 00000000 00000000 00000000 00000000 00000000
d84a1200 1617609040 S Bi:2:025:1 -115 13 <
d84a1200 1617609149 C Bi:2:025:1 0 13 = 55534253 c3000000 00000000 00
d84a1200 1617609421 S Bo:2:025:2 -115 31 = 55534243 c4000000 00400000 80000a28 0000001f 06000020 00000000 000000
d84a1200 1617609524 C Bo:2:025:2 0 31 >
d84a1200 1617609626 S Bi:2:025:1 -115 16384 <
d84a1200 1617610187 C Bi:2:025:1 0 16384 = 00000000 00000000 00000000 00000000 00000000 00000000 00000000 00000000
d84a1a80 1617610273 S Bi:2:025:1 -115 13 <
d84a1a80 1617610427 C Bi:2:025:1 0 13 = 55534253 c4000000 00000000 00
d84a1380 1617610681 S Bo:2:025:2 -115 31 = 55534243 c5000000 00400000 80000a28 0000001f 26000020 00000000 000000
d84a1380 1617610793 C Bo:2:025:2 0 31 >
d1045600 1617610856 S Bi:2:025:1 -115 16384 <
d1045600 1617611443 C Bi:2:025:1 0 16384 = 00000000 00000000 00000000 00000000 00000000 00000000 00000000 00000000
d1045600 1617611528 S Bi:2:025:1 -115 13 <
d1045600 1617611656 C Bi:2:025:1 0 13 = 55534253 c5000000 00000000 00
d1045600 1617612091 S Bo:2:025:2 -115 31 = 55534243 c6000000 00400000 80000a28 0000001f 46000020 00000000 000000
d1045600 1617612148 C Bo:2:025:2 0 31 >
d1045600 1617612248 S Bi:2:025:1 -115 16384 <
d1045600 1617612807 C Bi:2:025:1 0 16384 = 00000000 00000000 00000000 00000000 00000000 00000000 00000000 00000000
d8b32e00 1617612906 S Bi:2:025:1 -115 13 <
d8b32e00 1617613036 C Bi:2:025:1 0 13 = 55534253 c6000000 00000000 00
d8b32980 1617613173 S Bo:2:025:2 -115 31 = 55534243 c7000000 00400000 80000a28 0000001f 66000020 00000000 000000
d8b32980 1617613267 C Bo:2:025:2 0 31 >
d8b32980 1617613595 S Bi:2:025:1 -115 16384 <
d8b32980 1617614176 C Bi:2:025:1 0 16384 = 00000000 00000000 00000000 00000000 00000000 00000000 00000000 00000000
d8b32e00 1617614418 S Bi:2:025:1 -115 13 <
d8b32e00 1617614524 C Bi:2:025:1 0 13 = 55534253 c7000000 00000000 00
d8b32c00 1617614789 S Bo:2:025:2 -115 31 = 55534243 c8000000 00400000 80000a28 0000001f 86000020 00000000 000000
d8b32c00 1617614899 C Bo:2:025:2 0 31 >
d8b32f80 1617614947 S Bi:2:025:1 -115 16384 <
d8b32f80 1617615533 C Bi:2:025:1 0 16384 = 00000000 00000000 00000000 00000000 00000000 00000000 00000000 00000000
d8b32d00 1617615595 S Bi:2:025:1 -115 13 <
d8b32d00 1617615646 C Bi:2:025:1 0 13 = 55534253 c8000000 00000000 00
d8b32f00 1617615906 S Bo:2:025:2 -115 31 = 55534243 c9000000 00400000 80000a28 0000001f a6000020 00000000 000000
d8b32f00 1617616010 C Bo:2:025:2 0 31 >
d1045600 1617616070 S Bi:2:025:1 -115 16384 <
d1045600 1617616705 C Bi:2:025:1 0 16384 = 00000000 00000000 00000000 00000000 00000000 00000000 00000000 00000000
d1045600 1617616799 S Bi:2:025:1 -115 13 <
d1045600 1617616898 C Bi:2:025:1 0 13 = 55534253 c9000000 00000000 00
d1045600 1617617817 S Bo:2:025:2 -115 31 = 55534243 ca000000 00400000 80000a28 0000001f c6000020 00000000 000000
d1045600 1617617915 C Bo:2:025:2 0 31 >
d1045600 1617617977 S Bi:2:025:1 -115 16384 <
d1045600 1617618556 C Bi:2:025:1 0 16384 = 00000000 00000000 00000000 00000000 00000000 00000000 00000000 00000000
d1045600 1617618672 S Bi:2:025:1 -115 13 <
d1045600 1617618784 C Bi:2:025:1 0 13 = 55534253 ca000000 00000000 00
d1045600 1617619228 S Bo:2:025:2 -115 31 = 55534243 cb000000 00400000 80000a28 0000001f e6000020 00000000 000000
d1045600 1617619291 C Bo:2:025:2 0 31 >
d1045600 1617619377 S Bi:2:025:1 -115 16384 <
d1045600 1617620228 C Bi:2:025:1 0 16384 = 00000000 00000000 00000000 00000000 00000000 00000000 00000000 00000000
d1045600 1617620318 S Bi:2:025:1 -115 13 <
d1045600 1617620398 C Bi:2:025:1 0 13 = 55534253 cb000000 00000000 00
d1045600 1617620763 S Bo:2:025:2 -115 31 = 55534243 cc000000 00400000 80000a28 00000020 06000020 00000000 000000
d1045600 1617620806 C Bo:2:025:2 0 31 >
d1045600 1617620865 S Bi:2:025:1 -115 16384 <
d1045600 1617621504 C Bi:2:025:1 0 16384 = 00000000 00000000 00000000 00000000 00000000 00000000 00000000 00000000
d1045600 1617621576 S Bi:2:025:1 -115 13 <
d1045600 1617621647 C Bi:2:025:1 0 13 = 55534253 cc000000 00000000 00
d1045600 1617621883 S Bo:2:025:2 -115 31 = 55534243 cd000000 00400000 80000a28 00000020 26000020 00000000 000000
d1045600 1617622036 C Bo:2:025:2 0 31 >
d1045600 1617622158 S Bi:2:025:1 -115 16384 <
d1045600 1617622705 C Bi:2:025:1 0 16384 = 00000000 00000000 00000000 00000000 00000000 00000000 00000000 00000000
d1045600 1617622799 S Bi:2:025:1 -115 13 <
d1045600 1617622897 C Bi:2:025:1 0 13 = 55534253 cd000000 00000000 00
d1045600 1617623320 S Bo:2:025:2 -115 31 = 55534243 ce000000 00400000 80000a28 00000020 46000020 00000000 000000
d1045600 1617623387 C Bo:2:025:2 0 31 >
d1045600 1617623454 S Bi:2:025:1 -115 16384 <
d1045600 1617624028 C Bi:2:025:1 0 16384 = 00000000 00000000 00000000 00000000 00000000 00000000 00000000 00000000