ffff88006e616580 4022184563 S Ci:1:038:0 s 80 06 0100 0000 0012 18 <
ffff88006e616580 4022184698 C Ci:1:038:0 0 18 = 12011002 00000040 d80d0831 04010102 0301
ffff88006e616580 4022184722 S Ci:1:038:0 s 80 06 0f00 0000 0005 5 <
ffff88006e616580 4022184819 C Ci:1:038:0 0 5 = 050f1600 02
ffff88006e616580 4022184840 S Ci:1:038:0 s 80 06 0f00 0000 0016 22 <
ffff88006e616580 4022185070 C Ci:1:038:0 0 22 = 050f1600 02071002 06000000 0a100300 0e00010a 0002
ffff88006e616580 4022185099 S Ci:1:038:0 s 80 06 0200 0000 0009 9 <
ffff88006e616580 4022185195 C Ci:1:038:0 0 9 = 09022000 01010080 96
ffff88006e616580 4022185221 S Ci:1:038:0 s 80 06 0200 0000 0020 32 <
ffff88006e616580 4022185441 C Ci:1:038:0 0 32 = 09022000 01010080 96090400 00020806 50000705 81020002 00070502 02000200
ffff880071178c40 4022185507 S Ci:1:038:0 s 80 06 0300 0000 00ff 255 <
ffff880071178c40 4022185569 C Ci:1:038:0 0 4 = 04030904
ffff880071178c40 4022185591 S Ci:1:038:0 s 80 06 0302 0409 00ff 255 <
ffff880071178c40 4022185817 C Ci:1:038:0 0 34 = 22034f00 6e006c00 79004400 69007300 6b000000 00000000 00000000 00000000
ffff880071178c40 4022185829 S Ci:1:038:0 s 80 06 0301 0409 00ff 255 <
ffff880071178c40 4022186068 C Ci:1:038:0 0 18 = 12034e00 65007400 61006300 00000000 0000
ffff880071178c40 4022186079 S Ci:1:038:0 s 80 06 0303 0409 00ff 255 <
ffff880071178c40 4022186322 C Ci:1:038:0 0 34 = 22033600 37003900 32003900 43004200 43003100 35004400 44003800 33004500
ffff880070b38d00 4022186615 S Co:1:038:0 s 00 09 0001 0000 0000 0
ffff880070b38d00 4022186696 C Co:1:038:0 0 0
ffff88006ee5ac40 4022236861 S Bo:1:038:2 -115 31 = 55534243 00000000 08000000 80000a25 00000000 00000000 00000000 000000
ffff88006ee5ac40 4022236949 C Bo:1:038:2 0 31 >
ffff880070b38e80 4022237080 S Bi:1:038:1 -115 8 <
ffff880070b38e80 4022237198 C Bi:1:038:1 0 8 = 000063ff 00000800
ffff880070b38e80 4022237260 S Bi:1:038:1 -115 13 <
ffff880070b38e80 4022237322 C Bi:1:038:1 0 13 = 55534253 00000000 00000000 00
ffff880070b38e80 4022237521 S Bo:1:038:2 -115 31 = 55534243 01000000 00080000 80000a28 00000000 00000001 00000000 000000
ffff880070b38e80 4022237572 C Bo:1:038:2 0 31 >
ffff880070b38e80 4022237687 S Bi:1:038:1 -115 2048 <
ffff880070b38e80 4022238191 C Bi:1:038:1 0 2048 = 00000000 00000000 00000000 00000000 00000000 00000000 00000000 00000000
ffff880070b38e80 4022238266 S Bi:1:038:1 -115 13 <
ffff880070b38e80 4022238317 C Bi:1:038:1 -32 0
ffff88006ee5ac40 4022238396 S Bi:1:038:1 -115 13 <
ffff88006ee5ac40 4022238693 C Bi:1:038:1 -32 0
ffff88006ee5ac40 4022238767 S Bi:1:038:1 -115 13 <
ffff88006ee5ac40 4022239073 C Bi:1:038:1 -32 0
ffff88006ee5ac40 4022239144 S Bi:1:038:1 -115 13 <
ffff88006ee5ac40 4022239445 C Bi:1:038:1 -32 0
ffff88006ee5ac40 4022239515 S Bi:1:038:1 -115 13 <
ffff88006ee5ac40 4022239817 C Bi:1:038:1 -32 0
ffff880070164100 4022239972 S Co:1:003:0 s 23 03 0004 0004 0000 0
ffff880070164100 4022240068 C Co:1:003:0 0 0
ffff88006e75fd00 4022252558 S Ci:1:003:0 s a3 00 0000 0004 0004 4 <
ffff88006e75fd00 4022252693 C Ci:1:003:0 0 4 = 11050000
ffff88007084d700 4022268567 S Ci:1:003:0 s a3 00 0000 0004 0004 4 <
ffff88007084d700 4022268705 C Ci:1:003:0 0 4 = 03051000
ffff88007084d700 4022268722 S Co:1:003:0 s 23 01 0014 0004 0000 0
ffff88007084d700 4022268821 C Co:1:003:0 0 0
ffff88006e69f640 4022324579 S Ci:1:000:0 s 80 06 0100 0000 0040 64 <
ffff88006e69f640 4022328571 C Ci:1:000:0 -71 0
ffff88006e69f640 4022328760 S Ci:1:000:0 s 80 06 0100 0000 0040 64 <
ffff88006e69f640 4022332824 C Ci:1:000:0 -71 0
ffff88006e69f640 4022332837 S Ci:1:000:0 s 80 06 0100 0000 0040 64 <
ffff88006e69f640 4022337071 C Ci:1:000:0 -71 0
ffff88006e69f640 4022337082 S Co:1:003:0 s 23 03 0004 0004 0000 0
ffff88006e69f640 4022337203 C Co:1:003:0 0 0
ffff88006e69f640 4022352577 S Ci:1:003:0 s a3 00 0000 0004 0004 4 <
ffff88006e69f640 4022352700 C Ci:1:003:0 0 4 = 03051000
ffff88006e69f640 4022352717 S Co:1:003:0 s 23 01 0014 0004 0000 0
ffff88006e69f640 4022352820 C Co:1:003:0 0 0
ffff880070b38e80 4022512575 S Ci:1:000:0 s 80 06 0100 0000 0040 64 <
ffff880070b38e80 4022512713 C Ci:1:000:0 0 18 = 12011002 00000040 d80d0831 04010102 0301
ffff880070b38e80 4022512736 S Co:1:003:0 s 23 03 0004 0004 0000 0
ffff880070b38e80 4022512819 C Co:1:003:0 0 0
ffff88006eed6880 4022528569 S Ci:1:003:0 s a3 00 0000 0004 0004 4 <
ffff88006eed6880 4022528700 C Ci:1:003:0 0 4 = 03051000
ffff88006eed6880 4022528718 S Co:1:003:0 s 23 01 0014 0004 0000 0
ffff88006eed6880 4022528820 C Co:1:003:0 0 0
ffff88006eed6880 4022584571 S Co:1:000:0 s 00 05 0026 0000 0000 0
ffff88006eed6880 4022584700 C Co:1:000:0 0 0
ffff88006eed6880 4022604561 S Ci:1:038:0 s 80 06 0100 0000 0012 18 <
ffff88006eed6880 4022604700 C Ci:1:038:0 0 18 = 12011002 00000040 d80d0831 04010102 0301
ffff88006eed6880 4022604713 S Ci:1:038:0 s 80 06 0f00 0000 0005 5 <
ffff88006eed6880 4022604816 C Ci:1:038:0 0 5 = 050f1600 02
ffff88006eed6880 4022604828 S Ci:1:038:0 s 80 06 0f00 0000 0016 22 <
ffff88006eed6880 4022604944 C Ci:1:038:0 0 22 = 050f1600 02071002 06000000 0a100300 0e00010a 0002
ffff88006eed6880 4022604965 S Ci:1:038:0 s 80 06 0200 0000 0020 32 <
ffff88006eed6880 4022605196 C Ci:1:038:0 0 32 = 09022000 01010080 96090400 00020806 50000705 81020002 00070502 02000200
ffff88006eed6880 4022605215 S Ci:1:038:0 s 80 06 0303 0409 00ff 255 <
ffff88006eed6880 4022605442 C Ci:1:038:0 0 34 = 22033600 37003900 32003900 43004200 43003100 35004400 44003800 33004500
ffff88006eed6880 4022605455 S Co:1:038:0 s 00 09 0001 0000 0000 0
ffff88006eed6880 4022605581 C Co:1:038:0 0 0
ffff88006eeeed00 4022605643 S Bo:1:038:2 -115 31 = 55534243 01000000 00080000 80000a28 00000000 00000001 00000000 000000
ffff88006eeeed00 4022605693 C Bo:1:038:2 0 31 >
ffff88006e695c40 4022605803 S Bi:1:038:1 -115 2048 <
ffff88006e695c40 4022606069 C Bi:1:038:1 0 2048 = 00000000 00000000 00000000 00000000 00000000 00000000 00000000 00000000
ffff88006e695c40 4022606105 S Bi:1:038:1 -115 13 <
ffff88006e695c40 4022606195 C Bi:1:038:1 -32 0
ffff88006eeeed00 4022606288 S Bi:1:038:1 -115 13 <
ffff88006eeeed00 4022606567 C Bi:1:038:1 -32 0
ffff88006eeeed00 4022606642 S Bi:1:038:1 -115 13 <
ffff88006eeeed00 4022606943 C Bi:1:038:1 -32 0
ffff88006eeeed00 4022607015 S Bi:1:038:1 -115 13 <
ffff88006eeeed00 4022607319 C Bi:1:038:1 -32 0
ffff88006eeeed00 4022607388 S Bi:1:038:1 -115 13 <
ffff88006eeeed00 4022607695 C Bi:1:038:1 -32 0
ffff88007084d700 4022608567 S Co:1:003:0 s 23 03 0004 0004 0000 0
ffff88007084d700 4022608694 C Co:1:003:0 0 0
ffff88007084d700 4022624575 S Ci:1:003:0 s a3 00 0000 0004 0004 4 <
ffff88007084d700 4022624699 C Ci:1:003:0 0 4 = 03051000
ffff88007084d700 4022624717 S Co:1:003:0 s 23 01 0014 0004 0000 0
ffff88007084d700 4022624825 C Co:1:003:0 0 0
ffff88007084d700 4022680593 S Ci:1:000:0 s 80 06 0100 0000 0040 64 <
ffff88007084d700 4022680709 C Ci:1:000:0 0 18 = 12011002 00000040 d80d0831 04010102 0301
ffff88007084d700 4022680739 S Co:1:003:0 s 23 03 0004 0004 0000 0
ffff88007084d700 4022680819 C Co:1:003:0 0 0
ffff88006e695c40 4022696567 S Ci:1:003:0 s a3 00 0000 0004 0004 4 <
ffff88006e695c40 4022696697 C Ci:1:003:0 0 4 = 03051000
ffff88006e695c40 4022696712 S Co:1:003:0 s 23 01 0014 0004 0000 0
ffff88006e695c40 4022696826 C Co:1:003:0 0 0
ffff88007084d700 4022752575 S Co:1:000:0 s 00 05 0026 0000 0000 0
ffff88007084d700 4022752702 C Co:1:000:0 0 0
ffff88006eed6880 4022772574 S Ci:1:038:0 s 80 06 0100 0000 0012 18 <
ffff88006eed6880 4022772700 C Ci:1:038:0 0 18 = 12011002 00000040 d80d0831 04010102 0301
ffff88006eed6880 4022772719 S Ci:1:038:0 s 80 06 0f00 0000 0005 5 <
ffff88006eed6880 4022772821 C Ci:1:038:0 0 5 = 050f1600 02
ffff88006eed6880 4022772846 S Ci:1:038:0 s 80 06 0f00 0000 0016 22 <
ffff88006eed6880 4022773067 C Ci:1:038:0 0 22 = 050f1600 02071002 06000000 0a100300 0e00010a 0002
ffff88006eed6880 4022773081 S Ci:1:038:0 s 80 06 0200 0000 0020 32 <
ffff88006eed6880 4022773327 C Ci:1:038:0 0 32 = 09022000 01010080 96090400 00020806 50000705 81020002 00070502 02000200
ffff88006eed6880 4022773347 S Ci:1:038:0 s 80 06 0303 0409 00ff 255 <
ffff88006eed6880 4022773571 C Ci:1:038:0 0 34 = 22033600 37003900 32003900 43004200 43003100 35004400 44003800 33004500
ffff88006eed6880 4022773591 S Co:1:038:0 s 00 09 0001 0000 0000 0
ffff88006eed6880 4022773698 C Co:1:038:0 0 0
ffff8800712714c0 4022774544 S Ci:1:038:0 s a1 fe 0000 0000 0001 1 <
ffff8800712714c0 4022774697 C Ci:1:038:0 0 1 = 02
ffff88007015ef40 4023249359 S Ci:1:038:0 s 80 06 0303 0409 00ff 255 <
ffff88007015ef40 4023249705 C Ci:1:038:0 0 34 = 22033600 37003900 32003900 43004200 43003100 35004400 44003800 33004500
ffff88007015ef40 4023251270 S Ci:1:038:0 s 80 06 0300 0000 00ff 255 <
ffff88007015ef40 4023251448 C Ci:1:038:0 0 4 = 04030904
ffff88007015ef40 4023253278 S Ci:1:038:0 s 80 06 0302 0409 00ff 255 <
ffff88006e695c40 4023253320 S Ci:1:038:0 s 80 06 0301 0409 00ff 255 <
ffff88007015ef40 4023253574 C Ci:1:038:0 0 34 = 22034f00 6e006c00 79004400 69007300 6b000000 00000000 00000000 00000000
ffff88006e695c40 4023253582 C Ci:1:038:0 0 18 = 12034e00 65007400 61006300 00000000 0000
ffff88007015ef40 4023330450 S Bo:1:038:2 -115 31 = 55534243 50267703 24000000 80000612 00000024 00000000 00000000 000000
ffff88007015ef40 4023330579 C Bo:1:038:2 0 31 >
ffff88007015ef40 4023332245 S Bi:1:038:1 -115 36 <
ffff88007015ef40 4023332317 C Bi:1:038:1 0 36 = 05800612 47000002 4e657461 63000000 4f6e6c79 4469736b 00000000 00000000
ffff88007015ef40 4023333267 S Bi:1:038:1 -115 512 <
ffff88007015ef40 4023333323 C Bi:1:038:1 0 13 = 55534253 50267703 00000000 00
ffff88007015ef40 4023335417 S Bo:1:038:2 -115 31 = 55534243 40ca0904 4c000000 80000612 0000004c 00000000 00000000 000000
ffff88007015ef40 4023335442 C Bo:1:038:2 0 31 >
ffff88007015ef40 4023336643 S Bi:1:038:1 -115 76 <
ffff88007015ef40 4023336691 C Bi:1:038:1 0 76 = 05800612 47000002 4e657461 63000000 4f6e6c79 4469736b 00000000 00000000
ffff88007015ef40 4023338269 S Bi:1:038:1 -115 512 <
ffff88007015ef40 4023338447 C Bi:1:038:1 0 13 = 55534253 40ca0904 00000000 00
ffff88007015ef40 4023340385 S Bo:1:038:2 -115 31 = 55534243 50267703 00000000 00000ca2 00000080 00000000 00000000 000000
ffff88007015ef40 4023340443 C Bo:1:038:2 0 31 >
ffff88007015ef40 4023342241 S Bi:1:038:1 -115 512 <
ffff88007015ef40 4023342319 C Bi:1:038:1 0 13 = 55534253 50267703 00000000 01
ffff88007015ef40 4023344307 S Bo:1:038:2 -115 31 = 55534243 10fc3104 00000000 00000ca2 00000080 00000000 00000000 000000
ffff88007015ef40 4023344442 C Bo:1:038:2 0 31 >
ffff88007015ef40 4023345257 S Bi:1:038:1 -115 512 <
ffff88007015ef40 4023345320 C Bi:1:038:1 0 13 = 55534253 10fc3104 00000000 01
ffff88007015ef40 4023347418 S Bo:1:038:2 -115 31 = 55534243 10ccb003 00000000 00000ca2 00000080 00000000 00000000 000000
ffff88007015ef40 4023347571 C Bo:1:038:2 0 31 >
ffff88007015ef40 4023349252 S Bi:1:038:1 -115 512 <
ffff88007015ef40 4023349320 C Bi:1:038:1 0 13 = 55534253 10ccb003 00000000 01
ffff88007015ef40 4023351404 S Bo:1:038:2 -115 31 = 55534243 10209003 00000000 00000ca2 00000000 00000000 00000000 000000
ffff88007015ef40 4023351445 C Bo:1:038:2 0 31 >
ffff88007015ef40 4023353270 S Bi:1:038:1 -115 512 <
ffff88007015ef40 4023353451 C Bi:1:038:1 0 13 = 55534253 10209003 00000000 01
ffff88007015ef40 4023355418 S Bo:1:038:2 -115 31 = 55534243 10bcb303 00000000 00000ca2 00000000 00000000 00000000 000000
ffff88007015ef40 4023355570 C Bo:1:038:2 0 31 >
ffff8800701a0a00 4023357249 S Bi:1:038:1 -115 512 <
ffff8800701a0a00 4023357319 C Bi:1:038:1 0 13 = 55534253 10bcb303 00000000 01
ffff8800701a0a00 4023359399 S Bo:1:038:2 -115 31 = 55534243 10fc3104 00000000 00000ca2 00000000 00000000 00000000 000000
ffff8800701a0a00 4023359445 C Bo:1:038:2 0 31 >
ffff8800701a0a00 4023361251 S Bi:1:038:1 -115 512 <
ffff8800701a0a00 4023361323 C Bi:1:038:1 0 13 = 55534253 10fc3104 00000000 01
ffff8800701a0a00 4023363398 S Bo:1:038:2 -115 31 = 55534243 10fc3104 24000000 80000612 00000024 00000000 00000000 000000
ffff8800701a0a00 4023363447 C Bo:1:038:2 0 31 >
ffff8800701a0a00 4023365265 S Bi:1:038:1 -115 36 <
ffff8800701a0a00 4023365319 C Bi:1:038:1 0 36 = 05800612 47000002 4e657461 63000000 4f6e6c79 4469736b 00000000 00000000
ffff8800701a0a00 4023367263 S Bi:1:038:1 -115 512 <
ffff8800701a0a00 4023367328 C Bi:1:038:1 0 13 = 55534253 10fc3104 00000000 00
ffff8800701a0a00 4023369394 S Bo:1:038:2 -115 31 = 55534243 10fc3104 ff000000 80000612 018000ff 00000000 00000000 000000
ffff8800701a0a00 4023369444 C Bo:1:038:2 0 31 >
ffff8800701a0a00 4023371244 S Bi:1:038:1 -115 255 <
ffff8800701a0a00 4023371327 C Bi:1:038:1 0 28 = 00800018 00000000 00000000 04314e74 636f7400 00000000 00000000
ffff8800701a0a00 4023373265 S Bi:1:038:1 -115 512 <
ffff8800701a0a00 4023373325 C Bi:1:038:1 -32 0
ffff8800701a0a00 4023375249 S Co:1:038:0 s 02 01 0000 0081 0000 0
ffff8800701a0a00 4023375322 C Co:1:038:0 0 0
ffff8800701a0a00 4023376767 S Bi:1:038:1 -115 512 <
ffff8800701a0a00 4023376944 C Bi:1:038:1 0 13 = 55534253 10fc3104 e3000000 00
ffff8800701a0a00 4023378404 S Bo:1:038:2 -115 31 = 55534243 50267703 24000000 80010612 00000024 00000000 00000000 000000
ffff8800701a0a00 4023378569 C Bo:1:038:2 0 31 >
ffff8800439681c0 4023380245 S Bi:1:038:1 -115 36 <
ffff8800439681c0 4023380320 C Bi:1:038:1 0 36 = 00800612 47000002 4e657461 63000000 4f6e6c79 4469736b 00000000 00000000
ffff88006eed6880 4023382287 S Bi:1:038:1 -115 512 <
ffff88006eed6880 4023382446 C Bi:1:038:1 0 13 = 55534253 50267703 00000000 00
ffff88006eed6880 4023384402 S Bo:1:038:2 -115 31 = 55534243 50267703 4c000000 80010612 0000004c 00000000 00000000 000000
ffff88006eed6880 4023384572 C Bo:1:038:2 0 31 >
ffff88006eed6880 4023386276 S Bi:1:038:1 -115 76 <
ffff88006eed6880 4023386320 C Bi:1:038:1 0 76 = 00800612 47000002 4e657461 63000000 4f6e6c79 4469736b 00000000 00000000
ffff88006eed6880 4023388259 S Bi:1:038:1 -115 512 <
ffff88006eed6880 4023388321 C Bi:1:038:1 0 13 = 55534253 50267703 00000000 00
ffff88006eed6880 4023390421 S Bo:1:038:2 -115 31 = 55534243 50267703 00000000 00010ca2 00000080 00000000 00000000 000000
ffff88006eed6880 4023390574 C Bo:1:038:2 0 31 >
ffff88006eed6880 4023392259 S Bi:1:038:1 -115 512 <
ffff88006eed6880 4023392327 C Bi:1:038:1 0 13 = 55534253 50267703 00000000 01
ffff88006eed6880 4023394416 S Bo:1:038:2 -115 31 = 55534243 50267703 00000000 00010ca2 00000080 00000000 00000000 000000
ffff88006eed6880 4023394571 C Bo:1:038:2 0 31 >
ffff88006eed6880 4023396256 S Bi:1:038:1 -115 512 <
ffff88006eed6880 4023396320 C Bi:1:038:1 0 13 = 55534253 50267703 00000000 01
ffff88006eed6880 4023397423 S Bo:1:038:2 -115 31 = 55534243 40ca0904 00000000 00010ca2 00000080 00000000 00000000 000000
ffff88006eed6880 4023397571 C Bo:1:038:2 0 31 >
ffff88006eed6880 4023399243 S Bi:1:038:1 -115 512 <
ffff88006eed6880 4023399318 C Bi:1:038:1 0 13 = 55534253 40ca0904 00000000 01
ffff88007084d700 4023401427 S Bo:1:038:2 -115 31 = 55534243 009bf002 00000000 00010ca2 00000000 00000000 00000000 000000
ffff88007084d700 4023401586 C Bo:1:038:2 0 31 >
ffff88007084d700 4023403256 S Bi:1:038:1 -115 512 <
ffff88007084d700 4023403324 C Bi:1:038:1 0 13 = 55534253 009bf002 00000000 01
ffff88007084d700 4023405419 S Bo:1:038:2 -115 31 = 55534243 009bf002 00000000 00010ca2 00000000 00000000 00000000 000000
ffff88007084d700 4023405569 C Bo:1:038:2 0 31 >
ffff88007084d700 4023407240 S Bi:1:038:1 -115 512 <
ffff88007084d700 4023407319 C Bi:1:038:1 0 13 = 55534253 009bf002 00000000 01
ffff88007084d700 4023408399 S Bo:1:038:2 -115 31 = 55534243 009bf002 00000000 00010ca2 00000000 00000000 00000000 000000
ffff88007084d700 4023408446 C Bo:1:038:2 0 31 >
ffff88007084d700 4023410242 S Bi:1:038:1 -115 512 <
ffff88007084d700 4023410322 C Bi:1:038:1 0 13 = 55534253 009bf002 00000000 01
ffff88007084d700 4023412378 S Bo:1:038:2 -115 31 = 55534243 30f0fd03 24000000 80010612 00000024 00000000 00000000 000000
ffff88007084d700 4023412446 C Bo:1:038:2 0 31 >
ffff88007084d700 4023413854 S Bi:1:038:1 -115 36 <
ffff88007084d700 4023413946 C Bi:1:038:1 0 36 = 00800612 47000002 4e657461 63000000 4f6e6c79 4469736b 00000000 00000000
ffff88007084d700 4023415239 S Bi:1:038:1 -115 512 <
ffff88007084d700 4023415320 C Bi:1:038:1 0 13 = 55534253 30f0fd03 00000000 00
ffff88007084d700 4023416392 S Bo:1:038:2 -115 31 = 55534243 30f0fd03 fc000000 80010a23 00000000 000000fc 00000000 000000
ffff88007084d700 4023416445 C Bo:1:038:2 0 31 >
ffff88007084d700 4023418241 S Bi:1:038:1 -115 252 <
ffff88007084d700 4023418323 C Bi:1:038:1 -32 0
ffff88007084d700 4023420235 S Co:1:038:0 s 02 01 0000 0081 0000 0
ffff88007084d700 4023420321 C Co:1:038:0 0 0
ffff88007084d700 4023422239 S Bi:1:038:1 -115 512 <
ffff88007084d700 4023422317 C Bi:1:038:1 0 13 = 55534253 30f0fd03 fc000000 01
ffff88007084d700 4023424374 S Bo:1:038:2 -115 31 = 55534243 30f0fd03 12000000 80010c03 00000012 00000000 00000000 000000
ffff88007084d700 4023424446 C Bo:1:038:2 0 31 >
ffff88007084d700 4023426249 S Bi:1:038:1 -115 18 <
ffff88007084d700 4023426321 C Bi:1:038:1 0 18 = 70000500 0000000a 00000000 20000000 0000
ffff88007084d700 4023428251 S Bi:1:038:1 -115 512 <
ffff88007084d700 4023428320 C Bi:1:038:1 0 13 = 55534253 30f0fd03 00000000 00
ffff88007084d700 4023430406 S Bo:1:038:2 -115 31 = 55534243 30f0fd03 fc000000 80010a23 00000000 000000fc 00000000 000000
ffff88007084d700 4023430445 C Bo:1:038:2 0 31 >
ffff88007084d700 4023432263 S Bi:1:038:1 -115 252 <
ffff88007084d700 4023432323 C Bi:1:038:1 -32 0
ffff88007084d700 4023434273 S Co:1:038:0 s 02 01 0000 0081 0000 0
ffff88007084d700 4023434450 C Co:1:038:0 0 0
ffff8800701a0a00 4023435279 S Bi:1:038:1 -115 512 <
ffff8800701a0a00 4023435452 C Bi:1:038:1 0 13 = 55534253 30f0fd03 fc000000 01
ffff8800701a0a00 4023436704 S Bo:1:038:2 -115 31 = 55534243 30f0fd03 12000000 80010c03 00000012 00000000 00000000 000000
ffff8800701a0a00 4023436826 C Bo:1:038:2 0 31 >
ffff8800701a0a00 4023438243 S Bi:1:038:1 -115 18 <
ffff8800701a0a00 4023438319 C Bi:1:038:1 0 18 = 70000500 0000000a 00000000 20000000 0000
ffff8800701a0a00 4023440241 S Bi:1:038:1 -115 512 <
ffff8800701a0a00 4023440321 C Bi:1:038:1 0 13 = 55534253 30f0fd03 00000000 00
ffff8800701a0a00 4023442400 S Bo:1:038:2 -115 31 = 55534243 30f0fd03 fc000000 80010a23 00000000 000000fc 00000000 000000
ffff8800701a0a00 4023442447 C Bo:1:038:2 0 31 >
ffff8800439681c0 4023443243 S Bi:1:038:1 -115 252 <
ffff8800439681c0 4023443322 C Bi:1:038:1 -32 0
ffff8800439681c0 4023445258 S Co:1:038:0 s 02 01 0000 0081 0000 0
ffff8800439681c0 4023445318 C Co:1:038:0 0 0
ffff8800439681c0 4023447246 S Bi:1:038:1 -115 512 <
ffff8800439681c0 4023447317 C Bi:1:038:1 0 13 = 55534253 30f0fd03 fc000000 01
ffff8800439681c0 4023448391 S Bo:1:038:2 -115 31 = 55534243 30f0fd03 12000000 80010c03 00000012 00000000 00000000 000000
ffff8800439681c0 4023448442 C Bo:1:038:2 0 31 >
ffff8800701a0a00 4023450258 S Bi:1:038:1 -115 18 <
ffff8800701a0a00 4023450322 C Bi:1:038:1 0 18 = 70000500 0000000a 00000000 20000000 0000
ffff88007015ef40 4023451237 S Bi:1:038:1 -115 512 <
ffff88007015ef40 4023451321 C Bi:1:038:1 0 13 = 55534253 30f0fd03 00000000 00
ffff88007015ef40 4023453375 S Bo:1:038:2 -115 31 = 55534243 30f0fd03 ff000000 80010612 018000ff 00000000 00000000 000000
ffff88007015ef40 4023453444 C Bo:1:038:2 0 31 >
ffff88007015ef40 4023455236 S Bi:1:038:1 -115 255 <
ffff88007015ef40 4023455320 C Bi:1:038:1 0 28 = 00800018 00000000 00000000 04314e74 636f7400 00000000 00000000
ffff88007015ef40 4023457252 S Bi:1:038:1 -115 512 <
ffff88007015ef40 4023457324 C Bi:1:038:1 -32 0
ffff88007015ef40 4023459235 S Co:1:038:0 s 02 01 0000 0081 0000 0
ffff88007015ef40 4023459318 C Co:1:038:0 0 0
ffff88007015ef40 4023460235 S Bi:1:038:1 -115 512 <
ffff88007015ef40 4023460319 C Bi:1:038:1 0 13 = 55534253 30f0fd03 e3000000 00
ffff88007015ef40 4023462380 S Bo:1:038:2 -115 31 = 55534243 009bf002 24000000 80020612 00000024 00000000 00000000 000000
ffff88007015ef40 4023462441 C Bo:1:038:2 0 31 >
ffff88007015ef40 4023464230 S Bi:1:038:1 -115 36 <
ffff88007015ef40 4023464317 C Bi:1:038:1 0 36 = 00800612 47000002 4e657461 63000000 4f6e6c79 4469736b 00000000 00000000
ffff880070b62dc0 4023466237 S Bi:1:038:1 -115 512 <
ffff880070b62dc0 4023466319 C Bi:1:038:1 0 13 = 55534253 009bf002 00000000 00
ffff88007015ef40 4023467409 S Bo:1:038:2 -115 31 = 55534243 30f0fd03 4c000000 80020612 0000004c 00000000 00000000 000000
ffff88007015ef40 4023467443 C Bo:1:038:2 0 31 >
ffff88007015ef40 4023469231 S Bi:1:038:1 -115 76 <
ffff88007015ef40 4023469318 C Bi:1:038:1 0 76 = 00800612 47000002 4e657461 63000000 4f6e6c79 4469736b 00000000 00000000
ffff88007015ef40 4023471229 S Bi:1:038:1 -115 512 <
ffff88007015ef40 4023471319 C Bi:1:038:1 0 13 = 55534253 30f0fd03 00000000 00
ffff88007015ef40 4023472800 S Bo:1:038:2 -115 31 = 55534243 30f0fd03 00000000 00020ca2 00000080 00000000 00000000 000000
ffff88007015ef40 4023472947 C Bo:1:038:2 0 31 >
ffff88007015ef40 4023474230 S Bi:1:038:1 -115 512 <
ffff88007015ef40 4023474319 C Bi:1:038:1 0 13 = 55534253 30f0fd03 00000000 01
ffff88007015ef40 4023476368 S Bo:1:038:2 -115 31 = 55534243 009bf002 00000000 00020ca2 00000080 00000000 00000000 000000
ffff88007015ef40 4023476441 C Bo:1:038:2 0 31 >
ffff880070b62dc0 4023477277 S Bi:1:038:1 -115 512 <
ffff880070b62dc0 4023477443 C Bi:1:038:1 0 13 = 55534253 009bf002 00000000 01
ffff880070b62dc0 4023478369 S Bo:1:038:2 -115 31 = 55534243 009bf002 00000000 00020ca2 00000080 00000000 00000000 000000
ffff880070b62dc0 4023478442 C Bo:1:038:2 0 31 >
ffff880070b62dc0 4023480228 S Bi:1:038:1 -115 512 <
ffff880070b62dc0 4023480318 C Bi:1:038:1 0 13 = 55534253 009bf002 00000000 01
ffff880070b62dc0 4023482369 S Bo:1:038:2 -115 31 = 55534243 009bf002 00000000 00020ca2 00000000 00000000 00000000 000000
ffff880070b62dc0 4023482445 C Bo:1:038:2 0 31 >
ffff880070b62dc0 4023484255 S Bi:1:038:1 -115 512 <
ffff880070b62dc0 4023484321 C Bi:1:038:1 0 13 = 55534253 009bf002 00000000 01
ffff880070b62dc0 4023486366 S Bo:1:038:2 -115 31 = 55534243 009bf002 00000000 00020ca2 00000000 00000000 00000000 000000
ffff880070b62dc0 4023486443 C Bo:1:038:2 0 31 >
ffff880070b62dc0 4023487458 S Bi:1:038:1 -115 512 <
ffff880070b62dc0 4023487567 C Bi:1:038:1 0 13 = 55534253 009bf002 00000000 01
ffff880070b62dc0 4023488331 S Bo:1:038:2 -115 31 = 55534243 009bf002 00000000 00020ca2 00000000 00000000 00000000 000000
ffff880070b62dc0 4023488445 C Bo:1:038:2 0 31 >
ffff880070b62dc0 4023490233 S Bi:1:038:1 -115 512 <
ffff880070b62dc0 4023490320 C Bi:1:038:1 0 13 = 55534253 009bf002 00000000 01
ffff880070b62dc0 4023492394 S Bo:1:038:2 -115 31 = 55534243 009bf002 24000000 80020612 00000024 00000000 00000000 000000
ffff880070b62dc0 4023492443 C Bo:1:038:2 0 31 >
ffff880070b62dc0 4023494230 S Bi:1:038:1 -115 36 <
ffff880070b62dc0 4023494319 C Bi:1:038:1 0 36 = 00800612 47000002 4e657461 63000000 4f6e6c79 4469736b 00000000 00000000
ffff880070b62dc0 4023496232 S Bi:1:038:1 -115 512 <
ffff880070b62dc0 4023496320 C Bi:1:038:1 0 13 = 55534253 009bf002 00000000 00
ffff880070b62dc0 4023498393 S Bo:1:038:2 -115 31 = 55534243 30f0fd03 fc000000 80020a23 00000000 000000fc 00000000 000000
ffff880070b62dc0 4023498442 C Bo:1:038:2 0 31 >
ffff880070b62dc0 4023500226 S Bi:1:038:1 -115 252 <
ffff880070b62dc0 4023500320 C Bi:1:038:1 -32 0
ffff880070b62dc0 4023502228 S Co:1:038:0 s 02 01 0000 0081 0000 0
ffff880070b62dc0 4023502319 C Co:1:038:0 0 0
ffff880070b62dc0 4023504230 S Bi:1:038:1 -115 512 <
ffff880070b62dc0 4023504320 C Bi:1:038:1 0 13 = 55534253 30f0fd03 fc000000 01
ffff8800701a0a00 4023506392 S Bo:1:038:2 -115 31 = 55534243 30f0fd03 12000000 80020c03 00000012 00000000 00000000 000000
ffff8800701a0a00 4023506442 C Bo:1:038:2 0 31 >
ffff88007084d700 4023507790 S Bi:1:038:1 -115 18 <
ffff88007084d700 4023507944 C Bi:1:038:1 0 18 = 70000500 0000000a 00000000 20000000 0000
ffff88007084d700 4023509256 S Bi:1:038:1 -115 512 <
ffff88007084d700 4023509322 C Bi:1:038:1 0 13 = 55534253 30f0fd03 00000000 00
ffff88007084d700 4023511367 S Bo:1:038:2 -115 31 = 55534243 c09ab003 fc000000 80020a23 00000000 000000fc 00000000 000000
ffff88007084d700 4023511444 C Bo:1:038:2 0 31 >
ffff88007084d700 4023513236 S Bi:1:038:1 -115 252 <
ffff88007084d700 4023513322 C Bi:1:038:1 -32 0
ffff88007084d700 4023515225 S Co:1:038:0 s 02 01 0000 0081 0000 0
ffff88007084d700 4023515318 C Co:1:038:0 0 0
ffff88007084d700 4023517229 S Bi:1:038:1 -115 512 <
ffff88007084d700 4023517318 C Bi:1:038:1 0 13 = 55534253 c09ab003 fc000000 01
ffff88007084d700 4023518413 S Bo:1:038:2 -115 31 = 55534243 c09ab003 12000000 80020c03 00000012 00000000 00000000 000000
ffff88007084d700 4023518567 C Bo:1:038:2 0 31 >
ffff88007084d700 4023520228 S Bi:1:038:1 -115 18 <
ffff88007084d700 4023520318 C Bi:1:038:1 0 18 = 70000500 0000000a 00000000 20000000 0000
ffff88007084d700 4023522231 S Bi:1:038:1 -115 512 <
ffff88007084d700 4023522319 C Bi:1:038:1 0 13 = 55534253 c09ab003 00000000 00
ffff88007084d700 4023524377 S Bo:1:038:2 -115 31 = 55534243 c09ab003 fc000000 80020a23 00000000 000000fc 00000000 000000
ffff88007084d700 4023524445 C Bo:1:038:2 0 31 >
ffff88007084d700 4023526239 S Bi:1:038:1 -115 252 <
ffff88007084d700 4023526320 C Bi:1:038:1 -32 0
ffff88007084d700 4023528234 S Co:1:038:0 s 02 01 0000 0081 0000 0
ffff88007084d700 4023528319 C Co:1:038:0 0 0
ffff88007084d700 4023530228 S Bi:1:038:1 -115 512 <
ffff88007084d700 4023530319 C Bi:1:038:1 0 13 = 55534253 c09ab003 fc000000 01
ffff88007084d700 4023532373 S Bo:1:038:2 -115 31 = 55534243 c09ab003 12000000 80020c03 00000012 00000000 00000000 000000
ffff88007084d700 4023532442 C Bo:1:038:2 0 31 >
ffff88007084d700 4023534229 S Bi:1:038:1 -115 18 <
ffff88007084d700 4023534318 C Bi:1:038:1 0 18 = 70000500 0000000a 00000000 20000000 0000
ffff88007084d700 4023536232 S Bi:1:038:1 -115 512 <
ffff88007084d700 4023536319 C Bi:1:038:1 0 13 = 55534253 c09ab003 00000000 00
ffff88007084d700 4023538371 S Bo:1:038:2 -115 31 = 55534243 c09ab003 ff000000 80020612 018000ff 00000000 00000000 000000
ffff88007084d700 4023538445 C Bo:1:038:2 0 31 >
ffff88007084d700 4023540249 S Bi:1:038:1 -115 255 <
ffff88007084d700 4023540321 C Bi:1:038:1 0 28 = 00800018 00000000 00000000 04314e74 636f7400 00000000 00000000
ffff88007084d700 4023542229 S Bi:1:038:1 -115 512 <
ffff88007084d700 4023542320 C Bi:1:038:1 -32 0
ffff88007084d700 4023544224 S Co:1:038:0 s 02 01 0000 0081 0000 0
ffff88007084d700 4023544320 C Co:1:038:0 0 0
ffff88007084d700 4023545229 S Bi:1:038:1 -115 512 <
ffff88007084d700 4023545318 C Bi:1:038:1 0 13 = 55534253 c09ab003 e3000000 00
ffff88007084d700 4023550398 S Bo:1:038:2 -115 31 = 55534243 10fc3104 24000000 80000612 00000024 00000000 00000000 000000
ffff88007084d700 4023550446 C Bo:1:038:2 0 31 >
ffff88007084d700 4023552248 S Bi:1:038:1 -115 36 <
ffff88007084d700 4023552321 C Bi:1:038:1 0 36 = 05800612 47000002 4e657461 63000000 4f6e6c79 4469736b 00000000 00000000
ffff88007084d700 4023554252 S Bi:1:038:1 -115 512 <
ffff88007084d700 4023554321 C Bi:1:038:1 0 13 = 55534253 10fc3104 00000000 00
ffff88007084d700 4023556400 S Bo:1:038:2 -115 31 = 55534243 10fc3104 4c000000 80000612 0000004c 00000000 00000000 000000
ffff88007084d700 4023556447 C Bo:1:038:2 0 31 >
ffff88007084d700 4023558233 S Bi:1:038:1 -115 76 <
ffff88007084d700 4023558321 C Bi:1:038:1 0 76 = 05800612 47000002 4e657461 63000000 4f6e6c79 4469736b 00000000 00000000
ffff88007084d700 4023560233 S Bi:1:038:1 -115 512 <
ffff88007084d700 4023560317 C Bi:1:038:1 0 13 = 55534253 10fc3104 00000000 00
ffff88007084d700 4023562229 S Bo:1:038:2 -115 31 = 55534243 30d03104 08000000 80000a4a 01000000 00000008 00000000 000000
ffff88006eed6880 4023562259 S Ci:1:038:0 s 80 06 0600 0000 000a 10 <
ffff88007084d700 4023562319 C Bo:1:038:2 0 31 >
ffff88006eed6880 4023562442 C Ci:1:038:0 0 10 = 0a061002 00000040 0100
ffff88006eed6880 4023564240 S Bi:1:038:1 -115 8 <
ffff88007084d700 4023564267 S Ci:1:038:0 s 80 06 0700 0000 0009 9 <
ffff88006eed6880 4023564321 C Bi:1:038:1 -32 0
ffff88007084d700 4023564446 C Ci:1:038:0 0 9 = 09072000 01010080 96
ffff88007084d700 4023566231 S Co:1:038:0 s 02 01 0000 0081 0000 0
ffff88007084d700 4023566323 C Co:1:038:0 0 0
ffff88007084d700 4023568236 S Bi:1:038:1 -115 512 <
ffff88006eed6880 4023568268 S Ci:1:038:0 s 80 06 0700 0000 0020 32 <
ffff88007084d700 4023568320 C Bi:1:038:1 0 13 = 55534253 30d03104 08000000 01
ffff88006eed6880 4023568442 C Ci:1:038:0 0 32 = 09072000 01010080 96090400 00020806 50000705 81024000 00070502 02400000
ffff88006eed6880 4023570261 S Ci:1:038:0 s 80 06 0f00 0000 0005 5 <
ffff88007084d700 4023570297 S Bo:1:038:2 -115 31 = 55534243 30d03104 12000000 80000c03 00000012 00000000 00000000 000000
ffff88006eed6880 4023570452 C Ci:1:038:0 0 5 = 050f1600 02
ffff88007084d700 4023570461 C Bo:1:038:2 0 31 >
ffff88007084d700 4023572234 S Ci:1:038:0 s 80 06 0f00 0000 0016 22 <
ffff88006eed6880 4023572262 S Bi:1:038:1 -115 18 <
ffff88006eed6880 4023572322 C Bi:1:038:1 0 18 = 70000500 0000000a 00000000 20000000 0000
ffff88007084d700 4023572444 C Ci:1:038:0 0 22 = 050f1600 02071002 06000000 0a100300 0e00010a 0002
ffff88007084d700 4023574237 S Bi:1:038:1 -115 512 <
ffff88007084d700 4023574317 C Bi:1:038:1 0 13 = 55534253 30d03104 00000000 00
ffff88007084d700 4023576385 S Bo:1:038:2 -115 31 = 55534243 60886603 08000000 80000a46 00000000 00000008 00000000 000000
ffff88007084d700 4023576444 C Bo:1:038:2 0 31 >
ffff88007084d700 4023578232 S Bi:1:038:1 -115 8 <
ffff88007084d700 4023578319 C Bi:1:038:1 0 8 = 00000050 00000000
ffff88007084d700 4023580243 S Bi:1:038:1 -115 512 <
ffff88007084d700 4023580323 C Bi:1:038:1 0 13 = 55534253 60886603 00000000 00
ffff88007084d700 4023582386 S Bo:1:038:2 -115 31 = 55534243 60886603 0c000000 80000a46 02000000 0000000c 00000000 000000
ffff88007084d700 4023582445 C Bo:1:038:2 0 31 >
ffff8800701a0a00 4023583237 S Bi:1:038:1 -115 12 <
ffff8800701a0a00 4023583321 C Bi:1:038:1 0 12 = 00000040 0000001b 00000338
ffff880070b62dc0 4023585233 S Bi:1:038:1 -115 512 <
ffff880070b62dc0 4023585319 C Bi:1:038:1 0 13 = 55534253 60886603 00000000 00
ffff880070b62dc0 4023586383 S Bo:1:038:2 -115 31 = 55534243 60886603 08000000 80000a46 00000000 00000008 00000000 000000
ffff880070b62dc0 4023586445 C Bo:1:038:2 0 31 >
ffff880070b62dc0 4023588246 S Bi:1:038:1 -115 8 <
ffff880070b62dc0 4023588320 C Bi:1:038:1 0 8 = 00000050 00000010
ffff880070b62dc0 4023588762 S Bi:1:038:1 -115 512 <
ffff880070b62dc0 4023588819 C Bi:1:038:1 0 13 = 55534253 60886603 00000000 00
ffff880070b62dc0 4023590381 S Bo:1:038:2 -115 31 = 55534243 60886603 54000000 80000a46 00000000 00000054 00000000 000000
ffff880070b62dc0 4023590446 C Bo:1:038:2 0 31 >
ffff88006eff6e80 4023591703 S Bi:1:038:1 -115 84 <
ffff88006eff6e80 4023591818 C Bi:1:038:1 0 84 = 00000050 00000010 00000308 00100100 00080000 00010b04 00000007 00020704
ffff88006eff6e80 4023593253 S Bi:1:038:1 -115 512 <
ffff88006eff6e80 4023593322 C Bi:1:038:1 0 13 = 55534253 60886603 00000000 00
ffff88006eff6e80 4023595383 S Bo:1:038:2 -115 31 = 55534243 10a09903 28000000 80000a5a 082a0000 00000028 00000000 000000
ffff88006eff6e80 4023595444 C Bo:1:038:2 0 31 >
ffff88007015ef40 4023597224 S Bi:1:038:1 -115 40 <
ffff88007015ef40 4023597320 C Bi:1:038:1 0 34 = 00200000 00000000 2a180800 01002900 00000000 00000000 00000000 00000000
ffff88007015ef40 4023600234 S Bi:1:038:1 -115 512 <
ffff88007015ef40 4023600325 C Bi:1:038:1 -32 0
ffff88007015ef40 4023602224 S Co:1:038:0 s 02 01 0000 0081 0000 0
ffff88007015ef40 4023602317 C Co:1:038:0 0 0
ffff88007015ef40 4023603224 S Bi:1:038:1 -115 512 <
ffff88007015ef40 4023603319 C Bi:1:038:1 0 13 = 55534253 10a09903 06000000 00
ffff88007015ef40 4023605340 S Bo:1:038:2 -115 31 = 55534243 00000000 08000000 80000a25 00000000 00000000 00000000 000000
ffff88007015ef40 4023605443 C Bo:1:038:2 0 31 >
ffff88007015ef40 4023605478 S Bi:1:038:1 -115 8 <
ffff88007015ef40 4023605567 C Bi:1:038:1 0 8 = 000063ff 00000800
ffff88007015ef40 4023605597 S Bi:1:038:1 -115 13 <
ffff88007015ef40 4023605692 C Bi:1:038:1 0 13 = 55534253 00000000 00000000 00
ffff88007015ef40 4023607379 S Bo:1:038:2 -115 31 = 55534243 50267703 08000000 80000ca4 00000000 00000000 08080000 000000
ffff88007015ef40 4023607443 C Bo:1:038:2 0 31 >
ffff880070b62dc0 4023609236 S Bi:1:038:1 -115 8 <
ffff880070b62dc0 4023609320 C Bi:1:038:1 -32 0
ffff880070b62dc0 4023611227 S Co:1:038:0 s 02 01 0000 0081 0000 0
ffff880070b62dc0 4023611322 C Co:1:038:0 0 0
ffff880070b62dc0 4023613231 S Bi:1:038:1 -115 512 <
ffff880070b62dc0 4023613317 C Bi:1:038:1 0 13 = 55534253 50267703 08000000 01
ffff880070b62dc0 4023615146 S Bo:1:038:2 -115 31 = 55534243 50267703 12000000 80000c03 00000012 00000000 00000000 000000
ffff880070b62dc0 4023615193 C Bo:1:038:2 0 31 >
ffff880070b62dc0 4023617225 S Bi:1:038:1 -115 18 <
ffff880070b62dc0 4023617320 C Bi:1:038:1 0 18 = 70000500 0000000a 00000000 20000000 0000
ffff880070b62dc0 4023619232 S Bi:1:038:1 -115 512 <
ffff880070b62dc0 4023619317 C Bi:1:038:1 0 13 = 55534253 50267703 00000000 00
ffff880070b62dc0 4023621247 S Bo:1:038:2 -115 31 = 55534243 01000000 08000000 80010a25 00000000 00000000 00000000 000000
ffff880070b62dc0 4023621320 C Bo:1:038:2 0 31 >
ffff880070b62dc0 4023621367 S Bi:1:038:1 -115 8 <
ffff880070b62dc0 4023621443 C Bi:1:038:1 0 8 = 03a2cfe3 00000200
ffff880070b62dc0 4023621475 S Bi:1:038:1 -115 13 <
ffff880070b62dc0 4023621568 C Bi:1:038:1 0 13 = 55534253 01000000 00000000 00
ffff880070b62dc0 4023623433 S Bo:1:038:2 -115 31 = 55534243 02000000 00020000 80010a28 00000000 00000001 00000000 000000
ffff880070b62dc0 4023623570 C Bo:1:038:2 0 31 >
ffff880070b62dc0 4023623641 S Bi:1:038:1 -115 512 <
ffff8800701a0a00 4023623651 S Bi:1:038:1 -115 13 <
ffff880070b62dc0 4023623821 C Bi:1:038:1 0 512 = fa33c08e d0bc007c 8bf45007 501ffbfc bf0006b9 0001f2a5 ea1d0600 00bebe07
ffff8800701a0a00 4023623826 C Bi:1:038:1 0 13 = 55534253 02000000 00000000 00
ffff88007015ef40 4023625249 S Bo:1:038:2 -115 31 = 55534243 10a0f803 c0000000 8001061a 001c00c0 00000000 00000000 000000
ffff88007015ef40 4023625321 C Bo:1:038:2 0 31 >
ffff8800701a0a00 4023626955 S Bi:1:038:1 -115 192 <
ffff8800701a0a00 4023627068 C Bi:1:038:1 0 192 = 0b001008 1c0116fe 00000200 00000000 00000000 00000000 00000000 00000000
ffff88006e86b340 4023629268 S Bi:1:038:1 -115 512 <
ffff88006e86b340 4023629449 C Bi:1:038:1 0 13 = 55534253 10a0f803 00000000 00
ffff88006e86b340 4023631391 S Bo:1:038:2 -115 31 = 55534243 10a09903 c0000000 8001061a 000800c0 00000000 00000000 000000
ffff88006e86b340 4023631447 C Bo:1:038:2 0 31 >
ffff88006e86b340 4023633232 S Bi:1:038:1 -115 192 <
ffff88006e86b340 4023633317 C Bi:1:038:1 0 192 = 1f001008 1c0116fe 00000200 081210ff ffffffff ffff0000 00000000 00000000
ffff88006eed6880 4023635233 S Bi:1:038:1 -115 512 <
ffff88006eed6880 4023635318 C Bi:1:038:1 0 13 = 55534253 10a09903 00000000 00
ffff88006eed6880 4023637257 S Bo:1:038:2 -115 31 = 55534243 03000000 08000000 80010a25 00000000 00000000 00000000 000000
ffff88006eed6880 4023637321 C Bo:1:038:2 0 31 >
ffff88006e86b340 4023637517 S Bi:1:038:1 -115 8 <
ffff88006e86b340 4023637570 C Bi:1:038:1 0 8 = 03a2cfe3 00000200
ffff88007014cd00 4023637710 S Bi:1:038:1 -115 13 <
ffff88007014cd00 4023637820 C Bi:1:038:1 0 13 = 55534253 03000000 00000000 00
ffff880070105580 4023639389 S Bo:1:038:2 -115 31 = 55534243 04000000 00020000 80010a28 00000000 00000001 00000000 000000
ffff880070105580 4023639446 C Bo:1:038:2 0 31 >
ffff880070105580 4023639489 S Bi:1:038:1 -115 512 <
ffff88006effda00 4023639499 S Bi:1:038:1 -115 13 <
ffff880070105580 4023639818 C Bi:1:038:1 0 512 = fa33c08e d0bc007c 8bf45007 501ffbfc bf0006b9 0001f2a5 ea1d0600 00bebe07
ffff88006effda00 4023639825 C Bi:1:038:1 0 13 = 55534253 04000000 00000000 00
ffff88006effda00 4023641382 S Bo:1:038:2 -115 31 = 55534243 05000000 00020000 80010a28 00000000 00000001 00000000 000000
ffff88006effda00 4023641443 C Bo:1:038:2 0 31 >
ffff88006effda00 4023641482 S Bi:1:038:1 -115 512 <
ffff880070105580 4023641498 S Bi:1:038:1 -115 13 <
ffff88006effda00 4023641820 C Bi:1:038:1 0 512 = fa33c08e d0bc007c 8bf45007 501ffbfc bf0006b9 0001f2a5 ea1d0600 00bebe07
ffff880070105580 4023641827 C Bi:1:038:1 0 13 = 55534253 05000000 00000000 00
ffff88007014cd00 4023643243 S Bo:1:038:2 -115 31 = 55534243 06000000 08000000 80010a25 00000000 00000000 00000000 000000
ffff88007014cd00 4023643319 C Bo:1:038:2 0 31 >
ffff88007014cd00 4023643362 S Bi:1:038:1 -115 8 <
ffff88007014cd00 4023643444 C Bi:1:038:1 0 8 = 03a2cfe3 00000200
ffff88007014cd00 4023643485 S Bi:1:038:1 -115 13 <
ffff88007014cd00 4023643573 C Bi:1:038:1 0 13 = 55534253 06000000 00000000 00
ffff88007014cd00 4023645247 S Bo:1:038:2 -115 31 = 55534243 07000000 08000000 80010a25 00000000 00000000 00000000 000000
ffff88007014cd00 4023645320 C Bo:1:038:2 0 31 >
ffff88007014cd00 4023645367 S Bi:1:038:1 -115 8 <
ffff88007014cd00 4023645445 C Bi:1:038:1 0 8 = 03a2cfe3 00000200
ffff88007014cd00 4023645489 S Bi:1:038:1 -115 13 <
ffff88007014cd00 4023645571 C Bi:1:038:1 0 13 = 55534253 07000000 00000000 00
ffff88007014cd00 4023647375 S Bo:1:038:2 -115 31 = 55534243 08000000 00020000 80010a28 00000000 00000001 00000000 000000
ffff88007014cd00 4023647443 C Bo:1:038:2 0 31 >
ffff88007014cd00 4023647482 S Bi:1:038:1 -115 512 <
ffff88006e86b340 4023647492 S Bi:1:038:1 -115 13 <
ffff88007014cd00 4023647818 C Bi:1:038:1 0 512 = fa33c08e d0bc007c 8bf45007 501ffbfc bf0006b9 0001f2a5 ea1d0600 00bebe07
ffff88006e86b340 4023647825 C Bi:1:038:1 0 13 = 55534253 08000000 00000000 00
ffff88006e86b340 4023649455 S Bo:1:038:2 -115 31 = 55534243 09000000 00020000 80010a28 00000000 00000001 00000000 000000
ffff88006e86b340 4023649572 C Bo:1:038:2 0 31 >
ffff88006e86b340 4023649624 S Bi:1:038:1 -115 512 <
ffff88007014cd00 4023649636 S Bi:1:038:1 -115 13 <
ffff88006e86b340 4023649820 C Bi:1:038:1 0 512 = fa33c08e d0bc007c 8bf45007 501ffbfc bf0006b9 0001f2a5 ea1d0600 00bebe07
ffff88007014cd00 4023649826 C Bi:1:038:1 0 13 = 55534253 09000000 00000000 00
ffff88007014cd00 4023651248 S Bo:1:038:2 -115 31 = 55534243 0a000000 08000000 80010a25 00000000 00000000 00000000 000000
ffff88007014cd00 4023651320 C Bo:1:038:2 0 31 >
ffff88007014cd00 4023651369 S Bi:1:038:1 -115 8 <
ffff88007014cd00 4023651445 C Bi:1:038:1 0 8 = 03a2cfe3 00000200
ffff88007014cd00 4023651485 S Bi:1:038:1 -115 13 <
ffff88007014cd00 4023651570 C Bi:1:038:1 0 13 = 55534253 0a000000 00000000 00
ffff88006e86b340 4023653249 S Bo:1:038:2 -115 31 = 55534243 0b000000 08000000 80010a25 00000000 00000000 00000000 000000
ffff88006e86b340 4023653321 C Bo:1:038:2 0 31 >
ffff88006e86b340 4023653366 S Bi:1:038:1 -115 8 <
ffff88006e86b340 4023653446 C Bi:1:038:1 0 8 = 03a2cfe3 00000200
ffff88006e86b340 4023653491 S Bi:1:038:1 -115 13 <
ffff88006e86b340 4023653567 C Bi:1:038:1 0 13 = 55534253 0b000000 00000000 00
ffff88006e86b340 4023655408 S Bo:1:038:2 -115 31 = 55534243 0c000000 00020000 80010a28 00000000 00000001 00000000 000000
ffff88006e86b340 4023655442 C Bo:1:038:2 0 31 >
ffff88006eed6880 4023655540 S Bi:1:038:1 -115 512 <
ffff8800712861c0 4023655552 S Bi:1:038:1 -115 13 <
ffff88006eed6880 4023655820 C Bi:1:038:1 0 512 = fa33c08e d0bc007c 8bf45007 501ffbfc bf0006b9 0001f2a5 ea1d0600 00bebe07
ffff8800712861c0 4023655828 C Bi:1:038:1 0 13 = 55534253 0c000000 00000000 00
ffff8800712861c0 4023658266 S Bo:1:038:2 -115 31 = 55534243 0d000000 08000000 80020a25 00000000 00000000 00000000 000000
ffff8800712861c0 4023658318 C Bo:1:038:2 0 31 >
ffff8800712861c0 4023658371 S Bi:1:038:1 -115 8 <
ffff8800712861c0 4023658442 C Bi:1:038:1 0 8 = 03a2cfe3 00000200
ffff8800712861c0 4023658490 S Bi:1:038:1 -115 13 <
ffff8800712861c0 4023658569 C Bi:1:038:1 0 13 = 55534253 0d000000 00000000 00
ffff88007017fd00 4023660405 S Bo:1:038:2 -115 31 = 55534243 0e000000 00020000 80020a28 00000000 00000001 00000000 000000
ffff88007017fd00 4023660447 C Bo:1:038:2 0 31 >
ffff8800439611c0 4023660585 S Bi:1:038:1 -115 512 <
ffff88007005f400 4023660599 S Bi:1:038:1 -115 13 <
ffff8800439611c0 4023660945 C Bi:1:038:1 0 512 = fa33c08e d0bc007c 8bf45007 501ffbfc bf0006b9 0001f2a5 ea1d0600 00bebe07
ffff88007005f400 4023660952 C Bi:1:038:1 0 13 = 55534253 0e000000 00000000 00
ffff88007005f400 4023662383 S Bo:1:038:2 -115 31 = 55534243 10a0f803 c0000000 8002061a 001c00c0 00000000 00000000 000000
ffff88007005f400 4023662445 C Bo:1:038:2 0 31 >
ffff88007005f400 4023664145 S Bi:1:038:1 -115 192 <
ffff88007005f400 4023664196 C Bi:1:038:1 0 192 = 0b001008 1c0116fe 00000200 00000000 00000000 00000000 00000000 00000000
ffff88007005f400 4023666241 S Bi:1:038:1 -115 512 <
ffff88007005f400 4023666319 C Bi:1:038:1 0 13 = 55534253 10a0f803 00000000 00
ffff88007005f400 4023668378 S Bo:1:038:2 -115 31 = 55534243 6067bb03 c0000000 8002061a 000800c0 00000000 00000000 000000
ffff88007005f400 4023668450 C Bo:1:038:2 0 31 >
ffff88007005f400 4023670117 S Bi:1:038:1 -115 192 <
ffff88007005f400 4023670198 C Bi:1:038:1 0 192 = 1f001008 1c0116fe 00000200 081210ff ffffffff ffff0000 00000000 00000000
ffff88007005f400 4023672239 S Bi:1:038:1 -115 512 <
ffff88007005f400 4023672319 C Bi:1:038:1 0 13 = 55534253 6067bb03 00000000 00
ffff88007005f400 4023674364 S Bo:1:038:2 -115 31 = 55534243 10ccb003 00000000 00010600 00000000 00000000 00000000 000000
ffff88007005f400 4023674444 C Bo:1:038:2 0 31 >
ffff88007005f400 4023676236 S Bi:1:038:1 -115 512 <
ffff88007005f400 4023676322 C Bi:1:038:1 0 13 = 55534253 10ccb003 00000000 00
ffff88007005f400 4023677262 S Bo:1:038:2 -115 31 = 55534243 0f000000 08000000 80020a25 00000000 00000000 00000000 000000
ffff88007005f400 4023677323 C Bo:1:038:2 0 31 >
ffff88007017fd00 4023677472 S Bi:1:038:1 -115 8 <
ffff88007017fd00 4023677569 C Bi:1:038:1 0 8 = 03a2cfe3 00000200
ffff88007017fd00 4023677612 S Bi:1:038:1 -115 13 <
ffff88007017fd00 4023677696 C Bi:1:038:1 0 13 = 55534253 0f000000 00000000 00
ffff88007005f400 4023679380 S Bo:1:038:2 -115 31 = 55534243 10ccb003 c0000000 8001061a 003f00c0 00000000 00000000 000000
ffff88007005f400 4023679446 C Bo:1:038:2 0 31 >
ffff88007005f400 4023681225 S Bi:1:038:1 -115 192 <
ffff88007005f400 4023681321 C Bi:1:038:1 0 192 = 1f001008 1c0116fe 00000200 081210ff ffffffff ffff0000 00000000 00000000
ffff880070b38e80 4023683236 S Bi:1:038:1 -115 512 <
ffff880070b38e80 4023683318 C Bi:1:038:1 0 13 = 55534253 10ccb003 00000000 00
ffff880070b38e80 4023685401 S Bo:1:038:2 -115 31 = 55534243 10000000 00020000 80020a28 00000000 00000001 00000000 000000
ffff880070b38e80 4023685449 C Bo:1:038:2 0 31 >
ffff88007005f400 4023685492 S Bi:1:038:1 -115 512 <
ffff88007017fd00 4023685504 S Bi:1:038:1 -115 13 <
ffff88007005f400 4023685697 C Bi:1:038:1 0 512 = fa33c08e d0bc007c 8bf45007 501ffbfc bf0006b9 0001f2a5 ea1d0600 00bebe07
ffff88007017fd00 4023685819 C Bi:1:038:1 0 13 = 55534253 10000000 00000000 00
ffff88007017fd00 4023687244 S Bo:1:038:2 -115 31 = 55534243 11000000 08000000 80010a25 00000000 00000000 00000000 000000
ffff88007017fd00 4023687321 C Bo:1:038:2 0 31 >
ffff880070b38e80 4023687361 S Bi:1:038:1 -115 8 <
ffff880070b38e80 4023687445 C Bi:1:038:1 0 8 = 03a2cfe3 00000200
ffff8800712861c0 4023687481 S Bi:1:038:1 -115 13 <
ffff8800712861c0 4023687571 C Bi:1:038:1 0 13 = 55534253 11000000 00000000 00
ffff88006eed6880 4023689382 S Bo:1:038:2 -115 31 = 55534243 12000000 00020000 80020a28 00000000 00000001 00000000 000000
ffff88006eed6880 4023689446 C Bo:1:038:2 0 31 >
ffff88006e86b340 4023689485 S Bi:1:038:1 -115 512 <
ffff88007014cd00 4023689495 S Bi:1:038:1 -115 13 <
ffff88006e86b340 4023689695 C Bi:1:038:1 0 512 = fa33c08e d0bc007c 8bf45007 501ffbfc bf0006b9 0001f2a5 ea1d0600 00bebe07
ffff88007014cd00 4023689702 C Bi:1:038:1 0 13 = 55534253 12000000 00000000 00
ffff880070105580 4023691373 S Bo:1:038:2 -115 31 = 55534243 10ccb003 00000000 00010600 00000000 00000000 00000000 000000
ffff880070105580 4023691463 C Bo:1:038:2 0 31 >
ffff88006effda00 4023693231 S Bi:1:038:1 -115 512 <
ffff88006effda00 4023693321 C Bi:1:038:1 0 13 = 55534253 10ccb003 00000000 00
ffff88006eeee400 4023695241 S Bo:1:038:2 -115 31 = 55534243 13000000 08000000 80020a25 00000000 00000000 00000000 000000
ffff88006eeee400 4023695320 C Bo:1:038:2 0 31 >
ffff88006e786280 4023695361 S Bi:1:038:1 -115 8 <
ffff88006e786280 4023695442 C Bi:1:038:1 0 8 = 03a2cfe3 00000200
ffff880071178400 4023695477 S Bi:1:038:1 -115 13 <
ffff880071178400 4023695567 C Bi:1:038:1 0 13 = 55534253 13000000 00000000 00
ffff88006e4d1b80 4023697379 S Bo:1:038:2 -115 31 = 55534243 10bcb303 c0000000 8001061a 003f00c0 00000000 00000000 000000
ffff88006e4d1b80 4023697445 C Bo:1:038:2 0 31 >
ffff880070e26640 4023699229 S Bi:1:038:1 -115 192 <
ffff880070e26640 4023699324 C Bi:1:038:1 0 192 = 1f001008 1c0116fe 00000200 081210ff ffffffff ffff0000 00000000 00000000
ffff880070105e80 4023701226 S Bi:1:038:1 -115 512 <
ffff880070105e80 4023701321 C Bi:1:038:1 0 13 = 55534253 10bcb303 00000000 00
ffff88006e62bb80 4023703253 S Bo:1:038:2 -115 31 = 55534243 14000000 08000000 80020a25 00000000 00000000 00000000 000000
ffff88006e62bb80 4023703318 C Bo:1:038:2 0 31 >
ffff8800701d1040 4023703373 S Bi:1:038:1 -115 8 <
ffff8800701d1040 4023703443 C Bi:1:038:1 0 8 = 03a2cfe3 00000200
ffff88006e6fd340 4023703480 S Bi:1:038:1 -115 13 <
ffff88006e6fd340 4023703573 C Bi:1:038:1 0 13 = 55534253 14000000 00000000 00
ffff880070b3a040 4023705357 S Bo:1:038:2 -115 31 = 55534243 10bcb303 00000000 00010600 00000000 00000000 00000000 000000
ffff880070b3a040 4023705449 C Bo:1:038:2 0 31 >
ffff88006ef06040 4023706239 S Bi:1:038:1 -115 512 <
ffff88006ef06040 4023706319 C Bi:1:038:1 0 13 = 55534253 10bcb303 00000000 00
ffff8800365db400 4023708399 S Bo:1:038:2 -115 31 = 55534243 15000000 00020000 80020a28 00000000 00000001 00000000 000000
ffff8800365db400 4023708449 C Bo:1:038:2 0 31 >
ffff8800439cba00 4023708496 S Bi:1:038:1 -115 512 <
ffff88006ef2b7c0 4023708508 S Bi:1:038:1 -115 13 <
ffff8800439cba00 4023708696 C Bi:1:038:1 0 512 = fa33c08e d0bc007c 8bf45007 501ffbfc bf0006b9 0001f2a5 ea1d0600 00bebe07
ffff88006ef2b7c0 4023708704 C Bi:1:038:1 0 13 = 55534253 15000000 00000000 00
ffff880043a4cb80 4023710231 S Bo:1:038:2 -115 31 = 55534243 c09ab003 00000000 00010600 00000000 00000000 00000000 000000
ffff880043a4cb80 4023710321 C Bo:1:038:2 0 31 >
ffff88006eeaa880 4023712240 S Bi:1:038:1 -115 512 <
ffff88006eeaa880 4023712327 C Bi:1:038:1 0 13 = 55534253 c09ab003 00000000 00
ffff88006eff61c0 4023714385 S Bo:1:038:2 -115 31 = 55534243 16000000 00020000 80020a28 00000000 00000001 00000000 000000
ffff88006eff61c0 4023714445 C Bo:1:038:2 0 31 >
ffff880070b38b80 4023714533 S Bi:1:038:1 -115 512 <
ffff88007101cd00 4023714544 S Bi:1:038:1 -115 13 <
ffff880070b38b80 4023714695 C Bi:1:038:1 0 512 = fa33c08e d0bc007c 8bf45007 501ffbfc bf0006b9 0001f2a5 ea1d0600 00bebe07
ffff88007101cd00 4023714701 C Bi:1:038:1 0 13 = 55534253 16000000 00000000 00
ffff88007122de80 4023716377 S Bo:1:038:2 -115 31 = 55534243 90093404 c0000000 8001061a 003f00c0 00000000 00000000 000000
ffff88007122de80 4023716446 C Bo:1:038:2 0 31 >
ffff88006e664dc0 4023718243 S Bi:1:038:1 -115 192 <
ffff88006e664dc0 4023718332 C Bi:1:038:1 0 192 = 1f001008 1c0116fe 00000200 081210ff ffffffff ffff0000 00000000 00000000
ffff88006e6b5700 4023721125 S Bi:1:038:1 -115 512 <
ffff88006e6b5700 4023721195 C Bi:1:038:1 0 13 = 55534253 90093404 00000000 00
ffff88006ee8f340 4023723248 S Bo:1:038:2 -115 31 = 55534243 17000000 08000000 80020a25 00000000 00000000 00000000 000000
ffff88006ee8f340 4023723320 C Bo:1:038:2 0 31 >
ffff880036e91640 4023723375 S Bi:1:038:1 -115 8 <
ffff880036e91640 4023723448 C Bi:1:038:1 0 8 = 03a2cfe3 00000200
ffff88007016a4c0 4023723486 S Bi:1:038:1 -115 13 <
ffff88007016a4c0 4023723568 C Bi:1:038:1 0 13 = 55534253 17000000 00000000 00
ffff880071ae8b80 4023725385 S Bo:1:038:2 -115 31 = 55534243 c09ab003 54000000 80000a46 01000000 00000054 00000000 000000
ffff880071ae8b80 4023725444 C Bo:1:038:2 0 31 >
ffff88006fa94040 4023727240 S Bi:1:038:1 -115 84 <
ffff88006fa94040 4023727326 C Bi:1:038:1 0 84 = 00000050 00000010 00000308 00100100 00080000 00010b04 00000007 00020704
ffff880070a54700 4023729232 S Bi:1:038:1 -115 512 <
ffff880070a54700 4023729323 C Bi:1:038:1 0 13 = 55534253 c09ab003 00000000 00
ffff88006ee851c0 4023731248 S Bo:1:038:2 -115 31 = 55534243 10a0f803 00000000 00010600 00000000 00000000 00000000 000000
ffff88006ee851c0 4023731321 C Bo:1:038:2 0 31 >
ffff88006ee54640 4023733238 S Bi:1:038:1 -115 512 <
ffff88006ee54640 4023733325 C Bi:1:038:1 0 13 = 55534253 10a0f803 00000000 00
ffff88006ec627c0 4023735248 S Bo:1:038:2 -115 31 = 55534243 18000000 08000000 80020a25 00000000 00000000 00000000 000000
ffff88006ec627c0 4023735321 C Bo:1:038:2 0 31 >
ffff880036e91700 4023735381 S Bi:1:038:1 -115 8 <
ffff880036e91700 4023735443 C Bi:1:038:1 0 8 = 03a2cfe3 00000200
ffff880070160040 4023735489 S Bi:1:038:1 -115 13 <
ffff880070160040 4023735577 C Bi:1:038:1 0 13 = 55534253 18000000 00000000 00
ffff88006fb424c0 4023737394 S Bo:1:038:2 -115 31 = 55534243 50267703 f0ff0000 80000a5a 082a0000 0000fff0 00000000 000000
ffff88006fb424c0 4023737447 C Bo:1:038:2 0 31 >
ffff880070b38880 4023738250 S Bi:1:038:1 -115 65520 <
ffff880070b38880 4023738325 C Bi:1:038:1 0 34 = 00200000 00000000 2a180800 01002900 00000000 00000000 00000000 00000000
ffff88006e62be80 4023740223 S Bi:1:038:1 -115 512 <
ffff88006e62be80 4023740341 C Bi:1:038:1 -32 0
ffff88006fbabb80 4023742234 S Co:1:038:0 s 02 01 0000 0081 0000 0
ffff88006fbabb80 4023742320 C Co:1:038:0 0 0
ffff88006fbabb80 4023744227 S Bi:1:038:1 -115 512 <
ffff88006fbabb80 4023744319 C Bi:1:038:1 0 13 = 55534253 50267703 ceff0000 00
ffff880070158340 4023745261 S Bo:1:038:2 -115 31 = 55534243 19000000 08000000 80010a25 00000000 00000000 00000000 000000
ffff880070158340 4023745319 C Bo:1:038:2 0 31 >
ffff88006e616a00 4023745372 S Bi:1:038:1 -115 8 <
ffff88006e616a00 4023745448 C Bi:1:038:1 0 8 = 03a2cfe3 00000200
ffff880070b38400 4023745483 S Bi:1:038:1 -115 13 <
ffff880070b38400 4023745574 C Bi:1:038:1 0 13 = 55534253 19000000 00000000 00
ffff8800438d2580 4023747381 S Bo:1:038:2 -115 31 = 55534243 1a000000 00020000 80020a28 00000000 00000001 00000000 000000
ffff8800438d2580 4023747450 C Bo:1:038:2 0 31 >
