ffff88006effd700 3813800571 S Ci:1:037:0 s 80 06 0100 0000 0012 18 <
ffff88006effd700 3813800726 C Ci:1:037:0 0 18 = 12011002 00000040 d80d0831 04010102 0301
ffff88006effd700 3813800744 S Ci:1:037:0 s 80 06 0f00 0000 0005 5 <
ffff88006effd700 3813800842 C Ci:1:037:0 0 5 = 050f1600 02
ffff88006effd700 3813800878 S Ci:1:037:0 s 80 06 0f00 0000 0016 22 <
ffff88006effd700 3813801096 C Ci:1:037:0 0 22 = 050f1600 02071002 06000000 0a100300 0e00010a 0002
ffff88006effd700 3813801221 S Ci:1:037:0 s 80 06 0200 0000 0009 9 <
ffff88006effd700 3813801344 C Ci:1:037:0 0 9 = 09022000 01010080 96
ffff88006effd700 3813801521 S Ci:1:037:0 s 80 06 0200 0000 0020 32 <
ffff88006effd700 3813801722 C Ci:1:037:0 0 32 = 09022000 01010080 96090400 00020806 50000705 81020002 00070502 02000200
ffff8800702d1040 3813801758 S Ci:1:037:0 s 80 06 0300 0000 00ff 255 <
ffff8800702d1040 3813801843 C Ci:1:037:0 0 4 = 04030904
ffff8800702d1040 3813801885 S Ci:1:037:0 s 80 06 0302 0409 00ff 255 <
ffff8800702d1040 3813802093 C Ci:1:037:0 0 34 = 22034f00 6e006c00 79004400 69007300 6b000000 00000000 00000000 00000000
ffff8800702d1040 3813802104 S Ci:1:037:0 s 80 06 0301 0409 00ff 255 <
ffff8800702d1040 3813802344 C Ci:1:037:0 0 18 = 12034e00 65007400 61006300 00000000 0000
ffff8800702d1040 3813802354 S Ci:1:037:0 s 80 06 0303 0409 00ff 255 <
ffff8800702d1040 3813802594 C Ci:1:037:0 0 34 = 22033600 37003900 32003900 43004200 43003100 35004400 44003800 33004500
ffff880070b38700 3813802842 S Co:1:037:0 s 00 09 0001 0000 0000 0
ffff880070b38700 3813802973 C Co:1:037:0 0 0
ffff880070f66d00 3813821010 S Bo:1:037:2 -115 31 = 55534243 00000000 08000000 80000a25 00000000 00000000 00000000 000000
ffff880070f66d00 3813821101 C Bo:1:037:2 0 31 >
ffff8800000594c0 3813821295 S Bi:1:037:1 -115 8 <
ffff8800000594c0 3813821476 C Bi:1:037:1 0 8 = 000063ff 00000800
ffff8800000594c0 3813821535 S Bi:1:037:1 -115 13 <
ffff8800000594c0 3813821593 C Bi:1:037:1 0 13 = 55534253 00000000 00000000 00
ffff8800000594c0 3813821859 S Bo:1:037:2 -115 31 = 55534243 01000000 00080000 80000a28 00000000 00000001 00000000 000000
ffff8800000594c0 3813821970 C Bo:1:037:2 0 31 >
ffff8800000594c0 3813822019 S Bi:1:037:1 -115 2048 <
ffff8800000594c0 3813822468 C Bi:1:037:1 0 2048 = 00000000 00000000 00000000 00000000 00000000 00000000 00000000 00000000
ffff8800000594c0 3813822502 S Bi:1:037:1 -115 13 <
ffff8800000594c0 3813822596 C Bi:1:037:1 -32 0
ffff8800000594c0 3813822682 S Bi:1:037:1 -115 13 <
ffff8800000594c0 3813822970 C Bi:1:037:1 -32 0
ffff88006e6eb4c0 3813823049 S Bi:1:037:1 -115 13 <
ffff88006e6eb4c0 3813823346 C Bi:1:037:1 -32 0
ffff88006ef8b940 3813823421 S Bi:1:037:1 -115 13 <
ffff88006ef8b940 3813823719 C Bi:1:037:1 -32 0
ffff88006ee36c40 3813823792 S Bi:1:037:1 -115 13 <
ffff88006ee36c40 3813824097 C Bi:1:037:1 -32 0
ffff88006eedb400 3813824256 S Co:1:003:0 s 23 03 0004 0004 0000 0
ffff88006eedb400 3813824345 C Co:1:003:0 0 0
ffff88006eb40280 3813836572 S Ci:1:003:0 s a3 00 0000 0004 0004 4 <
ffff88006eb40280 3813836726 C Ci:1:003:0 0 4 = 11050000
ffff880036dd61c0 3813852572 S Ci:1:003:0 s a3 00 0000 0004 0004 4 <
ffff880036dd61c0 3813852729 C Ci:1:003:0 0 4 = 03051000
ffff880036dd61c0 3813852749 S Co:1:003:0 s 23 01 0014 0004 0000 0
ffff880036dd61c0 3813852845 C Co:1:003:0 0 0
ffff880036dd61c0 3813908576 S Ci:1:000:0 s 80 06 0100 0000 0040 64 <
ffff880036dd61c0 3813912596 C Ci:1:000:0 -71 0
ffff880036dd61c0 3813912634 S Ci:1:000:0 s 80 06 0100 0000 0040 64 <
ffff880036dd61c0 3813916845 C Ci:1:000:0 -71 0
ffff880036dd61c0 3813916857 S Ci:1:000:0 s 80 06 0100 0000 0040 64 <
ffff880036dd61c0 3813921098 C Ci:1:000:0 -71 0
ffff880036dd61c0 3813921111 S Co:1:003:0 s 23 03 0004 0004 0000 0
ffff880036dd61c0 3813921224 C Co:1:003:0 0 0
ffff880036dd61c0 3813936566 S Ci:1:003:0 s a3 00 0000 0004 0004 4 <
ffff880036dd61c0 3813936723 C Ci:1:003:0 0 4 = 03051000
ffff880036dd61c0 3813936732 S Co:1:003:0 s 23 01 0014 0004 0000 0
ffff880036dd61c0 3813936842 C Co:1:003:0 0 0
ffff88006efeb7c0 3814096568 S Ci:1:000:0 s 80 06 0100 0000 0040 64 <
ffff88006efeb7c0 3814096732 C Ci:1:000:0 0 18 = 12011002 00000040 d80d0831 04010102 0301
ffff88006efeb7c0 3814096757 S Co:1:003:0 s 23 03 0004 0004 0000 0
ffff88006efeb7c0 3814096842 C Co:1:003:0 0 0
ffff8800701077c0 3814112569 S Ci:1:003:0 s a3 00 0000 0004 0004 4 <
ffff8800701077c0 3814112722 C Ci:1:003:0 0 4 = 03051000
ffff8800701077c0 3814112753 S Co:1:003:0 s 23 01 0014 0004 0000 0
ffff8800701077c0 3814112842 C Co:1:003:0 0 0
ffff8800701077c0 3814168571 S Co:1:000:0 s 00 05 0025 0000 0000 0
ffff8800701077c0 3814168725 C Co:1:000:0 0 0
ffff88006eb40280 3814188561 S Ci:1:037:0 s 80 06 0100 0000 0012 18 <
ffff88006eb40280 3814188719 C Ci:1:037:0 0 18 = 12011002 00000040 d80d0831 04010102 0301
ffff88006eb40280 3814188730 S Ci:1:037:0 s 80 06 0f00 0000 0005 5 <
ffff88006eb40280 3814188843 C Ci:1:037:0 0 5 = 050f1600 02
ffff88006eb40280 3814188854 S Ci:1:037:0 s 80 06 0f00 0000 0016 22 <
ffff88006eb40280 3814188968 C Ci:1:037:0 0 22 = 050f1600 02071002 06000000 0a100300 0e00010a 0002
ffff88006eb40280 3814188981 S Ci:1:037:0 s 80 06 0200 0000 0020 32 <
ffff88006eb40280 3814189219 C Ci:1:037:0 0 32 = 09022000 01010080 96090400 00020806 50000705 81020002 00070502 02000200
ffff88006eb40280 3814189232 S Ci:1:037:0 s 80 06 0303 0409 00ff 255 <
ffff88006eb40280 3814189469 C Ci:1:037:0 0 34 = 22033600 37003900 32003900 43004200 43003100 35004400 44003800 33004500
ffff88006eb40280 3814189481 S Co:1:037:0 s 00 09 0001 0000 0000 0
ffff88006eb40280 3814189599 C Co:1:037:0 0 0
ffff880070a5a880 3814189666 S Bo:1:037:2 -115 31 = 55534243 01000000 00080000 80000a28 00000000 00000001 00000000 000000
ffff880070a5a880 3814189721 C Bo:1:037:2 0 31 >
ffff88006eb40280 3814189767 S Bi:1:037:1 -115 2048 <
ffff88006eb40280 3814190092 C Bi:1:037:1 0 2048 = 00000000 00000000 00000000 00000000 00000000 00000000 00000000 00000000
ffff880036dd61c0 3814190144 S Bi:1:037:1 -115 13 <
ffff880036dd61c0 3814190219 C Bi:1:037:1 -32 0
ffff880036dd61c0 3814190251 S Bi:1:037:1 -115 13 <
ffff880036dd61c0 3814190595 C Bi:1:037:1 -32 0
ffff88006eb40280 3814190635 S Bi:1:037:1 -115 13 <
ffff88006eb40280 3814190970 C Bi:1:037:1 -32 0
ffff880070a5a880 3814191002 S Bi:1:037:1 -115 13 <
ffff880070a5a880 3814191346 C Bi:1:037:1 -32 0
ffff88006efebe80 3814191378 S Bi:1:037:1 -115 13 <
ffff88006efebe80 3814191718 C Bi:1:037:1 -32 0
ffff8800701077c0 3814192570 S Co:1:003:0 s 23 03 0004 0004 0000 0
ffff8800701077c0 3814192721 C Co:1:003:0 0 0
ffff8800701077c0 3814208570 S Ci:1:003:0 s a3 00 0000 0004 0004 4 <
ffff8800701077c0 3814208718 C Ci:1:003:0 0 4 = 03051000
ffff8800701077c0 3814208733 S Co:1:003:0 s 23 01 0014 0004 0000 0
ffff8800701077c0 3814208843 C Co:1:003:0 0 0
ffff8800701077c0 3814264597 S Ci:1:000:0 s 80 06 0100 0000 0040 64 <
ffff8800701077c0 3814264730 C Ci:1:000:0 0 18 = 12011002 00000040 d80d0831 04010102 0301
ffff8800701077c0 3814264744 S Co:1:003:0 s 23 03 0004 0004 0000 0
ffff8800701077c0 3814264844 C Co:1:003:0 0 0
ffff880070a5a880 3814280563 S Ci:1:003:0 s a3 00 0000 0004 0004 4 <
ffff880070a5a880 3814280724 C Ci:1:003:0 0 4 = 03051000
ffff880070a5a880 3814280736 S Co:1:003:0 s 23 01 0014 0004 0000 0
ffff880070a5a880 3814280843 C Co:1:003:0 0 0
ffff88006efebe80 3814336562 S Co:1:000:0 s 00 05 0025 0000 0000 0
ffff88006efebe80 3814336721 C Co:1:000:0 0 0
ffff880036ec5dc0 3814356563 S Ci:1:037:0 s 80 06 0100 0000 0012 18 <
ffff880036ec5dc0 3814356726 C Ci:1:037:0 0 18 = 12011002 00000040 d80d0831 04010102 0301
ffff880036ec5dc0 3814356743 S Ci:1:037:0 s 80 06 0f00 0000 0005 5 <
ffff880036ec5dc0 3814356846 C Ci:1:037:0 0 5 = 050f1600 02
ffff880036ec5dc0 3814356862 S Ci:1:037:0 s 80 06 0f00 0000 0016 22 <
ffff880036ec5dc0 3814357097 C Ci:1:037:0 0 22 = 050f1600 02071002 06000000 0a100300 0e00010a 0002
ffff880036ec5dc0 3814357142 S Ci:1:037:0 s 80 06 0200 0000 0020 32 <
ffff880036ec5dc0 3814357343 C Ci:1:037:0 0 32 = 09022000 01010080 96090400 00020806 50000705 81020002 00070502 02000200
ffff880036ec5dc0 3814357353 S Ci:1:037:0 s 80 06 0303 0409 00ff 255 <
ffff880036ec5dc0 3814357594 C Ci:1:037:0 0 34 = 22033600 37003900 32003900 43004200 43003100 35004400 44003800 33004500
ffff880036ec5dc0 3814357605 S Co:1:037:0 s 00 09 0001 0000 0000 0
ffff880036ec5dc0 3814357720 C Co:1:037:0 0 0
ffff88006e6eb280 3814832633 S Ci:1:037:0 s 80 06 0303 0409 00ff 255 <
ffff88006e6eb280 3814832856 C Ci:1:037:0 0 34 = 22033600 37003900 32003900 43004200 43003100 35004400 44003800 33004500
ffff88006e6eb280 3814834568 S Ci:1:037:0 s 80 06 0300 0000 00ff 255 <
ffff88006e6eb280 3814834722 C Ci:1:037:0 0 4 = 04030904
ffff88006e6eb280 3814836580 S Ci:1:037:0 s 80 06 0302 0409 00ff 255 <
ffff88006efeb7c0 3814836626 S Ci:1:037:0 s 80 06 0301 0409 00ff 255 <
ffff88006e6eb280 3814836849 C Ci:1:037:0 0 34 = 22034f00 6e006c00 79004400 69007300 6b000000 00000000 00000000 00000000
ffff88006efeb7c0 3814836971 C Ci:1:037:0 0 18 = 12034e00 65007400 61006300 00000000 0000
ffff88006e6eb280 3814914185 S Ci:1:037:0 s a1 fe 0000 0000 0001 1 <
ffff88006e6eb280 3814914359 C Ci:1:037:0 0 1 = 02
ffff88006e6eb280 3814916619 S Bo:1:037:2 -115 31 = 55534243 60886603 24000000 80000612 00000024 00000000 00000000 000000
ffff88006e6eb280 3814916724 C Bo:1:037:2 0 31 >
ffff88006e6eb280 3814917542 S Bi:1:037:1 -115 36 <
ffff88006e6eb280 3814917725 C Bi:1:037:1 0 36 = 05800612 47000002 4e657461 63000000 4f6e6c79 4469736b 00000000 00000000
ffff88006e6eb280 3814919583 S Bi:1:037:1 -115 512 <
ffff88006e6eb280 3814919723 C Bi:1:037:1 0 13 = 55534253 60886603 00000000 00
ffff88006e6eb280 3814921698 S Bo:1:037:2 -115 31 = 55534243 10bcb303 4c000000 80000612 0000004c 00000000 00000000 000000
ffff88006e6eb280 3814921852 C Bo:1:037:2 0 31 >
ffff88006e6eb280 3814923540 S Bi:1:037:1 -115 76 <
ffff88006e6eb280 3814923593 C Bi:1:037:1 0 76 = 05800612 47000002 4e657461 63000000 4f6e6c79 4469736b 00000000 00000000
ffff88006e6eb280 3814925558 S Bi:1:037:1 -115 512 <
ffff88006e6eb280 3814925725 C Bi:1:037:1 0 13 = 55534253 10bcb303 00000000 00
ffff88006e6eb280 3814927692 S Bo:1:037:2 -115 31 = 55534243 10bcb303 00000000 00000ca2 00000080 00000000 00000000 000000
ffff88006e6eb280 3814927725 C Bo:1:037:2 0 31 >
ffff8800701077c0 3814929554 S Bi:1:037:1 -115 512 <
ffff8800701077c0 3814929722 C Bi:1:037:1 0 13 = 55534253 10bcb303 00000000 01
ffff8800701077c0 3814930672 S Bo:1:037:2 -115 31 = 55534243 10bcb303 00000000 00000ca2 00000080 00000000 00000000 000000
ffff8800701077c0 3814930720 C Bo:1:037:2 0 31 >
ffff8800701077c0 3814932527 S Bi:1:037:1 -115 512 <
ffff8800701077c0 3814932597 C Bi:1:037:1 0 13 = 55534253 10bcb303 00000000 01
ffff8800701077c0 3814934675 S Bo:1:037:2 -115 31 = 55534243 10bcb303 00000000 00000ca2 00000080 00000000 00000000 000000
ffff8800701077c0 3814934718 C Bo:1:037:2 0 31 >
ffff8800701077c0 3814935542 S Bi:1:037:1 -115 512 <
ffff8800701077c0 3814935596 C Bi:1:037:1 0 13 = 55534253 10bcb303 00000000 01
ffff8800701077c0 3814936674 S Bo:1:037:2 -115 31 = 55534243 10bcb303 00000000 00000ca2 00000000 00000000 00000000 000000
ffff8800701077c0 3814936719 C Bo:1:037:2 0 31 >
ffff8800701077c0 3814938525 S Bi:1:037:1 -115 512 <
ffff8800701077c0 3814938595 C Bi:1:037:1 0 13 = 55534253 10bcb303 00000000 01
ffff8800701077c0 3814940670 S Bo:1:037:2 -115 31 = 55534243 10bcb303 00000000 00000ca2 00000000 00000000 00000000 000000
ffff8800701077c0 3814940717 C Bo:1:037:2 0 31 >
ffff8800701077c0 3814942526 S Bi:1:037:1 -115 512 <
ffff8800701077c0 3814942605 C Bi:1:037:1 0 13 = 55534253 10bcb303 00000000 01
ffff8800701077c0 3814944683 S Bo:1:037:2 -115 31 = 55534243 10bcb303 00000000 00000ca2 00000000 00000000 00000000 000000
ffff8800701077c0 3814944720 C Bo:1:037:2 0 31 >
ffff8800701077c0 3814945523 S Bi:1:037:1 -115 512 <
ffff8800701077c0 3814945593 C Bi:1:037:1 0 13 = 55534253 10bcb303 00000000 01
ffff8800701077c0 3814947678 S Bo:1:037:2 -115 31 = 55534243 10bcb303 24000000 80000612 00000024 00000000 00000000 000000
ffff8800701077c0 3814947719 C Bo:1:037:2 0 31 >
ffff8800701077c0 3814949526 S Bi:1:037:1 -115 36 <
ffff8800701077c0 3814949595 C Bi:1:037:1 0 36 = 05800612 47000002 4e657461 63000000 4f6e6c79 4469736b 00000000 00000000
ffff8800701077c0 3814951535 S Bi:1:037:1 -115 512 <
ffff8800701077c0 3814951598 C Bi:1:037:1 0 13 = 55534253 10bcb303 00000000 00
ffff8800701077c0 3814953676 S Bo:1:037:2 -115 31 = 55534243 107cc201 ff000000 80000612 018000ff 00000000 00000000 000000
ffff8800701077c0 3814953719 C Bo:1:037:2 0 31 >
ffff8800701077c0 3814955522 S Bi:1:037:1 -115 255 <
ffff8800701077c0 3814955595 C Bi:1:037:1 0 28 = 00800018 00000000 00000000 04314e74 636f7400 00000000 00000000
ffff8800701077c0 3814957526 S Bi:1:037:1 -115 512 <
ffff8800701077c0 3814957604 C Bi:1:037:1 -32 0
ffff8800701077c0 3814959541 S Co:1:037:0 s 02 01 0000 0081 0000 0
ffff8800701077c0 3814959597 C Co:1:037:0 0 0
ffff8800701077c0 3814961532 S Bi:1:037:1 -115 512 <
ffff8800701077c0 3814961595 C Bi:1:037:1 0 13 = 55534253 107cc201 e3000000 00
ffff880070171f40 3814963673 S Bo:1:037:2 -115 31 = 55534243 10ccb003 24000000 80010612 00000024 00000000 00000000 000000
ffff880070171f40 3814963720 C Bo:1:037:2 0 31 >
ffff880070171f40 3814965527 S Bi:1:037:1 -115 36 <
ffff880070171f40 3814965594 C Bi:1:037:1 0 36 = 00800612 47000002 4e657461 63000000 4f6e6c79 4469736b 00000000 00000000
ffff8800439e2280 3814967566 S Bi:1:037:1 -115 512 <
ffff8800439e2280 3814967728 C Bi:1:037:1 0 13 = 55534253 10ccb003 00000000 00
ffff8800439e2280 3814969713 S Bo:1:037:2 -115 31 = 55534243 10ccb003 4c000000 80010612 0000004c 00000000 00000000 000000
ffff8800439e2280 3814969852 C Bo:1:037:2 0 31 >
ffff8800439e2280 3814970741 S Bi:1:037:1 -115 76 <
ffff8800439e2280 3814970847 C Bi:1:037:1 0 76 = 00800612 47000002 4e657461 63000000 4f6e6c79 4469736b 00000000 00000000
ffff8800439e2280 3814972525 S Bi:1:037:1 -115 512 <
ffff8800439e2280 3814972596 C Bi:1:037:1 0 13 = 55534253 10ccb003 00000000 00
ffff8800439e2280 3814973668 S Bo:1:037:2 -115 31 = 55534243 40c33b03 00000000 00010ca2 00000080 00000000 00000000 000000
ffff8800439e2280 3814973720 C Bo:1:037:2 0 31 >
ffff8800439e2280 3814975524 S Bi:1:037:1 -115 512 <
ffff8800439e2280 3814975595 C Bi:1:037:1 0 13 = 55534253 40c33b03 00000000 01
ffff8800439e2280 3814977705 S Bo:1:037:2 -115 31 = 55534243 107cc201 00000000 00010ca2 00000080 00000000 00000000 000000
ffff8800439e2280 3814977845 C Bo:1:037:2 0 31 >
ffff8800439e2280 3814979539 S Bi:1:037:1 -115 512 <
ffff8800439e2280 3814979593 C Bi:1:037:1 0 13 = 55534253 107cc201 00000000 01
ffff8800439e2280 3814981662 S Bo:1:037:2 -115 31 = 55534243 b0f4c101 00000000 00010ca2 00000080 00000000 00000000 000000
ffff8800439e2280 3814981719 C Bo:1:037:2 0 31 >
ffff880000043c40 3814983542 S Bi:1:037:1 -115 512 <
ffff880000043c40 3814983598 C Bi:1:037:1 0 13 = 55534253 b0f4c101 00000000 01
ffff88006e6eb880 3814985677 S Bo:1:037:2 -115 31 = 55534243 102c2304 00000000 00010ca2 00000000 00000000 00000000 000000
ffff88006e6eb880 3814985720 C Bo:1:037:2 0 31 >
ffff88006e6eb880 3814986522 S Bi:1:037:1 -115 512 <
ffff88006e6eb880 3814986598 C Bi:1:037:1 0 13 = 55534253 102c2304 00000000 01
ffff88006e6eb880 3814987888 S Bo:1:037:2 -115 31 = 55534243 b0f4c101 00000000 00010ca2 00000000 00000000 00000000 000000
ffff88006e6eb880 3814987973 C Bo:1:037:2 0 31 >
ffff88006e6eb880 3814989526 S Bi:1:037:1 -115 512 <
ffff88006e6eb880 3814989596 C Bi:1:037:1 0 13 = 55534253 b0f4c101 00000000 01
ffff8800439e24c0 3814991694 S Bo:1:037:2 -115 31 = 55534243 b0f4c101 00000000 00010ca2 00000000 00000000 00000000 000000
ffff8800439e24c0 3814991844 C Bo:1:037:2 0 31 >
ffff8800439e24c0 3814996944 S Bi:1:037:1 -115 512 <
ffff8800439e24c0 3814997096 C Bi:1:037:1 0 13 = 55534253 b0f4c101 00000000 01
ffff8800439e24c0 3815002191 S Bo:1:037:2 -115 31 = 55534243 10bcb303 24000000 80010612 00000024 00000000 00000000 000000
ffff8800439e24c0 3815002349 C Bo:1:037:2 0 31 >
ffff8800439e24c0 3815003519 S Bi:1:037:1 -115 36 <
ffff8800439e24c0 3815003595 C Bi:1:037:1 0 36 = 00800612 47000002 4e657461 63000000 4f6e6c79 4469736b 00000000 00000000
ffff8800439e24c0 3815005526 S Bi:1:037:1 -115 512 <
ffff8800439e24c0 3815005596 C Bi:1:037:1 0 13 = 55534253 10bcb303 00000000 00
ffff8800439e24c0 3815007673 S Bo:1:037:2 -115 31 = 55534243 60886603 fc000000 80010a23 00000000 000000fc 00000000 000000
ffff8800439e24c0 3815007719 C Bo:1:037:2 0 31 >
ffff88006ef8ba00 3815009530 S Bi:1:037:1 -115 252 <
ffff88006ef8ba00 3815009598 C Bi:1:037:1 -32 0
ffff88006ef8ba00 3815011519 S Co:1:037:0 s 02 01 0000 0081 0000 0
ffff88006ef8ba00 3815011597 C Co:1:037:0 0 0
ffff88006ef8ba00 3815012542 S Bi:1:037:1 -115 512 <
ffff88006ef8ba00 3815012719 C Bi:1:037:1 0 13 = 55534253 60886603 fc000000 01
ffff88006ef8ba00 3815013674 S Bo:1:037:2 -115 31 = 55534243 60886603 12000000 80010c03 00000012 00000000 00000000 000000
ffff88006ef8ba00 3815013719 C Bo:1:037:2 0 31 >
ffff8800439e2f40 3815015519 S Bi:1:037:1 -115 18 <
ffff8800439e2f40 3815015595 C Bi:1:037:1 0 18 = 70000500 0000000a 00000000 20000000 0000
ffff8800439e2f40 3815017519 S Bi:1:037:1 -115 512 <
ffff8800439e2f40 3815017595 C Bi:1:037:1 0 13 = 55534253 60886603 00000000 00
ffff8800439e2f40 3815019667 S Bo:1:037:2 -115 31 = 55534243 a0e44902 fc000000 80010a23 00000000 000000fc 00000000 000000
ffff8800439e2f40 3815019718 C Bo:1:037:2 0 31 >
ffff8800439e2f40 3815020528 S Bi:1:037:1 -115 252 <
ffff8800439e2f40 3815020598 C Bi:1:037:1 -32 0
ffff88006ef8ba00 3815022454 S Co:1:037:0 s 02 01 0000 0081 0000 0
ffff88006ef8ba00 3815022597 C Co:1:037:0 0 0
ffff88006ef8ba00 3815024519 S Bi:1:037:1 -115 512 <
ffff88006ef8ba00 3815024594 C Bi:1:037:1 0 13 = 55534253 a0e44902 fc000000 01
ffff88006ef8bb80 3815026686 S Bo:1:037:2 -115 31 = 55534243 a0e44902 12000000 80010c03 00000012 00000000 00000000 000000
ffff88006ef8bb80 3815026846 C Bo:1:037:2 0 31 >
ffff88006ef8bb80 3815028519 S Bi:1:037:1 -115 18 <
ffff88006ef8bb80 3815028595 C Bi:1:037:1 0 18 = 70000500 0000000a 00000000 20000000 0000
ffff88006ef8bb80 3815030532 S Bi:1:037:1 -115 512 <
ffff88006ef8bb80 3815030595 C Bi:1:037:1 0 13 = 55534253 a0e44902 00000000 00
ffff88006ef8b340 3815032683 S Bo:1:037:2 -115 31 = 55534243 50267703 fc000000 80010a23 00000000 000000fc 00000000 000000
ffff88006ef8b340 3815032719 C Bo:1:037:2 0 31 >
ffff88006ef8b340 3815034519 S Bi:1:037:1 -115 252 <
ffff88006ef8b340 3815034597 C Bi:1:037:1 -32 0
ffff88006ef8b340 3815035519 S Co:1:037:0 s 02 01 0000 0081 0000 0
ffff88006ef8b340 3815035593 C Co:1:037:0 0 0
ffff88006ef8b340 3815037520 S Bi:1:037:1 -115 512 <
ffff88006ef8b340 3815037594 C Bi:1:037:1 0 13 = 55534253 50267703 fc000000 01
ffff88006ef8bb80 3815039673 S Bo:1:037:2 -115 31 = 55534243 50267703 12000000 80010c03 00000012 00000000 00000000 000000
ffff88006ef8bb80 3815039723 C Bo:1:037:2 0 31 >
ffff88007011ee80 3815041526 S Bi:1:037:1 -115 18 <
ffff88007011ee80 3815041594 C Bi:1:037:1 0 18 = 70000500 0000000a 00000000 20000000 0000
ffff88007011ee80 3815042518 S Bi:1:037:1 -115 512 <
ffff88007011ee80 3815042600 C Bi:1:037:1 0 13 = 55534253 50267703 00000000 00
ffff88007011ee80 3815049695 S Bo:1:037:2 -115 31 = 55534243 b0f4c101 ff000000 80010612 018000ff 00000000 00000000 000000
ffff88007011ee80 3815049853 C Bo:1:037:2 0 31 >
ffff88007011ee80 3815051165 S Bi:1:037:1 -115 255 <
ffff88007011ee80 3815051219 C Bi:1:037:1 0 28 = 00800018 00000000 00000000 04314e74 636f7400 00000000 00000000
ffff88007011ee80 3815052516 S Bi:1:037:1 -115 512 <
ffff88007011ee80 3815052596 C Bi:1:037:1 -32 0
ffff88007011ee80 3815054523 S Co:1:037:0 s 02 01 0000 0081 0000 0
ffff88007011ee80 3815054601 C Co:1:037:0 0 0
ffff88007011ee80 3815056518 S Bi:1:037:1 -115 512 <
ffff88007011ee80 3815056594 C Bi:1:037:1 0 13 = 55534253 b0f4c101 e3000000 00
ffff88007011ee80 3815057914 S Bo:1:037:2 -115 31 = 55534243 50267703 24000000 80020612 00000024 00000000 00000000 000000
ffff88007011ee80 3815057969 C Bo:1:037:2 0 31 >
ffff88007011ee80 3815059533 S Bi:1:037:1 -115 36 <
ffff88007011ee80 3815059600 C Bi:1:037:1 0 36 = 00800612 47000002 4e657461 63000000 4f6e6c79 4469736b 00000000 00000000
ffff88007011ee80 3815061519 S Bi:1:037:1 -115 512 <
ffff88007011ee80 3815061593 C Bi:1:037:1 0 13 = 55534253 50267703 00000000 00
ffff88007011ee80 3815063677 S Bo:1:037:2 -115 31 = 55534243 a0e44902 4c000000 80020612 0000004c 00000000 00000000 000000
ffff88007011ee80 3815063719 C Bo:1:037:2 0 31 >
ffff88007011ee80 3815065518 S Bi:1:037:1 -115 76 <
ffff88007011ee80 3815065598 C Bi:1:037:1 0 76 = 00800612 47000002 4e657461 63000000 4f6e6c79 4469736b 00000000 00000000
ffff88007011ee80 3815067519 S Bi:1:037:1 -115 512 <
ffff88007011ee80 3815067596 C Bi:1:037:1 0 13 = 55534253 a0e44902 00000000 00
ffff88007011ee80 3815069700 S Bo:1:037:2 -115 31 = 55534243 a0e44902 00000000 00020ca2 00000080 00000000 00000000 000000
ffff88007011ee80 3815069849 C Bo:1:037:2 0 31 >
ffff88007011ee80 3815071516 S Bi:1:037:1 -115 512 <
ffff88007011ee80 3815071596 C Bi:1:037:1 0 13 = 55534253 a0e44902 00000000 01
ffff88007011ee80 3815073459 S Bo:1:037:2 -115 31 = 55534243 50267703 00000000 00020ca2 00000080 00000000 00000000 000000
ffff88007011ee80 3815073596 C Bo:1:037:2 0 31 >
ffff88007011ee80 3815075514 S Bi:1:037:1 -115 512 <
ffff88007011ee80 3815075596 C Bi:1:037:1 0 13 = 55534253 50267703 00000000 01
ffff88007011ee80 3815076820 S Bo:1:037:2 -115 31 = 55534243 b0f4c101 00000000 00020ca2 00000080 00000000 00000000 000000
ffff88007011ee80 3815076972 C Bo:1:037:2 0 31 >
ffff88007011ee80 3815078516 S Bi:1:037:1 -115 512 <
ffff88007011ee80 3815078601 C Bi:1:037:1 0 13 = 55534253 b0f4c101 00000000 01
ffff88007011ee80 3815080667 S Bo:1:037:2 -115 31 = 55534243 b0f4c101 00000000 00020ca2 00000000 00000000 00000000 000000
ffff88007011ee80 3815080721 C Bo:1:037:2 0 31 >
ffff88006e6eb100 3815082531 S Bi:1:037:1 -115 512 <
ffff88006e6eb100 3815082596 C Bi:1:037:1 0 13 = 55534253 b0f4c101 00000000 01
ffff880070059dc0 3815084653 S Bo:1:037:2 -115 31 = 55534243 50267703 00000000 00020ca2 00000000 00000000 00000000 000000
ffff880070059dc0 3815084722 C Bo:1:037:2 0 31 >
ffff88007011ef40 3815085522 S Bi:1:037:1 -115 512 <
ffff88007011ef40 3815085594 C Bi:1:037:1 0 13 = 55534253 50267703 00000000 01
ffff88007011ef40 3815087662 S Bo:1:037:2 -115 31 = 55534243 50267703 00000000 00020ca2 00000000 00000000 00000000 000000
ffff88007011ef40 3815087720 C Bo:1:037:2 0 31 >
ffff88006ef8bc40 3815089523 S Bi:1:037:1 -115 512 <
ffff88006ef8bc40 3815089594 C Bi:1:037:1 0 13 = 55534253 50267703 00000000 01
ffff88006ee36c40 3815090680 S Bo:1:037:2 -115 31 = 55534243 b0f4c101 24000000 80020612 00000024 00000000 00000000 000000
ffff88006ee36c40 3815090723 C Bo:1:037:2 0 31 >
ffff88006ee36c40 3815092513 S Bi:1:037:1 -115 36 <
ffff88006ee36c40 3815092595 C Bi:1:037:1 0 36 = 00800612 47000002 4e657461 63000000 4f6e6c79 4469736b 00000000 00000000
ffff88006ee36c40 3815093514 S Bi:1:037:1 -115 512 <
ffff88006ee36c40 3815093595 C Bi:1:037:1 0 13 = 55534253 b0f4c101 00000000 00
ffff88006ee36c40 3815094680 S Bo:1:037:2 -115 31 = 55534243 50267703 fc000000 80020a23 00000000 000000fc 00000000 000000
ffff88006ee36c40 3815094719 C Bo:1:037:2 0 31 >
ffff88006ee36c40 3815096518 S Bi:1:037:1 -115 252 <
ffff88006ee36c40 3815096601 C Bi:1:037:1 -32 0
ffff88006ee36c40 3815098528 S Co:1:037:0 s 02 01 0000 0081 0000 0
ffff88006ee36c40 3815098602 C Co:1:037:0 0 0
ffff88006ef8b940 3815100530 S Bi:1:037:1 -115 512 <
ffff88006ef8b940 3815100595 C Bi:1:037:1 0 13 = 55534253 50267703 fc000000 01
ffff88006ef8b940 3815102728 S Bo:1:037:2 -115 31 = 55534243 50267703 12000000 80020c03 00000012 00000000 00000000 000000
ffff88006ef8b940 3815102851 C Bo:1:037:2 0 31 >
ffff880070f667c0 3815104651 S Bi:1:037:1 -115 18 <
ffff880070f667c0 3815104735 C Bi:1:037:1 0 18 = 70000500 0000000a 00000000 20000000 0000
ffff8800700b1ac0 3815107558 S Bi:1:037:1 -115 512 <
ffff8800700b1ac0 3815107732 C Bi:1:037:1 0 13 = 55534253 50267703 00000000 00
ffff88006e5c0d00 3815110730 S Bo:1:037:2 -115 31 = 55534243 a0e44902 fc000000 80020a23 00000000 000000fc 00000000 000000
ffff88006e5c0d00 3815110867 C Bo:1:037:2 0 31 >
ffff880070e2e400 3815112605 S Bi:1:037:1 -115 252 <
ffff880070e2e400 3815112750 C Bi:1:037:1 -32 0
ffff880070e2e400 3815114564 S Co:1:037:0 s 02 01 0000 0081 0000 0
ffff880070e2e400 3815114725 C Co:1:037:0 0 0
ffff880070e2e400 3815116656 S Bi:1:037:1 -115 512 <
ffff880070e2e400 3815116856 C Bi:1:037:1 0 13 = 55534253 a0e44902 fc000000 01
ffff880070e2e400 3815118699 S Bo:1:037:2 -115 31 = 55534243 a0e44902 12000000 80020c03 00000012 00000000 00000000 000000
ffff880070e2e400 3815118847 C Bo:1:037:2 0 31 >
ffff880070e2e400 3815120985 S Bi:1:037:1 -115 18 <
ffff880070e2e400 3815121097 C Bi:1:037:1 0 18 = 70000500 0000000a 00000000 20000000 0000
ffff880070e2e400 3815121900 S Bi:1:037:1 -115 512 <
ffff880070e2e400 3815121971 C Bi:1:037:1 0 13 = 55534253 a0e44902 00000000 00
ffff88006e5c0d00 3815122609 S Bo:1:037:2 -115 31 = 55534243 60886603 fc000000 80020a23 00000000 000000fc 00000000 000000
ffff88006e5c0d00 3815122720 C Bo:1:037:2 0 31 >
ffff88006e5c0d00 3815124533 S Bi:1:037:1 -115 252 <
ffff88006e5c0d00 3815124597 C Bi:1:037:1 -32 0
ffff88006e5c0d00 3815126518 S Co:1:037:0 s 02 01 0000 0081 0000 0
ffff88006e5c0d00 3815126597 C Co:1:037:0 0 0
ffff88006e5c0d00 3815128526 S Bi:1:037:1 -115 512 <
ffff88006e5c0d00 3815128594 C Bi:1:037:1 0 13 = 55534253 60886603 fc000000 01
ffff88006e5c0d00 3815130660 S Bo:1:037:2 -115 31 = 55534243 60886603 12000000 80020c03 00000012 00000000 00000000 000000
ffff88006e5c0d00 3815130721 C Bo:1:037:2 0 31 >
ffff88006e5c0d00 3815132522 S Bi:1:037:1 -115 18 <
ffff88006e5c0d00 3815132597 C Bi:1:037:1 0 18 = 70000500 0000000a 00000000 20000000 0000
ffff88006ef8bc40 3815134538 S Bi:1:037:1 -115 512 <
ffff88006ef8bc40 3815134596 C Bi:1:037:1 0 13 = 55534253 60886603 00000000 00
ffff88006ef8bc40 3815136670 S Bo:1:037:2 -115 31 = 55534243 60886603 ff000000 80020612 018000ff 00000000 00000000 000000
ffff88006ef8bc40 3815136722 C Bo:1:037:2 0 31 >
ffff88006e5c0d00 3815138516 S Bi:1:037:1 -115 255 <
ffff88006e5c0d00 3815138595 C Bi:1:037:1 0 28 = 00800018 00000000 00000000 04314e74 636f7400 00000000 00000000
ffff88006e5c0d00 3815140520 S Bi:1:037:1 -115 512 <
ffff88006e5c0d00 3815140598 C Bi:1:037:1 -32 0
ffff88006ef8bc40 3815141528 S Co:1:037:0 s 02 01 0000 0081 0000 0
ffff88006ef8bc40 3815141601 C Co:1:037:0 0 0
ffff88006ef8bc40 3815143515 S Bi:1:037:1 -115 512 <
ffff88006ef8bc40 3815143596 C Bi:1:037:1 0 13 = 55534253 60886603 e3000000 00
ffff880070e2e400 3815149690 S Bo:1:037:2 -115 31 = 55534243 10ccb003 24000000 80000612 00000024 00000000 00000000 000000
ffff880070e2e400 3815149849 C Bo:1:037:2 0 31 >
ffff8800700b1ac0 3815151519 S Bi:1:037:1 -115 36 <
ffff8800700b1ac0 3815151599 C Bi:1:037:1 0 36 = 05800612 47000002 4e657461 63000000 4f6e6c79 4469736b 00000000 00000000
ffff88006e616280 3815153519 S Bi:1:037:1 -115 512 <
ffff88006e616280 3815153594 C Bi:1:037:1 0 13 = 55534253 10ccb003 00000000 00
ffff880036f4b280 3815154673 S Bo:1:037:2 -115 31 = 55534243 60886603 4c000000 80000612 0000004c 00000000 00000000 000000
ffff880036f4b280 3815154721 C Bo:1:037:2 0 31 >
ffff88006ee8c580 3815156521 S Bi:1:037:1 -115 76 <
ffff88006ee8c580 3815156594 C Bi:1:037:1 0 76 = 05800612 47000002 4e657461 63000000 4f6e6c79 4469736b 00000000 00000000
ffff88006e62c340 3815158517 S Bi:1:037:1 -115 512 <
ffff88006e62c340 3815158599 C Bi:1:037:1 0 13 = 55534253 60886603 00000000 00
ffff8800439cb640 3815160694 S Bo:1:037:2 -115 31 = 55534243 102c2304 08000000 80000a4a 01000000 00000008 00000000 000000
ffff8800439cb640 3815160851 C Bo:1:037:2 0 31 >
ffff880070b00dc0 3815162520 S Bi:1:037:1 -115 8 <
ffff880070b00dc0 3815162595 C Bi:1:037:1 -32 0
ffff880070b00dc0 3815163526 S Co:1:037:0 s 02 01 0000 0081 0000 0
ffff880070b00dc0 3815163596 C Co:1:037:0 0 0
ffff880070b00dc0 3815165526 S Bi:1:037:1 -115 512 <
ffff880070b00dc0 3815165597 C Bi:1:037:1 0 13 = 55534253 102c2304 08000000 01
ffff8800439cb640 3815167540 S Bo:1:037:2 -115 31 = 55534243 102c2304 12000000 80000c03 00000012 00000000 00000000 000000
ffff88006e62c340 3815167581 S Ci:1:037:0 s 80 06 0600 0000 000a 10 <
ffff8800439cb640 3815167595 C Bo:1:037:2 0 31 >
ffff88006e62c340 3815167727 C Ci:1:037:0 0 10 = 0a061002 00000040 0100
ffff88006ee8c580 3815169519 S Bi:1:037:1 -115 18 <
ffff880036f4b280 3815169554 S Ci:1:037:0 s 80 06 0700 0000 0009 9 <
ffff88006ee8c580 3815169597 C Bi:1:037:1 0 18 = 70000500 0000000a 00000000 20000000 0000
ffff880036f4b280 3815169719 C Ci:1:037:0 0 9 = 09072000 01010080 96
ffff88006e616280 3815170518 S Bi:1:037:1 -115 512 <
ffff88006e616280 3815170593 C Bi:1:037:1 0 13 = 55534253 102c2304 00000000 00
ffff8800700b1ac0 3815170741 S Ci:1:037:0 s 80 06 0700 0000 0020 32 <
ffff8800700b1ac0 3815170971 C Ci:1:037:0 0 32 = 09072000 01010080 96090400 00020806 50000705 81024000 00070502 02400000
ffff880070e2e400 3815171672 S Bo:1:037:2 -115 31 = 55534243 10948a03 08000000 80000a46 00000000 00000008 00000000 000000
ffff880070e2e400 3815171721 C Bo:1:037:2 0 31 >
ffff88006ef8bc40 3815171919 S Ci:1:037:0 s 80 06 0f00 0000 0005 5 <
ffff88006ef8bc40 3815172219 C Ci:1:037:0 0 5 = 050f1600 02
ffff88006e5c0d00 3815172363 S Bi:1:037:1 -115 8 <
ffff88006e5c0d00 3815172469 C Bi:1:037:1 0 8 = 00000050 00000000
ffff88006ef8b640 3815173518 S Ci:1:037:0 s 80 06 0f00 0000 0016 22 <
ffff88006ef06a00 3815173552 S Bi:1:037:1 -115 512 <
ffff88006ef06a00 3815173594 C Bi:1:037:1 0 13 = 55534253 10948a03 00000000 00
ffff88006ef8b640 3815173721 C Ci:1:037:0 0 22 = 050f1600 02071002 06000000 0a100300 0e00010a 0002
ffff8800701c5700 3815175522 S Bo:1:037:2 -115 31 = 55534243 10948a03 0c000000 80000a46 02000000 0000000c 00000000 000000
ffff8800701c5700 3815175597 C Bo:1:037:2 0 31 >
ffff88006ef8b1c0 3815177519 S Bi:1:037:1 -115 12 <
ffff88006ef8b1c0 3815177596 C Bi:1:037:1 0 12 = 00000040 0000001b 00000338
ffff88006e695280 3815179519 S Bi:1:037:1 -115 512 <
ffff88006e695280 3815179599 C Bi:1:037:1 0 13 = 55534253 10948a03 00000000 00
ffff88006e695280 3815181689 S Bo:1:037:2 -115 31 = 55534243 10948a03 08000000 80000a46 00000000 00000008 00000000 000000
ffff88006e695280 3815181845 C Bo:1:037:2 0 31 >
ffff88006ef8b1c0 3815183520 S Bi:1:037:1 -115 8 <
ffff88006ef8b1c0 3815183594 C Bi:1:037:1 0 8 = 00000050 00000010
ffff8800701c5700 3815185516 S Bi:1:037:1 -115 512 <
ffff8800701c5700 3815185599 C Bi:1:037:1 0 13 = 55534253 10948a03 00000000 00
ffff88006ef8b640 3815187683 S Bo:1:037:2 -115 31 = 55534243 10948a03 54000000 80000a46 00000000 00000054 00000000 000000
ffff88006ef8b640 3815187719 C Bo:1:037:2 0 31 >
ffff88006ef06a00 3815189518 S Bi:1:037:1 -115 84 <
ffff88006ef06a00 3815189597 C Bi:1:037:1 0 84 = 00000050 00000010 00000308 00100100 00080000 00010b04 00000007 00020704
ffff88006e5c0d00 3815191531 S Bi:1:037:1 -115 512 <
ffff88006e5c0d00 3815191596 C Bi:1:037:1 0 13 = 55534253 10948a03 00000000 00
ffff88006ef8bc40 3815193676 S Bo:1:037:2 -115 31 = 55534243 10ccb003 28000000 80000a5a 082a0000 00000028 00000000 000000
ffff88006ef8bc40 3815193720 C Bo:1:037:2 0 31 >
ffff880070e2e400 3815195523 S Bi:1:037:1 -115 40 <
ffff880070e2e400 3815195596 C Bi:1:037:1 0 34 = 00200000 00000000 2a180800 01002900 00000000 00000000 00000000 00000000
ffff88006ef8bc40 3815197528 S Bi:1:037:1 -115 512 <
ffff88006ef8bc40 3815197600 C Bi:1:037:1 -32 0
ffff88006ef8bc40 3815199518 S Co:1:037:0 s 02 01 0000 0081 0000 0
ffff88006ef8bc40 3815199602 C Co:1:037:0 0 0
ffff88006ef8bc40 3815201533 S Bi:1:037:1 -115 512 <
ffff88006ef8bc40 3815201725 C Bi:1:037:1 0 13 = 55534253 10ccb003 06000000 00
ffff88006e5c0d00 3815203671 S Bo:1:037:2 -115 31 = 55534243 10ccb003 08000000 80000a25 00000000 00000000 00000000 000000
ffff88006e5c0d00 3815203720 C Bo:1:037:2 0 31 >
ffff88006e5c0d00 3815205520 S Bi:1:037:1 -115 8 <
ffff88006e5c0d00 3815205596 C Bi:1:037:1 0 8 = 000063ff 00000800
ffff88006ef8bc40 3815207534 S Bi:1:037:1 -115 512 <
ffff88006ef8bc40 3815207593 C Bi:1:037:1 0 13 = 55534253 10ccb003 00000000 00
ffff880070e2e400 3815209450 S Bo:1:037:2 -115 31 = 55534243 40c33b03 08000000 80000ca4 00000000 00000000 08080000 000000
ffff880070e2e400 3815209596 C Bo:1:037:2 0 31 >
ffff8800700b1ac0 3815211517 S Bi:1:037:1 -115 8 <
ffff8800700b1ac0 3815211600 C Bi:1:037:1 -32 0
ffff88006e616280 3815213520 S Co:1:037:0 s 02 01 0000 0081 0000 0
ffff88006e616280 3815213602 C Co:1:037:0 0 0
ffff88006e616280 3815215520 S Bi:1:037:1 -115 512 <
ffff88006e616280 3815215602 C Bi:1:037:1 0 13 = 55534253 40c33b03 08000000 01
ffff880036f4b280 3815217662 S Bo:1:037:2 -115 31 = 55534243 40c33b03 12000000 80000c03 00000012 00000000 00000000 000000
ffff880036f4b280 3815217720 C Bo:1:037:2 0 31 >
ffff88006ee8c580 3815219516 S Bi:1:037:1 -115 18 <
ffff88006ee8c580 3815219596 C Bi:1:037:1 0 18 = 70000500 0000000a 00000000 20000000 0000
ffff88006ee8c580 3815220529 S Bi:1:037:1 -115 512 <
ffff88006ee8c580 3815220594 C Bi:1:037:1 0 13 = 55534253 40c33b03 00000000 00
ffff88006ee8c580 3815222688 S Bo:1:037:2 -115 31 = 55534243 10ccb003 08000000 80010a25 00000000 00000000 00000000 000000
ffff88006ee8c580 3815222848 C Bo:1:037:2 0 31 >
ffff88006ee8c580 3815224525 S Bi:1:037:1 -115 8 <
ffff88006ee8c580 3815224597 C Bi:1:037:1 0 8 = 03a2cfe3 00000200
ffff880036f4b280 3815226525 S Bi:1:037:1 -115 512 <
ffff880036f4b280 3815226594 C Bi:1:037:1 0 13 = 55534253 10ccb003 00000000 00
ffff88006e616280 3815230703 S Bo:1:037:2 -115 31 = 55534243 10ccb003 00020000 80010a28 00000000 00000001 00000000 000000
ffff88006e616280 3815230854 C Bo:1:037:2 0 31 >
ffff8800700b1ac0 3815231529 S Bi:1:037:1 -115 512 <
ffff8800700b1ac0 3815231599 C Bi:1:037:1 0 512 = fa33c08e d0bc007c 8bf45007 501ffbfc bf0006b9 0001f2a5 ea1d0600 00bebe07
ffff8800700b1ac0 3815232526 S Bi:1:037:1 -115 512 <
ffff8800700b1ac0 3815232594 C Bi:1:037:1 0 13 = 55534253 10ccb003 00000000 00
ffff8800700b1ac0 3815247693 S Bo:1:037:2 -115 31 = 55534243 40ca0904 c0000000 8001061a 001c00c0 00000000 00000000 000000
ffff8800700b1ac0 3815247853 C Bo:1:037:2 0 31 >
ffff880070e2e400 3815248935 S Bi:1:037:1 -115 192 <
ffff880070e2e400 3815249101 C Bi:1:037:1 0 192 = 0b001008 1c0116fe 00000200 00000000 00000000 00000000 00000000 00000000
ffff88006e5c0d00 3815250531 S Bi:1:037:1 -115 512 <
ffff88006e5c0d00 3815250600 C Bi:1:037:1 0 13 = 55534253 40ca0904 00000000 00
ffff88006ef06a00 3815252673 S Bo:1:037:2 -115 31 = 55534243 10ccb003 c0000000 8001061a 000800c0 00000000 00000000 000000
ffff88006ef06a00 3815252720 C Bo:1:037:2 0 31 >
ffff88006ef06a00 3815254528 S Bi:1:037:1 -115 192 <
ffff88006ef06a00 3815254598 C Bi:1:037:1 0 192 = 1f001008 1c0116fe 00000200 081210ff ffffffff ffff0000 00000000 00000000
ffff88006ef06a00 3815256531 S Bi:1:037:1 -115 512 <
ffff88006ef06a00 3815256610 C Bi:1:037:1 0 13 = 55534253 10ccb003 00000000 00
ffff88006e5c0d00 3815258661 S Bo:1:037:2 -115 31 = 55534243 10ccb003 08000000 80010a25 00000000 00000000 00000000 000000
ffff88006e5c0d00 3815258730 C Bo:1:037:2 0 31 >
ffff880070e2e400 3815260102 S Bi:1:037:1 -115 8 <
ffff880070e2e400 3815260224 C Bi:1:037:1 0 8 = 03a2cfe3 00000200
ffff88006ef8bc40 3815261515 S Bi:1:037:1 -115 512 <
ffff88006ef8bc40 3815261597 C Bi:1:037:1 0 13 = 55534253 10ccb003 00000000 00
ffff8800700b1ac0 3815263683 S Bo:1:037:2 -115 31 = 55534243 10ccb003 00020000 80010a28 00000000 00000001 00000000 000000
ffff8800700b1ac0 3815263847 C Bo:1:037:2 0 31 >
ffff88006e616280 3815265391 S Bi:1:037:1 -115 512 <
ffff88006e616280 3815265472 C Bi:1:037:1 0 512 = fa33c08e d0bc007c 8bf45007 501ffbfc bf0006b9 0001f2a5 ea1d0600 00bebe07
ffff880036f4b280 3815266504 S Bi:1:037:1 -115 512 <
ffff880036f4b280 3815266597 C Bi:1:037:1 0 13 = 55534253 10ccb003 00000000 00
ffff88006ee8c580 3815268673 S Bo:1:037:2 -115 31 = 55534243 10ccb003 00020000 80010a28 00000000 00000001 00000000 000000
ffff88006ee8c580 3815268722 C Bo:1:037:2 0 31 >
ffff88006e62c340 3815270524 S Bi:1:037:1 -115 512 <
ffff88006e62c340 3815270597 C Bi:1:037:1 0 512 = fa33c08e d0bc007c 8bf45007 501ffbfc bf0006b9 0001f2a5 ea1d0600 00bebe07
ffff8800439cb640 3815272525 S Bi:1:037:1 -115 512 <
ffff8800439cb640 3815272598 C Bi:1:037:1 0 13 = 55534253 10ccb003 00000000 00
ffff880070b00dc0 3815274245 S Bo:1:037:2 -115 31 = 55534243 10ccb003 08000000 80010a25 00000000 00000000 00000000 000000
ffff880070b00dc0 3815274346 C Bo:1:037:2 0 31 >
ffff88006e62c880 3815275506 S Bi:1:037:1 -115 8 <
ffff88006e62c880 3815275597 C Bi:1:037:1 0 8 = 03a2cfe3 00000200
ffff8800711fb1c0 3815277521 S Bi:1:037:1 -115 512 <
ffff8800711fb1c0 3815277592 C Bi:1:037:1 0 13 = 55534253 10ccb003 00000000 00
ffff8800711fb1c0 3815279666 S Bo:1:037:2 -115 31 = 55534243 10ccb003 08000000 80010a25 00000000 00000000 00000000 000000
ffff8800711fb1c0 3815279722 C Bo:1:037:2 0 31 >
ffff88006e62c880 3815281509 S Bi:1:037:1 -115 8 <
ffff88006e62c880 3815281596 C Bi:1:037:1 0 8 = 03a2cfe3 00000200
ffff880070b00dc0 3815283526 S Bi:1:037:1 -115 512 <
ffff880070b00dc0 3815283596 C Bi:1:037:1 0 13 = 55534253 10ccb003 00000000 00
ffff880070b00dc0 3815285677 S Bo:1:037:2 -115 31 = 55534243 10ccb003 00020000 80010a28 00000000 00000001 00000000 000000
ffff880070b00dc0 3815285845 C Bo:1:037:2 0 31 >
ffff880070b00dc0 3815286894 S Bi:1:037:1 -115 512 <
ffff880070b00dc0 3815286971 C Bi:1:037:1 0 512 = fa33c08e d0bc007c 8bf45007 501ffbfc bf0006b9 0001f2a5 ea1d0600 00bebe07
ffff8800439cb640 3815288508 S Bi:1:037:1 -115 512 <
ffff8800439cb640 3815288594 C Bi:1:037:1 0 13 = 55534253 10ccb003 00000000 00
ffff88006e62c340 3815290668 S Bo:1:037:2 -115 31 = 55534243 10ccb003 00020000 80010a28 00000000 00000001 00000000 000000
ffff88006e62c340 3815290720 C Bo:1:037:2 0 31 >
ffff88006ee8c580 3815291666 S Bi:1:037:1 -115 512 <
ffff88006ee8c580 3815291724 C Bi:1:037:1 0 512 = fa33c08e d0bc007c 8bf45007 501ffbfc bf0006b9 0001f2a5 ea1d0600 00bebe07
ffff880036f4b280 3815293508 S Bi:1:037:1 -115 512 <
ffff880036f4b280 3815293596 C Bi:1:037:1 0 13 = 55534253 10ccb003 00000000 00
ffff880036f4b280 3815295669 S Bo:1:037:2 -115 31 = 55534243 10ccb003 08000000 80010a25 00000000 00000000 00000000 000000
ffff880036f4b280 3815295721 C Bo:1:037:2 0 31 >
ffff88006ee8c580 3815297524 S Bi:1:037:1 -115 8 <
ffff88006ee8c580 3815297597 C Bi:1:037:1 0 8 = 03a2cfe3 00000200
ffff88006e62c340 3815299507 S Bi:1:037:1 -115 512 <
ffff88006e62c340 3815299595 C Bi:1:037:1 0 13 = 55534253 10ccb003 00000000 00
ffff8800439cb640 3815301567 S Bo:1:037:2 -115 31 = 55534243 10ccb003 08000000 80010a25 00000000 00000000 00000000 000000
ffff8800439cb640 3815301720 C Bo:1:037:2 0 31 >
ffff880070059e80 3815303295 S Bi:1:037:1 -115 8 <
ffff880070059e80 3815303478 C Bi:1:037:1 0 8 = 03a2cfe3 00000200
ffff880070059e80 3815305519 S Bi:1:037:1 -115 512 <
ffff880070059e80 3815305592 C Bi:1:037:1 0 13 = 55534253 10ccb003 00000000 00
ffff880070059e80 3815307670 S Bo:1:037:2 -115 31 = 55534243 10ccb003 00020000 80010a28 00000000 00000001 00000000 000000
ffff880070059e80 3815307719 C Bo:1:037:2 0 31 >
ffff880070059e80 3815308504 S Bi:1:037:1 -115 512 <
ffff880070059e80 3815308592 C Bi:1:037:1 0 512 = fa33c08e d0bc007c 8bf45007 501ffbfc bf0006b9 0001f2a5 ea1d0600 00bebe07
ffff880070059e80 3815310505 S Bi:1:037:1 -115 512 <
ffff880070059e80 3815310595 C Bi:1:037:1 0 13 = 55534253 10ccb003 00000000 00
ffff880070059e80 3815312347 S Bo:1:037:2 -115 31 = 55534243 10a09903 08000000 80020a25 00000000 00000000 00000000 000000
ffff880070059e80 3815312478 C Bo:1:037:2 0 31 >
ffff880070059e80 3815314507 S Bi:1:037:1 -115 8 <
ffff880070059e80 3815314597 C Bi:1:037:1 0 8 = 03a2cfe3 00000200
ffff880070059e80 3815316502 S Bi:1:037:1 -115 512 <
ffff880070059e80 3815316594 C Bi:1:037:1 0 13 = 55534253 10a09903 00000000 00
ffff880070059e80 3815318650 S Bo:1:037:2 -115 31 = 55534243 10a0f803 00000000 00010600 00000000 00000000 00000000 000000
ffff880070059e80 3815318724 C Bo:1:037:2 0 31 >
ffff880070059e80 3815320525 S Bi:1:037:1 -115 512 <
ffff880070059e80 3815320598 C Bi:1:037:1 0 13 = 55534253 10a0f803 00000000 00
ffff880070059e80 3815322645 S Bo:1:037:2 -115 31 = 55534243 10a09903 00020000 80020a28 00000000 00000001 00000000 000000
ffff880070059e80 3815322720 C Bo:1:037:2 0 31 >
ffff880070059e80 3815324501 S Bi:1:037:1 -115 512 <
ffff880070059e80 3815324594 C Bi:1:037:1 0 512 = fa33c08e d0bc007c 8bf45007 501ffbfc bf0006b9 0001f2a5 ea1d0600 00bebe07
ffff880070059e80 3815326059 S Bi:1:037:1 -115 512 <
ffff880070059e80 3815326219 C Bi:1:037:1 0 13 = 55534253 10a09903 00000000 00
ffff880070059e80 3815327653 S Bo:1:037:2 -115 31 = 55534243 50267703 54000000 80000a46 01000000 00000054 00000000 000000
ffff880070059e80 3815327724 C Bo:1:037:2 0 31 >
ffff880070059e80 3815329507 S Bi:1:037:1 -115 84 <
ffff880070059e80 3815329595 C Bi:1:037:1 0 84 = 00000050 00000010 00000308 00100100 00080000 00010b04 00000007 00020704
ffff880070059e80 3815331500 S Bi:1:037:1 -115 512 <
ffff880070059e80 3815331596 C Bi:1:037:1 0 13 = 55534253 50267703 00000000 00
ffff880070059e80 3815333293 S Bo:1:037:2 -115 31 = 55534243 b0f4c101 c0000000 8001061a 003f00c0 00000000 00000000 000000
ffff880070059e80 3815333346 C Bo:1:037:2 0 31 >
ffff880070059e80 3815334516 S Bi:1:037:1 -115 192 <
ffff880070059e80 3815334600 C Bi:1:037:1 0 192 = 1f001008 1c0116fe 00000200 081210ff ffffffff ffff0000 00000000 00000000
ffff880070059e80 3815336539 S Bi:1:037:1 -115 512 <
ffff880070059e80 3815336592 C Bi:1:037:1 0 13 = 55534253 b0f4c101 00000000 00
ffff880070059e80 3815338668 S Bo:1:037:2 -115 31 = 55534243 40ca0904 c0000000 8002061a 001c00c0 00000000 00000000 000000
ffff880070059e80 3815338719 C Bo:1:037:2 0 31 >
ffff880070059e80 3815340499 S Bi:1:037:1 -115 192 <
ffff880070059e80 3815340596 C Bi:1:037:1 0 192 = 0b001008 1c0116fe 00000200 00000000 00000000 00000000 00000000 00000000
ffff880070059e80 3815342517 S Bi:1:037:1 -115 512 <
ffff880070059e80 3815342597 C Bi:1:037:1 0 13 = 55534253 40ca0904 00000000 00
ffff880070059e80 3815344666 S Bo:1:037:2 -115 31 = 55534243 40c33b03 f0ff0000 80000a5a 082a0000 0000fff0 00000000 000000
ffff880070059e80 3815344718 C Bo:1:037:2 0 31 >
ffff880070059e80 3815346518 S Bi:1:037:1 -115 65520 <
ffff880070059e80 3815346597 C Bi:1:037:1 0 34 = 00200000 00000000 2a180800 01002900 00000000 00000000 00000000 00000000
ffff880070059e80 3815348500 S Bi:1:037:1 -115 512 <
ffff880070059e80 3815348598 C Bi:1:037:1 -32 0
ffff880070059e80 3815349501 S Co:1:037:0 s 02 01 0000 0081 0000 0
ffff880070059e80 3815349595 C Co:1:037:0 0 0
ffff880070059e80 3815350792 S Bi:1:037:1 -115 512 <
ffff880070059e80 3815350969 C Bi:1:037:1 0 13 = 55534253 40c33b03 ceff0000 00
ffff880070059e80 3815352659 S Bo:1:037:2 -115 31 = 55534243 10ccb003 08000000 80010a25 00000000 00000000 00000000 000000
ffff880070059e80 3815352718 C Bo:1:037:2 0 31 >
ffff880070059e80 3815354500 S Bi:1:037:1 -115 8 <
ffff880070059e80 3815354596 C Bi:1:037:1 0 8 = 03a2cfe3 00000200
ffff880070059e80 3815356510 S Bi:1:037:1 -115 512 <
ffff880070059e80 3815356595 C Bi:1:037:1 0 13 = 55534253 10ccb003 00000000 00
ffff880070059e80 3815358658 S Bo:1:037:2 -115 31 = 55534243 10a09903 c0000000 8002061a 000800c0 00000000 00000000 000000
ffff880070059e80 3815358719 C Bo:1:037:2 0 31 >
ffff880070059e80 3815360516 S Bi:1:037:1 -115 192 <
ffff880070059e80 3815360598 C Bi:1:037:1 0 192 = 1f001008 1c0116fe 00000200 081210ff ffffffff ffff0000 00000000 00000000
ffff880070059e80 3815362503 S Bi:1:037:1 -115 512 <
ffff880070059e80 3815362597 C Bi:1:037:1 0 13 = 55534253 10a09903 00000000 00
ffff880070059e80 3815364683 S Bo:1:037:2 -115 31 = 55534243 40c33b03 880c0000 80000cac 14000000 00000000 c8000000 000000
ffff880070059e80 3815364849 C Bo:1:037:2 0 31 >
ffff880070059e80 3815366507 S Bi:1:037:1 -115 3208 <
ffff880070059e80 3815366597 C Bi:1:037:1 -32 0
ffff880070059e80 3815367494 S Co:1:037:0 s 02 01 0000 0081 0000 0
ffff880070059e80 3815367597 C Co:1:037:0 0 0
ffff880070059e80 3815368500 S Bi:1:037:1 -115 512 <
ffff880070059e80 3815368596 C Bi:1:037:1 0 13 = 55534253 40c33b03 880c0000 01
ffff880070059e80 3815370648 S Bo:1:037:2 -115 31 = 55534243 40c33b03 12000000 80000c03 00000012 00000000 00000000 000000
ffff880070059e80 3815370720 C Bo:1:037:2 0 31 >
ffff880070059e80 3815372499 S Bi:1:037:1 -115 18 <
ffff880070059e80 3815372594 C Bi:1:037:1 0 18 = 70000500 0000000a 00000000 20000000 0000
ffff880070059e80 3815374500 S Bi:1:037:1 -115 512 <
ffff880070059e80 3815374595 C Bi:1:037:1 0 13 = 55534253 40c33b03 00000000 00
ffff880070059e80 3815376647 S Bo:1:037:2 -115 31 = 55534243 b0f4c101 00000000 00010600 00000000 00000000 00000000 000000
ffff880070059e80 3815376721 C Bo:1:037:2 0 31 >
ffff880070059e80 3815378500 S Bi:1:037:1 -115 512 <
ffff880070059e80 3815378593 C Bi:1:037:1 0 13 = 55534253 b0f4c101 00000000 00
ffff880070059e80 3815380644 S Bo:1:037:2 -115 31 = 55534243 10a09903 08000000 80020a25 00000000 00000000 00000000 000000
ffff880070059e80 3815380718 C Bo:1:037:2 0 31 >
ffff880070059e80 3815382498 S Bi:1:037:1 -115 8 <
ffff880070059e80 3815382595 C Bi:1:037:1 0 8 = 03a2cfe3 00000200
ffff880070059e80 3815383396 S Bi:1:037:1 -115 512 <
ffff880070059e80 3815383467 C Bi:1:037:1 0 13 = 55534253 10a09903 00000000 00
ffff880070059e80 3815385658 S Bo:1:037:2 -115 31 = 55534243 40c33b03 880c0000 80000cac 00000000 00000000 c8030000 000000
ffff880070059e80 3815385720 C Bo:1:037:2 0 31 >
ffff880070059e80 3815387499 S Bi:1:037:1 -115 3208 <
ffff880070059e80 3815387599 C Bi:1:037:1 -32 0
ffff880070059e80 3815389498 S Co:1:037:0 s 02 01 0000 0081 0000 0
ffff880070059e80 3815389594 C Co:1:037:0 0 0
ffff880070059e80 3815391506 S Bi:1:037:1 -115 512 <
ffff880070059e80 3815391597 C Bi:1:037:1 0 13 = 55534253 40c33b03 880c0000 01
ffff880070059e80 3815393650 S Bo:1:037:2 -115 31 = 55534243 40c33b03 12000000 80000c03 00000012 00000000 00000000 000000
ffff880070059e80 3815393725 C Bo:1:037:2 0 31 >
ffff880070059e80 3815395499 S Bi:1:037:1 -115 18 <
ffff880070059e80 3815395593 C Bi:1:037:1 0 18 = 70000500 0000000a 00000000 20000000 0000
ffff880070059e80 3815397500 S Bi:1:037:1 -115 512 <
ffff880070059e80 3815397593 C Bi:1:037:1 0 13 = 55534253 40c33b03 00000000 00
ffff880070059e80 3815399663 S Bo:1:037:2 -115 31 = 55534243 40ca0904 00000000 00010600 00000000 00000000 00000000 000000
ffff880070059e80 3815399721 C Bo:1:037:2 0 31 >
ffff8800702d1ac0 3815401509 S Bi:1:037:1 -115 512 <
ffff8800702d1ac0 3815401600 C Bi:1:037:1 0 13 = 55534253 40ca0904 00000000 00
ffff8800702d1ac0 3815402661 S Bo:1:037:2 -115 31 = 55534243 10a09903 00020000 80020a28 00000000 00000001 00000000 000000
ffff8800702d1ac0 3815402719 C Bo:1:037:2 0 31 >
ffff880070f17040 3815404497 S Bi:1:037:1 -115 512 <
ffff880070f17040 3815404596 C Bi:1:037:1 0 512 = fa33c08e d0bc007c 8bf45007 501ffbfc bf0006b9 0001f2a5 ea1d0600 00bebe07
ffff880070f17040 3815406499 S Bi:1:037:1 -115 512 <
ffff880070f17040 3815406592 C Bi:1:037:1 0 13 = 55534253 10a09903 00000000 00
ffff880070f17040 3815407871 S Bo:1:037:2 -115 31 = 55534243 102c2304 00000000 00000600 00000000 00000000 00000000 000000
ffff880070f17040 3815407971 C Bo:1:037:2 0 31 >
ffff880070f17040 3815409440 S Bi:1:037:1 -115 512 <
ffff880070f17040 3815409594 C Bi:1:037:1 0 13 = 55534253 102c2304 00000000 00
ffff880070f17040 3815411641 S Bo:1:037:2 -115 31 = 55534243 b0f4c101 c0000000 8001061a 003f00c0 00000000 00000000 000000
ffff880070f17040 3815411719 C Bo:1:037:2 0 31 >
ffff880070f17040 3815412637 S Bi:1:037:1 -115 192 <
ffff880070f17040 3815412721 C Bi:1:037:1 0 192 = 1f001008 1c0116fe 00000200 081210ff ffffffff ffff0000 00000000 00000000
ffff880070f17040 3815413497 S Bi:1:037:1 -115 512 <
ffff880070f17040 3815413596 C Bi:1:037:1 0 13 = 55534253 b0f4c101 00000000 00
ffff880070f17040 3815415579 S Bo:1:037:2 -115 31 = 55534243 10a09903 00020000 80020a28 00000000 00000001 00000000 000000
ffff880070f17040 3815415722 C Bo:1:037:2 0 31 >
ffff88006e86b400 3815417074 S Bi:1:037:1 -115 512 <
ffff88006e86b400 3815417222 C Bi:1:037:1 0 512 = fa33c08e d0bc007c 8bf45007 501ffbfc bf0006b9 0001f2a5 ea1d0600 00bebe07
ffff88006e86b400 3815418498 S Bi:1:037:1 -115 512 <
ffff88006e86b400 3815418596 C Bi:1:037:1 0 13 = 55534253 10a09903 00000000 00
ffff88006e86b400 3815419637 S Bo:1:037:2 -115 31 = 55534243 40ca0904 00000000 00010600 00000000 00000000 00000000 000000
ffff88006e86b400 3815419719 C Bo:1:037:2 0 31 >
ffff88006e86b400 3815421499 S Bi:1:037:1 -115 512 <
ffff88006e86b400 3815421595 C Bi:1:037:1 0 13 = 55534253 40ca0904 00000000 00
ffff88006e86b400 3815423635 S Bo:1:037:2 -115 31 = 55534243 10a09903 08000000 80020a25 00000000 00000000 00000000 000000
ffff88006e86b400 3815423717 C Bo:1:037:2 0 31 >
ffff88006e86b400 3815425410 S Bi:1:037:1 -115 8 <
ffff88006e86b400 3815425469 C Bi:1:037:1 0 8 = 03a2cfe3 00000200
ffff88006e86b400 3815427498 S Bi:1:037:1 -115 512 <
ffff88006e86b400 3815427595 C Bi:1:037:1 0 13 = 55534253 10a09903 00000000 00
ffff88006e86b400 3815429633 S Bo:1:037:2 -115 31 = 55534243 10a0f803 c0000000 8001061a 003f00c0 00000000 00000000 000000
ffff88006e86b400 3815429721 C Bo:1:037:2 0 31 >
ffff88006e86b400 3815431495 S Bi:1:037:1 -115 192 <
ffff88006e86b400 3815431593 C Bi:1:037:1 0 192 = 1f001008 1c0116fe 00000200 081210ff ffffffff ffff0000 00000000 00000000
ffff88006e86b400 3815432932 S Bi:1:037:1 -115 512 <
ffff88006e86b400 3815433094 C Bi:1:037:1 0 13 = 55534253 10a0f803 00000000 00
ffff88006e86b400 3815434646 S Bo:1:037:2 -115 31 = 55534243 10a09903 08000000 80020a25 00000000 00000000 00000000 000000
ffff88006e86b400 3815434718 C Bo:1:037:2 0 31 >
ffff88006e86b400 3815436495 S Bi:1:037:1 -115 8 <
ffff88006e86b400 3815436594 C Bi:1:037:1 0 8 = 03a2cfe3 00000200
ffff88006e86b400 3815438499 S Bi:1:037:1 -115 512 <
ffff88006e86b400 3815438595 C Bi:1:037:1 0 13 = 55534253 10a09903 00000000 00
ffff88006e86b400 3815440662 S Bo:1:037:2 -115 31 = 55534243 10209003 00000000 00010600 00000000 00000000 00000000 000000
ffff88006e86b400 3815440719 C Bo:1:037:2 0 31 >
ffff88006e86b400 3815442498 S Bi:1:037:1 -115 512 <
ffff88006e86b400 3815442595 C Bi:1:037:1 0 13 = 55534253 10209003 00000000 00
ffff88006e86b400 3815444700 S Bo:1:037:2 -115 31 = 55534243 10a09903 00020000 80020a28 00000000 00000001 00000000 000000
ffff88006e86b400 3815444849 C Bo:1:037:2 0 31 >
ffff88006e86b400 3815446497 S Bi:1:037:1 -115 512 <
ffff88006e86b400 3815446595 C Bi:1:037:1 0 512 = fa33c08e d0bc007c 8bf45007 501ffbfc bf0006b9 0001f2a5 ea1d0600 00bebe07
ffff88006e86b400 3815448498 S Bi:1:037:1 -115 512 <
ffff88006e86b400 3815448593 C Bi:1:037:1 0 13 = 55534253 10a09903 00000000 00
ffff88006e86b400 3815450645 S Bo:1:037:2 -115 31 = 55534243 10ccb003 08000000 80010a25 00000000 00000000 00000000 000000
ffff88006e86b400 3815450720 C Bo:1:037:2 0 31 >
ffff88006e86b400 3815452495 S Bi:1:037:1 -115 8 <
ffff88006e86b400 3815452595 C Bi:1:037:1 0 8 = 03a2cfe3 00000200
ffff88006e86b400 3815454373 S Bi:1:037:1 -115 512 <
ffff88006e86b400 3815454470 C Bi:1:037:1 0 13 = 55534253 10ccb003 00000000 00
ffff88006e86b400 3815456637 S Bo:1:037:2 -115 31 = 55534243 10a09903 00020000 80020a28 00000000 00000001 00000000 000000
ffff88006e86b400 3815456718 C Bo:1:037:2 0 31 >
ffff88006e86b400 3815458495 S Bi:1:037:1 -115 512 <
ffff88006e86b400 3815458594 C Bi:1:037:1 0 512 = fa33c08e d0bc007c 8bf45007 501ffbfc bf0006b9 0001f2a5 ea1d0600 00bebe07
ffff88006e86b400 3815460499 S Bi:1:037:1 -115 512 <
ffff88006e86b400 3815460595 C Bi:1:037:1 0 13 = 55534253 10a09903 00000000 00
ffff88006e86b400 3815462664 S Bo:1:037:2 -115 31 = 55534243 40ca0904 24000000 80010612 00000024 00000000 00000000 000000
ffff88006e86b400 3815462719 C Bo:1:037:2 0 31 >
ffff88006e86b400 3815464500 S Bi:1:037:1 -115 36 <
ffff88006e86b400 3815464597 C Bi:1:037:1 0 36 = 00800612 47000002 4e657461 63000000 4f6e6c79 4469736b 00000000 00000000
ffff88006e86b400 3815466496 S Bi:1:037:1 -115 512 <
ffff88006e86b400 3815466595 C Bi:1:037:1 0 13 = 55534253 40ca0904 00000000 00
ffff88006e86b400 3815467643 S Bo:1:037:2 -115 31 = 55534243 10a09903 08000000 80020a25 00000000 00000000 00000000 000000
ffff88006e86b400 3815467718 C Bo:1:037:2 0 31 >
ffff88006e86b400 3815469523 S Bi:1:037:1 -115 8 <
ffff88006e86b400 3815469599 C Bi:1:037:1 0 8 = 03a2cfe3 00000200
ffff88006e86b400 3815470746 S Bi:1:037:1 -115 512 <
ffff88006e86b400 3815470844 C Bi:1:037:1 0 13 = 55534253 10a09903 00000000 00
ffff88006e86b400 3815472660 S Bo:1:037:2 -115 31 = 55534243 b0f4c101 4c000000 80010612 0000004c 00000000 00000000 000000
ffff88006e86b400 3815472721 C Bo:1:037:2 0 31 >
ffff88006e86b400 3815474494 S Bi:1:037:1 -115 76 <
ffff88006e86b400 3815474595 C Bi:1:037:1 0 76 = 00800612 47000002 4e657461 63000000 4f6e6c79 4469736b 00000000 00000000
ffff88006e86b400 3815476495 S Bi:1:037:1 -115 512 <
ffff88006e86b400 3815476593 C Bi:1:037:1 0 13 = 55534253 b0f4c101 00000000 00
ffff88006e86b400 3815478657 S Bo:1:037:2 -115 31 = 55534243 10a09903 08000000 80020a25 00000000 00000000 00000000 000000
ffff88006e86b400 3815478719 C Bo:1:037:2 0 31 >
ffff88006e86b400 3815480516 S Bi:1:037:1 -115 8 <
ffff88006e86b400 3815480598 C Bi:1:037:1 0 8 = 03a2cfe3 00000200
ffff88006e86b400 3815482504 S Bi:1:037:1 -115 512 <
ffff88006e86b400 3815482593 C Bi:1:037:1 0 13 = 55534253 10a09903 00000000 00
ffff88006e86b400 3815484657 S Bo:1:037:2 -115 31 = 55534243 b0f4c101 20000000 8001109e 10000000 00000000 00000000 200000
ffff88006e86b400 3815484720 C Bo:1:037:2 0 31 >
ffff88006e86b400 3815486499 S Bi:1:037:1 -115 32 <
ffff88006e86b400 3815486597 C Bi:1:037:1 -32 0
ffff88006e86b400 3815488499 S Co:1:037:0 s 02 01 0000 0081 0000 0
ffff88006e86b400 3815488596 C Co:1:037:0 0 0
ffff88006e86b400 3815490496 S Bi:1:037:1 -115 512 <
ffff88006e86b400 3815490593 C Bi:1:037:1 0 13 = 55534253 b0f4c101 20000000 01
ffff88006e86b400 3815492672 S Bo:1:037:2 -115 31 = 55534243 b0f4c101 12000000 80010c03 00000012 00000000 00000000 000000
ffff88006e86b400 3815492848 C Bo:1:037:2 0 31 >
ffff88006e86b400 3815494373 S Bi:1:037:1 -115 18 <
ffff88006e86b400 3815494470 C Bi:1:037:1 0 18 = 70000500 0000000a 00000000 20000000 0000
ffff88006e86b400 3815496494 S Bi:1:037:1 -115 512 <
ffff88006e86b400 3815496593 C Bi:1:037:1 0 13 = 55534253 b0f4c101 00000000 00
ffff88006e86b400 3815498642 S Bo:1:037:2 -115 31 = 55534243 10a09903 00020000 80020a28 00000000 00000001 00000000 000000
ffff88006e86b400 3815498718 C Bo:1:037:2 0 31 >
ffff88006e86b400 3815500494 S Bi:1:037:1 -115 512 <
ffff88006e86b400 3815500594 C Bi:1:037:1 0 512 = fa33c08e d0bc007c 8bf45007 501ffbfc bf0006b9 0001f2a5 ea1d0600 00bebe07
ffff88006e86b400 3815502517 S Bi:1:037:1 -115 512 <
ffff88006e86b400 3815502606 C Bi:1:037:1 0 13 = 55534253 10a09903 00000000 00
ffff88006e86b400 3815504666 S Bo:1:037:2 -115 31 = 55534243 b0f4c101 20000000 8001109e 10000000 00000000 00000000 200000
ffff88006e86b400 3815504727 C Bo:1:037:2 0 31 >
ffff88006e86b400 3815505494 S Bi:1:037:1 -115 32 <
ffff88006e86b400 3815505598 C Bi:1:037:1 -32 0
ffff88006e86b400 3815507489 S Co:1:037:0 s 02 01 0000 0081 0000 0
ffff88006e86b400 3815507593 C Co:1:037:0 0 0
ffff88006e86b400 3815508492 S Bi:1:037:1 -115 512 <
ffff88006e86b400 3815508595 C Bi:1:037:1 0 13 = 55534253 b0f4c101 20000000 01
ffff88006e86b400 3815510634 S Bo:1:037:2 -115 31 = 55534243 b0f4c101 12000000 80010c03 00000012 00000000 00000000 000000
ffff88006e86b400 3815510718 C Bo:1:037:2 0 31 >
ffff88006e86b400 3815511504 S Bi:1:037:1 -115 18 <
ffff88006e86b400 3815511597 C Bi:1:037:1 0 18 = 70000500 0000000a 00000000 20000000 0000
ffff88006e86b400 3815513494 S Bi:1:037:1 -115 512 <
ffff88006e86b400 3815513596 C Bi:1:037:1 0 13 = 55534253 b0f4c101 00000000 00
ffff88006e86b400 3815515647 S Bo:1:037:2 -115 31 = 55534243 10bc9b03 20000000 8001109e 10000000 00000000 00000000 200000
ffff88006e86b400 3815515720 C Bo:1:037:2 0 31 >
ffff88006e86b400 3815517494 S Bi:1:037:1 -115 32 <
ffff88006e86b400 3815517597 C Bi:1:037:1 -32 0
ffff88006e86b400 3815519519 S Co:1:037:0 s 02 01 0000 0081 0000 0
ffff88006e86b400 3815519600 C Co:1:037:0 0 0
ffff88006e86b400 3815521498 S Bi:1:037:1 -115 512 <
ffff88006e86b400 3815521593 C Bi:1:037:1 0 13 = 55534253 10bc9b03 20000000 01
ffff88006e86b400 3815523643 S Bo:1:037:2 -115 31 = 55534243 10bc9b03 12000000 80010c03 00000012 00000000 00000000 000000
ffff88006e86b400 3815523721 C Bo:1:037:2 0 31 >
ffff88006e86b400 3815525495 S Bi:1:037:1 -115 18 <
ffff88006e86b400 3815525595 C Bi:1:037:1 0 18 = 70000500 0000000a 00000000 20000000 0000
ffff88006ee36400 3816558134 S Bi:1:037:1 -115 512 <
ffff88006ee36400 3816558221 C Bi:1:037:1 0 13 = 55534253 40c33b03 00000000 00
ffff880070b17ac0 3816559445 S Bo:1:037:2 -115 31 = 55534243 40c33b03 08000000 80000c46 02002b00 00000008 00000000 000000
ffff880070b17ac0 3816559597 C Bo:1:037:2 0 31 >
ffff880070b17ac0 3816561437 S Bi:1:037:1 -115 8 <
ffff880070b17ac0 3816561598 C Bi:1:037:1 0 8 = 0000000c 00000010
ffff880070b17ac0 3816563430 S Bi:1:037:1 -115 512 <
ffff880070b17ac0 3816563597 C Bi:1:037:1 0 13 = 55534253 40c33b03 00000000 00
ffff88006e695280 3816564530 S Bo:1:037:2 -115 31 = 55534243 40c33b03 10000000 80000c46 02002b00 00000010 00000000 000000
ffff88006e695280 3816564612 C Bo:1:037:2 0 31 >
ffff880070090e80 3816566519 S Bi:1:037:1 -115 16 <
ffff880070090e80 3816566605 C Bi:1:037:1 0 16 = 0000000c 00000010 002b0004 00000000
ffff880070a5a4c0 3816568540 S Bi:1:037:1 -115 512 <
ffff880070a5a4c0 3816568602 C Bi:1:037:1 0 13 = 55534253 40c33b03 00000000 00
ffff880070a5a4c0 3816570653 S Bo:1:037:2 -115 31 = 55534243 40c33b03 08000000 80000c46 02002a00 00000008 00000000 000000
ffff880070a5a4c0 3816570725 C Bo:1:037:2 0 31 >
ffff880070a5a4c0 3816572432 S Bi:1:037:1 -115 8 <
ffff880070a5a4c0 3816572598 C Bi:1:037:1 0 8 = 0000000c 00000010
ffff880071178e80 3816574048 S Bi:1:037:1 -115 512 <
ffff880071178e80 3816574222 C Bi:1:037:1 0 13 = 55534253 40c33b03 00000000 00
ffff880071178e80 3816575592 S Bo:1:037:2 -115 31 = 55534243 40c33b03 10000000 80000c46 02002a00 00000010 00000000 000000
ffff880071178e80 3816575721 C Bo:1:037:2 0 31 >
ffff880071178e80 3816577431 S Bi:1:037:1 -115 16 <
ffff880071178e80 3816577597 C Bi:1:037:1 0 16 = 0000000c 00000010 002a0004 00000000
ffff880070a5a4c0 3816579440 S Bi:1:037:1 -115 512 <
ffff880070a5a4c0 3816579597 C Bi:1:037:1 0 13 = 55534253 40c33b03 00000000 00
ffff880070090e80 3816581527 S Bo:1:037:2 -115 31 = 55534243 102c2304 00000000 00000600 00000000 00000000 00000000 000000
ffff880070090e80 3816581603 C Bo:1:037:2 0 31 >
ffff88006e695280 3816583475 S Bi:1:037:1 -115 512 <
ffff88006e695280 3816583605 C Bi:1:037:1 0 13 = 55534253 102c2304 00000000 00
ffff88006e616d00 3816585633 S Bo:1:037:2 -115 31 = 55534243 40c33b03 08000000 80000c46 02003b00 00000008 00000000 000000
ffff88006e616d00 3816585721 C Bo:1:037:2 0 31 >
ffff88006ef8b640 3816587447 S Bi:1:037:1 -115 8 <
ffff88006ef8b640 3816587599 C Bi:1:037:1 0 8 = 0000000c 00000010
ffff880070b17ac0 3816588338 S Bi:1:037:1 -115 512 <
ffff880070b17ac0 3816588479 C Bi:1:037:1 0 13 = 55534253 40c33b03 00000000 00
ffff88006ef06a00 3816589551 S Bo:1:037:2 -115 31 = 55534243 40c33b03 10000000 80000c46 02003b00 00000010 00000000 000000
ffff88006ef06a00 3816589607 C Bo:1:037:2 0 31 >
ffff880070e2e400 3816590501 S Bi:1:037:1 -115 16 <
ffff880070e2e400 3816590616 C Bi:1:037:1 0 16 = 0000000c 00000010 003b0004 00000000
ffff880070e2e400 3816591657 S Bi:1:037:1 -115 512 <
ffff880070e2e400 3816591727 C Bi:1:037:1 0 13 = 55534253 40c33b03 00000000 00
ffff880070e2e400 3816593045 S Bo:1:037:2 -115 31 = 55534243 40c33b03 08000000 80000c46 02004100 00000008 00000000 000000
ffff880070e2e400 3816593104 C Bo:1:037:2 0 31 >
ffff880070e2e400 3816594470 S Bi:1:037:1 -115 8 <
ffff880070e2e400 3816594602 C Bi:1:037:1 0 8 = 0000000c 00000010
ffff88006ef8bb80 3818067343 S Bi:1:037:1 -115 4096 <
ffff88006ef8bb80 3818067472 C Bi:1:037:1 0 4096 = b33ec13f ca3fd33f eb3f0000 00208d00 9c000000 1f302d30 59300331 14312631
ffff88006ef8bb80 3818069348 S Bi:1:037:1 -115 512 <
ffff88006ef8bb80 3818069471 C Bi:1:037:1 -32 0
ffff88006ef8bb80 3818071342 S Co:1:037:0 s 02 01 0000 0081 0000 0
ffff88006ef8bb80 3818071470 C Co:1:037:0 0 0
ffff88006ef8bb80 3818073345 S Bi:1:037:1 -115 512 <
ffff88006ef8bb80 3818073471 C Bi:1:037:1 0 13 = 55534253 40c33b03 00000000 00
ffff88006ef8bb80 3818075481 S Bo:1:037:2 -115 31 = 55534243 10ccb003 00100000 80010a28 0000000c a0000008 00000000 000000
ffff88006ef8bb80 3818075594 C Bo:1:037:2 0 31 >
ffff88006ef8bb80 3818077344 S Bi:1:037:1 -115 4096 <
ffff88006ef8bb80 3818077469 C Bi:1:037:1 0 4096 = 00000000 00000000 00000000 00000000 00000000 00000000 00000000 00000000
ffff88006ef8bb80 3818079349 S Bi:1:037:1 -115 512 <
ffff88006ef8bb80 3818079479 C Bi:1:037:1 0 13 = 55534253 10ccb003 00000000 00
ffff88006ef8bb80 3818081487 S Bo:1:037:2 -115 31 = 55534243 40c33b03 00300000 80000a28 0000001e c9000006 00000000 000000
ffff88006ef8bb80 3818081599 C Bo:1:037:2 0 31 >
ffff88006ef8bb80 3818083341 S Bi:1:037:1 -115 12288 <
ffff88006ef8bb80 3818083721 C Bi:1:037:1 0 12288 = 563b5b3b 603b673b 6d3b723b 783b7e3b 843b893b 8f3b953b 9b3ba03b a63bac3b
ffff88006ef8bb80 3818085348 S Bi:1:037:1 -115 512 <
ffff88006ef8bb80 3818085473 C Bi:1:037:1 -32 0
ffff88006ef8bb80 3818087336 S Co:1:037:0 s 02 01 0000 0081 0000 0
ffff88006ef8bb80 3818087474 C Co:1:037:0 0 0
ffff88006ef8bb80 3818089346 S Bi:1:037:1 -115 512 <
ffff88006ef8bb80 3818089470 C Bi:1:037:1 0 13 = 55534253 40c33b03 00000000 00
ffff88006ef8bb80 3818091503 S Bo:1:037:2 -115 31 = 55534243 10ccb003 00100000 80010a28 0000000c a8000008 00000000 000000
ffff88006ef8bb80 3818091595 C Bo:1:037:2 0 31 >
ffff88006ef8bb80 3818093343 S Bi:1:037:1 -115 4096 <
ffff88006ef8bb80 3818093471 C Bi:1:037:1 0 4096 = 00000000 00000000 00000000 00000000 00000000 00000000 00000000 00000000
ffff88006ef8bb80 3818095378 S Bi:1:037:1 -115 512 <
ffff88006ef8bb80 3818095473 C Bi:1:037:1 0 13 = 55534253 10ccb003 00000000 00
ffff8800702d1ac0 3818097528 S Bo:1:037:2 -115 31 = 55534243 40c33b03 00080000 80000a28 0000001e cf000001 00000000 000000
ffff8800702d1ac0 3818097598 C Bo:1:037:2 0 31 >
ffff8800702d1ac0 3818099339 S Bi:1:037:1 -115 2048 <
ffff8800702d1ac0 3818099470 C Bi:1:037:1 0 2048 = 00409400 ac010000 4c355035 54355835 5c356035 64356835 6c357035 74357835
ffff8800702d1ac0 3818101355 S Bi:1:037:1 -115 512 <
ffff8800702d1ac0 3818101476 C Bi:1:037:1 -32 0
ffff8800702d1ac0 3818103359 S Co:1:037:0 s 02 01 0000 0081 0000 0
ffff8800702d1ac0 3818103471 C Co:1:037:0 0 0
ffff8800702d1ac0 3818105416 S Bi:1:037:1 -115 512 <
ffff8800702d1ac0 3818105602 C Bi:1:037:1 0 13 = 55534253 40c33b03 00000000 00
ffff8800439e2f40 3818107516 S Bo:1:037:2 -115 31 = 55534243 10ccb003 00100000 80010a28 0000000c b0000008 00000000 000000
ffff8800439e2f40 3818107605 C Bo:1:037:2 0 31 >
ffff8800439e24c0 3818108926 S Bi:1:037:1 -115 4096 <
ffff8800439e24c0 3818109106 C Bi:1:037:1 0 4096 = 00000000 00000000 00000000 00000000 00000000 00000000 00000000 00000000
ffff8800439e24c0 3818110345 S Bi:1:037:1 -115 512 <
ffff8800439e24c0 3818110472 C Bi:1:037:1 0 13 = 55534253 10ccb003 00000000 00
ffff8800439e24c0 3818112477 S Bo:1:037:2 -115 31 = 55534243 40c33b03 00100000 80000a28 0000001e cf000002 00000000 000000
ffff8800439e24c0 3818112599 C Bo:1:037:2 0 31 >
ffff8800439e24c0 3818114339 S Bi:1:037:1 -115 4096 <
ffff8800439e24c0 3818114469 C Bi:1:037:1 0 4096 = 00409400 ac010000 4c355035 54355835 5c356035 64356835 6c357035 74357835
ffff88006e6eb880 3818116368 S Bi:1:037:1 -115 512 <
ffff88006e6eb880 3818116481 C Bi:1:037:1 -32 0
ffff880000043c40 3818118360 S Co:1:037:0 s 02 01 0000 0081 0000 0
ffff880000043c40 3818118475 C Co:1:037:0 0 0
ffff880070171f40 3818120353 S Bi:1:037:1 -115 512 <
ffff880070171f40 3818120476 C Bi:1:037:1 0 13 = 55534253 40c33b03 00000000 00
ffff880070171f40 3818122508 S Bo:1:037:2 -115 31 = 55534243 10ccb003 00100000 80010a28 0000000c b8000008 00000000 000000
ffff880070171f40 3818122595 C Bo:1:037:2 0 31 >
ffff880070171f40 3818124338 S Bi:1:037:1 -115 4096 <
ffff880070171f40 3818124471 C Bi:1:037:1 0 4096 = 00000000 00000000 00000000 00000000 00000000 00000000 00000000 00000000
ffff880070171f40 3818126344 S Bi:1:037:1 -115 512 <
ffff880070171f40 3818126472 C Bi:1:037:1 0 13 = 55534253 10ccb003 00000000 00
ffff8800701077c0 3818128496 S Bo:1:037:2 -115 31 = 55534243 40c33b03 00300000 80000a28 0000001e d1000006 00000000 000000
ffff8800701077c0 3818128594 C Bo:1:037:2 0 31 >
ffff8800701077c0 3818130337 S Bi:1:037:1 -115 12288 <
ffff8800701077c0 3818130721 C Bi:1:037:1 0 12288 = a839ac39 b839bc39 c039c439 783b7c3b 803b843b 903b943b 983b9c3b a83bac3b
ffff8800701077c0 3818132342 S Bi:1:037:1 -115 512 <
ffff8800701077c0 3818132475 C Bi:1:037:1 -32 0
ffff880000043c40 3818134356 S Co:1:037:0 s 02 01 0000 0081 0000 0
ffff880000043c40 3818134478 C Co:1:037:0 0 0
ffff880000043c40 3818136340 S Bi:1:037:1 -115 512 <
ffff880000043c40 3818136471 C Bi:1:037:1 0 13 = 55534253 40c33b03 00000000 00
ffff880070171f40 3818138497 S Bo:1:037:2 -115 31 = 55534243 10ccb003 00100000 80010a28 0000000c c0000008 00000000 000000
ffff880070171f40 3818138596 C Bo:1:037:2 0 31 >
ffff880070171f40 3818140336 S Bi:1:037:1 -115 4096 <
ffff880070171f40 3818140473 C Bi:1:037:1 0 4096 = 00000000 00000000 00000000 00000000 00000000 00000000 00000000 00000000
ffff880070171f40 3818142344 S Bi:1:037:1 -115 512 <
ffff880070171f40 3818142470 C Bi:1:037:1 0 13 = 55534253 10ccb003 00000000 00
ffff88006e6eb880 3818144490 S Bo:1:037:2 -115 31 = 55534243 40c33b03 00080000 80000a28 0000001e d7000001 00000000 000000
ffff88006e6eb880 3818144596 C Bo:1:037:2 0 31 >
ffff88006e6eb880 3818146123 S Bi:1:037:1 -115 2048 <
ffff88006e6eb880 3818146222 C Bi:1:037:1 0 2048 = a836ac36 b036b436 b836bc36 c036c436 c836cc36 d036d436 d836dc36 e036e436
ffff88006e6eb880 3818148338 S Bi:1:037:1 -115 512 <
ffff88006e6eb880 3818148476 C Bi:1:037:1 -32 0
ffff88006e6eb880 3818150337 S Co:1:037:0 s 02 01 0000 0081 0000 0
ffff88006e6eb880 3818150471 C Co:1:037:0 0 0
ffff88006e6eb880 3818152336 S Bi:1:037:1 -115 512 <
ffff88006e6eb880 3818152471 C Bi:1:037:1 0 13 = 55534253 40c33b03 00000000 00
ffff88006e6eb880 3818154484 S Bo:1:037:2 -115 31 = 55534243 10ccb003 00100000 80010a28 0000000c c8000008 00000000 000000
ffff88006e6eb880 3818154599 C Bo:1:037:2 0 31 >
ffff88006e6eb880 3818156335 S Bi:1:037:1 -115 4096 <
ffff88006e6eb880 3818156470 C Bi:1:037:1 0 4096 = 00000000 00000000 00000000 00000000 00000000 00000000 00000000 00000000
ffff88006e6eb880 3818158341 S Bi:1:037:1 -115 512 <
ffff88006e6eb880 3818158472 C Bi:1:037:1 0 13 = 55534253 10ccb003 00000000 00
ffff88006e6eb880 3818160497 S Bo:1:037:2 -115 31 = 55534243 40c33b03 00100000 80000a28 0000001e d7000002 00000000 000000
ffff88006e6eb880 3818160599 C Bo:1:037:2 0 31 >
ffff88006e6eb880 3818162352 S Bi:1:037:1 -115 4096 <
ffff88006e6eb880 3818162474 C Bi:1:037:1 0 4096 = a836ac36 b036b436 b836bc36 c036c436 c836cc36 d036d436 d836dc36 e036e436
ffff8800439e2f40 3818164340 S Bi:1:037:1 -115 512 <
ffff8800439e2f40 3818164472 C Bi:1:037:1 -32 0
ffff8800439e2f40 3818165573 S Co:1:037:0 s 02 01 0000 0081 0000 0
ffff8800439e2f40 3818165721 C Co:1:037:0 0 0
ffff8800439e2f40 3818167335 S Bi:1:037:1 -115 512 <
ffff8800439e2f40 3818167471 C Bi:1:037:1 0 13 = 55534253 40c33b03 00000000 00
ffff8800439e2f40 3818169492 S Bo:1:037:2 -115 31 = 55534243 10ccb003 00100000 80010a28 0000000c d0000008 00000000 000000
ffff8800439e2f40 3818169597 C Bo:1:037:2 0 31 >
ffff8800439e2f40 3818171334 S Bi:1:037:1 -115 4096 <
ffff8800439e2f40 3818171473 C Bi:1:037:1 0 4096 = 00000000 00000000 00000000 00000000 00000000 00000000 00000000 00000000
ffff8800439e2f40 3818173341 S Bi:1:037:1 -115 512 <
ffff8800439e2f40 3818173471 C Bi:1:037:1 0 13 = 55534253 10ccb003 00000000 00
ffff8800439e24c0 3818175488 S Bo:1:037:2 -115 31 = 55534243 40c33b03 00300000 80000a28 0000001e d9000006 00000000 000000
ffff8800439e24c0 3818175596 C Bo:1:037:2 0 31 >
ffff8800439e24c0 3818177335 S Bi:1:037:1 -115 12288 <
ffff8800439e24c0 3818177722 C Bi:1:037:1 0 12288 = 74397839 7c398039 84398839 8c399039 94399839 9c39a039 a439a839 ac39b039
ffff8800439e24c0 3818179340 S Bi:1:037:1 -115 512 <
ffff8800439e24c0 3818179476 C Bi:1:037:1 -32 0
ffff8800439e24c0 3818181334 S Co:1:037:0 s 02 01 0000 0081 0000 0
ffff8800439e24c0 3818181470 C Co:1:037:0 0 0
ffff8800439e24c0 3818183333 S Bi:1:037:1 -115 512 <
ffff8800439e24c0 3818183471 C Bi:1:037:1 0 13 = 55534253 40c33b03 00000000 00
ffff8800439e24c0 3818185484 S Bo:1:037:2 -115 31 = 55534243 10ccb003 00100000 80010a28 0000000c d8000008 00000000 000000
ffff8800439e24c0 3818185597 C Bo:1:037:2 0 31 >
ffff8800439e24c0 3818187357 S Bi:1:037:1 -115 4096 <
ffff8800439e24c0 3818187595 C Bi:1:037:1 0 4096 = 00000000 00000000 00000000 00000000 00000000 00000000 00000000 00000000
ffff8800439e24c0 3818189337 S Bi:1:037:1 -115 512 <
ffff8800439e24c0 3818189471 C Bi:1:037:1 0 13 = 55534253 10ccb003 00000000 00
ffff8800439e24c0 3818191477 S Bo:1:037:2 -115 31 = 55534243 40c33b03 00080000 80000a28 0000001e df000001 00000000 000000
ffff8800439e24c0 3818191597 C Bo:1:037:2 0 31 >
ffff8800439e24c0 3818193334 S Bi:1:037:1 -115 2048 <
ffff8800439e24c0 3818193474 C Bi:1:037:1 0 2048 = 683a6c3a 703a743a 783a7c3a 803a843a 883a8c3a 903a943a 983a9c3a a03aa43a
ffff8800439e24c0 3818195342 S Bi:1:037:1 -115 512 <
ffff8800439e24c0 3818195475 C Bi:1:037:1 -32 0
ffff8800702d1ac0 3818197334 S Co:1:037:0 s 02 01 0000 0081 0000 0
ffff8800702d1ac0 3818197472 C Co:1:037:0 0 0
ffff8800439e24c0 3818199336 S Bi:1:037:1 -115 512 <
ffff8800439e24c0 3818199472 C Bi:1:037:1 0 13 = 55534253 40c33b03 00000000 00
ffff88006ef8bb80 3818201476 S Bo:1:037:2 -115 31 = 55534243 10ccb003 00100000 80010a28 0000000c e0000008 00000000 000000
ffff88006ef8bb80 3818201595 C Bo:1:037:2 0 31 >
ffff88006ef8b340 3818203332 S Bi:1:037:1 -115 4096 <
ffff88006ef8b340 3818203470 C Bi:1:037:1 0 4096 = 00000000 00000000 00000000 00000000 00000000 00000000 00000000 00000000
ffff880070f17040 3818205333 S Bi:1:037:1 -115 512 <
ffff880070f17040 3818205471 C Bi:1:037:1 0 13 = 55534253 10ccb003 00000000 00
ffff88006e6eb100 3818207400 S Bo:1:037:2 -115 31 = 55534243 40c33b03 00100000 80000a28 0000001e df000002 00000000 000000
ffff88006e6eb100 3818207473 C Bo:1:037:2 0 31 >
ffff8800702d1ac0 3818209355 S Bi:1:037:1 -115 4096 <
ffff8800702d1ac0 3818209470 C Bi:1:037:1 0 4096 = 683a6c3a 703a743a 783a7c3a 803a843a 883a8c3a 903a943a 983a9c3a a03aa43a
ffff88006ef06700 3818211332 S Bi:1:037:1 -115 512 <
ffff88006ef06700 3818211473 C Bi:1:037:1 -32 0
ffff8800701c5700 3818213329 S Co:1:037:0 s 02 01 0000 0081 0000 0
ffff8800701c5700 3818213473 C Co:1:037:0 0 0
ffff8800701c5700 3818215353 S Bi:1:037:1 -115 512 <
ffff8800701c5700 3818215473 C Bi:1:037:1 0 13 = 55534253 40c33b03 00000000 00
ffff880070059dc0 3818217494 S Bo:1:037:2 -115 31 = 55534243 10ccb003 00100000 80010a28 0000000c e8000008 00000000 000000
ffff880070059dc0 3818217596 C Bo:1:037:2 0 31 >
ffff88006e86b400 3818219329 S Bi:1:037:1 -115 4096 <
ffff88006e86b400 3818219471 C Bi:1:037:1 0 4096 = 00000000 00000000 00000000 00000000 00000000 00000000 00000000 00000000
ffff88006ef8bc40 3818221334 S Bi:1:037:1 -115 512 <
ffff88006ef8bc40 3818221472 C Bi:1:037:1 0 13 = 55534253 10ccb003 00000000 00
ffff8800438d27c0 3818223350 S Bo:1:037:2 -115 31 = 55534243 40c33b03 00300000 80000a28 0000001e e1000006 00000000 000000
ffff8800438d27c0 3818223470 C Bo:1:037:2 0 31 >
ffff880070d52dc0 3818225330 S Bi:1:037:1 -115 12288 <
ffff880070d52dc0 3818225724 C Bi:1:037:1 0 12288 = b0361837 1c372037 24372837 2c373037 34373837 3c374037 44374837 4c375037
ffff88006eeeef40 3818227159 S Bi:1:037:1 -115 512 <
ffff88006eeeef40 3818227223 C Bi:1:037:1 -32 0
ffff88006eee3dc0 3818229328 S Co:1:037:0 s 02 01 0000 0081 0000 0
ffff88006eee3dc0 3818229470 C Co:1:037:0 0 0
ffff88006eee3dc0 3818231326 S Bi:1:037:1 -115 512 <
ffff88006eee3dc0 3818231470 C Bi:1:037:1 0 13 = 55534253 40c33b03 00000000 00
ffff880070f667c0 3818233507 S Bo:1:037:2 -115 31 = 55534243 10ccb003 00100000 80010a28 0000000c f0000008 00000000 000000
ffff880070f667c0 3818233600 C Bo:1:037:2 0 31 >
ffff88006ee80e80 3818235336 S Bi:1:037:1 -115 4096 <
ffff88006ee80e80 3818235472 C Bi:1:037:1 0 4096 = 00000000 00000000 00000000 00000000 00000000 00000000 00000000 00000000
ffff88006e6eb4c0 3818237339 S Bi:1:037:1 -115 512 <
ffff88006e6eb4c0 3818237471 C Bi:1:037:1 0 13 = 55534253 10ccb003 00000000 00
ffff8800000594c0 3818239510 S Bo:1:037:2 -115 31 = 55534243 40c33b03 00080000 80000a28 0000001e e7000001 00000000 000000
ffff8800000594c0 3818239601 C Bo:1:037:2 0 31 >
ffff880070f66d00 3818241340 S Bi:1:037:1 -115 2048 <
ffff880070f66d00 3818241473 C Bi:1:037:1 0 2048 = 743f783f 7c3f803f 843f883f 8c3f903f 943f983f 9c3fa03f a43fa83f ac3fb03f
ffff88006e62cc40 3818243334 S Bi:1:037:1 -115 512 <
ffff88006e62cc40 3818243472 C Bi:1:037:1 -32 0
ffff88007015ef40 3818245337 S Co:1:037:0 s 02 01 0000 0081 0000 0
ffff88007015ef40 3818245473 C Co:1:037:0 0 0
ffff88007015ef40 3818247334 S Bi:1:037:1 -115 512 <
ffff88007015ef40 3818247473 C Bi:1:037:1 0 13 = 55534253 40c33b03 00000000 00
ffff88006ef8b940 3818249484 S Bo:1:037:2 -115 31 = 55534243 10ccb003 00100000 80010a28 0000000c f8000008 00000000 000000
ffff88006ef8b940 3818249596 C Bo:1:037:2 0 31 >
ffff88007015e7c0 3818251350 S Bi:1:037:1 -115 4096 <
ffff88007015e7c0 3818251472 C Bi:1:037:1 0 4096 = 00000000 00000000 00000000 00000000 00000000 00000000 00000000 00000000
ffff880070f17ac0 3818253340 S Bi:1:037:1 -115 512 <
ffff880070f17ac0 3818253472 C Bi:1:037:1 0 13 = 55534253 10ccb003 00000000 00
ffff88006efaf040 3818255479 S Bo:1:037:2 -115 31 = 55534243 40c33b03 00100000 80000a28 0000001e e7000002 00000000 000000
ffff88006efaf040 3818255599 C Bo:1:037:2 0 31 >
ffff880071286280 3818257337 S Bi:1:037:1 -115 4096 <
ffff880071286280 3818257471 C Bi:1:037:1 0 4096 = 743f783f 7c3f803f 843f883f 8c3f903f 943f983f 9c3fa03f a43fa83f ac3fb03f
ffff88006fb74940 3818259125 S Bi:1:037:1 -115 512 <
ffff88006fb74940 3818259222 C Bi:1:037:1 -32 0
ffff88006ebcc880 3818261334 S Co:1:037:0 s 02 01 0000 0081 0000 0
ffff88006ebcc880 3818261474 C Co:1:037:0 0 0
ffff88006ebcc880 3818262334 S Bi:1:037:1 -115 512 <
ffff88006ebcc880 3818262471 C Bi:1:037:1 0 13 = 55534253 40c33b03 00000000 00
ffff880043961880 3818264490 S Bo:1:037:2 -115 31 = 55534243 10ccb003 00100000 80010a28 0000000d 00000008 00000000 000000
ffff880043961880 3818264598 C Bo:1:037:2 0 31 >
ffff880043a25040 3818266332 S Bi:1:037:1 -115 4096 <
ffff880043a25040 3818266473 C Bi:1:037:1 0 4096 = 00000000 00000000 00000000 00000000 00000000 00000000 00000000 00000000
ffff880043a25340 3818268338 S Bi:1:037:1 -115 512 <
ffff880043a25340 3818268471 C Bi:1:037:1 0 13 = 55534253 10ccb003 00000000 00
ffff8800438a4100 3818270504 S Bo:1:037:2 -115 31 = 55534243 40c33b03 00300000 80000a28 0000001e e9000006 00000000 000000
ffff8800438a4100 3818270600 C Bo:1:037:2 0 31 >
ffff880036c06c40 3818272334 S Bi:1:037:1 -115 12288 <
ffff880036c06c40 3818272722 C Bi:1:037:1 0 12288 = 88378c37 90379437 98379c37 a037a437 a837ac37 b037b437 b837bc37 c037c437
ffff880036dea340 3818274330 S Bi:1:037:1 -115 512 <
ffff880036dea340 3818274471 C Bi:1:037:1 -32 0
ffff880043a25c40 3818276330 S Co:1:037:0 s 02 01 0000 0081 0000 0
ffff880043a25c40 3818276471 C Co:1:037:0 0 0
ffff880043a25c40 3818277327 S Bi:1:037:1 -115 512 <
ffff880043a25c40 3818277469 C Bi:1:037:1 0 13 = 55534253 40c33b03 00000000 00
ffff880043a25b80 3818279505 S Bo:1:037:2 -115 31 = 55534243 10ccb003 00100000 80010a28 0000000d 08000008 00000000 000000
ffff880043a25b80 3818279598 C Bo:1:037:2 0 31 >
ffff88006eed6640 3818281114 S Bi:1:037:1 -115 4096 <
ffff88006eed6640 3818281345 C Bi:1:037:1 0 4096 = 00000000 00000000 00000000 00000000 00000000 00000000 00000000 00000000
ffff880043a25700 3818283331 S Bi:1:037:1 -115 512 <
ffff880043a25700 3818283472 C Bi:1:037:1 0 13 = 55534253 10ccb003 00000000 00
ffff880043a25f40 3818284403 S Bo:1:037:2 -115 31 = 55534243 40c33b03 00080000 80000a28 0000001e ef000001 00000000 000000
ffff880043a25f40 3818284471 C Bo:1:037:2 0 31 >
ffff880043a25880 3818286349 S Bi:1:037:1 -115 2048 <
ffff880043a25880 3818286476 C Bi:1:037:1 0 2048 = d834dc34 e034e434 e834ec34 f034f434 f834fc34 00350435 08350c35 10351435
ffff88006eed6100 3818288326 S Bi:1:037:1 -115 512 <
ffff88006eed6100 3818288471 C Bi:1:037:1 -32 0
ffff880043a25a00 3818290333 S Co:1:037:0 s 02 01 0000 0081 0000 0
ffff880043a25a00 3818290471 C Co:1:037:0 0 0
ffff880043a25a00 3818292331 S Bi:1:037:1 -115 512 <
ffff880043a25a00 3818292471 C Bi:1:037:1 0 13 = 55534253 40c33b03 00000000 00
ffff880043a25ac0 3818294473 S Bo:1:037:2 -115 31 = 55534243 10ccb003 00100000 80010a28 0000000d 10000008 00000000 000000
ffff880043a25ac0 3818294595 C Bo:1:037:2 0 31 >
ffff88006eb507c0 3818296345 S Bi:1:037:1 -115 4096 <
ffff88006eb507c0 3818296474 C Bi:1:037:1 0 4096 = 00000000 00000000 00000000 00000000 00000000 00000000 00000000 00000000
ffff880043a25e80 3818298337 S Bi:1:037:1 -115 512 <
ffff880043a25e80 3818298472 C Bi:1:037:1 0 13 = 55534253 10ccb003 00000000 00
ffff880043a25280 3818300469 S Bo:1:037:2 -115 31 = 55534243 40c33b03 00100000 80000a28 0000001e ef000002 00000000 000000
ffff880043a25280 3818300599 C Bo:1:037:2 0 31 >
ffff880043a257c0 3818302325 S Bi:1:037:1 -115 4096 <
ffff880043a257c0 3818302469 C Bi:1:037:1 0 4096 = d834dc34 e034e434 e834ec34 f034f434 f834fc34 00350435 08350c35 10351435
ffff88006eed6340 3818304339 S Bi:1:037:1 -115 512 <
ffff88006eed6340 3818304474 C Bi:1:037:1 -32 0
ffff88006ee8ca00 3818306336 S Co:1:037:0 s 02 01 0000 0081 0000 0
ffff88006ee8ca00 3818306473 C Co:1:037:0 0 0
ffff8800438a4e80 3818308391 S Bi:1:037:1 -115 512 <
ffff8800438a4e80 3818308480 C Bi:1:037:1 0 13 = 55534253 40c33b03 00000000 00
ffff8800438a4e80 3818310520 S Bo:1:037:2 -115 31 = 55534243 10ccb003 00100000 80010a28 0000000d 18000008 00000000 000000
ffff8800438a4e80 3818310600 C Bo:1:037:2 0 31 >
ffff8800438a4e80 3818312324 S Bi:1:037:1 -115 4096 <
ffff8800438a4e80 3818312472 C Bi:1:037:1 0 4096 = 00000000 00000000 00000000 00000000 00000000 00000000 00000000 00000000
ffff88006eed6340 3818314359 S Bi:1:037:1 -115 512 <
ffff88006eed6340 3818314475 C Bi:1:037:1 0 13 = 55534253 10ccb003 00000000 00
ffff88006eed6340 3818315475 S Bo:1:037:2 -115 31 = 55534243 40c33b03 00300000 80000a28 0000001e f1000006 00000000 000000
ffff88006eed6340 3818315596 C Bo:1:037:2 0 31 >
ffff88006eed6340 3818317329 S Bi:1:037:1 -115 12288 <
ffff88006eed6340 3818317722 C Bi:1:037:1 0 12288 = 483f4c3f 503f543f 583f5c3f 603f643f 683f6c3f 703f743f 783f7c3f 803f843f
ffff88006e8927c0 3818319599 S Bi:1:037:1 -115 512 <
ffff88006e8927c0 3818319729 C Bi:1:037:1 -32 0
ffff88006ee8ca00 3818321363 S Co:1:037:0 s 02 01 0000 0081 0000 0
ffff88006ee8ca00 3818321474 C Co:1:037:0 0 0
ffff88006ee8ca00 3818322330 S Bi:1:037:1 -115 512 <
ffff88006ee8ca00 3818322474 C Bi:1:037:1 0 13 = 55534253 40c33b03 00000000 00
ffff88006ee8ca00 3818323826 S Bo:1:037:2 -115 31 = 55534243 10ccb003 00100000 80010a28 0000000d 20000008 00000000 000000
ffff88006ee8ca00 3818323972 C Bo:1:037:2 0 31 >
ffff880043a25280 3818325005 S Bi:1:037:1 -115 4096 <
ffff880043a25280 3818325223 C Bi:1:037:1 0 4096 = 00000000 00000000 00000000 00000000 00000000 00000000 00000000 00000000
ffff88006ee8ca00 3818327329 S Bi:1:037:1 -115 512 <
ffff88006ee8ca00 3818327473 C Bi:1:037:1 0 13 = 55534253 10ccb003 00000000 00
ffff880043a25280 3818328480 S Bo:1:037:2 -115 31 = 55534243 40c33b03 00080000 80000a28 0000001e f7000001 00000000 000000
ffff880043a25280 3818328598 C Bo:1:037:2 0 31 >
ffff88006eee3f40 3818330326 S Bi:1:037:1 -115 2048 <
ffff88006eee3f40 3818330469 C Bi:1:037:1 0 2048 = 0c361036 14361836 1c362036 24362836 2c363036 34363836 3c364036 44364836
ffff88006eee3f40 3818332327 S Bi:1:037:1 -115 512 <
ffff88006eee3f40 3818332473 C Bi:1:037:1 -32 0
ffff88006ef8b580 3818333336 S Co:1:037:0 s 02 01 0000 0081 0000 0
ffff88006ef8b580 3818333470 C Co:1:037:0 0 0
ffff88006ef8b580 3818334331 S Bi:1:037:1 -115 512 <
ffff88006ef8b580 3818334471 C Bi:1:037:1 0 13 = 55534253 40c33b03 00000000 00
ffff880000092e80 3818336475 S Bo:1:037:2 -115 31 = 55534243 10ccb003 00100000 80010a28 0000000d 28000008 00000000 000000
ffff880000092e80 3818336595 C Bo:1:037:2 0 31 >
ffff880000092e80 3818337331 S Bi:1:037:1 -115 4096 <
ffff880000092e80 3818337473 C Bi:1:037:1 0 4096 = 00000000 00000000 00000000 00000000 00000000 00000000 00000000 00000000
ffff88006ef8b580 3818339327 S Bi:1:037:1 -115 512 <
ffff88006ef8b580 3818339473 C Bi:1:037:1 0 13 = 55534253 10ccb003 00000000 00
ffff8800438a4e80 3818341491 S Bo:1:037:2 -115 31 = 55534243 40c33b03 00100000 80000a28 0000001e f7000002 00000000 000000
ffff8800438a4e80 3818341596 C Bo:1:037:2 0 31 >
ffff8800438a4e80 3818343323 S Bi:1:037:1 -115 4096 <
ffff8800438a4e80 3818343472 C Bi:1:037:1 0 4096 = 0c361036 14361836 1c362036 24362836 2c363036 34363836 3c364036 44364836
ffff88007084db80 3818345330 S Bi:1:037:1 -115 512 <
ffff88007084db80 3818345474 C Bi:1:037:1 -32 0
ffff88006e8924c0 3818347325 S Co:1:037:0 s 02 01 0000 0081 0000 0
ffff88006e8924c0 3818347472 C Co:1:037:0 0 0
ffff88006e8924c0 3818349327 S Bi:1:037:1 -115 512 <
ffff88006e8924c0 3818349470 C Bi:1:037:1 0 13 = 55534253 40c33b03 00000000 00
ffff88007084db80 3818351482 S Bo:1:037:2 -115 31 = 55534243 10ccb003 00100000 80010a28 0000000d 30000008 00000000 000000
ffff88007084db80 3818351596 C Bo:1:037:2 0 31 >
ffff88006e62c880 3818353355 S Bi:1:037:1 -115 4096 <
ffff88006e62c880 3818353476 C Bi:1:037:1 0 4096 = 00000000 00000000 00000000 00000000 00000000 00000000 00000000 00000000
ffff88006e62c880 3818355118 S Bi:1:037:1 -115 512 <
ffff88006e62c880 3818355219 C Bi:1:037:1 0 13 = 55534253 10ccb003 00000000 00
ffff88006e62c880 3818357484 S Bo:1:037:2 -115 31 = 55534243 40c33b03 00300000 80000a28 0000001e f9000006 00000000 000000
ffff88006e62c880 3818357596 C Bo:1:037:2 0 31 >
ffff8800438a4e80 3818358767 S Bi:1:037:1 -115 12288 <
ffff8800438a4e80 3818359098 C Bi:1:037:1 0 12288 = 443d483d 4c3d503d 543d583d 5c3d603d 643d683d 6c3d703d 743d783d 7c3d803d
ffff88006ef8b580 3818361361 S Bi:1:037:1 -115 512 <
ffff88006ef8b580 3818361478 C Bi:1:037:1 -32 0
ffff88006ef8b580 3818363323 S Co:1:037:0 s 02 01 0000 0081 0000 0
ffff88006ef8b580 3818363470 C Co:1:037:0 0 0
ffff88006ef8b580 3818365330 S Bi:1:037:1 -115 512 <
ffff88006ef8b580 3818365471 C Bi:1:037:1 0 13 = 55534253 40c33b03 00000000 00
ffff88006ef8b580 3818367476 S Bo:1:037:2 -115 31 = 55534243 10ccb003 00100000 80010a28 0000000d 38000008 00000000 000000
ffff88006ef8b580 3818367594 C Bo:1:037:2 0 31 >
ffff88006ef8b580 3818369325 S Bi:1:037:1 -115 4096 <
ffff88006ef8b580 3818369469 C Bi:1:037:1 0 4096 = 00000000 00000000 00000000 00000000 00000000 00000000 00000000 00000000
ffff88006ef8b580 3818370894 S Bi:1:037:1 -115 512 <
ffff88006ef8b580 3818370972 C Bi:1:037:1 0 13 = 55534253 10ccb003 00000000 00
ffff88006ef8b580 3818372455 S Bo:1:037:2 -115 31 = 55534243 40c33b03 00080000 80000a28 0000001e ff000001 00000000 000000
ffff88006ef8b580 3818372597 C Bo:1:037:2 0 31 >
ffff88006ef8b580 3818374326 S Bi:1:037:1 -115 2048 <
ffff88006ef8b580 3818374470 C Bi:1:037:1 0 2048 = 283b2c3b 303b343b 383b3c3b 403b443b 483b4c3b 503b543b 583b5c3b 603b643b
ffff8800438a4e80 3818376320 S Bi:1:037:1 -115 512 <
ffff8800438a4e80 3818376473 C Bi:1:037:1 -32 0
ffff8800438a4e80 3818378328 S Co:1:037:0 s 02 01 0000 0081 0000 0
ffff8800438a4e80 3818378470 C Co:1:037:0 0 0
ffff8800438a4e80 3818380322 S Bi:1:037:1 -115 512 <
ffff8800438a4e80 3818380471 C Bi:1:037:1 0 13 = 55534253 40c33b03 00000000 00
ffff8800438a4e80 3818382482 S Bo:1:037:2 -115 31 = 55534243 10ccb003 00100000 80010a28 0000000d 40000008 00000000 000000
ffff8800438a4e80 3818382596 C Bo:1:037:2 0 31 >
ffff8800438a4e80 3818384321 S Bi:1:037:1 -115 4096 <
ffff8800438a4e80 3818384471 C Bi:1:037:1 0 4096 = 00000000 00000000 00000000 00000000 00000000 00000000 00000000 00000000
ffff8800438a4e80 3818386326 S Bi:1:037:1 -115 512 <
ffff8800438a4e80 3818386469 C Bi:1:037:1 0 13 = 55534253 10ccb003 00000000 00
ffff880000092e80 3818388503 S Bo:1:037:2 -115 31 = 55534243 40c33b03 00100000 80000a28 0000001e ff000002 00000000 000000
ffff880000092e80 3818388600 C Bo:1:037:2 0 31 >
ffff8800438a4e80 3818390320 S Bi:1:037:1 -115 4096 <
